index,text,id,username,retweets,favorites,mentions,hashtags,geo,permalink
2017-03-09 17:38:35,@wpeg power 98 is killing that biggie mix right now. I can't get out the car.,839968685544579074,,0,0,@wpeg,,,https://twitter.com/iluviverson3/status/839968685544579074
2017-03-09 17:38:33,I'm gonna do this when I get out of work!!!! pic.twitter.com/75hCOXAuM5,839968677466406912,,0,4,,,,https://twitter.com/spac3jelly/status/839968677466406912
2017-03-09 17:38:32,I liked a @YouTube video from @gameontom http:// youtu.be/M_ht3q0gF0Q?a MONACO ALL-IN 40M - Road to 1 Billion Coins - BEST GET OUT OF JAIL,839968675222466560,,1,1,@YouTube @gameontom,,,https://twitter.com/RealChrisCope/status/839968675222466560
2017-03-09 17:38:30,The only way that ignoramus can get out of Obama's shadow is if he crawls back into that hole from which he came. #IllegitimatePresident https:// twitter.com/mmpadellan/sta tus/839856245439934469 …,839968665076400130,,0,0,,#IllegitimatePresident,,https://twitter.com/Brian_Killeen/status/839968665076400130
2017-03-09 17:38:26,"#GetOut of here, how I aint even realize this... https://www. instagram.com/p/BRbzYbEA6zn/",839968650702553090,,0,0,,#GetOut,,https://twitter.com/RuMusiq/status/839968650702553090
2017-03-09 17:38:24,that lady needs therapy! Maybe she needs to see get out !,839968640657059840,,0,1,,,,https://twitter.com/Buffet_Boys/status/839968640657059840
2017-03-09 17:38:16,"The moral of this story is that everything is better if you get out and walk. So if you can, do.",839968605429256192,,0,3,,,,https://twitter.com/joleHogan/status/839968605429256192
2017-03-09 17:38:12,I gotta get out of Texas. I'm not ready for the heat.,839968590128447488,,0,1,,,,https://twitter.com/pw_ax/status/839968590128447488
2017-03-09 17:38:12,Can God Help Me Once I Get Out of Prison? https://www. arcamax.com/billygraham/s- 1926920 … #arcamax,839968588853284865,,0,0,,#arcamax,,https://twitter.com/67572da1d5a2404/status/839968588853284865
2017-03-09 17:38:08,get out,839968573930045440,,0,0,,,,https://twitter.com/johnnyreeves666/status/839968573930045440
2017-03-09 17:38:07,"... Dipper please. [He just, wow he looks so uncomfortable, he totally missed the fact that Sutekh actually said the spell to get out (1/2)",839968569941229568,,0,0,,,,https://twitter.com/mysteryiisms/status/839968569941229568
2017-03-09 17:38:05,I never even seen the previews for get out #imlame,839968561988771841,,0,0,,#imlame,,https://twitter.com/__Keish/status/839968561988771841
2017-03-09 17:38:05,Guess who's watching #GetOut tonight,839968561296773121,,0,0,,#GetOut,,https://twitter.com/LifeOfChelseaF/status/839968561296773121
2017-03-09 17:38:03,"College basketball is a business yo, get out your feelings. Only emotion you should be showing is on the court.",839968552853594113,,0,4,,,,https://twitter.com/gbwehnic/status/839968552853594113
2017-03-09 17:38:03,I get out the baber chair and this woman gotta be 25-35 said I could be her daddy and my baber said thank me later,839968551054217216,,0,5,,,,https://twitter.com/Nuka57/status/839968551054217216
2017-03-09 17:37:57,"Not trying to be ""that one"" but honestly, I don't wanna see Get Out . I don't.",839968527390019584,,0,1,,,,https://twitter.com/delish___/status/839968527390019584
2017-03-09 17:37:51,i feel like enflamed trash today. i just wanna get out and drive rly far,839968500743458821,,1,1,,,,https://twitter.com/princexsams/status/839968500743458821
2017-03-09 17:37:50,It was nice to get out today! Such nice #weather !! Long time coming. #wales #gower #swansea #triathlete #triathlon @Strava @planetxbikes pic.twitter.com/lwATc8Z95U,839968498604474368,,0,23,@Strava @planetxbikes,#weather #wales #gower #swansea #triathlete #triathlon,,https://twitter.com/welshtriafflete/status/839968498604474368
2017-03-09 17:37:49,I just need a good weekend... maybe that'll help me get out of this funk,839968493411958784,,0,1,,,,https://twitter.com/P_Johnson023/status/839968493411958784
2017-03-09 17:37:48,You and Nikki must see the Get Out movie!,839968489183956993,,0,0,,,,https://twitter.com/bayou2lady/status/839968489183956993
2017-03-09 17:37:46,Mia Khalifa is the girl from get out researching NCAA prospects,839968480879243264,,1,1,,,,https://twitter.com/moomeezy/status/839968480879243264
2017-03-09 17:37:45,"I love these speak English or get out people. Hey assholes, this land belonged to #NativeAmerican people before your dumbass took it.",839968479067398145,,2,1,,#NativeAmerican,,https://twitter.com/kade6767/status/839968479067398145
2017-03-09 17:37:45,But...that's where I come from. RT @DJYorkWave: Get out your mind,839968477121171457,,0,1,@DJYorkWave,,,https://twitter.com/Frankencunt/status/839968477121171457
2017-03-09 17:37:45,i dont rly wanna sleep but i might be tired n dont wanna get out of bed,839968475900678144,,0,0,,,,https://twitter.com/abelbot_en/status/839968475900678144
2017-03-09 17:37:41,Finally watching get out,839968459580723201,,0,1,,,,https://twitter.com/xokaaaaay/status/839968459580723201
2017-03-09 17:37:41,i walked in my moms room & she's hearing Love yourself i said i like ur song mom she told me to shut up and get out,839968458641117185,,0,0,,,,https://twitter.com/_rebeccabieber/status/839968458641117185
2017-03-09 17:37:37,Cry me a river bitch get out Nut on her face thats my kids house,839968443864666113,,0,0,,,,https://twitter.com/Icyliike1017/status/839968443864666113
2017-03-09 17:37:35,Get Out is a movie you have to watch at least twice. You're gonna miss everything the first time. The second time will make A LOT of sense,839968436843343873,,0,1,,,,https://twitter.com/HeckPhilly/status/839968436843343873
2017-03-09 17:37:35,GET OUT https:// twitter.com/stevestfler/st atus/839860987268300801 …,839968435958321153,,0,0,,,,https://twitter.com/_dlew32/status/839968435958321153
2017-03-09 17:37:35,Get out is so wildddd,839968433898979328,,1,0,,,,https://twitter.com/wasabi_org/status/839968433898979328
2017-03-09 17:37:35,"Wanna get out of Barnsley and meet new people, try meet someone new here n always turns out they know every tom dick and harry",839968433882214404,,0,6,,,,https://twitter.com/courtneyjfoster/status/839968433882214404
2017-03-09 17:37:31,Kanye is Chris and Kim is Rose......this movie is all too familiar. #getout,839968417369194500,,0,0,,#getout,,https://twitter.com/queenbscourt/status/839968417369194500
2017-03-09 17:37:27,Somebody please take a flash photo of @RealBenCarson so He can snap out of it... #GETOUT #FREEBEN,839968401011326976,,3,2,@RealBenCarson,#GETOUT #FREEBEN,,https://twitter.com/jerron_jordan/status/839968401011326976
2017-03-09 17:37:24,If #GetOut gets 28 more positive reviews it can get back to 100% on @RottenTomatoes .,839968388667604995,,0,0,@RottenTomatoes,#GetOut,,https://twitter.com/Raghy78d/status/839968388667604995
2017-03-09 17:37:17,"I didn't either until niggahs started yelling "" Get out ! "" when they see me",839968360037285888,,0,1,,,,https://twitter.com/IRise_Above/status/839968360037285888
2017-03-09 17:37:13,I want your voice to get out of my head,839968343901757442,,0,0,,,,https://twitter.com/snortyoursins/status/839968343901757442
2017-03-09 17:37:13,The latest Avoid & Get out of Debt Daily! http:// paper.li/edebtadvice/13 43155029?edition_id=5e3dc870-04f7-11e7-89dc-0cc47a0d15fd …,839968340969922561,,0,0,,,,https://twitter.com/WealthMav/status/839968340969922561
2017-03-09 17:37:11,it wii not pass in its current form and it shouldnt. Government needs to get out .,839968332589719553,,0,0,,,,https://twitter.com/aubrey352/status/839968332589719553
2017-03-09 17:37:10,I'm driving south to the other airport so that I can get out due to the storm,839968331692146688,,0,0,,,,https://twitter.com/designingdaily/status/839968331692146688
2017-03-09 17:37:08,bro stop getting involved in never tagged u get out of here,839968323009929216,,0,0,,,,https://twitter.com/O34Hero/status/839968323009929216
2017-03-09 17:37:08,A Scene From ‘ Get Out ’ Has Sparked A Meme That’s Scary Awesome https:// goo.gl/FlNfZV,839968322955370496,,0,0,,,,https://twitter.com/andibulad/status/839968322955370496
2017-03-09 17:37:07,my life is kind of strange right now. either nonstop manic productive energy or i can't even get out of bed,839968318295539712,,0,2,,,,https://twitter.com/plantsnshit/status/839968318295539712
2017-03-09 17:37:04,Interview w @natalya926 The leap: How to get out of the #startup phase http:// ow.ly/nEy5309LcUu via @sloanspace @sloanspace,839968305007906817,,3,3,@natalya926 @sloanspace @sloanspace,#startup,,https://twitter.com/AccionSystems/status/839968305007906817
2017-03-09 17:37:02,I have to get out of my shyness first,839968297550557185,,0,0,,,,https://twitter.com/MalyricBanks/status/839968297550557185
2017-03-09 17:36:56,Finally watching #Getout,839968271344492548,,0,0,,#Getout,,https://twitter.com/TRICK_youtho/status/839968271344492548
2017-03-09 17:36:46,I liked a @YouTube video from @cbgirl19 http:// youtu.be/-mfIzEzhusk?a Get Out & John Wick 2 Movie Review,839968229133070336,,0,0,@YouTube @cbgirl19,,,https://twitter.com/SoundVerseSMP/status/839968229133070336
2017-03-09 17:36:46,Did tony mention he just wanted to get out the interview and go home to his kids??,839968228319383552,,0,0,,,,https://twitter.com/offendedmuch247/status/839968228319383552
2017-03-09 17:36:45,WANT TO GET OUT OF 8th period??? COME ON DOWN TOMORROW TO OUR FACULTY VS SENIORS BASKETBALL GAME (3$ bracelets) pic.twitter.com/3FMNGCdS3Y,839968226985512961,,1,5,,,,https://twitter.com/memstuco/status/839968226985512961
2017-03-09 17:36:42,Got a spray tan &now it's pouring so I can't get out the car,839968213807009794,,0,1,,,,https://twitter.com/TCredeur/status/839968213807009794
2017-03-09 17:36:37,"get out of uber with ""i don't wanna live forever"" playing, walk into restaurant with lany playing #WINNING",839968191778553857,,0,1,,#WINNING,,https://twitter.com/ansara2/status/839968191778553857
2017-03-09 17:36:37,Get Out is a good movie,839968190620798979,,0,2,,,,https://twitter.com/andreaathegiant/status/839968190620798979
2017-03-09 17:36:31,Mississippi can't afford him no more when he get out !! Prices going upppp probably 60k- 70k for a show,839968167019614209,,0,0,,,,https://twitter.com/RugrxtBMoney/status/839968167019614209
2017-03-09 17:36:30,i wanna see get out this weekend!!,839968163966099457,,0,0,,,,https://twitter.com/presleyknotts/status/839968163966099457
2017-03-09 17:36:27,Get out there and surround yourself with positive people who like to do the same things. B… http:// ift.tt/2mqPjJo pic.twitter.com/pCzFlnmUVX,839968148631785472,,0,0,,,,https://twitter.com/Scottophoto/status/839968148631785472
2017-03-09 17:36:21,Lowkey looking into being a paramedic when i get out of the military,839968125714042880,,0,1,,,,https://twitter.com/Caleb5oh/status/839968125714042880
2017-03-09 17:36:21,"Our Charter of Rights states""U have the right to Ur religion but must conform to our culture;if not get out ""read it shit head",839968125709914113,,0,0,,,,https://twitter.com/patclement1955/status/839968125709914113
2017-03-09 17:36:19,'I need to get out ': 8 women held captive in mansion @CNN http:// cnn.it/2m4GHon,839968118592094208,,0,0,@CNN,,,https://twitter.com/jackie_0705/status/839968118592094208
2017-03-09 17:36:19,when it's fridaaay and u dnt wna get out of bed,839968118189383681,,0,1,,,,https://twitter.com/valeriejoy31/status/839968118189383681
2017-03-09 17:36:17,If you think Alex Smith is better than Aaron Rodgers get out of my life,839968108529983488,,2,5,,,,https://twitter.com/BosqueBobby/status/839968108529983488
2017-03-09 17:36:15,Everything about Get out reminds me of LBC #allshadeeeeeeee,839968098384019460,,0,3,,#allshadeeeeeeee,,https://twitter.com/___SDabush/status/839968098384019460
2017-03-09 17:36:14,What Digimon would you want to fuck? — Getoutmon. That's the one that tells you to get out . https:// curiouscat.me/Usaagi/post/11 7177430?t=1489098974 …,839968096085508098,,0,0,,,,https://twitter.com/Nonophyllite/status/839968096085508098
2017-03-09 17:36:11,"Have you tried the "" Get Out "" challenge yet? Stephen Curry has, and his effort's not half bad. http:// nesn.com/?p=698424 pic.twitter.com/tr9EA1vPIq",839968083821334528,,1,7,,,,https://twitter.com/NESN/status/839968083821334528
2017-03-09 17:36:10,"""Entering Madison County""? Wtf, Illinois, get out of my Ohio lol",839968078293303296,,0,0,,,,https://twitter.com/mistyolr/status/839968078293303296
2017-03-09 17:36:07,Get Out was pretty damn good,839968067337785344,,0,3,,,,https://twitter.com/BenCumminsFF/status/839968067337785344
2017-03-09 17:36:05,Donald's Lando Calrissian Zazie is gonna be in DEADPOOL Brian Tyree's on NBC Lakeith was just in GET OUT The whole #AtlantaFX crew is up,839968058244489216,,3,5,,#AtlantaFX,,https://twitter.com/CineMasai_/status/839968058244489216
2017-03-09 17:36:02,I liked a @YouTube video from @johnny_carey_ http:// youtu.be/4FHAXZ7oFc8?a 3 WAYS TO GET OUT OF BEING MUGGED!!! | #3,839968047276384256,,1,1,@YouTube @johnny_carey_,#3,,https://twitter.com/reacter1/status/839968047276384256
2017-03-09 17:36:01,nothing more defeating than not being able to get out of your car because your anxiety is so crippling. so you sit in your car bawling.,839968041253269504,,1,5,,,,https://twitter.com/bitethecrave/status/839968041253269504
2017-03-09 17:35:59,Justine get out,839968033963667462,,0,2,,,,https://twitter.com/MllePilgrim/status/839968033963667462
2017-03-09 17:35:58,Should I listen to peyton and watch Get Out even though I hate horror movies,839968030100692992,,0,2,,,,https://twitter.com/annabowless/status/839968030100692992
2017-03-09 17:35:54,I recommend everyone to watch get out for a 2nd time,839968012623028224,,0,0,,,,https://twitter.com/Laydee_Kay/status/839968012623028224
2017-03-09 17:35:54,A lot of you white people that loved Moonlight and Get Out so much avoid black people at all costs in real life pic.twitter.com/QfJMuOzbnx,839968011163410432,,4,12,,,,https://twitter.com/Car1osDiaz/status/839968011163410432
2017-03-09 17:35:49,Finally seeing ' Get Out ',839967992561696769,,1,0,,,,https://twitter.com/Mayuhh_/status/839967992561696769
2017-03-09 17:35:47,Anyone tryna see Get Out,839967984437362689,,0,0,,,,https://twitter.com/Hamza_A11/status/839967984437362689
2017-03-09 17:35:44,@gillllbinsted why do u even still follow me ?????? ur family is fucking cray get out my mentions ya nut jobs,839967968255758338,,0,0,@gillllbinsted,,,https://twitter.com/trip_goddess/status/839967968255758338
2017-03-09 17:35:34,So actually watching get out again.,839967927994552326,,0,0,,,,https://twitter.com/HoneyCabbage/status/839967927994552326
2017-03-09 17:35:32,- i just be making money sitting it.. NOT like it's a bad thing but get .. get out ;,839967921325670400,,0,0,,,,https://twitter.com/da_blackdahlia/status/839967921325670400
2017-03-09 17:35:32,Even my tattoo artist told me to get out of the night shift lmao,839967919299764224,,0,0,,,,https://twitter.com/SeanDotMess/status/839967919299764224
2017-03-09 17:35:31,get out of here man,839967914371457024,,0,1,,,,https://twitter.com/avafinlayx/status/839967914371457024
2017-03-09 17:35:31,RT Boekloversss: Kijk de trailer van Get Out - nu op 1 in Amerika http:// fb.me/5sqQkszpi,839967914220462080,,0,0,,,,https://twitter.com/DirteesShop/status/839967914220462080
2017-03-09 17:35:31,Get Out . https:// twitter.com/bleacherreport /status/839925351077785601 …,839967913767538689,,0,0,,,,https://twitter.com/DaeDaviDavie/status/839967913767538689
2017-03-09 17:35:28,"< there's all these ""grandma"" chickens, birds kept for the ""grandparent genes"", that get out and roam free.",839967901062832129,,0,1,,,,https://twitter.com/CMClearly/status/839967901062832129
2017-03-09 17:35:27,The wood actually tempers bacteria growth in the raw cheese and stainless steel allows it go get out of control,839967899666317320,,0,0,,,,https://twitter.com/ChrisAlbrechtt/status/839967899666317320
2017-03-09 17:35:23,Waiting to pick up kids at school & here 1/2 hr early so I can get a good parking spot to beat the line up to get out of here. #momlife,839967880271634432,,1,1,,#momlife,,https://twitter.com/KatSusanne1982/status/839967880271634432
2017-03-09 17:35:13,I don’t want to watch Get Out . I don’t want to read a YA book on police brutality. I don’t want to watch slave or racial tension movies,839967839998136320,,0,0,,,,https://twitter.com/whitney_DG/status/839967839998136320
2017-03-09 17:35:13,A Absolutely get out of Syria after destroying ISIS. Obama made us an aggressor nation.,839967838597222400,,0,5,,,,https://twitter.com/564thTheOddSqd/status/839967838597222400
2017-03-09 17:35:13,Anyone else sit in their driveway for half an hour before they get out of the car after a long day lol,839967838442049538,,3,25,,,,https://twitter.com/CassidySwift/status/839967838442049538
2017-03-09 17:35:10,Much more than an app Get out of your comfort zone! Read more: https:// goo.gl/XgiBKY pic.twitter.com/pXzHSHECu8,839967827167772672,,0,0,,,,https://twitter.com/PTravelPlanner/status/839967827167772672
2017-03-09 17:35:10,get out,839967825460621316,,0,0,,,,https://twitter.com/izah__h/status/839967825460621316
2017-03-09 17:35:10,"Sun is out, oscillations extending; time to get out the bike. https://www. outsideonline.com/2006216/no-one -will-ever-make-better-mtb-video …",839967825179525120,,0,0,,,,https://twitter.com/bradrocheleau/status/839967825179525120
2017-03-09 17:35:07,"Someone was talking about Get Out and referred to Jordan Peele as ""the guy from Keanu"". Like I guess, but what????",839967813506756608,,0,5,,,,https://twitter.com/rachelsaayWHAT/status/839967813506756608
2017-03-09 17:35:01,When you go to get out he car but another good song comes on,839967791147024386,,0,2,,,,https://twitter.com/MandersBrandi/status/839967791147024386
2017-03-09 17:35:00,Lieing is just pointless what do u get out of it ?,839967783513391104,,7,1,,,,https://twitter.com/Vontay__00/status/839967783513391104
2017-03-09 17:34:57,"NO, DID YOU EVEN HYMN FROM YEARS 4-10?!?!!? GET OUT",839967774554402818,,0,1,,,,https://twitter.com/Tamaracornishh/status/839967774554402818
2017-03-09 17:34:57,"such a fun time, lots of laughs and was good to get out and about xx",839967774239830021,,0,1,,,,https://twitter.com/ArtistTracy10/status/839967774239830021
2017-03-09 17:34:56,With all other teams having very minimal time to gameplan. Everyone thought Brady was gonna get out of that suspension,839967767134666753,,0,0,,,,https://twitter.com/NEFLJam/status/839967767134666753
2017-03-09 17:34:56,I've seen Gone Girl and Get Out .....I've come to the conclusion that I am not white. Or crazy.,839967766421635072,,0,0,,,,https://twitter.com/V_Dashhh/status/839967766421635072
2017-03-09 17:34:55,Can't quite photograph it (potato iPhone quality) but there's a halo around the moon tonight. Get out and have a look pic.twitter.com/AmHE3qymZ8,839967763535974403,,0,1,,,,https://twitter.com/Davyshanks/status/839967763535974403
2017-03-09 17:34:52,Get out has the same effect on the brain as the roots did,839967750256652288,,0,0,,,,https://twitter.com/marciono__/status/839967750256652288
2017-03-09 17:34:51,Might just go see Get Out by myself later . I'm all late n shit,839967746653880320,,0,0,,,,https://twitter.com/_SeanMichaels/status/839967746653880320
2017-03-09 17:34:50,Oh brother How did Ann get out of her demon den did someone break the salt barrier that kept her trapped?,839967742555889664,,0,11,,,,https://twitter.com/DianeBrewer99/status/839967742555889664
2017-03-09 17:34:49,"#GetOut ,One of the strangest weirdest movie I have ever seen , plays with your mind ,so hard to explain but definitely worth watching",839967739200569344,,0,0,,#GetOut,,https://twitter.com/jassemi/status/839967739200569344
2017-03-09 17:34:48,lmaooo get out of my mentions!,839967734251266048,,0,0,,,,https://twitter.com/yesssh67/status/839967734251266048
2017-03-09 17:34:48,Fuck it some one send in the site for GET OUT .. tired of this shit,839967733357879296,,1,0,,,,https://twitter.com/STARTHESTAR/status/839967733357879296
2017-03-09 17:34:46,lmao my nigga trying get out let me see what bro on,839967727695470592,,0,1,,,,https://twitter.com/MarleyDonFilms/status/839967727695470592
2017-03-09 17:34:45,I wonder if my friends wanna do something Monday or Tuesday after we get out of class,839967723518062593,,0,0,,,,https://twitter.com/tiondriaa/status/839967723518062593
2017-03-09 17:34:44,"I apologize for not feeling myself these past few days, I'll be streaming again..I need to get out of this funk.",839967717536989188,,1,9,,,,https://twitter.com/GamingAmbitious/status/839967717536989188
2017-03-09 17:34:40,get out of my mentions,839967701732847616,,0,0,,,,https://twitter.com/AirBlair2/status/839967701732847616
2017-03-09 17:34:39,saturday wya im so ready to see get out,839967696070586369,,0,0,,,,https://twitter.com/mysomoney/status/839967696070586369
2017-03-09 17:34:38,What a fraud get out my club,839967693197418497,,0,0,,,,https://twitter.com/StLaurentDon/status/839967693197418497
2017-03-09 17:34:33,How many times y'all seen get out ?,839967673366773760,,0,0,,,,https://twitter.com/Desire_Nae/status/839967673366773760
2017-03-09 17:34:33,Can't wait to see ' Get Out ',839967672490196992,,2,0,,,,https://twitter.com/VishalNanda94/status/839967672490196992
2017-03-09 17:34:24,literally she didnt even get out of the car and the guy is yelling eleanor,839967635538235396,,2,7,,,,https://twitter.com/medicalstyles/status/839967635538235396
2017-03-09 17:34:20,I just saw a black woman get out of her car at a red light and charge the car in front of her and open the door and assault the driver,839967618958254080,,0,0,,,,https://twitter.com/jeredmathias/status/839967618958254080
2017-03-09 17:34:20,"before this get out of hand, think about more than the triple doubles bruh lol",839967617230053376,,1,1,,,,https://twitter.com/ObioneJakolbhi/status/839967617230053376
2017-03-09 17:34:16,Are you saying I need to get out of the country? I surely hope not!,839967600180334592,,0,1,,,,https://twitter.com/sheryljames/status/839967600180334592
2017-03-09 17:34:15,Honestly can't wait to see Korina when I get out,839967595839258625,,1,1,,,,https://twitter.com/imperfectionmtr/status/839967595839258625
2017-03-09 17:34:14,working to get out of the house. Truthfully? It's women that make the difference. You demand to be treated the same. It worked,839967590680236032,,0,1,,,,https://twitter.com/SandyWagers528/status/839967590680236032
2017-03-09 17:34:14,Get Out Was Pretty Good . The Outcome Was Not What I Was Excepting Tho,839967590508331010,,0,0,,,,https://twitter.com/thatdollann/status/839967590508331010
2017-03-09 17:34:13,@indieguy888 All of the negatives of our healthcare is because of Gvt meddling. They need to get out completely!,839967586372665344,,0,0,@indieguy888,,,https://twitter.com/ottesen42/status/839967586372665344
2017-03-09 17:34:13,Wanna know how gone I was last night? I threw a fit in an Uber because my cousin wouldn't let me get out of the car for some Taco Bell,839967586368557056,,0,4,,,,https://twitter.com/theburningyoung/status/839967586368557056
2017-03-09 17:34:12,"Fml, school is so shit!!!!! Can't wait to get out of the prison",839967583621304320,,0,3,,,,https://twitter.com/MogzMate/status/839967583621304320
2017-03-09 17:34:09,but I don't get out until 3:15 niño,839967572355227648,,0,1,,,,https://twitter.com/lupita16__/status/839967572355227648
2017-03-09 17:34:07,Ready for Saturday to see get out,839967564050501632,,1,0,,,,https://twitter.com/Beauclassy25/status/839967564050501632
2017-03-09 17:34:07,If you don't want to take a bath then at least get out of the rug where I usually dry my feets there. pic.twitter.com/NHs38bELN7,839967562951786496,,0,0,,,,https://twitter.com/tunatical/status/839967562951786496
2017-03-09 17:34:07,What are you hoping to get out of Emily??? A shag?? — Birthday Presents https:// curiouscat.me/MorganWells/po st/117174871?t=1489098847 …,839967562272309248,,0,0,,,,https://twitter.com/Morgan_Wells_/status/839967562272309248
2017-03-09 17:34:04,❝sAYS THE ONE WHO SAID I HAVE NO MUSCLES. GET OUT .❞,839967548460396545,,0,0,,,,https://twitter.com/rapbaam/status/839967548460396545
2017-03-09 17:34:03,I swear 5 minutes before I get out of work or school I get so much energy it's like I'm revived bc I know I'm gonna be free from that,839967546962952192,,1,1,,,,https://twitter.com/Jazrichie/status/839967546962952192
2017-03-09 17:33:59,"Senior year is going by so fast, and I'm just so excited to get out of high school.",839967529128849409,,0,0,,,,https://twitter.com/_jascole/status/839967529128849409
2017-03-09 17:33:56,#TMW you see [REDACTED] in @GetOutMovie eating Froot Loops outta the milk b/c they ALWAYS separate the whites from the colours. #horror #WTF pic.twitter.com/gB64mH8SbD,839967515073658881,,2,3,@GetOutMovie,#TMW #horror #WTF,,https://twitter.com/JaiField/status/839967515073658881
2017-03-09 17:33:54,"I finally watched Get Out , now I get RT everything lol",839967509763788802,,0,3,,,,https://twitter.com/_Wonkaa_/status/839967509763788802
2017-03-09 17:33:54,I'm praying sm that my group presented at the English seminar yesterday or today so I get out of doing it tomorrow,839967508698374146,,0,0,,,,https://twitter.com/butlerftadidas/status/839967508698374146
2017-03-09 17:33:48,"Get out your tissues for an emotional but uplifting read. Congrats, @ShelleyWood2 ! https:// twitter.com/translitagency /status/839933293449588738 …",839967484748894208,,0,1,@ShelleyWood2,,,https://twitter.com/lamckeown1/status/839967484748894208
2017-03-09 17:33:45,Just scrubbed my hair with cheap shampoo about 5 times to get out this pink coloured conditioner... still pink. So stubborn,839967468697296899,,0,0,,,,https://twitter.com/leahthirlwall/status/839967468697296899
