index,text,id,username,retweets,favorites,mentions,hashtags,geo,permalink
2017-03-09 18:59:59,Get out ! https:// twitter.com/blackpplvines/ status/839978844539015168 …,839989172198899713,,0,0,,,,https://twitter.com/jThatoneguy/status/839989172198899713
2017-03-09 11:31:22,Ain't this the truest thing about blackness in #GetOut how black women be in the fight long before we get the flash to join in.,839876275565170688,,443,796,,#GetOut,,https://twitter.com/Wordplay4Days/status/839876275565170688
2017-03-08 19:51:14,They got one . #GetOut pic.twitter.com/dVGBAiZNdl,839639681209942016,,10085,16448,,#GetOut,,https://twitter.com/Lando_1207/status/839639681209942016
2017-03-09 18:59:56,"If you haven't seen Get Out , it's on 123movies. You're welcome. :)",839989160744120320,,1,2,,,,https://twitter.com/aliahdenny/status/839989160744120320
2017-03-09 18:59:55,i needa see get out .,839989155153207299,,0,0,,,,https://twitter.com/clitorispatra/status/839989155153207299
2017-02-28 21:58:37,get out (2017) pic.twitter.com/q5WQcjVWEI,836772636612927488,,1194,1698,,,,https://twitter.com/chulomang/status/836772636612927488
2017-03-09 18:59:54,UH GET OUT OF THAT HOUSE RIGHT NOW,839989148962430976,,0,0,,,,https://twitter.com/devilkmikaelson/status/839989148962430976
2017-03-09 18:59:49,get out is crazy af ..........,839989128213233667,,0,0,,,,https://twitter.com/nvomi_/status/839989128213233667
2017-03-09 18:59:46,Watching ' Get Out ' out on my phone while smokin a wood got me trippin .,839989117056241664,,0,2,,,,https://twitter.com/iAm_Amari/status/839989117056241664
2017-03-09 18:59:45,"In 1915, ""Birth of a Nation"" warned white women against ""race-mixing"". In 2017, "" Get Out "" does the same for black men.",839989111318597634,,0,0,,,,https://twitter.com/BorealSpirit/status/839989111318597634
2017-03-09 18:59:43,Like my 3rd time going to see Get Out,839989104691597313,,0,0,,,,https://twitter.com/hugsneedhugs/status/839989104691597313
2017-03-09 18:59:42,First I get out of the shower and Kenzie's on my couch with my whole family now she's downstairs chatting with Tim I love it,839989098962132992,,0,9,,,,https://twitter.com/__allisonn_/status/839989098962132992
2017-03-09 18:59:41,I need help. I've had my jaws wired shut for 6 weeks. I have 17 screws in my mouth now I get out tomorrow. 8 weeks they been in....,839989098215546880,,0,0,,,,https://twitter.com/Mark_Adrian9/status/839989098215546880
2017-03-09 18:59:41,"Riddle me this, why do men spend the first 9 months of our lives trying to get out of what we spend the rest of our lives to get into?",839989097305391105,,0,4,,,,https://twitter.com/shmulian/status/839989097305391105
2017-03-09 18:59:37,#Radionomy #TuneIn #Nowplaying #Bob Seger #Get Out of Denver (Live) http:// listen.radionomy.com/radiorock-blues,839989080125558785,,0,0,,#Radionomy #TuneIn #Nowplaying #Bob #Get,,https://twitter.com/RadioRockyBlues/status/839989080125558785
2017-03-09 18:59:36,If ANYONE hasn't seen Get Out and wants to. I got da link,839989077537615872,,0,1,,,,https://twitter.com/__beysus/status/839989077537615872
2017-03-09 18:59:34,Just want to be sure we don't end up with RINOcare. Govt should get out of ins business.,839989066586312704,,0,0,,,,https://twitter.com/boomer2748/status/839989066586312704
2017-03-09 18:59:32,Still haven't seen get out,839989059292299267,,0,0,,,,https://twitter.com/_elisaaaaa_/status/839989059292299267
2017-03-09 18:59:31,I wanted to watch get out ...,839989055198789632,,0,0,,,,https://twitter.com/rudyreer02_/status/839989055198789632
2017-03-09 18:59:31,I mean I've interviewed when I had jobs before but I REALLY wanted to get out of them jobs.,839989055131639808,,0,0,,,,https://twitter.com/YourHoodLawyer/status/839989055131639808
2017-03-09 18:59:24,I've been reading article after article about #GETOUT piecing everything together and I'm still mind blown,839989026945921024,,0,1,,#GETOUT,,https://twitter.com/RealDanieB/status/839989026945921024
2017-03-09 18:59:22,"@casmccullough Hope you find the blog "" Get out of your way and believe in yourself ( http:// bluewi.re/1DQpqT6 )"" useful! ^AG",839989017076748288,,0,0,@casmccullough,,,https://twitter.com/Bluewire_Media/status/839989017076748288
2017-03-09 18:59:21,i've been in a funk for 3 days now and i can't seem to get out of it :/,839989013188603904,,0,0,,,,https://twitter.com/cearaadwyer/status/839989013188603904
2017-03-09 18:59:20,Finally gonna watch Get Out !!,839989009589907460,,0,1,,,,https://twitter.com/Primaverakc/status/839989009589907460
2017-03-09 18:59:18,"My cousin was moaning about having to get out of bed and go to the toilet, but I legit thought she was talking in her sleep again",839988998412107777,,0,0,,,,https://twitter.com/arzuisen/status/839988998412107777
2017-03-09 18:59:17,barnes can't get out there and play for them lol,839988996277170177,,0,0,,,,https://twitter.com/UTMotivator/status/839988996277170177
2017-03-09 18:59:12,"I don't even trust white people anymore after watching Get Out , shits crazy...",839988975674646528,,0,1,,,,https://twitter.com/White_Cracker21/status/839988975674646528
2017-03-09 18:59:09,Its gonna be nice to get out of town for the weekend,839988962399678464,,1,1,,,,https://twitter.com/_DesireeB_/status/839988962399678464
2017-03-09 18:59:08,Finally going to see get out,839988957865750529,,0,0,,,,https://twitter.com/SammySplurge/status/839988957865750529
2017-03-09 18:59:06,Noticed hella more shit after watchin Get Out again,839988949497999362,,0,0,,,,https://twitter.com/ShooterJones_/status/839988949497999362
2017-03-09 18:59:06,"Get Out , got me like ..... WTF!!!",839988948864765954,,0,0,,,,https://twitter.com/tljohnson26/status/839988948864765954
2017-03-09 18:59:06,OMG OMG OMG Get Out is just to much!!! Lord have mercy,839988948176912384,,0,0,,,,https://twitter.com/ChakaCUNN17/status/839988948176912384
2017-03-09 18:59:02,So the guy who was running towards Chris in Get Out from Jennings,839988931278065664,,0,0,,,,https://twitter.com/_Flght/status/839988931278065664
2017-03-09 18:59:01,Girlllll get out of my seat smh,839988927494680577,,0,0,,,,https://twitter.com/laurendejoras/status/839988927494680577
2017-03-09 18:59:00,@GoldenStateShow When will Steph & Klay get out of their slumps in all seriousness?,839988924252483584,,0,0,@GoldenStateShow,,,https://twitter.com/eljaykbg1991/status/839988924252483584
2017-03-09 18:59:00,Admittedly I have hesitated to watch Get Out because I fear overhype. But I will watch it.,839988923992530946,,1,1,,,,https://twitter.com/iamtisean/status/839988923992530946
2017-03-09 18:58:57,bro get out njoku can easily for 600 and he is a bigger TE with crazy athleticism. Go take a look at his film,839988912751824897,,0,0,,,,https://twitter.com/ianrachelson/status/839988912751824897
2017-03-09 18:58:56,"forget that, if I didnt have resentment and contempt, I wouldn't be able to get out of bed in the morning.",839988907068514304,,0,1,,,,https://twitter.com/SomeEgrets/status/839988907068514304
2017-03-09 18:58:55,they need to get out of roma asap,839988905051095041,,0,0,,,,https://twitter.com/sheikhlaurent/status/839988905051095041
2017-03-09 18:58:54,"Get out is a ""Pro Black Fuck them Crackers"" movie",839988900949032960,,0,0,,,,https://twitter.com/Nygey_J/status/839988900949032960
2017-03-09 18:58:54,omfg get out of here!,839988898537308160,,0,0,,,,https://twitter.com/murse_nurse/status/839988898537308160
2017-03-09 18:58:52,"I'd be too dumb to get out , they'd be like bitch just leave",839988889204883456,,0,0,,,,https://twitter.com/AnTiSociAble0/status/839988889204883456
2017-03-09 18:58:51,i shoulda never watched get out,839988888525496320,,0,0,,,,https://twitter.com/worthamilli2_/status/839988888525496320
2017-03-09 18:58:50,@ConwayPolice Please do us a favor and come to Acxiom at 5. Waiting through 5 lights to get out of parking lot is no fun. pic.twitter.com/8hE6tWiizl,839988883702075392,,0,0,@ConwayPolice,,,https://twitter.com/neetsark/status/839988883702075392
2017-03-09 18:58:50,can't wait to get off n finally go see get out with my baby,839988881286144001,,0,1,,,,https://twitter.com/fridaesglomil/status/839988881286144001
2017-03-09 18:58:49,lol “Jordan Peele's Get Out inspires the Get Out Challenge” https:// twitter.com/i/moments/8397 51171418042368 …,839988878098485248,,0,0,,,,https://twitter.com/kaytlinroberson/status/839988878098485248
2017-03-09 18:58:45,Finally seeing Get Out w/ @JPSully95 in an hour and I'm stoked,839988861476491264,,0,0,@JPSully95,,,https://twitter.com/sierraplz/status/839988861476491264
2017-03-09 18:58:44,Wish I could get out this shiter of a mood,839988857634447361,,0,2,,,,https://twitter.com/_JordanCree/status/839988857634447361
2017-03-09 18:58:42,That Get Out challenge too funny dawg.,839988847563943936,,1,1,,,,https://twitter.com/thedopedenim/status/839988847563943936
2017-03-09 18:58:41,Babe get out this month #FreeGates,839988843856220160,,0,1,,#FreeGates,,https://twitter.com/Jazzzzy_Jaz/status/839988843856220160
2017-03-09 18:58:38,I don't like horror movies - should I still watch Get Out ?,839988834117025792,,0,2,,,,https://twitter.com/UnfunnyOaf/status/839988834117025792
2017-03-09 18:58:37,Two apartment showings tomorrow.. I can't wait to get out of here.,839988829561999361,,0,2,,,,https://twitter.com/julianrdz38/status/839988829561999361
2017-03-09 18:58:30,Get Out was crazy bro,839988798045986816,,0,2,,,,https://twitter.com/jamesarenae/status/839988798045986816
2017-03-09 18:58:26,get out of my head!! For real!,839988781092601856,,0,0,,,,https://twitter.com/danastarr83/status/839988781092601856
2017-03-09 18:58:21,going round the McDonalds drive through n Maia had to open the door and near enough get out to pay for the food cause she was so far away:)),839988760691527680,,0,1,,,,https://twitter.com/brxkenbone/status/839988760691527680
2017-03-09 18:58:20,"Lmao I love when people try to tease us when they get out of a ticket. We could legit not care less at all, more power to you.",839988755243098112,,0,0,,,,https://twitter.com/_Im_That_Guy_/status/839988755243098112
2017-03-09 18:58:19,UT for skiing tomorrow. Hoping I can get out with the snow here!,839988752298700801,,0,0,,,,https://twitter.com/Dappleby/status/839988752298700801
2017-03-09 18:58:19,Bibi told Trump take Golan Heights when he was here like Trump campaigned saying take the oil and get out !,839988751686287361,,1,0,,,,https://twitter.com/pyramidmedicine/status/839988751686287361
2017-03-09 18:58:18,The best thing we did was get out of debt and save. Having runway reduces stress and empowers you to get better projects.,839988749891178500,,0,3,,,,https://twitter.com/mds/status/839988749891178500
2017-03-09 18:58:18,""" Get Out "" was scary and suspenseful, but not for the reasons you might think. http://www. upworthy.com/im-black-my-wi fe-is-white-we-saw-get-out-this-was-our-conversation-afterward?g=2&c=upw1 …",839988747588493312,,1,0,,,,https://twitter.com/Raptured_Night/status/839988747588493312
2017-03-09 18:58:13,"what they do I been meant to tell you that I saw you at the movies "" Get Out",839988727560712196,,0,0,,,,https://twitter.com/Rip_Kendre/status/839988727560712196
2017-03-09 18:58:10,TRUE AS AN ARROW-you no like- get out of way....,839988715418079233,,0,0,,,,https://twitter.com/Albertmingo/status/839988715418079233
2017-03-09 18:58:10,I feel so sorry for the people on Twitter who haven't seen Get Out already because the way y'all be posting these spoilers...,839988714256388101,,0,0,,,,https://twitter.com/dareIIe/status/839988714256388101
2017-03-09 18:58:04,I need to get out of this trap,839988690684375041,,0,1,,,,https://twitter.com/ziggy_igor/status/839988690684375041
2017-03-09 18:57:59,I wanna go watch Get out bc everyone talks about it!!,839988668764889089,,0,0,,,,https://twitter.com/O_Lyyn/status/839988668764889089
2017-03-09 18:57:54,"my friends and I are so conflicted rn we don't know if we should watch get out , before I fall, or wait until everything comes out pic.twitter.com/H0Lot0v7AP",839988646514159616,,0,3,,,,https://twitter.com/jaeyonganti/status/839988646514159616
2017-03-09 18:57:53,"Yo this "" Get Out "" challenge is comedy",839988643200671745,,0,0,,,,https://twitter.com/_beautiful_b23/status/839988643200671745
2017-03-09 18:57:52,Pedro trying to get out of his contract after seeing Halliday and Waghorn in action like... pic.twitter.com/uHhFgA2DYi,839988639413202944,,0,1,,,,https://twitter.com/munkibhoy/status/839988639413202944
2017-03-09 18:57:52,Ok at noon I'll get out of bed and do something. -is now 3:57- I might as well wait till five.,839988637731250176,,0,2,,,,https://twitter.com/partysuealways/status/839988637731250176
2017-03-09 18:57:52,"Titans finally get out of inning, with pop out to third. Headed to bottom 3rd with 5-0 deficit.",839988637278298115,,0,0,,,,https://twitter.com/Stone_SN/status/839988637278298115
2017-03-09 18:57:47,WELCOME WILLAM! Im sorry I cant get out to see you perform... in either way <dirty grin> have a great evening here!!,839988616331894784,,0,0,,,,https://twitter.com/voranek/status/839988616331894784
2017-03-09 18:57:46,"pa epal pala ako eh, imma get out of ur life nalang",839988612720607232,,0,3,,,,https://twitter.com/elyzamarie_/status/839988612720607232
2017-03-09 18:57:42,"can't even get out a full ""hey guys"" before i'm cut off with ""we're not playing shades of gray"" thanks! pic.twitter.com/J2SDVpn4yf",839988598833319936,,1,129,,,,https://twitter.com/heyholyghost/status/839988598833319936
2017-03-09 18:57:42,Only needs another 105.00 pledged to get out . http:// fb.me/2PmudYuoj,839988597994459137,,0,0,,,,https://twitter.com/DeborahSpellman/status/839988597994459137
2017-03-09 18:57:41,Stop fucking discrediting and trying to illegitimize the horror genre. GET OUT was a fucking HORROR MOVIE. THEY CUT PEOPLES BRAINS OPEN BRO pic.twitter.com/zizKg6vMRT,839988591698804736,,2,6,,,,https://twitter.com/sick__66/status/839988591698804736
2017-03-09 18:57:39,lol get out your feelings,839988585076019201,,0,0,,,,https://twitter.com/Dopeboy_Al/status/839988585076019201
2017-03-09 18:57:36,I be twerking naked as soon as I get out the shower.,839988571280986112,,0,0,,,,https://twitter.com/sheabuttahbby/status/839988571280986112
2017-03-09 18:57:30,Get out was a good movie but its not as good as i thought it would be the whole plot and everything was nice had people really thinking,839988545066528768,,1,0,,,,https://twitter.com/_ayoosamm/status/839988545066528768
2017-03-09 18:57:29,Samuel L. Jackson would be right if #GetOut tackled [American] slavery but the black experience portrayed in the film is quite universal.,839988541543329796,,0,4,,#GetOut,,https://twitter.com/iamMelsmith/status/839988541543329796
2017-03-09 18:57:26,Get Out has me praying for the souls of all Black people everywhere.,839988530017366017,,0,0,,,,https://twitter.com/shoulder_LEEN/status/839988530017366017
2017-03-09 18:57:24,#potus #realdonaldtrump Beware of the Military political complex. 15 years in middle East and counting. America first! Time to get Out .,839988520580186112,,0,0,,#potus #realdonaldtrump,,https://twitter.com/william20673995/status/839988520580186112
2017-03-09 18:57:22,I can't get out of bed but I'm on break now so why should I?,839988514435526656,,2,6,,,,https://twitter.com/AyoIsola27/status/839988514435526656
2017-03-09 18:57:20,get out,839988505044373504,,0,0,,,,https://twitter.com/fckustyles/status/839988505044373504
2017-03-09 18:57:20,"Get Out 's main plot is obviously a film exaggerated for drama, but it rly does point out the subtle racist comments people make on the daily",839988503203188736,,0,1,,,,https://twitter.com/JessiLoza11/status/839988503203188736
2017-03-09 18:57:18,#GetOut will have you questioning every white person that has ever been nice to you. I'm not with the shits,839988494726500353,,0,0,,#GetOut,,https://twitter.com/KiaBayBii/status/839988494726500353
2017-03-09 18:57:15,and it dropped right in Get Out and Logan .. 2 of the biggest movies .. perfect,839988485087993861,,0,1,,,,https://twitter.com/creativemedia7/status/839988485087993861
2017-03-09 18:57:10,GET OUT .,839988464401711104,,1,6,,,,https://twitter.com/marissa_may5678/status/839988464401711104
2017-03-09 18:57:08,"Cannot secure your network, but you can hack back? If you think that's possible, you need to get out of security. http:// thehackernews.com/2017/03/hackin g-back-hackers.html …",839988455472001024,,4,0,,,,https://twitter.com/jbhall56/status/839988455472001024
2017-03-09 18:57:07,I pull in my driveway and chill in my car for at least 5 mins before I get out lol,839988451411951616,,0,7,,,,https://twitter.com/sofiacorrao_/status/839988451411951616
2017-03-09 18:57:07,"""I want your eye, man."" #GetOut #WhitePplAreActuallyJustJealous #TheOriginalHaters #ItsWayBetterBTW",839988448597573632,,0,0,,#GetOut #WhitePplAreActuallyJustJealous #TheOriginalHaters #ItsWayBetterBTW,,https://twitter.com/CaR0lcan2/status/839988448597573632
2017-03-09 18:57:06,It takes so much effort to get out of bed sometimes,839988446181675009,,0,2,,,,https://twitter.com/HaleyKitty94/status/839988446181675009
2017-03-09 18:57:05,GET OUT OF MY MENTIONS,839988441182044160,,0,0,,,,https://twitter.com/1GBFL/status/839988441182044160
2017-03-09 18:57:00,It's almost like Shep's trying to get out of his contract. https:// twitter.com/yashar/status/ 839976866312257536 …,839988422710312960,,0,1,,,,https://twitter.com/james_meader/status/839988422710312960
2017-03-09 18:57:00,“Time waits for no one. Get out there and do it” - @swapthebiz http:// buff.ly/2lIS8H7 #marketing #business,839988420093050881,,0,0,@swapthebiz,#marketing #business,,https://twitter.com/creativeclicknj/status/839988420093050881
2017-03-09 18:56:57,i'm getting my way idc who i gotta get out my way. i deserve it,839988410257420288,,0,0,,,,https://twitter.com/__kouture/status/839988410257420288
2017-03-09 18:56:57,get out is not a horror movie,839988408978137090,,0,0,,,,https://twitter.com/ariez_kea01/status/839988408978137090
2017-03-09 18:56:56,Llllllsssssss RT @waldorfsfinest : had to tell my lil bro to GET OUT !!!! lol,839988404259573761,,0,0,@waldorfsfinest,,,https://twitter.com/CavsQueen/status/839988404259573761
2017-03-09 18:56:55,i really have to get out of the habit of unnecessarily apologizing,839988400522424320,,0,0,,,,https://twitter.com/caressed/status/839988400522424320
2017-03-09 18:56:54,I'm FINALLY going to get to see Get Out tonight praise him!,839988395728347137,,0,2,,,,https://twitter.com/misssadea_/status/839988395728347137
2017-03-09 18:56:54,The latest #SmallBiz Influencers! http:// paper.li/matthewperosi/ 1464623811?edition_id=81e59630-0502-11e7-89dc-0cc47a0d15fd … #getout,839988395078230018,,0,0,,#SmallBiz #getout,,https://twitter.com/matthewperosi/status/839988395078230018
2017-03-09 18:56:53,"Ugh, being pressured to watch Get Out to give my thoughts. Mentally tired so not sure how much I will be able to add to the discussion.",839988393828352003,,0,0,,,,https://twitter.com/iamvictorious/status/839988393828352003
2017-03-09 18:56:51,Let's go see get out ?,839988384575635456,,0,2,,,,https://twitter.com/kaycee1017/status/839988384575635456
2017-03-09 18:56:48,I wanna go see get out,839988370726146048,,0,0,,,,https://twitter.com/briiannaax0/status/839988370726146048
2017-03-09 18:56:47,I have to go see get out this weekend,839988368314400768,,0,1,,,,https://twitter.com/markyboii33/status/839988368314400768
2017-03-09 18:56:46,GET OUT SPOILERS: in a whole movie where people's brains are put into younger ppl bodies to live the life they want this what you take away pic.twitter.com/aKiSTn1tPE,839988364212355072,,2,3,,,,https://twitter.com/khristen/status/839988364212355072
2017-03-09 18:56:37,Like go make some friends damn get out from each others asses. https:// twitter.com/issadyke/statu s/839986879546216448 …,839988324672651265,,1,0,,,,https://twitter.com/kittyh0l3/status/839988324672651265
2017-03-09 18:56:34,"Looks like plow season is over. It's been a good year but now it's time to get out the aerators,… https://www. instagram.com/p/BRb8UjGBXCg/",839988311858991105,,0,0,,,,https://twitter.com/StevenPogipogi/status/839988311858991105
2017-03-09 18:56:31,just really ready to get out of here,839988300609966080,,0,3,,,,https://twitter.com/hampton_baylee/status/839988300609966080
2017-03-09 18:56:31,noooo wait for me to get out first before the drop!!,839988300479922176,,0,0,,,,https://twitter.com/PLin55/status/839988300479922176
2017-03-09 18:56:27,Get out your comfort zone for a minute,839988282259783681,,0,1,,,,https://twitter.com/Swazeyy_7/status/839988282259783681
2017-03-09 18:56:24,I really need to see Get Out,839988269114896385,,0,0,,,,https://twitter.com/Bigwap_/status/839988269114896385
2017-03-09 18:56:22,"Haven't seen my man @MrSteveLee in months & the first thing he says to me is not ""hello"" but rather, ""you're like the guy from Get Out "" lol",839988262794100740,,0,2,@MrSteveLee,,,https://twitter.com/ClaudeAtcho/status/839988262794100740
2017-03-09 18:56:22,"Me, someone who just seen Get Out : You're too lit to politic.",839988259845492740,,0,0,,,,https://twitter.com/DBDx_ebooks_x/status/839988259845492740
2017-03-09 18:56:21,"""Sharp"" or not, he's hit 1 ball to the OF in 11 AB's. Really hope to see a different look from last yr when I get out there.",839988258163458048,,0,0,,,,https://twitter.com/dmjay/status/839988258163458048
2017-03-09 18:56:18,"Going to see Get Out at my home away from home, the Alamo Drafthouse. I scare easy so I will be clutching a flatbread for comfort",839988245912002560,,0,0,,,,https://twitter.com/WalkIntoABook/status/839988245912002560
2017-03-09 18:56:17,"@carrie_severson ""When we get out of own way& #write from heart-centered place,our #stories act as magnets in life"" http:// ow.ly/9a34308W4LX pic.twitter.com/jYVTsm4Ma9",839988239024943104,,0,0,@carrie_severson,#write #stories,,https://twitter.com/AnnalisaParent/status/839988239024943104
2017-03-09 18:56:15,Need to get out of my house,839988230460174336,,0,1,,,,https://twitter.com/shaylafarleyy/status/839988230460174336
2017-03-09 18:56:12,Seeing @GetOutMovie with @theveropowers @_seriousblack for the 3RD TIME!!!! Love this movie. Thank you @JordanPeele,839988218669940736,,0,1,@GetOutMovie @theveropowers @_seriousblack @JordanPeele,,,https://twitter.com/xwlkx/status/839988218669940736
2017-03-09 18:56:09,Seeing Get Out with Dominique,839988208314273792,,0,0,,,,https://twitter.com/Slipsandcaps/status/839988208314273792
2017-03-09 18:56:09,Get out the tinfoil for these guys. https:// twitter.com/RawStory/statu s/839985428153397248 …,839988207840305152,,0,0,,,,https://twitter.com/dspalten/status/839988207840305152
2017-03-09 18:56:09,"All up in my head, wish I could get out",839988207639003137,,0,0,,,,https://twitter.com/sapphirevirgo88/status/839988207639003137
2017-03-09 18:56:08,Finally seen get out it was good,839988205168578561,,0,0,,,,https://twitter.com/__b_randyy/status/839988205168578561
2017-03-09 18:56:07,I'm really tryna tell myself I'll get up early tomorrow to see Get Out at 10:30 but the way my sleep schedule set up,839988198201778176,,0,0,,,,https://twitter.com/katastic_kat/status/839988198201778176
2017-03-09 18:56:07,I'm looking at white people differently now #getout,839988197908201472,,0,0,,#getout,,https://twitter.com/Narsso33/status/839988197908201472
2017-03-09 18:56:04,I need to watch Get out,839988188009680897,,0,0,,,,https://twitter.com/Ms_Derbs/status/839988188009680897
2017-03-09 18:56:01,We are the only ones in this restaurant and the looks feel like we about to experience #Getout @GetOutMovie,839988174030028800,,0,0,@GetOutMovie,#Getout,,https://twitter.com/Omeakiasmiles/status/839988174030028800
2017-03-09 18:55:59,Can't wait to get out,839988167415599104,,0,0,,,,https://twitter.com/dylwilso3/status/839988167415599104
2017-03-09 18:55:58,listen to 24k Magic for the first time right now???? Sorry y'all the rock I live under is v heavy and I'm weak it takes a while to get out,839988162818633730,,0,2,,,,https://twitter.com/actualshithead/status/839988162818633730
2017-03-09 18:55:50,"The iSo14Below Film Club had a TIME last night screening "" Get Out "" last night. pic.twitter.com/QvvXKCsGdA",839988129545240576,,0,1,,,,https://twitter.com/so14below/status/839988129545240576
2017-03-09 18:55:44,My nephew didn't want to get out and eat at Sonic so he just sat in the car like this pic.twitter.com/RCA1gQxRLP,839988102131273728,,0,7,,,,https://twitter.com/omgausername/status/839988102131273728
2017-03-09 18:55:43,bruh I is home just don't want to get out of my car,839988097014202368,,0,0,,,,https://twitter.com/SarahEdgar14/status/839988097014202368
2017-03-09 18:55:41,When that deer in Get Out broke the rearview mirror I was like BIH.. me too!!!,839988090668179456,,0,0,,,,https://twitter.com/giseller0bles/status/839988090668179456
2017-03-09 18:55:39,can the 15th come already? I want to see get out dammit! pic.twitter.com/UqS6yWUSRe,839988082346729472,,0,1,,,,https://twitter.com/fayolazahra/status/839988082346729472
2017-03-09 18:55:36,@SafetyPinDaily don't just like my last tweet. Retweet it please. it needs to get out I have 29 followers and can't do it alone.,839988069075947520,,0,0,@SafetyPinDaily,,,https://twitter.com/3rd_POTUS/status/839988069075947520
2017-03-09 18:55:36,@JordanPeele this is how I felt after I saw #GetOut https:// twitter.com/ABC/status/839 944776170422273 …,839988068807503872,,0,0,@JordanPeele,#GetOut,,https://twitter.com/Lion_Heart_12/status/839988068807503872
2017-03-09 18:55:24,yall need to get out of other people's relationships and worry about your own !!,839988018156986368,,2,0,,,,https://twitter.com/quinpierre/status/839988018156986368
2017-03-09 18:55:18,I'm going to lose it if I don't get out of traffic,839987994153107456,,0,1,,,,https://twitter.com/503Eli/status/839987994153107456
