index,text,id,username,retweets,favorites,mentions,hashtags,geo,permalink
2017-03-09 16:56:23,don't be anxious... you have to be able to think to get out ... it's fun but challenging mentally. Have fun!,839958065743069187,,0,0,,,,https://twitter.com/lowill99/status/839958065743069187
2017-03-09 16:56:13,"There are so many couples on campus today, like plz get out of my face.",839958026681356288,,0,0,,,,https://twitter.com/CullMoney/status/839958026681356288
2017-03-09 16:56:07,I really want to see Get Out .,839957999380803584,,1,1,,,,https://twitter.com/meganxxoxo/status/839957999380803584
2017-03-09 16:56:05,I just watched ' Get Out ' and now I feel like I need to watch it again because I know I missed some of these hidden messages,839957993571639296,,0,1,,,,https://twitter.com/SimpleAsBri/status/839957993571639296
2017-03-09 16:56:05,I'd get out and investigate of course. That's the obvious answer https:// twitter.com/ParanoiaPics/s tatus/803688979862319104 …,839957991860363264,,0,1,,,,https://twitter.com/JarrettBishop03/status/839957991860363264
2017-03-09 16:56:04,april 16th ??? venus i'm gonna need you to get out of retrograde a bit sooner than that. thanks,839957987401715712,,0,2,,,,https://twitter.com/bunnysugars/status/839957987401715712
2017-03-09 16:56:04,really had me thinking i was gonna get out of work early today,839957985967419392,,0,0,,,,https://twitter.com/carolynvanessa_/status/839957985967419392
2017-03-09 16:56:04,Bro!!! I hope I get out of work soon enough to join! Miss our BO3 days lol,839957985929678850,,0,1,,,,https://twitter.com/Armlockz/status/839957985929678850
2017-03-09 16:56:03,thanks Ant. Lee's closet is massive so it will take a while to get out of.,839957985174650881,,0,0,,,,https://twitter.com/sambo1078/status/839957985174650881
2017-03-09 16:56:02,I think Cass everyone is gonna want to get out Neda as soon as possible.,839957980216885248,,0,0,,,,https://twitter.com/kaylamwilliams1/status/839957980216885248
2017-03-09 16:56:01,After watching GET OUT Im Smacking anybody that just start running towards me rs,839957975972413440,,0,5,,,,https://twitter.com/Benny2x/status/839957975972413440
2017-03-09 16:56:01,Or die quickly and get out of the way. Serves you right for getting sick in the first place. Or old.,839957973686489088,,0,0,,,,https://twitter.com/dameunroto1/status/839957973686489088
2017-03-09 16:56:00,a dry-retching cat on your duvet is an effective get-out -of-bed strategy,839957971215896576,,0,0,,,,https://twitter.com/az6667/status/839957971215896576
2017-03-09 16:55:54,this post is so goddamn funny omg. there's spoilers if you haven't seen get out https://www. facebook.com/eliibaybee/pos ts/10155278208106264 …,839957945735663618,,0,0,,,,https://twitter.com/stephaniejuune/status/839957945735663618
2017-03-09 16:55:52,"The level of joy I get out of eating cold Chinese food an hour after ""I'm full"" will never be understood by anyone",839957937183490049,,0,1,,,,https://twitter.com/LilDebbyDick_BR/status/839957937183490049
2017-03-09 16:55:48,you should get out of retirement and have a wheelchair match at mania with @HulkHogan get a big fat pay cheque. @wwe,839957922167853059,,0,0,@HulkHogan @wwe,,,https://twitter.com/jus4laf/status/839957922167853059
2017-03-09 16:55:47,"is this the plot to "" Get Out ?"" Haven't seen it yet.",839957916186714112,,1,5,,,,https://twitter.com/jartasm/status/839957916186714112
2017-03-09 16:55:46,To all the ppl who down played Get Out,839957910851559424,,0,0,,,,https://twitter.com/allNITElong_/status/839957910851559424
2017-03-09 16:55:44,I still needa see get out,839957903066955776,,0,0,,,,https://twitter.com/KeefStr8/status/839957903066955776
2017-03-09 16:55:42,GET OUT CHALLENGE AFRICAN VERSION IMMIGRATION #getoutchallenge #immigration pic.twitter.com/2WlpencYjm,839957894598721539,,11,20,,#getoutchallenge #immigration,,https://twitter.com/TreandIce/status/839957894598721539
2017-03-09 16:55:37,"@VAHSwildcats students: if you want to help us get out our message, come volunteer at the children's carnival on 3/18. DM for more info",839957874159783936,,0,0,@VAHSwildcats,,,https://twitter.com/VAHSAid/status/839957874159783936
2017-03-09 16:55:33,I believe this to be true! What you put out into the universe is what you get out of it.… https://www. instagram.com/p/BRbueSmB0aT/,839957857210552322,,0,0,,,,https://twitter.com/ricasillypants/status/839957857210552322
2017-03-09 16:55:33,Get out,839957855402856449,,0,0,,,,https://twitter.com/Tino_Christine/status/839957855402856449
2017-03-09 16:55:27,"Paul Ryan is holding himself accountable to Hannity and his audience, if only the Senate would get out of their ivory tower and do the same",839957833105956865,,1,1,,,,https://twitter.com/PillarofAndrew/status/839957833105956865
2017-03-09 16:55:25,? ? get out ! u love ur hair,839957823798804480,,0,0,,,,https://twitter.com/blushhabbo/status/839957823798804480
2017-03-09 16:55:23,Thanks for all the hard work and memories in Dallas. Now get out to Denver and get u a ring!,839957817176051712,,0,0,,,,https://twitter.com/jedbase/status/839957817176051712
2017-03-09 16:55:23,I'm going to see get out when I go home.,839957815838068741,,0,0,,,,https://twitter.com/SincerelyyNadia/status/839957815838068741
2017-03-09 16:55:22,* I will not write an over long think piece on Underground and Get Out *,839957811035529220,,0,4,,,,https://twitter.com/Blackamazon/status/839957811035529220
2017-03-09 16:55:21,GET OUT ... https:// twitter.com/cash_sam_/stat us/839853611937058818 …,839957805901754368,,0,0,,,,https://twitter.com/ImBigZone/status/839957805901754368
2017-03-09 16:55:21,"Allison Williams ""completely"" lied to friends about the plot of ' Get Out ' http:// huff.to/2m4LHt5 pic.twitter.com/AhYdDtvB0w",839957805331279876,,0,0,,,,https://twitter.com/FOXCinemas/status/839957805331279876
2017-03-09 16:55:20,you need to get out more if you think most Americans feel that way. You live in a bubble world? Talk w some1 outside your circle,839957801761964033,,0,0,,,,https://twitter.com/Truth_Famine/status/839957801761964033
2017-03-09 16:55:19,You must get out of your comfort zone . . . . . #selfemployed #success #successmindset … https://www. instagram.com/p/BRbuchPBlWU/,839957799916331008,,1,6,,#selfemployed #success #successmindset,,https://twitter.com/MrWagner37/status/839957799916331008
2017-03-09 16:55:19,@JordanPeele did Alfred Hitchcock steal your black body and put his brain inside of it? You are a cinema genius #GetOut,839957796800061440,,0,1,@JordanPeele,#GetOut,,https://twitter.com/CHANDLERralphii/status/839957796800061440
2017-03-09 16:55:18,Movies tonight finally going see #GetOut,839957793893408771,,0,0,,#GetOut,,https://twitter.com/AintThatsTee/status/839957793893408771
2017-03-09 16:55:18,"Are you just ""shuffling"" from task to task when it comes to your #accounting work? Here's how to get out of that rut http:// ow.ly/QADu309uA2Q",839957792832249856,,0,0,,#accounting,,https://twitter.com/SmartVault/status/839957792832249856
2017-03-09 16:55:13,Cousins don't wanna play for the Redskins but they won't let him go somebody must of took his picture #GetOut,839957772011728897,,0,0,,#GetOut,,https://twitter.com/ItsMe_Chauntice/status/839957772011728897
2017-03-09 16:55:06,I need to get out of here,839957745197592584,,1,2,,,,https://twitter.com/jastokes14/status/839957745197592584
2017-03-09 16:55:05,get out really crazy,839957739858194432,,0,0,,,,https://twitter.com/1SHEEZUS/status/839957739858194432
2017-03-09 16:55:04,"If the Texans can get out of the Oswieler contract, the Yankees can get out of the Jacoby Ellsbury contract.",839957735148027905,,2,2,,,,https://twitter.com/madisonmills28/status/839957735148027905
2017-03-09 16:55:03,This financial advisor has a vape pen on her desk I gotta get out of here,839957730534293505,,0,1,,,,https://twitter.com/thornbrah/status/839957730534293505
2017-03-09 16:55:02,There is ideology here however misinformed. I'd pay to stay in because I think it's worth it. Brexiteers will pay to get out .,839957725849288709,,0,0,,,,https://twitter.com/FairtradeRuth/status/839957725849288709
2017-03-09 16:55:01,"I really wouldn't mind seeing "" get out "" again",839957723093540864,,1,1,,,,https://twitter.com/Brvndn/status/839957723093540864
2017-03-09 16:55:00,use ur get out of jail free card,839957720136613888,,0,0,,,,https://twitter.com/lookatmyglo/status/839957720136613888
2017-03-09 16:54:59,OUT. GET OUT .,839957716265213952,,0,0,,,,https://twitter.com/ElaineAtwell/status/839957716265213952
2017-03-09 16:54:58,Get Out is a perfect representation of how white people be,839957711299215361,,0,0,,,,https://twitter.com/RielDimee/status/839957711299215361
2017-03-09 16:54:58,Walmart be overworking these people #GetOut,839957710984642561,,0,0,,#GetOut,,https://twitter.com/NovembersQueen/status/839957710984642561
2017-03-09 16:54:53,i still wanna see Get Out since I couldn't,839957687924326401,,0,0,,,,https://twitter.com/_anavax19/status/839957687924326401
2017-03-09 16:54:52,Today is a day to not get out of bed and feel like life is on you.,839957685411782656,,0,1,,,,https://twitter.com/FosterBrennon/status/839957685411782656
2017-03-09 16:54:49,get out the Tavern mate,839957674313863168,,0,0,,,,https://twitter.com/Lee_Tollervey88/status/839957674313863168
2017-03-09 16:54:43,A friend figured that was a damn good reason to celebrate today as long as hes drivin im down to go anywhere these days I dnt get out much,839957649273868291,,0,0,,,,https://twitter.com/MinkChocolate78/status/839957649273868291
2017-03-09 16:54:43,"If the Texans can get out of the Oswieler contract, the Knicks can get out of the Joakim Noah contract.",839957646631448576,,0,0,,,,https://twitter.com/madisonmills28/status/839957646631448576
2017-03-09 16:54:42,A Scene From ‘ Get Out ’ Has Sparked A Meme That’s Scary Awesome http:// newshq.in/Nb0VFL pic.twitter.com/L3iffCYXVa,839957643837890560,,0,0,,,,https://twitter.com/newshqtoday/status/839957643837890560
2017-03-09 16:54:42,#فلم_الكوميدي Get Out مترجم . . التقييم: 8.3 /10 الكود : #15424 الدقه : HDcam رابط الفلم : http:// ar.oo.je/gtout #افلام_فشار #فشار pic.twitter.com/S8I2V1Rkt8,839957642508468228,,5,54,,#فلم_الكوميدي #15424 #افلام_فشار #فشار,,https://twitter.com/ifushaar/status/839957642508468228
2017-03-09 16:54:35,How the fuck could this happen mind you I'm not surprised its not the first time wrong prisoners get out .,839957614645612545,,0,0,,,,https://twitter.com/susannawhite123/status/839957614645612545
2017-03-09 16:54:34,Just saw Get Out ...whew that was a lot,839957608446492675,,0,0,,,,https://twitter.com/_terpsich0re/status/839957608446492675
2017-03-09 16:54:32,Loving @StaceySolomon on #ReleaseTheHounds she is so funny love how she was willing to give joe up to get out the house,839957603543289856,,0,3,@StaceySolomon,#ReleaseTheHounds,,https://twitter.com/Danielle_steel8/status/839957603543289856
2017-03-09 16:54:32,Back home unfortunately. I was planning to see Get Out but onboarding and the bus took longer than I expected,839957602675142661,,0,0,,,,https://twitter.com/jimmyyadig/status/839957602675142661
2017-03-09 16:54:32,A Scene From ‘ Get Out ’ Has Sparked A Meme That’s Scary Awesome http:// trumpedamerica.appspot.com/article.jsp?na me=a-scene-from-get-out-has-sparked-a-meme-thats-scary-awesome&t=news … pic.twitter.com/ARvZHCIi4v,839957602154999810,,0,0,,,,https://twitter.com/trumped_news/status/839957602154999810
2017-03-09 16:54:30,get out spoilers but anyway i didn't even question this bc i thought it was just white culture pic.twitter.com/qDmAJasZ0H,839957592222957568,,0,1,,,,https://twitter.com/battlecalm/status/839957592222957568
2017-03-09 16:54:28,"I'm done. After watching "" Get Out "" I'm never going inside a white person's house again.",839957584543174656,,0,9,,,,https://twitter.com/HJaved420/status/839957584543174656
2017-03-09 16:54:27,"ACC=Tourists. Get in and get out , NYC is run by the BigEast https:// twitter.com/nypost_brazill e/status/839956182727008256 …",839957580566757376,,0,0,,,,https://twitter.com/M_Malgieri/status/839957580566757376
2017-03-09 16:54:26,That Get Out Movie Really Crazy,839957574556549124,,0,0,,,,https://twitter.com/RichBoy_Nas/status/839957574556549124
2017-03-09 16:54:21,Sooooooo i just watched get out and i must say that NO WHITE BITCH BETTER NOT COME UP TO ME FOR ANY FUCKING THING Oms im on my P's & Q's,839957556525223936,,0,3,,,,https://twitter.com/Papii_333/status/839957556525223936
2017-03-09 16:54:20,The ending of Get Out could've been better tbh.,839957551026503681,,0,0,,,,https://twitter.com/KicksForDayz_/status/839957551026503681
2017-03-09 16:54:19,Ive been on twitter for almost two years. Its time to commit or get out .,839957546152693760,,0,0,,,,https://twitter.com/quotepelican/status/839957546152693760
2017-03-09 16:54:13,What do people get out of been an absolute cunt? Just cos you have a shite life no need to take it out on everyone else,839957521884459008,,0,0,,,,https://twitter.com/sammy_ohhh/status/839957521884459008
2017-03-09 16:54:12,A Scene From ‘ Get Out ’ Has Sparked A Meme That’s Scary Awesome http:// trumpedamerica.appspot.com/article.jsp?na me=a-scene-from-get-out-has-sparked-a-meme-thats-scary-awesome&t=trump … pic.twitter.com/nTGU2UNj0C,839957518495469568,,0,0,,,,https://twitter.com/TrumpedAmerica/status/839957518495469568
2017-03-09 16:54:12,If you talk shit then I talk shit back &you block me you a bitch can't handle the heat get out my kitchen,839957518306672641,,0,0,,,,https://twitter.com/BOSSMARVEN/status/839957518306672641
2017-03-09 16:54:12,i watched get out yesterday and that movie was terrible Lmao,839957516733652992,,0,2,,,,https://twitter.com/theyknowvee/status/839957516733652992
2017-03-09 16:54:11,Didn't get out cause I failed the out of map because I didn't jump to the door and I died inside eallbreach,839957512879218688,,0,1,,,,https://twitter.com/GGRALOH/status/839957512879218688
2017-03-09 16:54:06,Watching get out,839957490548764672,,0,0,,,,https://twitter.com/PaVar_Ball/status/839957490548764672
2017-03-09 16:54:03,"@GetOutMovie was outstanding. Well done, @JordanPeele ! #GetOut",839957479530332160,,0,0,@GetOutMovie @JordanPeele,#GetOut,,https://twitter.com/ChaiMike26/status/839957479530332160
2017-03-09 16:54:02,Our friends over at Drew & Rogers Inc. managed to get out with 5 minutes left on the clock!… https://www. instagram.com/p/BRbuTB2DjE_/,839957476095262723,,1,0,,,,https://twitter.com/escape_state/status/839957476095262723
2017-03-09 16:53:57,Guess who just saw Get Out again? Me bitch lol,839957453169102849,,0,0,,,,https://twitter.com/minimomba/status/839957453169102849
2017-03-09 16:53:56,"Get out there if you can, he’ll probably thinks its part of his victory tour https:// twitter.com/TopherSpiro/st atus/839544754379636746 …",839957452359630848,,1,1,,,,https://twitter.com/45enoughalready/status/839957452359630848
2017-03-09 16:53:53,I'm ready to get out this house wtf is rell doing,839957439449554945,,0,0,,,,https://twitter.com/SwavyTray_/status/839957439449554945
2017-03-09 16:53:52,I still haven't seen get out wthhhh,839957433246232577,,1,0,,,,https://twitter.com/anak24_/status/839957433246232577
2017-03-09 16:53:50,for the love of god Miles get out,839957423205056514,,0,0,,,,https://twitter.com/iggigg/status/839957423205056514
2017-03-09 16:53:48,Being sick the day we get out for spring break is just flippin fabulous,839957417463058433,,0,8,,,,https://twitter.com/sidrydel/status/839957417463058433
2017-03-09 16:53:46,#GetOut got me out here getting mad over nothing seen a white lady taking orders and a black lady slaving over the stove instantly got mad,839957409313378305,,0,0,,#GetOut,,https://twitter.com/RihannaXhusband/status/839957409313378305
2017-03-09 16:53:46,what do i get out of this,839957406583062530,,0,1,,,,https://twitter.com/xosivan/status/839957406583062530
2017-03-09 16:53:41,About to now watch Get out !!,839957387670925312,,0,0,,,,https://twitter.com/SocialGlobalSMT/status/839957387670925312
2017-03-09 16:53:41,Adelynne does this not so cute thing where she'll get out of the tub to show me the puddle she makes from the water dripping off of her.,839957385754116096,,0,3,,,,https://twitter.com/jimenezbabii/status/839957385754116096
2017-03-09 16:53:39,Stuff Monsters Like: Have you seen #GetOut yet? http://www. stuffmonsterslike.com/horror-review- get-out/ … … #horror http:// dlvr.it/Nb0TPY @scottia pic.twitter.com/F31ZFsPeCF,839957380347547648,,0,0,@scottia,#GetOut #horror,,https://twitter.com/scottia/status/839957380347547648
2017-03-09 16:53:34,This look just like scene from get out https:// twitter.com/crackcokaine/s tatus/833020984911335426 …,839957356549189632,,0,1,,,,https://twitter.com/its_ceej/status/839957356549189632
2017-03-09 16:53:33,@DrawnByLeek I saw on your link you have the get out print but it's 6x6 is there any way to get a bigger one?,839957356075225093,,0,0,@DrawnByLeek,,,https://twitter.com/Sinnerellaa/status/839957356075225093
2017-03-09 16:53:32,Get out !!!! https:// twitter.com/stevestfler/st atus/839860987268300801 …,839957348118585348,,0,0,,,,https://twitter.com/King_Hueyo/status/839957348118585348
2017-03-09 16:53:30,I just got picked up from school before 3 which is the time when I get out of school lol,839957339448938497,,0,3,,,,https://twitter.com/Ironicbish/status/839957339448938497
2017-03-09 16:53:24,I told that bitch I count my cake bitch get out my face,839957317504368640,,0,0,,,,https://twitter.com/ProjectSikSeven/status/839957317504368640
2017-03-09 16:53:23,I'm finna do the get out challenge lmaooooo,839957311368134656,,0,1,,,,https://twitter.com/Jarahhhh/status/839957311368134656
2017-03-09 16:53:22,"@SenateMajLdr get on board, or get out of the way. #RepealAndReplace #taxreform #byaugustbreak",839957308532797446,,0,0,@SenateMajLdr,#RepealAndReplace #taxreform #byaugustbreak,,https://twitter.com/Polymorphed101/status/839957308532797446
2017-03-09 16:53:20,I really need a Hawaiian vacation. I need to get out to Kaua‘i soon. That's the most beautiful place I've seen and I've been gone too long.,839957298055254016,,0,0,,,,https://twitter.com/kornzilla2k1/status/839957298055254016
2017-03-09 16:53:19,It was manageable then but it required a lot of managing. I rushed to get out . The timing was the best it could be but still tough.,839957296771923973,,0,0,,,,https://twitter.com/BertLoch/status/839957296771923973
2017-03-09 16:53:18,she now described the whole plot to get out and people said not to spoil it and she still did lmao,839957292065787904,,0,2,,,,https://twitter.com/jessicagravity/status/839957292065787904
2017-03-09 16:53:16,HOF oml get out you do not know what you are talking about,839957282632916992,,0,0,,,,https://twitter.com/EarpAaron/status/839957282632916992
2017-03-09 16:53:14,Happy Hour and Get Out is the play this evening. Strong.,839957273875263488,,0,1,,,,https://twitter.com/mattyports/status/839957273875263488
2017-03-09 16:53:11,Get out & exercise. It's your brain asking for it :) https:// youtu.be/Chr3rQ6Vpcw,839957262798061570,,0,0,,,,https://twitter.com/MaricaCassarino/status/839957262798061570
2017-03-09 16:53:06,Okay someone go watch Get Out w me this weekend,839957241792978945,,5,9,,,,https://twitter.com/PaytonWoosley__/status/839957241792978945
2017-03-09 16:53:04,Get Out is 10/10 but the ending kinda killed it lmao,839957233496498176,,1,3,,,,https://twitter.com/xFrancisRoque/status/839957233496498176
2017-03-09 16:53:02,Bonus happiness: Picked up our tickets for Get Out for this weekend. So scared and therefore so excited.,839957225657421825,,0,0,,,,https://twitter.com/the_real_tyler/status/839957225657421825
2017-03-09 16:53:00,My body odor smells like reefer. What you put in is what you get out so they say.,839957214886404097,,0,1,,,,https://twitter.com/cieradowork/status/839957214886404097
2017-03-09 16:52:58,Get out of here this is so cute!! https:// twitter.com/girlposts/stat us/838104824583434241 …,839957209085775872,,0,1,,,,https://twitter.com/stephhanierenee/status/839957209085775872
2017-03-09 16:52:54,Trying to shower is difficult because Derek sleeps in the bathtub and refuses to get out .,839957191004196865,,0,5,,,,https://twitter.com/Michaelaamelia/status/839957191004196865
2017-03-09 16:52:53,Our other recent PMs should take pointers from @JuliaGillard on appropriate post leader etiquette. Get out & get on with life,839957184280526848,,0,0,@JuliaGillard,,,https://twitter.com/DobsonJan/status/839957184280526848
2017-03-09 16:52:52,"Reading the comments BTL can I just ask politely and calmly, how soon can we get out of this nasty UK?",839957184104501249,,0,0,,,,https://twitter.com/WattsWilma/status/839957184104501249
2017-03-09 16:52:52,Watching Get Out,839957181294317568,,0,0,,,,https://twitter.com/that_RIDDICK/status/839957181294317568
2017-03-09 16:52:50,nigga lookin like bitch you better get out My car lmao RT @AyeMistahCarter : Come on mann,839957175132758016,,0,0,@AyeMistahCarter,,,https://twitter.com/PostedWidPuff/status/839957175132758016
2017-03-09 16:52:47,finally about to go see get out,839957159316193280,,0,0,,,,https://twitter.com/hermosazayy/status/839957159316193280
2017-03-09 16:52:46,When you have to watch get out by yourself cus everyone already watched it,839957155000242182,,0,3,,,,https://twitter.com/taijahsaunders/status/839957155000242182
2017-03-09 16:52:43,get out,839957143725965312,,0,1,,,,https://twitter.com/mcmanning1/status/839957143725965312
2017-03-09 16:52:42,Somebody find Mary Mitchell for me please!!! Spat Chance??? Really??? #GetOut,839957138789314563,,0,0,,#GetOut,,https://twitter.com/MalcolmTalks/status/839957138789314563
2017-03-09 16:52:41,"If the Browns are ever going to get out of their hole, this is the chance. I think it's a good move as well.",839957137837133825,,0,0,,,,https://twitter.com/oxfordparkcomjd/status/839957137837133825
2017-03-09 16:52:41,Time to get out my tissues! ...,839957137543606272,,0,0,,,,https://twitter.com/vilxo/status/839957137543606272
2017-03-09 16:52:35,If you haven't seen the movie Get Out watch the @Redskins players as they give you a preview,839957110612000768,,0,0,@Redskins,,,https://twitter.com/TydoTJ/status/839957110612000768
2017-03-09 16:52:35,ready to get OUT of sabine parish ASAP,839957108938452992,,3,13,,,,https://twitter.com/aaliyahnikale/status/839957108938452992
2017-03-09 16:52:33,You get out what you put in!! Got to put more in if I want more,839957101397041157,,1,1,,,,https://twitter.com/jheard_PPP_38/status/839957101397041157
2017-03-09 16:52:33,Judging everyone and everything will keep you in the hole you have made around your life. #ThursdayThoughts #positivethinking #getout,839957101334179841,,0,0,,#ThursdayThoughts #positivethinking #getout,,https://twitter.com/poetbuterscotch/status/839957101334179841
2017-03-09 16:52:32,Mazi must've seen get out cuz when that lady came to the door he spazzed out,839957097047400448,,0,0,,,,https://twitter.com/unkwncenterfold/status/839957097047400448
2017-03-09 16:52:32,Robot: r we there yet Woman: FOR THE LAST FUCKING TIME WE ARENT FUCKING THERE YET! GET OUT OF MY FUCKING CAR,839957096779173888,,0,0,,,,https://twitter.com/Darkened_Raven/status/839957096779173888
2017-03-09 16:52:32,I want to see get out tonight,839957096435175425,,0,1,,,,https://twitter.com/xtheyLOVEashxo/status/839957096435175425
2017-03-09 16:52:30,I liked a @YouTube video http:// youtu.be/DmNpjCFSkZw?a NORMIES GET OUT,839957090701471744,,0,1,@YouTube,,,https://twitter.com/WalidTheMouffin/status/839957090701471744
2017-03-09 16:52:30,Get Out is so fucking good man..,839957090189869056,,2,0,,,,https://twitter.com/KeeveeTheRapper/status/839957090189869056
2017-03-09 16:52:26,this year we struggled w/giving teams early leads & against SHSU we dug a hole we couldn't get out of.,839957073072902144,,0,0,,,,https://twitter.com/Darrogerthat/status/839957073072902144
2017-03-09 16:52:25,There is no spoon. #12x12 acrylic on canvas. #art #redpill #thematrix #getout https://www. instagram.com/p/BRbuHLzF5xr/,839957069528727556,,0,0,,#12x12 #art #redpill #thematrix #getout,,https://twitter.com/JWadGallery/status/839957069528727556
2017-03-09 16:52:24,yeah get out,839957065959440385,,0,0,,,,https://twitter.com/KayleighGannon3/status/839957065959440385
2017-03-09 16:52:19,"These "" Get Out "" discussions be insane..... Went into it thinking horror, and left having seen the best most truthful comedy in a long time.",839957044748845056,,0,0,,,,https://twitter.com/LeDjeNdAry/status/839957044748845056
2017-03-09 16:52:17,Falcons plate a pair in the 2. Lead @bluedevilslive 2-0 in varsity scrimmage! Still time to get out here. JV to follow,839957036674781184,,1,1,@bluedevilslive,,,https://twitter.com/vhsfalconslive/status/839957036674781184
2017-03-09 16:52:17,"In the words of A.A Milne, "" get out of my chair, dillhole.""",839957035840065537,,0,0,,,,https://twitter.com/beth_lewie/status/839957035840065537
2017-03-09 16:52:16,$ XTNT is exactly why I don't play earnings. Was in this heap for a while made some and was happy to get out before today.,839957032249729024,,0,0,,,,https://twitter.com/TraderDanger/status/839957032249729024
2017-03-09 16:52:16,It's Forcing me to get out of my comfort zone but also having scary health issues https:// twitter.com/50shadesof_nay _/status/839668831299768320 …,839957029506670593,,0,0,,,,https://twitter.com/SephoritaLova/status/839957029506670593
2017-03-09 16:52:15,like fill the potholes and get out,839957028135116800,,0,0,,,,https://twitter.com/GDzedzy/status/839957028135116800
2017-03-09 16:52:14,It's #valspar haha my bad . Shaping up to be a good weekend already ! Can't wait to get out and hack up some grass #ValsparChampionship,839957023315857410,,0,0,,#valspar #ValsparChampionship,,https://twitter.com/lynchysviews/status/839957023315857410
