index,text,id,username,retweets,favorites,mentions,hashtags,geo,permalink
2017-03-09 18:17:37,senhoraa cancela e vê #GETOUT https:// twitter.com/shannybarbs/st atus/839976991168364544 …,839978511783854080,,0,0,,#GETOUT,,https://twitter.com/DenzelBangBang/status/839978511783854080
2017-03-09 18:17:37,I think these Get Out challenge videos are funny http:// fb.me/1OriVCzV1,839978509573468161,,0,1,,,,https://twitter.com/khesap/status/839978509573468161
2017-03-09 18:17:37,Real nice interview by Brett and love the plug for O'Leary hockeyville. People get out and vote https:// twitter.com/monstershockey /status/839940124817285120 …,839978509518962689,,6,5,,,,https://twitter.com/BlueTractorMike/status/839978509518962689
2017-03-09 18:17:37,Oh well shit happens... They need to get out of the way,839978509435076609,,0,0,,,,https://twitter.com/RichReynolds111/status/839978509435076609
2017-03-09 18:17:37,the American people handed the Republicans the opportunity to Make America Great Again. Can't help? Get out of the way,839978508185141248,,0,0,,,,https://twitter.com/patriotgr2/status/839978508185141248
2017-03-09 18:17:35,Just get out the way https:// twitter.com/wakeuppeopie/s tatus/839121592315707393 …,839978501730119680,,1,4,,,,https://twitter.com/BamBriaan/status/839978501730119680
2017-03-09 18:17:33,'News Update:' Kansas man in ' get out of my country' shooting of Indian man appears in court http:// ow.ly/tyr250a53EZ,839978495216349184,,0,0,,,,https://twitter.com/dartfacts/status/839978495216349184
2017-03-09 18:17:29,My late ass finally saw get out,839978476086185986,,0,3,,,,https://twitter.com/Marviannn/status/839978476086185986
2017-03-09 18:17:28,11 Did you get out 〜ing? Meaning: Did you get out 〜ing? 意味：〜したの? Did you get out running this weekend? #英会話 #learnenglish,839978471472295940,,0,0,,#英会話 #learnenglish,,https://twitter.com/homura0402/status/839978471472295940
2017-03-09 18:17:25,Hella symbolism in Get Out,839978460600659968,,0,0,,,,https://twitter.com/bigbrimstone/status/839978460600659968
2017-03-09 18:17:23,There's this weird ass lady staring at me at the drive through and I want to get out and punch her lol,839978451897532416,,0,0,,,,https://twitter.com/dirtXnaasty/status/839978451897532416
2017-03-09 18:17:22,When you get out of a long practice to find out your sister and dad are steady roasting you on the twitasphere<<<< #LetMeLive,839978448705708032,,1,10,,#LetMeLive,,https://twitter.com/MikeskaSeth/status/839978448705708032
2017-03-09 18:17:18,Get out . Now. https:// twitter.com/justtipme_/sta tus/839977828238127104 …,839978430464684032,,0,0,,,,https://twitter.com/LifeBeTrippin/status/839978430464684032
2017-03-09 18:17:17,Has everyone seen @GetOutMovie yet? I want to talk about it with every person I meet,839978428023599105,,0,0,@GetOutMovie,,,https://twitter.com/hnewmansmart/status/839978428023599105
2017-03-09 18:17:17,"@jasoncundy05 @andygoldstein05 Celtic wouldn't get out the championship, let's have it right. Deluded fans tonight ... @talkSPORT",839978425205075968,,0,0,@jasoncundy05 @andygoldstein05 @talkSPORT,,,https://twitter.com/JakeJake2812/status/839978425205075968
2017-03-09 18:17:14,Give that man a the only thing @UKLabour get out of a snap election it a new leader. Other than that a complete waste of time and #bbcqt,839978411833626624,,0,0,@UKLabour,#bbcqt,,https://twitter.com/cambosheff/status/839978411833626624
2017-03-09 18:17:09,"Get out , get out , get out of my mind And come on, come into my life I don't, I don't, don't know what it is But I need that o #OneDirection",839978394456489984,,0,0,,#OneDirection,,https://twitter.com/One_nicechance/status/839978394456489984
2017-03-09 18:17:06,omg the ' get out ' jojo?,839978379336155144,,0,0,,,,https://twitter.com/ms_peaceweaver/status/839978379336155144
2017-03-09 18:17:06,they should open up or get out,839978379118018560,,0,0,,,,https://twitter.com/AlznerRoy/status/839978379118018560
2017-03-09 18:17:04,I gotta get out of ny,839978373107576832,,0,2,,,,https://twitter.com/yairforceone/status/839978373107576832
2017-03-09 18:17:02,"How will John Rudiger get out of his latest mess? My thriller, Spin Move. Read a sample. #crime #thriller #suspense http:// tinyurl.com/kkshxt8",839978364672901121,,0,0,,#crime #thriller #suspense,,https://twitter.com/davidtlender/status/839978364672901121
2017-03-09 18:17:01,"Looking at the forecast I see five days of temperatures in the 90's. I wish I could get out of Arizona sooner, man...",839978358280671232,,0,0,,,,https://twitter.com/JordanWoollenVO/status/839978358280671232
2017-03-09 18:16:58,boutta get out this bathtub & go straight to sleep .. & sleep good,839978347782438913,,0,0,,,,https://twitter.com/kkirstynleigh/status/839978347782438913
2017-03-09 18:16:57,Not to be that guy...but the first thing you shouldn't do is get out of your car in a road rage incident...,839978343990677505,,0,0,,,,https://twitter.com/Ospreys81/status/839978343990677505
2017-03-09 18:16:56,"Watching this 60-70 y.o. White man pick up this 25 yr old black girl thinking ""she must not have seen Get Out yet""",839978339653857280,,0,0,,,,https://twitter.com/Lamar_NoOdom/status/839978339653857280
2017-03-09 18:16:55,I'm seeing Get Out tonight.,839978334557728768,,0,0,,,,https://twitter.com/getyashinebox_/status/839978334557728768
2017-03-09 18:16:48,Can't sleep at night and can't get out of bed in the morning,839978305763827712,,0,0,,,,https://twitter.com/Rubidium_/status/839978305763827712
2017-03-09 18:16:48,Brittany Snow can put me in a closet anyday. I don't care if it took me 17 years to get out last time,839978305403068416,,5,11,,,,https://twitter.com/acaawesomenerd/status/839978305403068416
2017-03-09 18:16:45,"haven't you heard? i'm not yours anymore i'm not yours anymore it's my soul, and I think it's time to get out",839978293352849408,,1,0,,,,https://twitter.com/fr_azzled/status/839978293352849408
2017-03-09 18:16:45,anyone wanna go see get out & logan?,839978290387419138,,0,2,,,,https://twitter.com/HaiImIvan/status/839978290387419138
2017-03-09 18:16:44,Another great thing about the success of ' Get Out ' is that I finally know which one of them is Key and which one of them is Peele.,839978287044694019,,1,5,,,,https://twitter.com/BrotherDante/status/839978287044694019
2017-03-09 18:16:44,Get out was crazy but why did it have to end like that...,839978286642057216,,0,0,,,,https://twitter.com/AWinnerduhh/status/839978286642057216
2017-03-09 18:16:42,I need a vacation & get out of Michigan,839978278626742272,,16,16,,,,https://twitter.com/elvia_vizcarra/status/839978278626742272
2017-03-09 18:16:41,I won't even be able to catch the game. I decided Wichita wasn't AAC worthy so I had to get out of town ASAP. I will be up in the air. https:// twitter.com/uconnolliewood /status/839977868054654976 …,839978274520530945,,0,1,,,,https://twitter.com/UConn6thBorough/status/839978274520530945
2017-03-09 18:16:41,Does anyone know if Get Out is available on the firestick yet? I'm too lazy and full to switch out the chrome cast just to be disappointed,839978274264657920,,0,0,,,,https://twitter.com/Brandii_Candi/status/839978274264657920
2017-03-09 18:16:40,Most likely to use their period as an excuse to get out of the annual hospital staff softball game,839978272511447042,,0,0,,,,https://twitter.com/greysukay/status/839978272511447042
2017-03-09 18:16:39,Fucking flower crown hairstyle get out tumblr :U,839978265074888707,,0,0,,,,https://twitter.com/Pendjicles/status/839978265074888707
2017-03-09 18:16:37,@JulianAssange_ Smart to get out & start helping people defeat the false narrative. U r the truth & elites & DC will try to destroy u!,839978259723026435,,0,0,@JulianAssange_,,,https://twitter.com/Resistmybutt/status/839978259723026435
2017-03-09 18:16:37,Game night starts at 7:00! Get out to Sharky's play some games and drink some beer Karaoke starts at 10:00 http:// fb.me/1WZQeMjy7,839978259488124928,,0,1,,,,https://twitter.com/Bigrandy52/status/839978259488124928
2017-03-09 18:16:34,『 Get Out 』やTVシリーズ『Atlanta』などで活躍する俳優ラキース・スタンフィールドのラッパー名義MoorsとALA.NIの新プロジェクト。 #Moors https:// twitter.com/PigsAndPlans/s tatus/839915849729236992 …,839978245281964033,,1,2,,#Moors,,https://twitter.com/LeratoAnzjp/status/839978245281964033
2017-03-09 18:16:33,We finally seeing get out my gf won't stop talking tho,839978241783922688,,0,0,,,,https://twitter.com/AliciaMinyon/status/839978241783922688
2017-03-09 18:16:33,Get out of my yard,839978239758139392,,0,1,,,,https://twitter.com/brianggeorge/status/839978239758139392
2017-03-09 18:16:27,Muhammad Ali became a Muslim to get out of serving in Vietnam don't make me laugh,839978214785183744,,0,0,,,,https://twitter.com/realTMcCormick/status/839978214785183744
2017-03-09 18:16:26,"And in case you're new here this Twitter is all about VapeNation so if you're offended, get out .",839978213753442304,,0,0,,,,https://twitter.com/Flollu/status/839978213753442304
2017-03-09 18:16:26,i'm going to see get out tonight!!,839978211496906752,,0,4,,,,https://twitter.com/vyrantiums/status/839978211496906752
2017-03-09 18:16:22,im determined to go see get out this weekend,839978196011528193,,0,0,,,,https://twitter.com/Jay_NYaFace/status/839978196011528193
2017-03-09 18:16:22,"Year 11, I couldn't wait to get out https:// twitter.com/sellubanya1/st atus/839841642144280576 …",839978194665144320,,0,0,,,,https://twitter.com/NSKL_/status/839978194665144320
2017-03-09 18:16:13,jonathan and i are still shook after watching get out .,839978156014632960,,0,0,,,,https://twitter.com/Elisa_528/status/839978156014632960
2017-03-09 18:16:10,I hope y'all enjoy the team weeks :) I'm trying to come this summer if I can get out of doing summer classes!!!,839978144929107968,,0,0,,,,https://twitter.com/iamgengurley/status/839978144929107968
2017-03-09 18:16:08,Get out my face,839978136116867072,,0,0,,,,https://twitter.com/htxdreamz/status/839978136116867072
2017-03-09 18:16:07,but let's just blame it on my tight pants and enormous tits. Get out of my way I'm late for work.,839978131805036544,,0,1,,,,https://twitter.com/LizzCastles/status/839978131805036544
2017-03-09 18:16:04,I want to get out of NY,839978120421789696,,4,2,,,,https://twitter.com/sellavoanirak/status/839978120421789696
2017-03-09 18:16:01,"ptsd is not even a real disease, get out of your bubble.",839978109155889153,,0,0,,,,https://twitter.com/tonyhoro/status/839978109155889153
2017-03-09 18:15:59,Get out was good,839978096971358208,,0,0,,,,https://twitter.com/bankrollreese/status/839978096971358208
2017-03-09 18:15:56,"lmaooooo now that I think about it, it's an autobiography of you",839978084589690880,,0,0,,,,https://twitter.com/three6chaka/status/839978084589690880
2017-03-09 18:15:54,"Think imma check out "" Get Out",839978078948511748,,0,2,,,,https://twitter.com/Bouncekeepit100/status/839978078948511748
2017-03-09 18:15:53,Get out of the way https://www. instagram.com/p/BRb3qldjJ1l/,839978073567178752,,0,0,,,,https://twitter.com/JuliiAcilio/status/839978073567178752
2017-03-09 18:15:52,#getout reviewed in my new #podcast . Hear it without spoilers here http:// screamingqueenz.podbean.com/e/screaming-qu eenz-ep-33-get-out/ …,839978068664000513,,1,1,,#getout #podcast,,https://twitter.com/jonnylarkin/status/839978068664000513
2017-03-09 18:15:50,"Wow, GET OUT was GOOD @JordanPeele WELL DONE",839978059197534209,,0,1,@JordanPeele,,,https://twitter.com/lefthandedsun/status/839978059197534209
2017-03-09 18:15:48,Get out of my room.,839978053103190016,,1,0,,,,https://twitter.com/zaneigh21/status/839978053103190016
2017-03-09 18:15:35,"Get Out was so good , it's different from other movies !",839977999730630656,,0,0,,,,https://twitter.com/Samaria_Mommy26/status/839977999730630656
2017-03-09 18:15:34,? Your team had to pay a 2nd round pick to get out of a major fuckup. We'll allow you to continue celebrating now. https:// twitter.com/michaelberrysh o/status/839973252701229056 …,839977994907189252,,0,0,,,,https://twitter.com/DJ84/status/839977994907189252
2017-03-09 18:15:33,""" GET OUT OF MY HOUSE!"" has a gem clutched in his hand.",839977988364075008,,0,0,,,,https://twitter.com/maxicthief/status/839977988364075008
2017-03-09 18:15:29,I need to get out this mall like now,839977972371206145,,0,0,,,,https://twitter.com/alexis_jasha/status/839977972371206145
2017-03-09 18:15:28,Get out of my dreams,839977967300255745,,0,0,,,,https://twitter.com/naticus/status/839977967300255745
2017-03-09 18:15:21,I should be petty tell my bitch fuck your broke ass babyfather. But what can we get out of that.,839977940880334848,,0,0,,,,https://twitter.com/AmoniChanel/status/839977940880334848
2017-03-09 18:15:21,fact: I LOOVE watching horror movies but NEVER have I ever watched one by myself NEVER. #getout,839977938137284609,,0,0,,#getout,,https://twitter.com/JaRaMiLlAD/status/839977938137284609
2017-03-09 18:15:19,Do not take life too seriously. You will never get out of it alive.,839977929341784064,,0,0,,,,https://twitter.com/VTaekim95/status/839977929341784064
2017-03-09 18:15:18,Get out of that slump & start doing these tasks to truly be a #productive worker-bee. #goodvibes #habits http:// ow.ly/8q963090vJx pic.twitter.com/4s5Phlb6HM,839977927295008768,,1,1,,#productive #goodvibes #habits,,https://twitter.com/media_mad/status/839977927295008768
2017-03-09 18:15:16,"THIS WOMAN COULD NOT GET OUT OF THE BED BECAUSE OF A STRONG PAIN IN THE JOINTS, UNTIL SHE .. https://www. top10homeremediess.com/healthy/woman- not-get-bed-strong-pain-joints-started-taking/ … via @MrOutbrain",839977917836849154,,2,0,@MrOutbrain,,,https://twitter.com/healthy_farm/status/839977917836849154
2017-03-09 18:15:15,The laze to get out of bed ... gdi,839977916020662272,,0,0,,,,https://twitter.com/farishhaa/status/839977916020662272
2017-03-09 18:15:14,Did she think I told her to Get Out ? pic.twitter.com/ReBvPANv4A,839977910161252352,,0,3,,,,https://twitter.com/TheSportsJim/status/839977910161252352
2017-03-09 18:15:12,"A FUCKING POG RESERVIST JUST HAD THE NERVE TO ASK ME ""why do u wanna get out ? u just party all the time""",839977901541957633,,0,0,,,,https://twitter.com/keeganhislop/status/839977901541957633
2017-03-09 18:15:11,"GET OUT WHILE YOU STILL CAN!!! ""Games"" like this aren't worth it. Trust me, I've learnt from experience.",839977899130290177,,0,1,,,,https://twitter.com/SteviePatamon/status/839977899130290177
2017-03-09 18:15:09,Monks from #dhammakaya can get out to receive alms every morning exit frm gate 5/6 & back@gate7 #weneedfood #HumanRights,839977888044666880,,0,0,@gate7,#dhammakaya #weneedfood #HumanRights,,https://twitter.com/zuchanya/status/839977888044666880
2017-03-09 18:15:06,"if you come to me and say ""Effy and Freddie were perfect for each other"" the doors on your left. Get out",839977876908810241,,1,1,,,,https://twitter.com/mill_stocks/status/839977876908810241
2017-03-09 18:15:03,There's a student in my lecture who is legit asleep curled up under a coat. #getout,839977862673367043,,0,1,,#getout,,https://twitter.com/dexter_doggie/status/839977862673367043
2017-03-09 18:15:02,"All they have to do is get out & get a well paid job, then they can drive & buy a house. God, it's so easy to overcome poverty. #auspol https:// twitter.com/Lyn_Col/status /839961216453787649 …",839977858508378112,,0,1,,#auspol,,https://twitter.com/PeterRelph/status/839977858508378112
2017-03-09 18:15:02,Lil za is a boxer. I ride for my nigga I die for my nigga. Seat belt always strapped but justin... Baby... You can't get out the car 4 dis https:// twitter.com/kdrickzzler/st atus/839974062248062976 …,839977858437017600,,1,4,,,,https://twitter.com/SavagexMami/status/839977858437017600
2017-03-09 18:14:59,"haha. Yeah I mean, if you get in, you might not get out .",839977848270127105,,0,0,,,,https://twitter.com/selling_theta/status/839977848270127105
2017-03-09 18:14:59,@VZWSupport i switch from att w 4 lines n traded in phones. service is bad where I m n can’t get out without paying $2200. Why not a break?,839977845766127616,,0,0,@VZWSupport,,,https://twitter.com/fharczuk/status/839977845766127616
2017-03-09 18:14:57,GET OUT https:// twitter.com/skyeasiyanbi/s tatus/839973015488237573 …,839977839453700096,,0,0,,,,https://twitter.com/slecpers/status/839977839453700096
2017-03-09 18:14:57,If you don't like pop get out of my face.,839977838082052096,,0,0,,,,https://twitter.com/1DEbooks/status/839977838082052096
2017-03-09 18:14:54,I really need to pee but I don't wanna get out of bed,839977825864146944,,0,1,,,,https://twitter.com/shayscoIIeen/status/839977825864146944
2017-03-09 18:14:52,yea defiantly cause I get out at 9 my guy,839977816519299076,,0,0,,,,https://twitter.com/illMindOfJosh/status/839977816519299076
2017-03-09 18:14:48,"No problem with any Redskins brawling in practice, to me that shows their care about winning. Put in, or get out .",839977803114295296,,0,0,,,,https://twitter.com/BiGTaVoZ/status/839977803114295296
2017-03-09 18:14:48,Hey Hun? Can you get out the tape and the sharpie? pic.twitter.com/t7ZRmoWJPB,839977801822437377,,0,1,,,,https://twitter.com/krvanch/status/839977801822437377
2017-03-09 18:14:45,"Get Out lives up the hype. Pretty crazy movie, in a good way.",839977787377217536,,1,4,,,,https://twitter.com/dylann_west/status/839977787377217536
2017-03-09 18:14:45,yaaa get out baby,839977787226202112,,0,0,,,,https://twitter.com/sergadan31/status/839977787226202112
2017-03-09 18:14:42,When you're trying 2 go see #GetOut with your family and your little sister only watches animated movies #TIMETOGROWUP pic.twitter.com/8VFZ6c1aDS,839977775012466689,,0,0,,#GetOut #TIMETOGROWUP,,https://twitter.com/MusicDatum/status/839977775012466689
2017-03-09 18:14:42,"Get out of the office with a 1-minute footage reel of North Shore from Canada Place, taken today. http:// ruq.us/SCbVvwO #YVR",839977774844641281,,0,3,,#YVR,,https://twitter.com/BC411_/status/839977774844641281
2017-03-09 18:14:40,This is how I sound trying to get out of bed in the morning https:// twitter.com/realhughjackma n/status/839108592447995907 …,839977768926490624,,0,4,,,,https://twitter.com/mason_sigmon/status/839977768926490624
2017-03-09 18:14:40,"Get out , Rey! https:// twitter.com/radiotimes/sta tus/839791352539922432 …",839977767038992384,,0,0,,,,https://twitter.com/vanguy/status/839977767038992384
2017-03-09 18:14:39,"Wait so the dude from "" Get out "" isn't Bud from the Cosby Show. pic.twitter.com/ofsRF1VgwP",839977764962914305,,0,0,,,,https://twitter.com/That_GirlLauren/status/839977764962914305
2017-03-09 18:14:39,Maybe you should.. Better yet.. Maybe you should just get out of the @NFL totally.. What do you think @BengalsFiend @whodeybaby https:// twitter.com/paheringer/sta tus/839905007336058880 …,839977762182037505,,0,0,@NFL @BengalsFiend @whodeybaby,,,https://twitter.com/TheFranchise_14/status/839977762182037505
2017-03-09 18:14:27,Nursing school is bribing yourself to get out of bed every single day because you are just so tired and burned out,839977711124770817,,0,4,,,,https://twitter.com/hayley_taylorr/status/839977711124770817
2017-03-09 18:14:24,I do this this to my human.... nightly,839977698579603456,,0,1,,,,https://twitter.com/LaphroaigKitty/status/839977698579603456
2017-03-09 18:14:23,My get out challenge was a FAIL,839977695362555904,,0,0,,,,https://twitter.com/xx_Moneybagss/status/839977695362555904
2017-03-09 18:14:20,If my flat mate doesn't get out of the shower in a minute I'm gonna have to take a shit in a paper cup #honest,839977684914614273,,0,2,,#honest,,https://twitter.com/Nathc_22/status/839977684914614273
2017-03-09 18:14:18,Still waiting to see get out . Dude be playing.,839977676865675267,,0,0,,,,https://twitter.com/sippinonteaaa/status/839977676865675267
2017-03-09 18:14:17,What a great way to get out and enjoy the outdoors and all the nature that Canada has to offer https:// twitter.com/BioblitzCanada /status/826129125173760000 …,839977670557360128,,0,0,,,,https://twitter.com/bernersarebest/status/839977670557360128
2017-03-09 18:14:15,NATE get out this is a private conversation,839977661581553664,,0,0,,,,https://twitter.com/heylookacat/status/839977661581553664
2017-03-09 18:14:12,So ready to get out of town for a weekend,839977648495374336,,1,5,,,,https://twitter.com/sam_testerman/status/839977648495374336
2017-03-09 18:14:09,It amazes me how many people blame social media for everything like they have to log on. If you can't take the heat get out of the kitchen.,839977637288259584,,0,2,,,,https://twitter.com/Kwballa685/status/839977637288259584
2017-03-09 18:14:08,My mom just told me to get out of the kitchen cause we are not compatible working together. Honey how will I ever learn how to cook?,839977633836335104,,0,5,,,,https://twitter.com/OleMcMona/status/839977633836335104
2017-03-09 18:14:07,I get my moneeeii & i get out the way,839977630535417856,,1,0,,,,https://twitter.com/lillkedreii_/status/839977630535417856
2017-03-09 18:14:00,get out my mentions lil bro,839977597916348417,,0,0,,,,https://twitter.com/ArrionMonae/status/839977597916348417
2017-03-09 18:13:57,Get Out (2017),839977588030234625,,0,0,,,,https://twitter.com/hypercubexl/status/839977588030234625
2017-03-09 18:13:56,Did you know there's a #GetOut syllabus? https:// docs.google.com/document/d/1Vb Ya7JXmj87uvdEWFg1EAKio0duW8UpjLQDYu-XchvY/mobilebasic …,839977584825937922,,78,126,,#GetOut,,https://twitter.com/GraveyardSister/status/839977584825937922
2017-03-09 18:13:54,"""Do you think it would be wise to take a white girl to see Get Out ???"" - My homie",839977573668937728,,0,0,,,,https://twitter.com/CamCooLLaidMan/status/839977573668937728
2017-03-09 18:13:53,"Get your ass out of the sunken place, baby girl, and come over and listen to our #GetOut Special! https:// soundcloud.com/media-realness /episode-44-the-sunken-place-feat-christine … pic.twitter.com/uICTJdNqSf",839977569965465601,,28,6,,#GetOut,,https://twitter.com/MediaRealness/status/839977569965465601
2017-03-09 18:13:50,"I'm actually offended that some people didn't like "" Get out "" . I understand people have opinions but uhhh",839977558963867649,,0,0,,,,https://twitter.com/Ag_SoulFy/status/839977558963867649
2017-03-09 18:13:49,I be forgetting everybody don't smoke like me I'll just get out of a session and be ready to match somebody else right after,839977551984558081,,0,1,,,,https://twitter.com/__tamerab/status/839977551984558081
2017-03-09 18:13:46,I luv sleeping naked until it's the next morning and I'm tryin to get out of my warm ass bed,839977541419094016,,0,0,,,,https://twitter.com/caracatsaro/status/839977541419094016
2017-03-09 18:13:44,Feels good to get out of class early,839977533827350528,,0,0,,,,https://twitter.com/Meghanlyn_/status/839977533827350528
2017-03-09 18:13:41,So amped to about to watch @GetOutMovie been waiting forever!!! #GetOut #horror #JordanPeele w/ @Michelle_LDB,839977519629676544,,0,2,@GetOutMovie @Michelle_LDB,#GetOut #horror #JordanPeele,,https://twitter.com/Steph_JonesPR/status/839977519629676544
2017-03-09 18:13:40,Those bitches better get out of my fucking way or I'll kill them,839977516030963715,,0,0,,,,https://twitter.com/Eduarda61088318/status/839977516030963715
2017-03-09 18:13:40,Get out of the way old man... You're standing where we park! http:// fb.me/1ggvQ5z2X,839977515238137856,,0,0,,,,https://twitter.com/PrairieSkyRV/status/839977515238137856
2017-03-09 18:13:33,How to get out of the Friend Zone - http:// url9.co/aK2 pic.twitter.com/gWtIdPJtKa,839977487421460480,,0,0,,,,https://twitter.com/lady_gaga_lyrcs/status/839977487421460480
2017-03-09 18:13:30,Tops get out of a bases-loaded jam in T1 and are headed to the plate 0 | 0,839977475119669248,,0,1,,,,https://twitter.com/WKUSoftball/status/839977475119669248
2017-03-09 18:13:30,"Im lyin , i aint goin no damn where. Yall betta not listen to my silly ass n end up sumweer its hard for u to get out",839977474637217792,,0,0,,,,https://twitter.com/crooklynborn/status/839977474637217792
2017-03-09 18:13:26,F YOUTUBE!!! Ill reupload after i get out of class,839977458015358976,,0,0,,,,https://twitter.com/TraKidd/status/839977458015358976
2017-03-09 18:13:24,nahhhh. I call bullshit. There's a limit to where someone needs to get out in their fucking place,839977449878355969,,0,0,,,,https://twitter.com/Infamous_Dtrain/status/839977449878355969
2017-03-09 18:13:22,Few things are sadder than when someone with an abundance of talent and potential can't get out of their own way. #Raiders #RaiderNation,839977441963700224,,0,0,,#Raiders #RaiderNation,,https://twitter.com/CaseyInSoDak/status/839977441963700224
2017-03-09 18:13:20,#JMU now longer has its bounce. The Dukes are frustrated and very tight right now. UNCW can't get out of its own way though at the moment.,839977432341946368,,0,0,,#JMU,,https://twitter.com/Josh_DNRSports/status/839977432341946368
2017-03-09 18:13:20,bitch... did u not see get out ? Or were u sleep in the theater?,839977430332944385,,0,4,,,,https://twitter.com/dawndruh/status/839977430332944385
2017-03-09 18:13:17,messy hair don't give a fuck @lorddwardswife movie night. #GetOut,839977419461300224,,0,0,@lorddwardswife,#GetOut,,https://twitter.com/AlexJordanz/status/839977419461300224
2017-03-09 18:13:11,"I volunteer, let's fight. I have some aggression to get out . Meet me in the WWE 17 ring",839977395197100032,,0,0,,,,https://twitter.com/SwirlAndVinegar/status/839977395197100032
2017-03-09 18:13:11,Get Out could have been a five minute movie.,839977395134345217,,0,0,,,,https://twitter.com/Kayla_Sherrie/status/839977395134345217
2017-03-09 18:13:09,Recycling disproven stories again. They can't get out of their own hole. https:// twitter.com/foxnews/status /839972723183013889 …,839977387475492865,,0,1,,,,https://twitter.com/zeroinscw/status/839977387475492865
