index,text,id,username,retweets,favorites,mentions,hashtags,geo,permalink
2016-11-03 14:52:32,"I dimly recall ""...and you'll go mad!"" tales from childhood. Night in Chamber of Horrors, sleep in moonlight .",794250928849305601,,0,2,,,,https://twitter.com/richmondie/status/794250928849305601
2016-11-03 14:52:31,Hello darkness my old friend,794250923463868423,,0,0,,,,https://twitter.com/ultra_moonlight/status/794250923463868423
2016-11-03 14:52:09,The 3rd movement of moonlight sonata is killing my hands,794250830442471424,,0,0,,,,https://twitter.com/Nightttwing/status/794250830442471424
2016-11-03 14:51:52,My movie theaters suck. I wanna see Moonlight .,794250761769086977,,0,0,,,,https://twitter.com/dualmyra/status/794250761769086977
2016-11-03 14:51:46,定期 計画的は苦手だ。,794250737219837952,,0,0,,,,https://twitter.com/S_let_Midnight/status/794250737219837952
2016-11-03 14:51:45,sa sobrang pagaabang kay Park Bo Gum natapos ko yung Moonlight Drawn by Clouds within a day,794250732694179840,,0,2,,,,https://twitter.com/criiisteeel/status/794250732694179840
2016-11-03 14:51:40,نقدددحح من راسنا يلد pic.twitter.com/dJgFcUnPqF,794250711391498240,,0,0,,,,https://twitter.com/Bassem_z1/status/794250711391498240
2016-11-03 14:51:08,"I saw the movie Moonlight & just ached all the way through it. If you like a very heavy & heartbreaking movie, this is a great one.",794250577114963970,,0,23,,,,https://twitter.com/AdvanceBase/status/794250577114963970
2016-11-03 14:50:14,Moonlight : Classic Man http:// ift.tt/2f5Iqrh,794250351402745857,,0,0,,,,https://twitter.com/cinemasn/status/794250351402745857
2016-11-03 14:49:27,"Here's my review of Barry Jenkins' heart-shattering MOONLIGHT , which I compare to BROKEBACK MOUNTAIN. http://www. baltimoremagazine.net/2016/11/3/revi ew-moonlight …",794250152424796160,,1,2,,,,https://twitter.com/maxthegirl/status/794250152424796160
2016-11-03 14:49:11,sad u'll have to travel to cry in the moonlight,794250083462217730,,0,1,,,,https://twitter.com/yungmaans_/status/794250083462217730
2016-11-03 14:49:04,#Excerpt - Moonlight 's Peril by @ashlynn_monroe #shifter #romance http:// goo.gl/7ffTKZ via @drb1stchp,794250055016271872,,0,1,@ashlynn_monroe @drb1stchp,#Excerpt #shifter #romance,,https://twitter.com/NdulgentBloggrs/status/794250055016271872
2016-11-03 14:48:58,I swear ive seen that Goalkeeper Vulkan making milkshakes in Moonlight on Wilmslow Rd.,794250032430149633,,1,1,,,,https://twitter.com/perci11/status/794250032430149633
2016-11-03 14:48:46,"I've seen DOTS, Moonlight drawn by clouds, Scarlet Heart and W recently, and like 20 others so I'm running out of options, whoops",794249980261371904,,0,0,,,,https://twitter.com/artaesan/status/794249980261371904
2016-11-03 14:48:30,لا إله إلا الله مخلصين له الدين ولو كره الكافرون http:// du3a.org,794249912900866052,,0,0,,,,https://twitter.com/_Moonlight_999/status/794249912900866052
2016-11-03 14:48:27,La La Land > Moonlight .,794249898925273092,,0,0,,,,https://twitter.com/HoffmanOnFilm/status/794249898925273092
2016-11-03 14:47:27,الماضي قد مضى..فتعلم منه و المستقبل أمامك..فتأهب له أما الحاضر فهو هنا..فعِشه #توماس_مانسون,794249647787220992,,0,0,,#توماس_مانسون,,https://twitter.com/moonlight_A_M/status/794249647787220992
2016-11-03 14:47:17,"insanely good queer narratives in three parts: poison, the handmaiden, moonlight",794249607739887616,,0,1,,,,https://twitter.com/Dofmau5/status/794249607739887616
2016-11-03 14:47:03,"No, MOONLIGHT is.",794249548466003968,,0,0,,,,https://twitter.com/Ctrice/status/794249548466003968
2016-11-03 14:47:02,"Would you care for a glass of grape juice with me, while we listen to a lovely melody under the moonlight ?",794249545785872386,,0,0,,,,https://twitter.com/VampCookie_Bot/status/794249545785872386
2016-11-03 14:46:48,"I'm at Moonlight in Tepebaşı, Eskisehir w/ @ugurcannn26 @beyazhat https://www. swarmapp.com/c/hy9ADQMVyOZ",794249485220249605,,0,0,@ugurcannn26 @beyazhat,,,https://twitter.com/ulasberkgarip/status/794249485220249605
2016-11-03 14:46:39,"I'm at Moonlight in Tepebaşı, Eskisehir w/ @ugurcannn26 https://www. swarmapp.com/c/9T2Mk7D2C6D",794249449228926980,,0,0,@ugurcannn26,,,https://twitter.com/beyazhat/status/794249449228926980
2016-11-03 14:46:36,Moonlight | Official Trailer HD | A24 https:// youtu.be/9NJj12tJzqc via @YouTube,794249434699886592,,0,0,@YouTube,,,https://twitter.com/MonEliRose/status/794249434699886592
2016-11-03 14:46:35,#Cine Moonlight : Classic Man http:// ift.tt/2f5Iqrh,794249433177268224,,0,0,,#Cine,,https://twitter.com/ClaraDeHueevo/status/794249433177268224
2016-11-03 14:45:09,5 LGBT African Movies to See After You Watch Moonlight - http://www. okayafrica.com/culture-2/lgbt -african-movies-moonlight-black-gay-identity/ …,794249070827212800,,0,0,,,,https://twitter.com/danwibg/status/794249070827212800
2016-11-03 14:45:05,"Недавно читала факты от учёных Один из фактов Цитирую: ""В среднем подростки тратят на интернет 16 часов в неделю"" Я: мб в день?",794249053538316289,,0,1,,,,https://twitter.com/Moonlight_Girl6/status/794249053538316289
2016-11-03 14:44:57,Moonlight https:// youtu.be/T-ZcNeczqSw via @YouTube Have a cool one! xx,794249021779038209,,0,0,@YouTube,,,https://twitter.com/maureenReeder1/status/794249021779038209
2016-11-03 14:44:40,#Nightfall #instagram #moonlight #sky pic.twitter.com/goQpEmx30q,794248950681403392,,0,0,,#Nightfall #instagram #moonlight #sky,,https://twitter.com/LadyAnwynn/status/794248950681403392
2016-11-03 14:44:07,Comin for ya tonight @AlamoNYC I'm tryna drink at least 4 milkshakes throughout Moonlight,794248811044544513,,0,0,@AlamoNYC,,,https://twitter.com/PF_FLYR/status/794248811044544513
2016-11-03 14:44:06,#Np ~ Beethoven - Moonlight sonata .,794248804979589120,,0,0,,#Np,,https://twitter.com/MrRudeGentleMan/status/794248804979589120
2016-11-03 14:43:02,https:// twitter.com/ilegalnoise/st atus/793283508768690177 …,794248536967647232,,0,1,,,,https://twitter.com/Moonlight_bae8/status/794248536967647232
2016-11-03 14:42:58,[ซับไทย]Park Bo Gum(박보검) - My Person/My dearest(내 사람)[ Moonlight Drawn by... http:// ln.is/www.youtube.co m/vlMuF …,794248522203795456,,0,1,,,,https://twitter.com/cher_tawan/status/794248522203795456
2016-11-03 14:42:57,이렇게 보면 그래픽 엄청 좋아보이는데... Moonlight Blade Online 天涯明月刀.ol - All Legendary Epic Weapons Big Update ... https:// youtu.be/Ahogee750aI @YouTube 님이 공유,794248514817560576,,1,0,@YouTube,,,https://twitter.com/artk11177/status/794248514817560576
2016-11-03 14:42:52,"Moonlight needs to be showing in UK cinemas, like now.",794248497281323008,,0,1,,,,https://twitter.com/LeahSinclairr/status/794248497281323008
2016-11-03 14:42:49,I never knew You could have moonlight in ur hands Till the night i held you You...youre my moonlight,794248481888026624,,0,0,,,,https://twitter.com/riljoyx/status/794248481888026624
2016-11-03 14:42:23,اللهم أحفظ لي من تقر عيني بوجودهم ومن جعلتهم أسباب سعادتي http:// d3waapp.org /,794248375768150016,,0,0,,,,https://twitter.com/Moonlight_mone/status/794248375768150016
2016-11-03 14:41:50,"Cause I'm your moonlight , you're my star and nothing's shining more than you",794248235598675969,,0,9,,,,https://twitter.com/shadeofari/status/794248235598675969
2016-11-03 14:41:25,pic.twitter.com/kJqpFQ2dRf,794248129017217028,,1,3,,,,https://twitter.com/zuk60/status/794248129017217028
2016-11-03 14:40:44,"My next album will be entitled ""One Man's Opinion of Moonlight "" and will feature just me and a nylon string... http:// fb.me/8x2IZBlKW",794247958195601409,,0,0,,,,https://twitter.com/knoxbronson/status/794247958195601409
2016-11-03 14:40:33,CINE: ' Moonlight ' ('Luz de Luna') la rompedora película LGBT que va camino de los Oscar http://www. playgroundmag.net/cultura/romped ora-historia-afroamericano-camino-Oscar_0_1852614745.html … pic.twitter.com/b7sgY6Lg49,794247911412469760,,2,2,,,,https://twitter.com/NoticiasLGBT/status/794247911412469760
2016-11-03 14:40:32,"Love was at first sight You came walking through the pale, Pale moonlight Pale moonlight",794247907696201728,,0,0,,,,https://twitter.com/bot_marley/status/794247907696201728
2016-11-03 14:40:32,Having a good time with Anna! #berlin #modellife #nightwalk #moonlight pic.twitter.com/LKMehGwv6R,794247907037704194,,0,2,,#berlin #modellife #nightwalk #moonlight,,https://twitter.com/JuliaLennikova/status/794247907037704194
2016-11-03 14:40:24,I just wanna see Moonlight that is it that is all,794247874074836999,,0,0,,,,https://twitter.com/edwikipedia/status/794247874074836999
2016-11-03 14:40:22,Mis amigas odian a tod@s la gente que me ha hecho daño https:// twitter.com/humoratope/sta tus/781552899889377280 …,794247867145732096,,0,0,@s,,,https://twitter.com/Moonlight_bae8/status/794247867145732096
2016-11-03 14:40:12,Hiding in the Fog Where darkness meets the moonlight I will sing your melody Till the morning come ~,794247825643212800,,0,0,,,,https://twitter.com/Ati_Fiction/status/794247825643212800
2016-11-03 14:40:12,Moonlight (2016) http://www. videodownloadhd.com/moonlight-2016 -2.html …,794247824644812800,,0,0,,,,https://twitter.com/videodownloadhd/status/794247824644812800
2016-11-03 14:39:47,Who wants to go see Moonlight with me at Sunray on November 25th?,794247718860390400,,0,2,,,,https://twitter.com/Belanie_/status/794247718860390400
2016-11-03 14:39:23,ヒステリックな声で求めて エゴイスティックに繰り返すストリップ MOONLIGHT …細い指でなぞり 【Butterfly】,794247619891449856,,0,1,,,,https://twitter.com/FEST_lyrics/status/794247619891449856
2016-11-03 14:39:22,"i hate how hateful black people are to the lgbt+ community and even more so after my dumb ass read the comments section for "" moonlight """,794247616905277441,,0,1,,,,https://twitter.com/tousmuch/status/794247616905277441
2016-11-03 14:39:22,pic.twitter.com/UYRmdu27Uo,794247616200577024,,4,6,,,,https://twitter.com/zuk60/status/794247616200577024
2016-11-03 14:39:18,I am currently watching Moonlight Drawn by Stars and damn that is one fine drama how about you?,794247598957883392,,0,0,,,,https://twitter.com/omelysspace/status/794247598957883392
2016-11-03 14:39:14,Aweza aras danasi? — Yeah http:// l.ask.fm/igoto/45DKECN7 5V62DDAUPY6IQO6N5KNTZLY3SDUOLBVZKHV2XYNMYIYNC6KOFRBMYRBXL26P2HQJI5RH6FIN5U36Y3N7NLRP5BJDXAAQDBCPIR3SEK6PA6MD4JHXTT5O5VDVTCUYAVIDZXKE3F4EICDQURLE72IHT74O23OURUDLTKWI2I47GRDX5XPV2BALT47GRM7YYSYZ …,794247580918153221,,0,0,,,,https://twitter.com/Nura_moonlight/status/794247580918153221
2016-11-03 14:39:04,Still Processing: The Striking Humanity of ‘ Moonlight ’ #Artrs http://www. newslocker.com/en-us/professi on/artrs/still-processing-the-striking-humanity-of-moonlight/ …,794247538207555592,,0,0,,#Artrs,,https://twitter.com/Arts_news_USA/status/794247538207555592
2016-11-03 14:38:55,Marquei como visto The Vampire Diaries - 7x14 - Moonlight On the Bayou http:// bit.ly/1Q6bqvZ #bancodeseries,794247500219584512,,0,0,,#bancodeseries,,https://twitter.com/JeInWonderland_/status/794247500219584512
2016-11-03 14:38:17,' Moonlight ' illuminates the darker side of the American dream http:// bit.ly/2fzdFz0 pic.twitter.com/ck4M3HaYwR,794247342320971776,,3,7,,,,https://twitter.com/euronews/status/794247342320971776
2016-11-03 14:37:56,o alexandre nao tem respeito nenhum. Acabamos nem á uma cena e mete fts sem camisola.. nem comento fds. Cagativo..o coisinho ocupa o lugar,794247253141684224,,0,1,,,,https://twitter.com/_x_moonlight_x_/status/794247253141684224
2016-11-03 14:37:16,┏┓ in ┃┃╱╲ this ┃╱╱╲╲ house ╱╱╭╮╲╲ we ▔▏┗┛▕▔ worship ╱▔▔▔▔▔▔▔▔▔╲ Moonlight ╱╱┏┳┓╭╮┏┳┓ ╲╲ ▔▏┗┻┛┃┃┗┻┛▕▔,794247084878614528,,1,3,,,,https://twitter.com/paulsnewmans/status/794247084878614528
2016-11-03 14:36:59,Fritz Thaulow Moonlight in Beaulieu 1904 pic.twitter.com/kWtlRu6CHX,794247014640996353,,26,56,,,,https://twitter.com/WilhelmGustloff/status/794247014640996353
2016-11-03 14:36:30,adorei quando perguntaram se eu e ele namoravamos e ele beijou me e eu fiquei tp O.o <3,794246893815660544,,0,0,,,,https://twitter.com/_x_moonlight_x_/status/794246893815660544
2016-11-03 14:36:27,"バリー・ジェンキンス(Barry Jenkins)脚本・監督、マハーシャラ・アリ、ナオミ・ハリス共演"" Moonlight ""(2016年)からの映像が公開されたようだ。 http:// bcove.me/fu38ksq3 (EW)",794246881656176640,,0,1,,,,https://twitter.com/cinepre/status/794246881656176640
2016-11-03 14:36:12,Can someone explain to me why #Moonlight is considered a Best Original Screenplay contender & not a Best Adapted Screenplay contender? @THR,794246819316432900,,0,4,@THR,#Moonlight,,https://twitter.com/DarrenEdward/status/794246819316432900
2016-11-03 14:36:09,ponay watch W ug love in the moonlight,794246804086792192,,0,0,,,,https://twitter.com/pilosopongpong/status/794246804086792192
2016-11-03 14:35:46,@Moonlight _grl AMOOOO https:// twitter.com/ChannieMaromba /status/781338112198897664 …,794246707164938240,,1,1,@Moonlight,,,https://twitter.com/mariavick1994/status/794246707164938240
2016-11-03 14:35:32,smutno mi z powodu Michael'a,794246650822852611,,0,1,,,,https://twitter.com/Be__Moonlight/status/794246650822852611
2016-11-03 14:35:19,Tomu Uchida’s SWORDS IN THE MOONLIGHT PART THREE (1958) 4pm at MoMA. #TomuUchida @MoMAFilm,794246595411931136,,0,0,@MoMAFilm,#TomuUchida,,https://twitter.com/NitrateStock/status/794246595411931136
2016-11-03 14:35:17,I liked a @YouTube video from @ytandrearomano6 http:// youtu.be/4Tr0otuiQuU?a Beethoven - Moonlight Sonata (FULL),794246587472105476,,0,0,@YouTube @ytandrearomano6,,,https://twitter.com/E_King1/status/794246587472105476
2016-11-03 14:35:10,"Udah selese nonton dramanya park bogum yang moonlight drawn by clouds, dan gw langsung jatuh cinta liat bogum pake baju putra mahkota gtu",794246558548041728,,0,0,,,,https://twitter.com/WindiArsihh/status/794246558548041728
2016-11-03 14:35:00,'Enjoy the super moonlight ': Extra-special celestial treat coming soon: http://www. ctvnews.ca/sci-tech/enjoy -the-super-moonlight-extra-special-celestial-treat-coming-soon-1.3144622 … pic.twitter.com/RzQCMGpI7g,794246516911337472,,1,3,,,,https://twitter.com/ctvedmonton/status/794246516911337472
2016-11-03 14:34:55,Moonlight lion encounters & lavish #Uzbek weddings! #memoir #humour #travel http:// tinyurl.com/jhegtn7 pic.twitter.com/GLkQ9cQ026,794246496803815424,,2,0,,#Uzbek #memoir #humour #travel,,https://twitter.com/shazcrackers/status/794246496803815424
2016-11-03 14:34:48,#Moonlight is masterful filmmaking. Beautiful & sensitive & heartbreaking. All while being subtle & understated w/ much depth.,794246467116470272,,0,1,,#Moonlight,,https://twitter.com/don_con/status/794246467116470272
2016-11-03 14:34:13,هو بس انتي,794246319716057089,,0,0,,,,https://twitter.com/ZaZafersaad/status/794246319716057089
2016-11-03 14:34:09,Ever danced with the devil by the pale moonlight ? #AskJohnnyMarr,794246303358324736,,0,0,,#AskJohnnyMarr,,https://twitter.com/craigan87/status/794246303358324736
2016-11-03 14:34:03,Under the moonlight as we stated at the sea.,794246275768188933,,2,1,,,,https://twitter.com/1DailyLyrics/status/794246275768188933
2016-11-03 14:33:46,kilimanjaro - kilimanjaro https:// tmblr.co/ZCqpDg2EDFSex,794246204859252736,,0,0,,,,https://twitter.com/moonlight_tours/status/794246204859252736
2016-11-03 14:33:20,"Fam i need to watch "" moonlight ""!",794246098399412224,,0,0,,,,https://twitter.com/suggykang/status/794246098399412224
2016-11-03 14:33:09,kilimanjaro https://www. linkedin.com/pulse/kilimanj aro-moonlight-tours-expedition …,794246052425633792,,0,0,,,,https://twitter.com/moonlight_tours/status/794246052425633792
2016-11-03 14:33:02,不死街大嫌い；；,794246019416346624,,0,0,,,,https://twitter.com/moonlight_leon/status/794246019416346624
2016-11-03 14:32:59,"#Moonlight left me reeling. Beautifully directed, excellent central performances, and my favorite use of score this year.",794246009261985793,,0,10,,#Moonlight,,https://twitter.com/jdfunari/status/794246009261985793
2016-11-03 14:32:48,"André Holland is charming, heartbreaking & just spectacular in MOONLIGHT . Thrilled he's coming back to Broadway: http:// bit.ly/2fIoqhN pic.twitter.com/XNazbP0vWf",794245963472900096,,2,24,,,,https://twitter.com/rdmcphee/status/794245963472900096
2016-11-03 14:32:45,"in this day and age, it's rare to experience a composition or work of art that both captivates x cultivates the soul. #Moonlight",794245948700590081,,1,2,,#Moonlight,,https://twitter.com/coolcrsh/status/794245948700590081
2016-11-03 14:32:24,주주탱 안자고 머하니.... pic.twitter.com/CbZbyObeh3,794245862826262529,,0,0,,,,https://twitter.com/That_moonlight/status/794245862826262529
2016-11-03 14:32:20,Now playing Moonlight Bay by Drifters! ( http:// ln.is/airtime.pro/f8 ZDh … ),794245845298401280,,0,0,,,,https://twitter.com/willie_c/status/794245845298401280
2016-11-03 14:31:59,في المشمش,794245756257468416,,0,0,,,,https://twitter.com/ZaZafersaad/status/794245756257468416
2016-11-03 14:31:31,new still processing re: moonlight . — must listen for white critics: https:// play.google.com/music/m/D36xyt kvgkvmhtipdo5b765dqba?t=Dancing_in_the_Moonlight__Episode_9-Still_Processing …,794245640012308480,,0,16,,,,https://twitter.com/museummammy/status/794245640012308480
2016-11-03 14:31:08,Slow dance in the moonlight I'm just tryna set the mood right ... #EMABiggestFansJustinBieber,794245542654124032,,2,0,,#EMABiggestFansJustinBieber,,https://twitter.com/sweetxBiebo/status/794245542654124032
2016-11-03 14:30:48,Aidonia - Better Moonlight Riddim @AIDONIAJOP @jaydsjop4thgenna @onton4thgenna #Dancehall https:// youtu.be/IT_ZtMus78s,794245459493736448,,0,2,@AIDONIAJOP @jaydsjop4thgenna @onton4thgenna,#Dancehall,,https://twitter.com/dhrtv/status/794245459493736448
2016-11-03 14:30:48,"Everyone's talking about "" Moonlight "", the film of the year. Our review by @Lar206 : http://www. thestranger.com/film/2016/11/0 2/24664365/moonlight-is-even-better-than-youve-heard … pic.twitter.com/X2pKU7LESk",794245458013126657,,2,6,@Lar206,,,https://twitter.com/TheStranger/status/794245458013126657
2016-11-03 14:29:21,i think this is the chopped + screwed version of 'classic man' from moonlight https://www. youtube.com/watch?v=4wZzv2 tz01E&feature=youtu.be …,794245095457521664,,0,8,,,,https://twitter.com/gabrielherrera/status/794245095457521664
2016-11-03 14:29:11,@vhuntercapps @qodnrl @Turning_Scripts Moonlight opens locally 11/11 and I would like to see it.,794245050595213317,,0,2,@vhuntercapps @qodnrl @Turning_Scripts,,,https://twitter.com/avincentz/status/794245050595213317
2016-11-03 14:27:48,"Ночью этот миллионный улей становится достаточно милым: казахи с баулами, вылезающие из автобуса,пьяные мужики, Moonlight and vodka.",794244705966030849,,0,0,,,,https://twitter.com/Mark951Yam/status/794244705966030849
2016-11-03 14:27:37,Ándale perro https:// twitter.com/borntowin____/ status/793887341639241728 …,794244658180169728,,0,0,,,,https://twitter.com/Moonlight_bae8/status/794244658180169728
2016-11-03 14:27:36,Moonlight Tea! Go check it out on @moonlightsvoice page pic.twitter.com/fHwyDVWmHP,794244655621640194,,0,0,@moonlightsvoice,,,https://twitter.com/lavendergrandee/status/794244655621640194
2016-11-03 14:27:25,달빛이 비추는 그 역 내가 너에게 전하지 못했던 말 '고맙다'라는 말을 나는 잊고 있었어 네가 달로 돌아가버리기 전에 - moonlight station-,794244609656295424,,0,0,,,,https://twitter.com/Sekaowa__00/status/794244609656295424
2016-11-03 14:27:12,Go see #moonlight,794244551867334656,,0,0,,#moonlight,,https://twitter.com/dianelisa/status/794244551867334656
2016-11-03 14:27:04,"I've heard soooo much buzz about MOONLIGHT , and it's at the Oirental? DONE. https:// twitter.com/mkefilm/status /794221229121093632 …",794244519982231552,,1,1,,,,https://twitter.com/localfirstmke/status/794244519982231552
2016-11-03 14:27:04,Moonlight Tea! Check it it on @moonlightsvoice page pic.twitter.com/hWjncBknzb,794244518564413440,,0,0,@moonlightsvoice,,,https://twitter.com/Arianasgrandes0/status/794244518564413440
2016-11-03 14:26:17,,794244323546042369,,0,0,,,,https://twitter.com/Moonlight_Bae20/status/794244323546042369
2016-11-03 14:26:13,OPENING VERY SOON: The Strawberry Moons rooftop garden and moonlight bar! Playing the best laid back & uplifting house :-) pic.twitter.com/tIfHCCqNR9,794244304684404736,,0,0,,,,https://twitter.com/moonsmaidstone/status/794244304684404736
2016-11-03 14:25:58,#JustPlayed Moonlight Highlife by Dr. Victor Olaiya #JustHighlife - TheBlessedOne & FatherAbraham #1049SMAFM http:// smafmonline.com,794244243489509376,,0,0,,#JustPlayed #JustHighlife #1049SMAFM,,https://twitter.com/1047SMAFM/status/794244243489509376
2016-11-03 14:25:31,♬ “What A Little Moonlight Can Do” by Billie Holiday on ‘The Complete Billie Holiday On Verve 1945-1959’ pic.twitter.com/ekkiNta5FY,794244128938885121,,0,0,,,,https://twitter.com/flickr4jazz/status/794244128938885121
2016-11-03 14:25:26,เป็นลูกเจี๊ยบที่หล่อมาก pic.twitter.com/I6tz0Hfcyf,794244107321253888,,0,0,,,,https://twitter.com/52Hz_moonlight/status/794244107321253888
2016-11-03 14:25:25,@Moonlight _grl https:// twitter.com/ChannieMaromba /status/793804117785382913 …,794244104414756870,,3,3,@Moonlight,,,https://twitter.com/mariavick1994/status/794244104414756870
2016-11-03 14:25:10,"""Nice in the Moonlight "", Ivan Choultse. 1920. Via @WilhelmGustloff pic.twitter.com/iMZLcSsjg5",794244039486869505,,5,5,@WilhelmGustloff,,,https://twitter.com/78Derngate/status/794244039486869505
2016-11-03 14:24:54,"In an America where Black children don't get to be children for very long, the films #Moonlight and #TheFits allowed for wistful gazes. pic.twitter.com/G6qbdsG0Az",794243974873518080,,3,7,,#Moonlight #TheFits,,https://twitter.com/tmtweetz/status/794243974873518080
2016-11-03 14:24:26,Slow dance in the moonlight I'm just tryna set the mood right #EMABiggestFansJustinBieber,794243855860252672,,2,0,,#EMABiggestFansJustinBieber,,https://twitter.com/sweetxBiebo/status/794243855860252672
2016-11-03 14:24:24,"""Daydreamin' Of Moonlight "" on #Wattpad http:// my.w.tt/UiNb/nMbO5pWx0x http:// my.w.tt/UiNb/Z9QxrrWx0x",794243850332209152,,5,9,,#Wattpad,,https://twitter.com/moonlightsvoice/status/794243850332209152
2016-11-03 14:23:27,Three Times: Barry Jenkins and Tarell McCraney on “ Moonlight ” | Interviews | Roger Ebert http://www. rogerebert.com/interviews/thr ee-times-barry-jenkins-and-tarell-mccraney-on-moonlight …,794243608006180864,,2,0,,,,https://twitter.com/pramsey342/status/794243608006180864
2016-11-03 14:23:26,"Yo: Play Music, dame amor Play Music: Moonlight *se está acabando* Yo: Pero no pares eh *se acaba* Play Music: Young Forever Gracias.",794243603849740295,,0,0,,,,https://twitter.com/RealSadQueen_/status/794243603849740295
2016-11-03 14:23:15,vampire in the moonlight countin money up,794243557972475908,,0,0,,,,https://twitter.com/RosarioMusic/status/794243557972475908
2016-11-03 14:22:48,Liquid Copper o Moonlight White? Che colore sceglieresti per la tua INFINITI #Q30 ? Scopri la gamma completa: http:// bit.ly/2fztfuw pic.twitter.com/9WjTJj8yiA,794243445607038978,,1,1,,#Q30,,https://twitter.com/InfinitiItalia/status/794243445607038978
2016-11-03 14:22:33,I wanna see Moonlight so bad omg,794243384718327809,,0,0,,,,https://twitter.com/cicixfenty/status/794243384718327809
2016-11-03 14:22:17,#Moonlight is an amazing film. I'm still reeling from heart ache and heart throb! @GLIDEsf @nprfreshair @BandryBarry @NPR,794243314933338112,,1,1,@GLIDEsf @nprfreshair @BandryBarry @NPR,#Moonlight,,https://twitter.com/KarlRobillard1/status/794243314933338112
2016-11-03 14:22:14,Why try and moonlight #EMABiggestFansArianaGrande https:// twitter.com/DWTour_/status /794174865372774401 …,794243301482303488,,0,0,,#EMABiggestFansArianaGrande,,https://twitter.com/lukesquit/status/794243301482303488
2016-11-03 14:21:41,Walking home after watching Moonlight yesterday was magical. Now I'm putting together all podcasts/articles about it to consume this weekend,794243163045195776,,0,0,,,,https://twitter.com/yoli_martinez/status/794243163045195776
2016-11-03 14:21:16,Still Processing: The Striking Humanity of ‘ Moonlight ’ by @Wesley_Morris : http:// buff.ly/2fIhEIT,794243059336839172,,0,2,@Wesley_Morris,,,https://twitter.com/grantlander33/status/794243059336839172
2016-11-03 14:20:38,SEE THIS MOVIE!!!! Moonlight Movie Review & Film Summary (2016) | Roger Ebert http://www. rogerebert.com/reviews/moonli ght-2016 …,794242900896972802,,0,0,,,,https://twitter.com/laptop_lasane/status/794242900896972802
2016-11-03 14:20:34,you deserve the fucking world,794242882035011584,,1,1,,,,https://twitter.com/Moonlight_bae8/status/794242882035011584
2016-11-03 14:20:30,@igzamzam1 @MoonLight _48com @morsy_33 @LopezLaila pic.twitter.com/HcIhoYr80E,794242865513775105,,0,1,@igzamzam1 @MoonLight @morsy_33 @LopezLaila,,,https://twitter.com/WalaszekZsuzsa1/status/794242865513775105
2016-11-03 14:20:06,"Vehicle Collision: I-35 at FM 1695/ Moonlight Dr, South of Hewitt, Status Detected TxDOT I-35 Alerts: South of Hewi… http:// ift.tt/2fgAWEB",794242767190949889,,0,0,,,,https://twitter.com/HOTCOG_HS/status/794242767190949889
