index,text,id,username,retweets,favorites,mentions,hashtags,geo,permalink
2016-11-03 10:59:34,The Otherside Orchestra - Possessive Tonight under the moonlight we'll dance into the summer light. https://www. youtube.com/watch?v=GACabg 05Hws&feature=share …,794192302163955712,,0,0,,,,https://twitter.com/monz_freedumb/status/794192302163955712
2016-11-03 10:59:22,ehhhh,794192251899576321,,0,0,,,,https://twitter.com/moonlight_obliv/status/794192251899576321
2016-11-03 10:58:37,The Mystical Moonlight - The Enchanted Edition https://www. bloglovin.com/blogs/express- yourself-through-beauty-14285523/mystical-moonlight-enchanted-edition-5242969185 … on @bloglovin,794192060115021824,,1,1,@bloglovin,,,https://twitter.com/xobeautyexpress/status/794192060115021824
2016-11-03 10:58:35,di di di di di di di does the moonlight shine on paris after sun goes downnnnnnnnnnnnnnnnnnnnnnnnnnnnnnnn,794192054054109185,,0,0,,,,https://twitter.com/PolPasco/status/794192054054109185
2016-11-03 10:58:15,나이제 사당..,794191969576550400,,0,0,,,,https://twitter.com/ESTHER_Y01/status/794191969576550400
2016-11-03 10:58:15,＊ moonlight 照らしてくれ この想いを乗せ君の元へ My love 約束しよう 大切な人よ 永遠に FTISLAND/ Moonlight https:// youtu.be/ESJKxQpfyLc,794191968448303104,,0,0,,,,https://twitter.com/seung_hyun_bot5/status/794191968448303104
2016-11-03 10:58:10,scarlet heart dah habis baru la nak layan love in the moonlight hehe,794191949393629184,,0,1,,,,https://twitter.com/noraimiliyana/status/794191949393629184
2016-11-03 10:57:56,大丈夫です、予約段階ですのでｗ,794191891562524673,,0,0,,,,https://twitter.com/maybe_moonlight/status/794191891562524673
2016-11-03 10:57:55,Juskopooo sabog ovaries sa Moonlight Drawn By Clouds,794191883962433536,,0,0,,,,https://twitter.com/MersheeJes/status/794191883962433536
2016-11-03 10:57:44,4) Смотреть за Зиндольфом,794191840186691584,,2,1,,,,https://twitter.com/moonlight_1140/status/794191840186691584
2016-11-03 10:57:38,"진심 하 난아직 더가야하고 이제 사당,,",794191812546023425,,0,0,,,,https://twitter.com/ESTHER_Y01/status/794191812546023425
2016-11-03 10:57:34,Moonlight Angel,794191798323154944,,0,0,,,,https://twitter.com/aceuuu/status/794191798323154944
2016-11-03 10:57:31,THANK YOU SO MUCH MY MOONLIGHT . I LOVE YOU TOO. ♡ ♡ https:// twitter.com/Focuslikemila/ status/794190163748540420 …,794191783815213056,,0,8,,,,https://twitter.com/adorevisuaIs/status/794191783815213056
2016-11-03 10:57:14,フィールド広くてどこにいるのかわからんくなるな 冒険してる感はあるけども,794191712964919297,,0,0,,,,https://twitter.com/mazisuki/status/794191712964919297
2016-11-03 10:57:01,Did I say you got a choice in the make out session? *she giggles*,794191658392965120,,0,0,,,,https://twitter.com/Shiny_Eev/status/794191658392965120
2016-11-03 10:56:58,51. Mary stayed out all night; 52. Master's sun; 53. MISS GRANNY; 54. Moonlight drawn by clouds; 55. My girlfriend's a gumiho;,794191646279823360,,0,0,,,,https://twitter.com/melhopes_/status/794191646279823360
2016-11-03 10:56:23,moonlight is coming to happy together 헐 !!,794191497880973312,,1,0,,,,https://twitter.com/tgsyah_/status/794191497880973312
2016-11-03 10:55:47,The idea that Moonlight may not be playing in my area come this Friday... All the sadz!!!,794191350203826176,,0,0,,,,https://twitter.com/RihannnasHeart/status/794191350203826176
2016-11-03 10:55:47,그럽시다 후훗,794191346634326016,,0,0,,,,https://twitter.com/MC_Myeon2/status/794191346634326016
2016-11-03 10:55:43,"aku juga mau minta temen, copyin ke flashdisk kya tidak sabar, aku aja beli kaset moonlight yang bogum blm ntn :(",794191331505512449,,0,0,,,,https://twitter.com/MYSTJOYY/status/794191331505512449
2016-11-03 10:55:24,I never knew you could hold moonlight in your hands till the night I held you #EMABiggestFansArianaGrande,794191252191375360,,1,0,,#EMABiggestFansArianaGrande,,https://twitter.com/explosiveariana/status/794191252191375360
2016-11-03 10:55:24,Dancing In The Moonlight Video https:// youtu.be/LB8Rtio69MY via @YouTube,794191250719117313,,0,0,@YouTube,,,https://twitter.com/OSOPLAY/status/794191250719117313
2016-11-03 10:55:21,失礼します。投稿されてませんよね、まだ,794191241386790912,,0,0,,,,https://twitter.com/lookvictor/status/794191241386790912
2016-11-03 10:55:18,"I'm so tired. So sick of this. Do, write, whatever you want. I don't care anymore, If my four boys are ok, I'm ok.",794191225599442944,,0,0,,,,https://twitter.com/Oh_moonlight/status/794191225599442944
2016-11-03 10:55:06,Moonlight has me looking at a glass mirror of different pieces of myself throughout the years.. and I just can't deal right now lol,794191177729843200,,1,1,,,,https://twitter.com/CdashRICH_/status/794191177729843200
2016-11-03 10:54:53,"#HollywoodFilmAwards Interprete Revelación: Naomie Harris, Collateral Beauty y Moonlight Interprete Comedia: Robert De Niro, The Comedian pic.twitter.com/GSc0TEZalq",794191120133722112,,0,0,,#HollywoodFilmAwards,,https://twitter.com/LunesSeriefilos/status/794191120133722112
2016-11-03 10:54:38,moonlight ~English ver~ こういうの普通に好きやねん。 https://www. youtube.com/watch?v=W9ulDo aQ60w&feature=share …,794191060511563776,,0,0,,,,https://twitter.com/MonChack1108/status/794191060511563776
2016-11-03 10:54:38,Sing me a lullaby under the moonlight sky I will kiss you til the sunrise comes shining bright pic.twitter.com/yWaGVP9fl3,794191058112487425,,0,0,,,,https://twitter.com/PHONEGIRL2008/status/794191058112487425
2016-11-03 10:54:29,@Moonlight ___JH 집도착 부럽다,794191023333195777,,0,0,@Moonlight,,,https://twitter.com/ESTHER_Y01/status/794191023333195777
2016-11-03 10:54:23,Dr. Donna's Movie Reviews: MOONLIGHT An Impressionist painting of a gay child growing up in a black drug culture. http:// drdonnasfilmreviews.blogspot.com/2016/11/moonli ght.html?spref=tw …,794190994862288896,,0,0,,,,https://twitter.com/drcDr_Donna/status/794190994862288896
2016-11-03 10:54:08,EXO-CBX 첸백시 포카 교환합니다! 나) 베레모슈 ) 흑백슈 호피슈 서울내 직거래 휴일에는 아티움에서 저녁에 다 가능하고 주말에도 가능합니다! #포카교환 #베레모슈 #호피슈 #흑백슈 #아티움 pic.twitter.com/vddfME6mSF,794190933231161345,,0,0,,#포카교환 #베레모슈 #호피슈 #흑백슈 #아티움,,https://twitter.com/Moonlight_0921/status/794190933231161345
2016-11-03 10:53:58,그날 넘나 기여운 거시어따... 그 즈음에 다시 한번 일정 잡아봅시다! 우리 집도 놀러와양,794190889950134272,,0,0,,,,https://twitter.com/MC_Myeon2/status/794190889950134272
2016-11-03 10:53:19,長嶺の所に主人公居候するじゃん？望美もじゃん？w 笑わない、基本どツン、技術にだけは正当な評価を下す(並大抵では認めない)、主人公側の仲間に対して色々思うところがありすぎる、仏門(笑)… 大体一緒だった。,794190727357964288,,0,0,,,,https://twitter.com/kaede0318yama/status/794190727357964288
2016-11-03 10:53:16,"tujuh episode.. Dri episode org tau sepa Cloud, to how the Moonlight is drawn buh",794190716188532736,,0,0,,,,https://twitter.com/meeemooohhh/status/794190716188532736
2016-11-03 10:53:02,オンエア曲(2016/11/03 23:52)⇒ MOONLIGHT IN VERMONT / RAY CHARLES,794190654578405376,,0,1,,,,https://twitter.com/802NOWONAIR/status/794190654578405376
2016-11-03 10:52:14,うん,794190455462211584,,0,0,,,,https://twitter.com/Meg_moonlight/status/794190455462211584
2016-11-03 10:52:09,ชอบซีรี่ย์เกาหลีเรื่องไหนอ่ะคะ — หมายถึงเรื่องโปรดใช่มั้ยคะ Princess Hours เลยค่ะ แต่ถ้าเป็นช่วงนี้ก็ Moonlight Dr… http:// l.ask.fm/igoto/45DKECN7 5V62DDAUPY6IQO6T6ODCJKY7SD6NXINTA6S2J7FI2AT5AJKQFZEMCRZ2K62PKFQDINVDKFAU34N7A55YPPSKNTBAUYOADFKYCASCGMX5GWID6KPLQSVKBSDZSKQY2H2QZTGX7K4GJSNBWTLK67BSL4ET2LHV77K3QK236UUDLFOUVQHX5FR2P3XGTIUKEOQF7U====== …,794190433844940800,,0,1,,,,https://twitter.com/FLK26892/status/794190433844940800
2016-11-03 10:52:08,定期 俺はお世辞は言えねぇからなぁ,794190428018835456,,0,0,,,,https://twitter.com/S_let_Midnight/status/794190428018835456
2016-11-03 10:52:07,9月10月と遠征して金欠だったから今月は服とかお化粧品購入にあてたい,794190427561676802,,0,0,,,,https://twitter.com/moonlight_noah/status/794190427561676802
2016-11-03 10:51:04,Moonlight got me shook. I feel stupid writing about it.,794190163501006848,,0,2,,,,https://twitter.com/AfroJediii/status/794190163501006848
2016-11-03 10:51:01,http:// blastfi.com/jmediafm #JmediaFMRadio ♪ King Harvest - Dancing In the Moonlight ♪,794190150100275200,,0,0,,#JmediaFMRadio,,https://twitter.com/JMediaFMRadio/status/794190150100275200
2016-11-03 10:50:08,Why Movies Like ‘ Moonlight ’ Favor Pity Over Storytelling http:// acculturated.com/movies-like-mo onlight-favor-pity-storytelling/?platform=hootsuite … This totally sums up my hesitation about seeing #Moonlight,794189926598381568,,1,5,,#Moonlight,,https://twitter.com/OckyJ83/status/794189926598381568
2016-11-03 10:49:42,"gue punya semua, minus yg ada bagian rap. :))) awal2 suka ost moonlight , tapi ujungnya dengerin ost scarlet. hhhh",794189818993340416,,0,0,,,,https://twitter.com/rararatnaP/status/794189818993340416
2016-11-03 10:49:25,へー、そうおもってたんだ,794189748206084100,,0,0,,,,https://twitter.com/i__214/status/794189748206084100
2016-11-03 10:49:25,love in the moonlight,794189746385715200,,0,0,,,,https://twitter.com/znellal/status/794189746385715200
2016-11-03 10:48:51,' Moonlight ' Cast Toasts Film Fest Favorite https:// is.gd/5kmomW #VideoGameCelebs #TuesdayMotivation #bfc530 #FunnyOrCoolStuffWhereILive,794189603074818049,,0,0,,#VideoGameCelebs #TuesdayMotivation #bfc530 #FunnyOrCoolStuffWhereILive,,https://twitter.com/therealestvibe/status/794189603074818049
2016-11-03 10:48:39,ㄴㄱ인지 나옴?,794189554295050241,,0,0,,,,https://twitter.com/Pbeastbeauty/status/794189554295050241
2016-11-03 10:48:08,"daytime has sunlight, nighttime has moonlight & you're a fake Christian",794189423311261700,,0,0,,,,https://twitter.com/IisousChristos/status/794189423311261700
2016-11-03 10:48:05,#Excerpt - Moonlight 's Peril by @ashlynn_monroe #shifter #romance http:// goo.gl/7ffTKZ via @drb1stchp,794189408677359616,,0,2,@ashlynn_monroe @drb1stchp,#Excerpt #shifter #romance,,https://twitter.com/eroticaforall/status/794189408677359616
2016-11-03 10:47:51,なんか努力の人ってイメージありますん！！｢なんか頑張ったら出来ちゃった ｣とか言って欲しい！,794189350934188033,,0,0,,,,https://twitter.com/KokokaraL/status/794189350934188033
2016-11-03 10:47:51,……(相手の手を握り),794189350456016896,,0,0,,,,https://twitter.com/xxxadc00/status/794189350456016896
2016-11-03 10:47:47,awts. Hahahaha. Ung moonlight drawn by clouds. Tpos na yun. Pinapanood ko ngayon.,794189333280399361,,0,0,,,,https://twitter.com/kkimericka/status/794189333280399361
2016-11-03 10:47:42,Join us at Moonlight Madness tonight! @nutimberwolves pic.twitter.com/PMxTT7DosG,794189314280275968,,0,1,@nutimberwolves,,,https://twitter.com/CampusLifeNU/status/794189314280275968
2016-11-03 10:46:57,"I liked a @YouTube video http:// youtu.be/Qvz4hT6lsvA?a Naomie Harris and Barry Jenkins on "" Moonlight """,794189123896700928,,0,0,@YouTube,,,https://twitter.com/Srbog1/status/794189123896700928
2016-11-03 10:46:35,see's Moonlight and now bumpin https://www. youtube.com/watch?v=YGaBbo -eUd8 … http:// fb.me/57IUIX0oC,794189031160639488,,0,0,,,,https://twitter.com/the_avervge/status/794189031160639488
2016-11-03 10:46:31,"between this, Moonlight , and Loving, there's gonna be a lot of teary-eyed Matt Cohen this Oscars season.",794189017701040128,,0,1,,,,https://twitter.com/Matt_D_Cohen/status/794189017701040128
2016-11-03 10:46:21,"You have an awesome dad. My dad is going on 98 years, and has never left her side. She has Alzheimer's.",794188973140676608,,1,1,,,,https://twitter.com/Moonlight_Lace/status/794188973140676608
2016-11-03 10:46:06,"Lost will be, The moon The stars.. Only Your memories Won't fade. . . . . Even in the Dark Moonlight",794188913388589060,,4,2,,,,https://twitter.com/AliceInDelhi/status/794188913388589060
2016-11-03 10:45:22,【プレイ中】PSO2 ship07 にてたまに遊んでます。キャラ名 Moonlight です。チーム探してるかも。 http:// kamitsuki-works.github.io/pso2/,794188725454413824,,0,0,,,,https://twitter.com/kamitsuki_genya/status/794188725454413824
2016-11-03 10:45:13,i marathon tgk moonlight & scarlet heart... lepas tu sakit kepala sbb bnyk sgt nangis,794188691254046720,,0,1,,,,https://twitter.com/Katz891108/status/794188691254046720
2016-11-03 10:45:13,ですよね……! 絵も文も、書(描)かないことには始まらないですね！,794188690696249344,,0,1,,,,https://twitter.com/siina_yuuki/status/794188690696249344
2016-11-03 10:45:13,Cinderella - Wicked Words in the Moonlight by @RenaFreefall #wattpad http:// my.w.tt/UiNb/cJ9P8bhi0x,794188689521905668,,0,0,@RenaFreefall,#wattpad,,https://twitter.com/RenaFreefall/status/794188689521905668
2016-11-03 10:44:51,"The same people that made that movie Kicks , made that movie Moonlight I'm bout to go check that out",794188597029052416,,0,1,,,,https://twitter.com/BigBenji__/status/794188597029052416
2016-11-03 10:44:47,ちゅっ,794188581820506112,,0,0,,,,https://twitter.com/S_let_Midnight/status/794188581820506112
2016-11-03 10:44:44,Absolutely the best film I've seen in quite some time. My review of MOONLIGHT http://www. dearcastandcrew.com/content/2016/1 1/3/moonlight.html … Bravo @moonlightmov,794188566951772160,,0,0,@moonlightmov,,,https://twitter.com/ColeMcEown/status/794188566951772160
2016-11-03 10:44:28,Belum nonton Moonlight drawn by clouds lah nnton ? https:// twitter.com/faradhiv/statu s/794160619402297345 …,794188501793140736,,0,0,,,,https://twitter.com/kaweek16/status/794188501793140736
2016-11-03 10:44:27,"Anyone who wanna livestream Moonlight Cast (Jin Young, Dong Yeon, Eunuch Jang..) on Happy Together, here's the link https:// aqstream.com/kbs2/KBS2-Stre am-5-SD …",794188495409381377,,5,15,,,,https://twitter.com/FoodielovesTOP/status/794188495409381377
2016-11-03 10:44:26,あっ はいいよねw,794188491143819264,,0,0,,,,https://twitter.com/myc_moonlight/status/794188491143819264
2016-11-03 10:44:23,「蒼ノ翼」「Splash Blue」「 MOONLIGHT 」あたりも好きだし、キャラソンもいれるなら「Laboratory Love」（コルダ）が泣くほど好き,794188480423206912,,0,1,,,,https://twitter.com/rennelouis/status/794188480423206912
2016-11-03 10:44:10,do you ever dance with the devil in the pale moonlight ?,794188426618617856,,0,0,,,,https://twitter.com/philflowrez/status/794188426618617856
2016-11-03 10:44:04,10 Moonlight,794188401427628032,,0,0,,,,https://twitter.com/Ignisotest/status/794188401427628032
2016-11-03 10:43:57,Introducing Interview: Moonlight Zoo http://www. gigslutz.co.uk/introducing-in terview-moonlight-zoo/ … #NewMusic @_MoonlightZoo pic.twitter.com/L7n4gmR5x9,794188368670314496,,0,1,@_MoonlightZoo,#NewMusic,,https://twitter.com/Gigslutz_/status/794188368670314496
2016-11-03 10:43:48,とうらぶ詳しくないんやけど沖田組好きでね… 目の保養〜♪♪どんどんとうらぶやってほしい♡,794188332242604032,,0,1,,,,https://twitter.com/mey_xxx9/status/794188332242604032
2016-11-03 10:43:32,hic phần 2 quay đẹp hơn này trông lung linh vl kang taeoh đẹp trai vcl ;;; quay màu cũng kiểu Moonlight nữa,794188266958295040,,0,0,,,,https://twitter.com/biyoong110/status/794188266958295040
2016-11-03 10:43:29,今知ったよその情報。 何だろう…ホール取れなかったのかね？,794188251271565312,,0,0,,,,https://twitter.com/kaede0318yama/status/794188251271565312
2016-11-03 10:43:23,Song request nga ate — Moonlight over Paris The way you look tonight What a wonderful world Pag yan kinanta say… http:// l.ask.fm/igoto/45DKECN7 5V62DDAUPY6IQO625SEARCI7Q666LBVDBHX3PYPUSZYZU3SOFNFMCQBVK23PGU2FDYBHSDQVYAT6MJNZP3XLPBJRUNJQBFKQHVXTGIXZD6IGOPXNSKXPZVZQQS6ICLAV3DKGFFMMJKMVMTLN4PNH3Y5CZ3HVJUZJ3SPJO7GBAVKXXW7M6BJKFW5734====== …,794188226965684226,,0,0,,,,https://twitter.com/HappyAyskrem/status/794188226965684226
2016-11-03 10:43:19,Zayn my husband and my husband I have no one else but I'm so thankful to be happy for holidays to my husband husband I hope he will have to https:// twitter.com/brideivy/statu s/794168840674381826 …,794188209093771264,,0,1,,,,https://twitter.com/swift_moonlight/status/794188209093771264
2016-11-03 10:43:14,LOVE IN THE MOONLIGHT THO,794188189279784960,,0,0,,,,https://twitter.com/marshhhmelooo/status/794188189279784960
2016-11-03 10:43:09,"tapos mo na ba, Cinderella and the 4 knights, W, Scarlett Heart, Moonlight drawn by clouds? Haha.",794188169579085824,,0,1,,,,https://twitter.com/LorraineGoAwayy/status/794188169579085824
2016-11-03 10:42:54,ひたすら書くしかないですね、こればかりは！,794188107721502720,,0,1,,,,https://twitter.com/maybe_moonlight/status/794188107721502720
2016-11-03 10:42:54,I added a video to a @YouTube playlist http:// youtu.be/NuwC8ZM-kjM?a Sailor Moon Crystal Season 3 OP ( Moonlight Densetsu),794188107096752128,,0,0,@YouTube,,,https://twitter.com/noahdavidbors/status/794188107096752128
2016-11-03 10:42:48,ceyregi bile degil. Ceyreginin ceyregi,794188081893175296,,1,1,,,,https://twitter.com/mfatmam16/status/794188081893175296
2016-11-03 10:42:31,"Moonlight Drawn By Clouds, Boogum ahh ~ https://www. instagram.com/p/BMWgwioA_W7U whH_xU98cMIxZxlAuyJDIxWugE0/ …",794188011768516608,,0,0,,,,https://twitter.com/MefitaRosalinda/status/794188011768516608
2016-11-03 10:42:25,"I can’t remember the last time a movie has stuck with me like Moonlight . Also, this poster is tremendous: https:// images-na.ssl-images-amazon.com/images/M/MV5BN zQxNTIyODAxMV5BMl5BanBnXkFtZTgwNzQyMDA3OTE@._V1_SY1000_CR0,0,674,1000_AL_.jpg …",794187983855517697,,0,2,@,,,https://twitter.com/JessieSima/status/794187983855517697
2016-11-03 10:42:19,サウンドクラウドに曲あります。 https:// m.soundcloud.com/oon_ight,794187957678673920,,0,0,,,,https://twitter.com/MoonLight_HC/status/794187957678673920
2016-11-03 10:42:08,夜空先輩の未来トランジットがゆめちゃんと小春ちゃんのことを歌ってるように思えてしまう…美月さんの Moonlight destinyがいちごちゃんとあおいちゃんの夜会話と重ねられていたのと似た感覚…,794187911474184192,,0,5,,,,https://twitter.com/hata_oriko/status/794187911474184192
2016-11-03 10:41:59,やはり、慣れが必要ですね……慣れるかなぁ……(苦笑),794187873532555265,,0,1,,,,https://twitter.com/siina_yuuki/status/794187873532555265
2016-11-03 10:41:58,someone take me to see the movie moonlight,794187872291131393,,0,0,,,,https://twitter.com/nudoteight/status/794187872291131393
2016-11-03 10:41:49,もうマヂ無理…… ＰＶもゼロだしブクマも一つもつかないよ…… pic.twitter.com/enGauYR8bW,794187833976066048,,1,0,,,,https://twitter.com/maybe_moonlight/status/794187833976066048
2016-11-03 10:41:34,"Мне понравилось видео ""Oil painting. Moonlight night."" ( http:// youtu.be/CdzKSFZapWA?a ) на @YouTube .",794187770558291968,,0,0,@YouTube,,,https://twitter.com/LyubovM1/status/794187770558291968
2016-11-03 10:41:29,I liked a @YouTube video from @skylenox http:// youtu.be/N1U8Cavjid8?a Moonlight Official Trailer Reaction,794187748018098179,,0,0,@YouTube @skylenox,,,https://twitter.com/Srbog1/status/794187748018098179
2016-11-03 10:41:14,I wanna see Moonlight tomorrow night.,794187686441578496,,0,2,,,,https://twitter.com/______nija/status/794187686441578496
2016-11-03 10:40:40,景気回復させて経済が強くなれば解決に向かう話だとわかってはいるんだが、そもそも、そういう緊縮思考が変わってくれないと景気回復もままならないわけで。困ったもんだぞ本当に。,794187545382830080,,0,0,,,,https://twitter.com/kent_moonlight/status/794187545382830080
2016-11-03 10:40:30,私の場合は「一人称きつい！ 場面を上から俯瞰的に見るとか出来ないで、どうやってストーリー表現するの？！」と思ってました。ようやく慣れました。,794187503678824448,,0,0,,,,https://twitter.com/maybe_moonlight/status/794187503678824448
2016-11-03 10:40:30,VITA版だとフィリスおちるな,794187502298894341,,0,0,,,,https://twitter.com/moonlight_lapis/status/794187502298894341
2016-11-03 10:40:05,looking forward to Moonlight Saving Time,794187399139979264,,0,1,,,,https://twitter.com/mattsiegel/status/794187399139979264
2016-11-03 10:39:59,"푸흐, 저랑 같네요. 저도 막내라고 엄청 시켜댔었거든요, 하하하!",794187372636160000,,0,0,,,,https://twitter.com/Moonlight_RO/status/794187372636160000
2016-11-03 10:39:57,@MoonLight _48com @igzamzam1 @LopezLaila @mirianmh23 pic.twitter.com/GgNJF9lfsg,794187363157217280,,0,1,@MoonLight @igzamzam1 @LopezLaila @mirianmh23,,,https://twitter.com/WalaszekZsuzsa1/status/794187363157217280
2016-11-03 10:39:49,أذكر الله : لا إله إلا الله http:// d3waapp.org /,794187329707667456,,0,0,,,,https://twitter.com/Moonlight_mone/status/794187329707667456
2016-11-03 10:39:40,... ... ... (가만히 눈물을 흘리며 바라본다. 네가 차갑게 얘기한다. 내가 원하던 것인데 왜 이리 마음이 아플까.),794187292608860161,,0,1,,,,https://twitter.com/Moonlight_RO/status/794187292608860161
2016-11-03 10:39:29,"he knows just what it does when he's holding me tight and he calls me moonlight , too",794187247650078720,,0,0,,,,https://twitter.com/intcngible/status/794187247650078720
2016-11-03 10:39:28,Made this super creepy thing. Dubbed the name of the Lunar Devil since this form comes out under moonlight and after touch. #creepypasta ? pic.twitter.com/vKfa0wa9hx,794187242419982336,,0,1,,#creepypasta,,https://twitter.com/crisisangelwolf/status/794187242419982336
2016-11-03 10:39:23,아미친 하록마감((뛰어내림,794187223092428804,,0,0,,,,https://twitter.com/eori_moonlight/status/794187223092428804
2016-11-03 10:39:08,"eu tenho que ver la la land, nocturnal animals, moonlight , fences etc",794187159452389377,,0,1,,,,https://twitter.com/arqeiroverde/status/794187159452389377
2016-11-03 10:39:08,끄으으으으응ㄸ,794187157720043520,,0,0,,,,https://twitter.com/eori_moonlight/status/794187157720043520
2016-11-03 10:38:59,으악 ㅁ ㅏ감끝,794187120583708674,,0,0,,,,https://twitter.com/eori_moonlight/status/794187120583708674
2016-11-03 10:38:58,リオでメダル獲得した時は持て囃しておいて、選手が気持ち良く試合や練習ができる施設を作ろうとすると金をかけるなと言ってみたり、はやぶさが帰ってきた時は感動の物語とか持ち上げといて、でも予算をつけるって話にはならなかったり。勝手すぎないか。,794187117110792192,,0,0,,,,https://twitter.com/kent_moonlight/status/794187117110792192
2016-11-03 10:38:50,네ㅔ네ㅜㅜㅜㅜㅡ나중에 놀ㄹ아요...!!((꼬옥,794187084923686912,,0,0,,,,https://twitter.com/eori_moonlight/status/794187084923686912
2016-11-03 10:38:49,"moonlight is already telling me to go to bed and say good night, so bye!",794187080616161280,,0,1,,,,https://twitter.com/raphaeldmg/status/794187080616161280
2016-11-03 10:38:46,#moonlight was one of the best movies I have seen in a VERY long time. GO SEE IT!,794187064036233216,,0,1,,#moonlight,,https://twitter.com/TallGlassofAsh/status/794187064036233216
2016-11-03 10:38:33,Moonlight Reading is tonight!It begins at 6:00. Food trucks will be here at 5:00. Book Fair also opens at 5:00. See you tonight! pic.twitter.com/ZeqsKMkH0Q,794187012328849409,,1,4,,,,https://twitter.com/FuquayVarinaES/status/794187012328849409
2016-11-03 10:38:27,교환구하셨나요? 호피슈와 베레모슈를 바꾸고싶습니다!,794186984541409280,,0,0,,,,https://twitter.com/Moonlight_0921/status/794186984541409280
2016-11-03 10:38:05,@semrakuytul ya yalancı olduğunu itiraf et ya da cevap ver.,794186895530004480,,1,1,@semrakuytul,,,https://twitter.com/Islam_hizmetcsi/status/794186895530004480
2016-11-03 10:37:59,마 감 끝,794186867100897280,,0,0,,,,https://twitter.com/eori_moonlight/status/794186867100897280
2016-11-03 10:37:58,なるほど…… 自分の場合は一人称に慣れ親しみすぎた結果、かも知れませんね……三人称については、これから勉強していくしかないと思ってます！,794186865683243008,,0,0,,,,https://twitter.com/siina_yuuki/status/794186865683243008
2016-11-03 10:37:54,Moonlight by Ariana Grande — https:// path.com/p/2Wt8jy,794186846175510528,,0,0,,,,https://twitter.com/Tiara_ayuWndr/status/794186846175510528
2016-11-03 10:37:52,回れ回れよオルゴール 幻と錆び果てる前に 螺子のないガラクタを 僕はまだ持ち続けている 【The Milage of Moonlight 】,794186839011667970,,0,0,,,,https://twitter.com/asriel_lyrics/status/794186839011667970
2016-11-03 10:37:41,uhhhh love in the moonlight too double yikes,794186793885106176,,0,0,,,,https://twitter.com/palettemv/status/794186793885106176
2016-11-03 10:37:34,そんなスタッカートついてたっけwwwwww,794186766022365184,,0,0,,,,https://twitter.com/Meg_moonlight/status/794186766022365184
