index,text,id,username,retweets,favorites,mentions,hashtags,geo,permalink
2016-11-03 19:59:57,Anyone see moonlight ? It's really catching my attention,794328294573441024,,0,1,,,,https://twitter.com/pbarsway/status/794328294573441024
2016-11-03 19:59:04,Ho fame.,794328072082391041,,0,0,,,,https://twitter.com/lunaelumens/status/794328072082391041
2016-11-03 19:58:45,Craving a night filled with wine and conversations under the moonlight .,794327991694270464,,0,2,,,,https://twitter.com/neodenise/status/794327991694270464
2016-11-03 19:58:32,長征5号打ち上げにどよめく宇宙クラスタとその技術的解説のまとめ - Togetterまとめ http:// togetter.com/li/1044431 @togetter_jp から 太田垣さんの Moonlight mile来たな。 生物学も10年以内に中国に抜かれる、いやもっと早いか,794327937289814016,,8,5,@togetter_jp,,,https://twitter.com/Micheletto_D/status/794327937289814016
2016-11-03 19:58:11,Wanna go see that movie moonlight,794327848878120960,,0,0,,,,https://twitter.com/thats_dnice/status/794327848878120960
2016-11-03 19:57:37,#np Dancing in the moonlight,794327706749915136,,0,0,,#np,,https://twitter.com/EAzuin/status/794327706749915136
2016-11-03 19:57:36,คืออยากดู Moonlight มาก พูดเป็นรอบที่ร้อย จะมีค่ายหนังไหนสนใจม้ายยยยย อยากดูพร้อมชาวโลกอะค่ะ ไม่อยากไปดูตอนที่ใกล้จะออสการ์แล้ว,794327701330870272,,0,0,,,,https://twitter.com/zuuzuushii/status/794327701330870272
2016-11-03 19:57:01,"Who seen that new movie "" Moonlight "" yet?",794327555792744448,,0,1,,,,https://twitter.com/icecream_pete/status/794327555792744448
2016-11-03 19:56:32,Gonna watch #moonlight this weekend @deray,794327432576630784,,0,0,@deray,#moonlight,,https://twitter.com/_mooncube/status/794327432576630784
2016-11-03 19:56:31,I would call her moonlight idk why,794327428873256960,,0,1,,,,https://twitter.com/pinkfoxxxx/status/794327428873256960
2016-11-03 19:56:26,"If the stars align I can see both "" Moonlight "" and ""Do the Right Thing"" in Berkeley on Saturday, probably for free.",794327407893221377,,0,2,,,,https://twitter.com/Lefebvre_Sam/status/794327407893221377
2016-11-03 19:54:47,ポケモンGO 盛り土 ゲス不倫 ペンパイナッポーアッポーペン 厳しい第三者の目 熊本地震 君の名は アモーレ SMAP解散 生前退位,794326992577384448,,0,0,,,,https://twitter.com/moonlight_voice/status/794326992577384448
2016-11-03 19:54:27,@choppadowick Happy birthday !!! I hope it was a great day!,794326908100087812,,0,0,@choppadowick,,,https://twitter.com/Moonlight_pkmn/status/794326908100087812
2016-11-03 19:54:26,hideさん、おはようございます♡ チャームを付けるだけで華やかになるので、昨日は色々買い込んできました！ もちろん「J」も(♡´艸`) 映画、楽しんできますねー！,794326903796600832,,0,1,,,,https://twitter.com/moonlight__JJ/status/794326903796600832
2016-11-03 19:54:21,Tan tontuela,794326883852689408,,0,0,,,,https://twitter.com/Moonlight_bae8/status/794326883852689408
2016-11-03 19:53:59,"Cuando me termine de ver Moon Lovers: Scarlet Heart Ryeo y Love In The Moonlight , no se que dorama verme",794326790961594368,,0,0,,,,https://twitter.com/00Delimalimon00/status/794326790961594368
2016-11-03 19:53:51,"Is "" Moonlight "" only showing in select cities?? So I'm just gonna have to wait 6 months till it hits the redbox huh",794326756333264897,,0,0,,,,https://twitter.com/Kamrywilson/status/794326756333264897
2016-11-03 19:53:38,"http:// ift.tt/2e6PKG5 King Harvest Marty And The Captain Dancing In The Moonlight 45 rpm Record Ex 7""",794326701081841668,,0,1,,,,https://twitter.com/TruckingLinks/status/794326701081841668
2016-11-03 19:53:16,"Para que nada nos separe, que no nos una nada... #BuenasNoches pic.twitter.com/OdaPOBu7n5",794326609788620801,,0,2,,#BuenasNoches,,https://twitter.com/Tess_moonlight/status/794326609788620801
2016-11-03 19:53:05,I wanna know who gonna go see Moonlight,794326562552315904,,0,0,,,,https://twitter.com/thatcheviee/status/794326562552315904
2016-11-03 19:52:59,2時間しか寝てない、死にそう、研修。。,794326540548907008,,0,0,,,,https://twitter.com/moonlight_baaae/status/794326540548907008
2016-11-03 19:52:40,울오빵 길고 긴 촬영 드디어 끝났구나ㅠㅠ고생했네ㅠㅠㅠㅠㅠㅠ살빠진거가타서 넘나 짠한데 앞으로도 팬미팅 스케줄 겁나 많구여ㅠㅠㅠㅠㅠㅠㅠㅠㅠㅠ이제 매일 출퇴근 사진 못본다니....,794326461075177473,,0,0,,,,https://twitter.com/That_moonlight/status/794326461075177473
2016-11-03 19:52:30,Dancing in the Moonlight by Chris Williams Exploration Photography on 500px http:// pinterest.com/pin/2047731142 87394659/ …,794326419052646405,,0,0,,,,https://twitter.com/ffpaws/status/794326419052646405
2016-11-03 19:52:27,Moonlight pra vida! https:// twitter.com/minseokanalha/ status/794308140166709248 …,794326403315597312,,0,0,,,,https://twitter.com/RenataPimentel_/status/794326403315597312
2016-11-03 19:52:15,Moonlight,794326356574076928,,0,1,,,,https://twitter.com/Moonlight_bae8/status/794326356574076928
2016-11-03 19:52:11,Good night moonlight . https:// twitter.com/sir_ssg/status /794325484486164480 …,794326337330806784,,0,0,,,,https://twitter.com/DinmaEnebeli/status/794326337330806784
2016-11-03 19:52:10,定期 俺にも親密度はあるよ。親密度が上がると話しかける回数が上がるよ,794326333807394816,,0,0,,,,https://twitter.com/S_let_Midnight/status/794326333807394816
2016-11-03 19:51:44,秋の先取りカフェタイム 〜スイーツを楽しみながら〜 Moonlight Jazz Blue & JAZZ PARADISE | 形式: MP3 ダウンロード アルバムの売れ筋ランキング: 257 (以前はランク付けされていません)… http:// amzn.to/2fAmM2A,794326225988689920,,0,0,,,,https://twitter.com/MP3_Hit_product/status/794326225988689920
2016-11-03 19:51:43,冬カフェミュージック 〜冬の匂いを感じて〜 Moonlight Jazz Blue & JAZZ PARADISE | 形式: MP3 ダウンロード アルバムの売れ筋ランキング: 259 (以前はランク付けされていません)… http:// amzn.to/2fAnv3M,794326221949501442,,0,0,,,,https://twitter.com/MP3_Hit_product/status/794326221949501442
2016-11-03 19:51:34,@KendallJenner happy birthday Kenny! 21 beauty,794326181604708352,,0,0,@KendallJenner,,,https://twitter.com/moonlight_____/status/794326181604708352
2016-11-03 19:50:33,Hay cosas que se rompen y ya no tienen reparación.,794325925546467328,,1,0,,,,https://twitter.com/Moonlight_bae8/status/794325925546467328
2016-11-03 19:50:30,"Set, set bright sun, Set, blackout And you clear moonlight too Run away, drown yourself",794325913722900481,,0,1,,,,https://twitter.com/SoskinFilm/status/794325913722900481
2016-11-03 19:50:28,today I just want to be alone....,794325907519524865,,0,0,,,,https://twitter.com/vsfd_moonlight/status/794325907519524865
2016-11-03 19:50:16,I wanna go see Moonlight this weekend,794325855820316672,,0,0,,,,https://twitter.com/IAMtherealCoCo/status/794325855820316672
2016-11-03 19:49:22,"Sweetest lil shine of moonlight . Don't let em break... — D'aw, cutiepie<3 http:// curiouscat.me/woofcree/post/ 40606758 …",794325628233404431,,0,0,,,,https://twitter.com/woofcree/status/794325628233404431
2016-11-03 19:49:15,hell ys moonlight greatword is fav,794325598311092224,,0,0,,,,https://twitter.com/queen_natascha/status/794325598311092224
2016-11-03 19:49:03,I liked a @YouTube video http:// youtu.be/A0XBmN_FNOQ?a 4K Moonlight Magic* 1 hour - wonderful music & nature sounds mix LIVE VIDEO,794325549917360136,,0,0,@YouTube,,,https://twitter.com/tonyflake2/status/794325549917360136
2016-11-03 19:49:01,"2016 has been a horrendous year for new movies, but I'm dying to see the Moonlight movie https://www. youtube.com/watch?v=9NJj12 tJzqc …",794325539263827973,,0,0,,,,https://twitter.com/HR_Mantis/status/794325539263827973
2016-11-03 19:48:56,"If you missed TCFF Best Film WINNER #Moonlight this year, it opens tomorrow in Uptown! #tcff16 #bestfilm #twincitiesfilmfest pic.twitter.com/nkNvFGbFyj",794325518208344064,,4,12,,#Moonlight #tcff16 #bestfilm #twincitiesfilmfest,,https://twitter.com/TCFilmFest/status/794325518208344064
2016-11-03 19:48:50,from what ive seen they are plus you get that moonlight greatsword whitch is super good in bloodborne? i think,794325496284577792,,0,0,,,,https://twitter.com/minecraft_woman/status/794325496284577792
2016-11-03 19:48:47,' Moonlight ' illuminates the darker side of the American dream http:// bit.ly/2fhu7jA pic.twitter.com/B9c7eCDdKZ,794325480921059333,,1,4,,,,https://twitter.com/euronews/status/794325480921059333
2016-11-03 19:48:37,#NowPlaying Starbuck - Moonlight Feels Right on Car Tunes Radio #Oldies,794325440538300421,,0,0,,#NowPlaying #Oldies,,https://twitter.com/cartunesradio/status/794325440538300421
2016-11-03 19:48:27,Oh Miss Moonlight 少女だった Oh Miss Moonlight 「貴方へ」 Cry For The Moon Cry For The Moon 黒夢/Missmoonlight,794325399454904320,,0,0,,,,https://twitter.com/rockvkasibot/status/794325399454904320
2016-11-03 19:48:14,Active just for look messages and notificationss,794325345629519872,,0,0,,,,https://twitter.com/moonlight__1993/status/794325345629519872
2016-11-03 19:48:08,I need advance screening passes for moonlight #helpme #elevationpictures #moonlight #yyc @Elevation_Pics,794325317531774976,,0,0,@Elevation_Pics,#helpme #elevationpictures #moonlight #yyc,,https://twitter.com/TarisSmith/status/794325317531774976
2016-11-03 19:47:10,Moonlight Madness starts at 8 tonight - kicking off the basketball season! See you at Riepma Arena - free pizza! @The_WOOD_FB @NUwomensoccer,794325073872244746,,3,4,@The_WOOD_FB @NUwomensoccer,,,https://twitter.com/nutimberwolves/status/794325073872244746
2016-11-03 19:47:00,@SBS_MTV Moonlight 너에게 가는 길을 비춰라 #더쇼 #인피니트 #Bad,794325035456413696,,0,0,@SBS_MTV,#더쇼 #인피니트 #Bad,,https://twitter.com/sarrejici/status/794325035456413696
2016-11-03 19:46:26,Moonlight Cookie,794324889956065280,,2,0,,,,https://twitter.com/JERILONG_22/status/794324889956065280
2016-11-03 19:46:06,[Karaoke - Thaisub] EXO-K - Moonlight (Korean Ver.) ⇒ https:// youtu.be/BWb9ORnisyo,794324807236009984,,0,0,,,,https://twitter.com/jtokqwn656ngany/status/794324807236009984
2016-11-03 19:45:53,Moonlight @ArianaGrande Artist Of The Year #AMAs https:// twitter.com/GrandeNovidade /status/790696523252269057 …,794324753725214729,,6,0,@ArianaGrande,#AMAs,,https://twitter.com/dangerous_lighx/status/794324753725214729
2016-11-03 19:45:42,No digo las cosas sólo por decir.,794324706220355584,,0,0,,,,https://twitter.com/Moonlight_bae8/status/794324706220355584
2016-11-03 19:45:10,"Me encanta que alguien me conozca al punto de poder decir ""a ella no le gusta eso"".",794324573256724480,,0,1,,,,https://twitter.com/Moonlight_bae8/status/794324573256724480
2016-11-03 19:44:55,最近はIT'S THE TIMEと MOONLIGHT を永遠リピートしてる( ˘ω˘ ) ライブで聴きたいよ〜 ！MIXING!にちょっとだけ期待,794324510119903232,,0,0,,,,https://twitter.com/ikuroro_17/status/794324510119903232
2016-11-03 19:44:37,whew i just got out of Moonlight (2016) and im wreckkkkkt as hell !!,794324432370225156,,0,6,,,,https://twitter.com/teens4weenz/status/794324432370225156
2016-11-03 19:44:27,What a difference a year makes... #TBT #Moonlight #SetLife #JadenPiner #DemPinerBoys … https://www. instagram.com/p/BMXexUaFjjm/,794324391446401028,,0,2,,#TBT #Moonlight #SetLife #JadenPiner #DemPinerBoys,,https://twitter.com/NataliePiner/status/794324391446401028
2016-11-03 19:44:06,اللهم اسألك الهدى والسداد http:// d3waapp.org /,794324304498487296,,0,0,,,,https://twitter.com/Moonlight_mone/status/794324304498487296
2016-11-03 19:43:04,tbh the reason I watch Moonlight is bcs of Kwak and ppl just talking abt that drama. so Im curious. but... hm,794324045772701697,,0,0,,,,https://twitter.com/mingeatkuki/status/794324045772701697
2016-11-03 19:42:53,Moonlight madness tonight!!,794323997366382593,,0,0,,,,https://twitter.com/MON5T3R95/status/794323997366382593
2016-11-03 19:42:20,"bone digger bone digger, dogs in the moonlight pic.twitter.com/GNKoMwfKw8",794323860787253257,,0,10,,,,https://twitter.com/Huskyteer/status/794323860787253257
2016-11-03 19:42:12,If Naomie Harris doesn't get an Oscar idk what I'll do #Moonlight,794323826523983874,,1,3,,#Moonlight,,https://twitter.com/RyanStreit/status/794323826523983874
2016-11-03 19:41:39,i'm gonna watch moonlight in 2hrs pic.twitter.com/lelt4Tv9k5,794323686920589312,,0,7,,,,https://twitter.com/cmbyn/status/794323686920589312
2016-11-03 19:41:01,"Si no son dos kilos, no hay trato! #3DiasParaMTVEMA",794323529361596416,,1,1,,#3DiasParaMTVEMA,,https://twitter.com/MTVLA/status/794323529361596416
2016-11-03 19:40:51,오늘 함께하는 별은 「토성」. 당신의 곁에서 강하게 빛나고 있습니다. 토성이 대흉성이라고는 해도… 이렇게 환히 빛날때라면 실수없이 신중하게 행동할 수 있도록 당신을 도울거에요.,794323486885826560,,0,0,,,,https://twitter.com/nath_celeste/status/794323486885826560
2016-11-03 19:40:43,Okay but I wanna see Moonlight SO BAD but there's not a single movie theater in the entire mid-south that's showing it...,794323452878524416,,0,1,,,,https://twitter.com/atdaunais/status/794323452878524416
2016-11-03 19:40:40,"오늘 너의 '운명'은 ""조금은 자신감을 가질 필요가 있어. 너는 스스로를 과소평가하게 될것 같은데.""",794323439045656576,,0,0,,,,https://twitter.com/Witch_Destiny/status/794323439045656576
2016-11-03 19:40:38,100 free spins på unika Mr Green: Moonlight ! Intresserad av gratissnurr? => http:// bit.ly/2bjCpVx pic.twitter.com/OTgV16lXd3,794323429952458752,,0,0,,,,https://twitter.com/spelariskfritt/status/794323429952458752
2016-11-03 19:40:23,ふうさん、おはようございます♡ ストラップどんどん進化してますね。 真心込もってまたまた可愛い 街もクリスマス仕様に早変わり。 映画、楽しんできてね。 行ってらっしゃい,794323368333873153,,0,0,,,,https://twitter.com/loveJJparadise/status/794323368333873153
2016-11-03 19:40:06,"Affs, não to bem",794323295692869632,,0,0,,,,https://twitter.com/vsfd_moonlight/status/794323295692869632
2016-11-03 19:39:57,"Completely obsessed with @BandryBarry and #moonlight . Brilliant Q&A last night. Brilliant, beautiful film. Can't wait to see it again.",794323258644385792,,0,1,@BandryBarry,#moonlight,,https://twitter.com/juasnua/status/794323258644385792
2016-11-03 19:39:53,Drinking some Strawberry Rhubarb mead from Moonlight Meadery.,794323241149968384,,0,1,,,,https://twitter.com/fusion_mobile/status/794323241149968384
2016-11-03 19:39:41,Moonlight !,794323190986121216,,0,0,,,,https://twitter.com/txflxn/status/794323190986121216
2016-11-03 19:39:21,"Singing ""Better Man"" She heard me singing it & wanted to learn it. She stole my heart @littlebigtown @taylorswift13 pic.twitter.com/LAEmQozm4a",794323109725818895,,0,5,@littlebigtown @taylorswift13,,,https://twitter.com/Moonlight_Luv19/status/794323109725818895
2016-11-03 19:39:16,اللهم لا سهل إلا ما جعلته سهلاً وأنت تجعل الحزن إذا شئت سهلا http:// du3a.org,794323085310750720,,0,0,,,,https://twitter.com/_Moonlight_999/status/794323085310750720
2016-11-03 19:39:03,"I've seen sooo many commercials for "" Moonlight "" on and offline lol I'm going to see the movie now TV and YouTube leave me alone",794323031216844800,,0,1,,,,https://twitter.com/Drapetomaniac4/status/794323031216844800
2016-11-03 19:38:31,"Gostei de um vídeo @YouTube de @vallisitsa http:// youtu.be/zucBfXpCA6s?a Beethoven "" Moonlight "" Sonata op 27 #2 Mov 3 Valentina Lisitsa",794322896898445315,,0,0,@YouTube @vallisitsa,#2,,https://twitter.com/Evamnuel/status/794322896898445315
2016-11-03 19:37:48,ohhh sebab dalam kritikan Ada jugak nama group moonlight . Ingatkan group u huhu,794322719177199616,,0,0,,,,https://twitter.com/allithskull/status/794322719177199616
2016-11-03 19:37:27,(옷갈아입는중),794322629456822272,,0,0,,,,https://twitter.com/hyee_MoonLight/status/794322629456822272
2016-11-03 19:37:13,ㅠㅜㅠㅠㅠㅜㅠㅠ후에에유ㅠㅠㅠㅜㅜㅠㅠㅠㅜㅜㅜㅠㅠㅠㅠㅠㅠㅜㅠㅠㅜ후에에에ㅔㅇ엥우ㅜㅜㅜㅠ,794322571101544448,,0,0,,,,https://twitter.com/hyee_MoonLight/status/794322571101544448
2016-11-03 19:37:10,묘도인 이츠키는 츠보미와 에리카랑 마찬가지로 내 중학교 후배이자 프리큐어로서 후배야. 이사장님의 손녀딸이지만 사정이 있어서 남장을 하고 있어. 큐어 선샤인이라고도 불리고 포푸리는 그녀의 파트너 요정이야. 무도를 하고 있고 귀여운 것을 엄청 좋아해.,794322557897822208,,0,0,,,,https://twitter.com/moonlight_krbot/status/794322557897822208
2016-11-03 19:37:05,CLASSIC HITS UK just played - Elvis Presley - - Moonlight Swim,794322536213286912,,0,0,,,,https://twitter.com/classichitsuk/status/794322536213286912
2016-11-03 19:37:01,Moonlight and love songs Never out of date Casablanca - As Time Goes By - Original Song by Sam (Dooley Wilson) https:// youtu.be/d22CiKMPpaY v,794322520530911232,,0,0,,,,https://twitter.com/ElsaBortolotti/status/794322520530911232
2016-11-03 19:36:52,Tô ouvindo Moonlight de novo. Quero que todo mundo ouça comigo.,794322481335193609,,0,0,,,,https://twitter.com/whythefy/status/794322481335193609
2016-11-03 19:36:41,26: A song that makes you want to fall in love Moonlight - Ariana Grande,794322437534076928,,0,0,,,,https://twitter.com/nyazzyt/status/794322437534076928
2016-11-03 19:36:15,고민이 있으신가요? 훌훌 털어버리세요.,794322327630548992,,0,0,,,,https://twitter.com/fortune_cookieb/status/794322327630548992
2016-11-03 19:35:41,I LOVE DANCE more than 100.000 Hits Click and Play!! ! http:// listen.radionomy.com/ilovedance24-7 morethan100000hitsarlearadio … Cher What About the Moonlight (Sam Ward Remix),794322186353987591,,0,0,,,,https://twitter.com/Radio100000Hits/status/794322186353987591
2016-11-03 19:35:39,"Also, WHO THE FUCK IS JANELLE MONAE'S AGENT?! #Moonlight",794322179257237504,,1,0,,#Moonlight,,https://twitter.com/RyanStreit/status/794322179257237504
2016-11-03 19:35:39,（議員がなんJ語を使っては）いかんのか？,794322175855456256,,0,0,,,,https://twitter.com/maybe_moonlight/status/794322175855456256
2016-11-03 19:35:05,Moonlight #StevieNicks @Amalie Arena https://www. instagram.com/p/BMXds9OBZaP/,794322036206104576,,0,1,@Amalie,#StevieNicks,,https://twitter.com/JusBeinMichael/status/794322036206104576
2016-11-03 19:34:59,당신에겐 특별한 꿈이 없네요. 특별한 기회가 오지 않는 한 큰 꿈을 가지진 못하실거예요. 당신에겐 두가지 선택이 있어요. 기회를 찾느냐， 아니면 꿈을 지닌 사람을 찾느냐. 다행히도 당신은 누군가의 꿈을 지킬 힘이 있으니까.,794322008108507136,,0,0,,,,https://twitter.com/Mirang_me/status/794322008108507136
2016-11-03 19:34:54,"This featured illustration is @JBromleyArt 's "" Moonlight Stag"" from #SketchFest 30. http://www. ellenmilliongraphics.com/sketchfest/ske tchfestart.php?id=7871 …",794321989448192001,,0,2,@JBromleyArt,#SketchFest,,https://twitter.com/ellen_million/status/794321989448192001
2016-11-03 19:34:37,we make the Sun shine in the moonlight #EMABiggestFansJustinBieber,794321918488956928,,0,0,,#EMABiggestFansJustinBieber,,https://twitter.com/pwrposi/status/794321918488956928
2016-11-03 19:34:32,(느와르껴안고다시잠),794321897584410625,,0,0,,,,https://twitter.com/hyee_MoonLight/status/794321897584410625
2016-11-03 19:34:02,Walpurgis Night - Under the moonlight イタリア産正統派・NWOTHMバンドよ。メイデン直系の音ね。しっかり80年代だわ。 https://www. youtube.com/watch?v=XEDCH3 I8Qb4 …,794321771679784960,,0,0,,,,https://twitter.com/kuroneko_metal/status/794321771679784960
2016-11-03 19:33:58,The relationship between the impressionable and the ones who guide them has never been so elegantly and intelligently portrayed #Moonlight,794321754667831310,,1,1,,#Moonlight,,https://twitter.com/RyanStreit/status/794321754667831310
2016-11-03 19:33:58,去年のstarlight tourの神戸で最前列だったのですが MOONLIGHT DRIVEの時に、ちょうど目の前に座ってハンドル回してたの可愛かったなぁ 誕生日に大阪ライブだったし去年も良い一年だった。今年には及ばないけど(*´ー｀*) https:// twitter.com/simrockstar/st atus/794316587016724480 …,794321752008466432,,0,3,,,,https://twitter.com/believer_megu/status/794321752008466432
2016-11-03 19:33:43,それ以前にイガグリくん（しかもその時点で作者は故人）が出ているという明らかなアウト物件,794321691811794944,,0,0,,,,https://twitter.com/maybe_moonlight/status/794321691811794944
2016-11-03 19:33:38,안스타 회장이 이쁘게 생기심...지금 앙스타때문에 설정이 병약에 비설이 건강이 떠오르긴한데..,794321669087064065,,0,1,,,,https://twitter.com/hyee_MoonLight/status/794321669087064065
2016-11-03 19:33:35,Michael Herrera X WARR!OR - Moonlight https:// youtu.be/BCAYR_dg_B4 via @YouTube,794321657242537989,,0,0,@YouTube,,,https://twitter.com/GZaviergodard/status/794321657242537989
2016-11-03 19:33:31,She loves moonlight and rainstorms. And so many other things that have soul. #itsamazingoutthere … http:// ln.is/www.instagram. com/p/fS3oD …,794321640347881484,,0,0,,#itsamazingoutthere,,https://twitter.com/Piratekelli/status/794321640347881484
2016-11-03 19:33:19,u can do both i don't feel like being me today!!!!,794321590758625282,,0,1,,,,https://twitter.com/moonlight_motel/status/794321590758625282
2016-11-03 19:33:18,ついて行く もう分からんw,794321586383777792,,0,0,,,,https://twitter.com/chobiharu0216/status/794321586383777792
2016-11-03 19:33:01,Moonlight was such a beautiful movie and I think everyone should see it. It honestly was beyond what I expected.,794321515038855168,,0,0,,,,https://twitter.com/Rhxvin/status/794321515038855168
2016-11-03 19:32:50,참고로 저분취미는 겹사돈 중요하니까 두번말하지만 겹사돈,794321467781431296,,0,0,,,,https://twitter.com/hyee_MoonLight/status/794321467781431296
2016-11-03 19:32:50,ドカベンが柔道漫画だった時代は「ルールを間違えている」場面があるし,794321466539921408,,0,1,,,,https://twitter.com/maybe_moonlight/status/794321466539921408
2016-11-03 19:32:25,앤오님이랑 웅앵웅 인생조기포기..이러고노는데 정작자컾은...,794321364031111169,,0,1,,,,https://twitter.com/hyee_MoonLight/status/794321364031111169
2016-11-03 19:32:14,つまりごまかせるレベルまで勉強したら書いてもいいのだ,794321318921371648,,0,0,,,,https://twitter.com/maybe_moonlight/status/794321318921371648
2016-11-03 19:32:13,Now playing on Amazing 70's Radio ►: Moonlight Feels Right by Starbuck more #70s Hits ♫ Listen here ♫ http:// amazing70s.weebly.com /,794321314613968896,,0,0,,#70s,,https://twitter.com/amazing70s/status/794321314613968896
2016-11-03 19:31:53,おはようございます♡ 今日はシワン君の映画を観に行きます(^O^) 楽しみ！ ハロウィンも終わったので、娘と友達にクリスマスストラップを(♡´艸`) pic.twitter.com/Dm3zItA3Xq,794321229465276416,,0,8,,,,https://twitter.com/moonlight__JJ/status/794321229465276416
2016-11-03 19:31:41,書けば書くほど露呈する勉強不足！ だが「書いたらダメレベルの勉強不足」と、「ごまかせるレベルの勉強不足」がある,794321179385339905,,0,1,,,,https://twitter.com/maybe_moonlight/status/794321179385339905
2016-11-03 19:31:24,미치누ㅜㅜㅜㅜ현아ㅜㅜㅜㅜ,794321106735808512,,0,0,,,,https://twitter.com/Moonlight_BBH56/status/794321106735808512
2016-11-03 19:31:21,(와장창널부럭,794321093943119872,,0,0,,,,https://twitter.com/hyee_MoonLight/status/794321093943119872
2016-11-03 19:30:58,Headed to see Moonlight tonight. Been looking forward to this one. #itsthemostwonderfultimeoftheyear,794320999705673728,,0,0,,#itsthemostwonderfultimeoftheyear,,https://twitter.com/brentcarcher/status/794320999705673728
2016-11-03 19:30:41,"Moonlight premieres at The Avon in Stamford, CT on 11/4/16 – exclusive… https:// reelcharlie.wordpress.com/2016/11/03/moo nlight-premieres-at-the-avon-in-stamford-ct-on-11416-exclusive-connecticut-engagement … pic.twitter.com/aKhbIDB9eE",794320926842101760,,0,0,,,,https://twitter.com/reelcharlie/status/794320926842101760
2016-11-03 19:30:25,종강전에 기말이있넹,794320859804512257,,0,0,,,,https://twitter.com/hyee_MoonLight/status/794320859804512257
2016-11-03 19:30:16,here are some OK selfies from before today made me Sad pic.twitter.com/Q6UbtELZov,794320820961234951,,0,9,,,,https://twitter.com/moonlight_motel/status/794320820961234951
2016-11-03 19:30:06,@Coooots sharing a fond memory in Brighton recently walking on a moonlight stroll with a friend. Single now too pic.twitter.com/UX4644OUvq,794320782310723589,,0,0,@Coooots,,,https://twitter.com/waynetlc/status/794320782310723589
2016-11-03 19:29:43,네 감사합니다~ :),794320685212389377,,0,0,,,,https://twitter.com/Moonlight_0921/status/794320685212389377
2016-11-03 19:29:32,the- moonlight -witch: tumblr + history https:// tmblr.co/ZEmSlj2EDuBzy,794320639972823058,,0,0,,,,https://twitter.com/ehsnape/status/794320639972823058
2016-11-03 19:29:21,허엉ㅇ엉ㅇ유ㅠㅜㅜ,794320591973011459,,0,0,,,,https://twitter.com/hyee_MoonLight/status/794320591973011459
