2683,"лекарство от здоровья / cure well / / год выпуска: 2016 / страна: германия, сша / жанр: триллер, д.. https:// vk.cc/6ibfn5"
2684,i'v watch except cure well
2685,probabl see fifti shade cure well .
2686,cure well . load shit like.
2687,"cure well great, great watch @mce_artistri react medic horror"
2688,want go see cure well tonight?
2689,watch cure well amaz movi
2690,cure well pretti dope didnt realli get end tho good
2691,"yeah, cure well absolut mess. review huge disappoint horror flick: http:// themoviegurusblog.blogspot.com/2017/02/a-cur -for-wellness-review.html … pic.twitter.com/dxrhg2tlqg"
2692,#tecnologia casi todo se venir de lejo en ' cure well ' http:// bit.ly/2llpchc
2693,en qui ont vu cure well ?
2694,cure well (2017) iii http:// posterbinge.com/2017/cure-wel ness-2017-iii/?utm_source=reviveoldpost&utm_medium=social&utm_campaign=reviveoldpost …
2695,rate cure well (2016) 3/10 #whatdidijustwatch ?! http://www. imdb.com/title/tt4731136
2696,look forward cure well sequel dane dehaan enrol famou school danc europ
2697,peopl say cure well 10/10 ://
2698,cure well look soo good
2699,john wick 2 cure well !
2700,honestli cure well hell that????? never seen weird film one make wanna watch rest??
2701,"ya quería ver está película. (@cinépoli cure well silao, gto., gto) https://www. swarmapp.com/c/2hdlqoo6djb"
2702,"cure well = weird, bizarr confu"
2703,"i'v heard noth good thing "" cure well "" need see like, right"
2704,oscar nom check list realli want go see cure well
2705,right wanna see cure well friend see with. don't confid go cinema alon ahahahahah
2706,"biggest issu movi "" cure well "" one forget $20 tube m•a•c lipstick bathroom."
2707,moonlight brilliant i'm desper see cure well !
2708,"you'r horror films, cure well mad. there' one very...interest scene toward end. ""wtf..."" kinda film"
2709,"wait long time see "" cure well "" & ""get out"" needless say wait fuckin worth it, go see them."
2710,[the /filmcast] ep. 406 – cure well http:// podplayer.net/#/?id=30490509 via @podcastaddict pic.twitter.com/da1h4w3m4d
2711,cure well review- smart thriller made dumb people: http:// redlegagenda.com/2017/02/25/a-c ure-for-wellness-review-a-smart-thriller-made-for-dumb-peopl … pic.twitter.com/qaudmfj9rx
2712,cure well quit possibl worst film i'v ever seen. never lett greg pick see cinema
2713,offenc director cure well cast beauti male lead distract
2714,casi todo se venir de lejo en ' cure well ' http:// hiper.click/ntdmp2 https:// twitter.com/hipertextual/ tatus/835453692035780612 …
2715,parec increíbl que cure well (2016) ha recibido tanta atención cuándo es buen film de terror de... http:// fb.me/wttynhfd
2716,"cure well , well, we'll see-lol! (@celebration! cinema - @celebrationcnma cure well ) https://www. swarmapp.com/c/clvttfxqgs5"
2717,cure well https:// thatfilmsite.wordpress.com/2017/02/25/a-c ure-for-wel … pic.twitter.com/ksdbtzrwrg
2718,whose seen ' cure well '? good? im see it.
2719,cure well - last night offering. #cineworldunlimit #cineworld @cineworld whiteley… https://www. instagram.com/p/bq8eemdg8ig/
2720,someon go see get cure well w
2721,defo want go see cure well tonight????????
2722,"movi review: cure well - total bonkers, confusing, beauti shot & idea love everi minut it."
2723,anyon seen cure well ?
2724,cure well alreadi two show day. almost leav faster silence. film exhibition- fuck cut-throat business.
2725,someone: hi me: cure well 2017 psycholog horror thriller film direct gore verbinski written justin haythe. t-
2726,würde mir ja auch cure well ansehen aber 146 minuten?
2727,coupl brought babi cure well . cour cried.
2728,"saw cure well busi screen great audience, realli attent yet reactiv right moments, *that* scene omg!!"
2729,"christ time im actual gonna watch cure well left house, im car, we'r"
2730,attempt see cure well audio issu saw split instead. last 30 second total redeem movie.
2731,"gonna go movies. see ""get out"" "" cure well "" ?"
2732,film 050- cura #filmes2017 (@playart cinema - @grupoplayart cure well ) https://www. swarmapp.com/c/kzs7hgqq4rc pic.twitter.com/tkcz5pgy8m
2733,think i'm gonna use free bday ticket @alamodfw watch cure well solo
2734,"cure well get out, it' great year horror we'r 2 month in."
2735,time cure well feel like studio film direct quay brother jan švankmaj
2736,serresland.gr: cine σέρρες: αντίδοτο στην ευεξία | cure well (2017) http://www. serresland.gr/2017/02/cine-c ure-for-wellness-2017.html#.wlhlmp4uzzm.twitt …
2737,somebody' need go see cure well
2738,anyon want go see cure well tonight?
2739,episod 203 @horrornewsradio scale great wall & look cure cure well . http:// gruesomemagazine.com/2017/02/24/pod cast-cure-wellness-2017-great-wall-2017-episode-203-horror-news-radio/ … #acureforwel
2740,here' review gore verbinski' cure well ! https:// seanmcconvillereviews.wordpress.com/2017/02/25/a-c ure-for-wellness-review/ …
2741,"one movi put smile face. like, "" cure well "", it' ""wow... interesting"" movie."
2742,john wick 2. cure well major disappointment. john wick 2 world-class.
2743,cure well review http:// moviebarf.com/2017/02/25/a-c ure-for-wellness-review … pic.twitter.com/dfy3ga0ge8
2744,honestli struggl whether give cure well 3 star honestli 3.5 star amaz visual
2745,"' cure well ' still theaters. read review, go see big screen can... https:// scarepop.com/2017/02/17/rev iew-a-cure-for-wellness-makes-a-case-for-big-budget-horror/ …"
2746,bother cure well . #utterbaw
2747,cure well cinemas. eel-i good eel-i bad? audio review here: http:// buff.ly/2mkopag pic.twitter.com/mbjtfpfphz
2748,boutta see cure well stare dane dehaan' beauti face next two hour
2749,film review cure well : http:// tiny.cc/rg1gji #horror #acureforwel #filmreview #horrorreview #horrorfilm #horrorfan pic.twitter.com/yj9gwjxnbg
2750,realli want go watch cure well get out.
2751,casi todo se venir de lejo en ' cure well ' http:// hiper.click/ntdmp2 https:// twitter.com/hipertextual/ tatus/835453692035780612 …
2752,cure well : one outlandish schlocki piec pulp come hollywood ages. realli dug it.
2753,cure well uk/roi cinema now. read review http://www. themoviewaffler.com/2017/02/new-r lease-review-cure-for-wellness.html … pic.twitter.com/ru92nkibgc
2754,"throwaway line @dannytheleigh regard cure well : ""leagu gentlemen make tobleron ad."" best lol i'v while."
2755,până und merg vanitatea de a-ţi păstra tinereţea? nimeni nu refuză leacul! „ cure well / terapie... http:// fb.me/v5qtaoba
2756,mom might see cure well tomorrow!
2757,"someth weird happen cure well screening, ""didn't happen"" wasn't sure whether mention it..."
2758,everyon see cure well
2759,cure well like one well written creepier episod american horror story... fuck lol
2760,"john wick 2, cure well slow bore actual quit shite"
2761,"well, cure well pretti meh. fuss shocking, grotesqu 'cant look away' come it..."
2762,"cure well : bizarro studio anomaly, wonder gothic, echo classi 70' european exploitation. ador it!"
2763,same! cure well look tight though
2764,"""you know cure well ? disease. it' way find cure."""
2765,wanna go see ' cure well ' think we'll allow
2766,love cure well fond european gothic. real moment visual splendour nastiness. long though.
2767,cure well es como la peor película de esta década.
2768,cure well : spa break fail hit remedi – belfast telegraph http:// uklocal.net/a-cure-for-wel lness-spa-break-fails-to-hit-remedy-belfast-telegraph/ …
2769,"i'v given day mull over, i'm still realli angri bad cure well is."
2770,cure well look like good movi
2771,scene cure well could'v sworn dane dehaan young @joedrinkswat
2772,honestli cure well great origin movi somewhat disturb
2773,cure well tonight. look brilliant
2774,cure well pretti good
2775,casi todo se venir de lejo en ' cure well ' http:// bit.ly/2lgj4e9 vía @hipertextu
2776,#nowwatch ' cure well ' #goreverbinski #movieticket #movielov #moviebuff #filmlov … https://www. instagram.com/p/bq8uzk4d25o/
2777,cure well get mind go sure
2778,"cure well gussi hokum. verbinski unappreci image-maker, it' shame thing bloat flimsy."
2779,wouldn't call cure well horror movie.
2780,cure well good movi it' lonnnng af
2781,cure well must watch film
2782,definit go check cure well first though. look like could inten plu kind becom dane dehaan fan.
2783,"saw cure well . ten thriller effect scari scenes, plot predict clever thinks."
2784,realli like cure well . pull rug seriou examin human condit camp tit gothic horror
2785,ich glaub ich sehe mir cure well auch wenn ich angst haben werde. wäre dann mein erster horror film ^^
2786,wait see cure well (cue extrem excitement)
2787,watch cure well (2015) movi onlin free http:// putlockerflix.com/a-cure-for-wel lness/ …
2788,@lyzolko alex watch cure well hahaha pic.twitter.com/xbli8ilhir
2789,""" cure well "" film fuck baffl me...."
2790,"like @youtub video http:// youtu.be/rffg0s0ndey?a horrorh pictur show (#4) - cure well (dane dehaan, jason isaacs) + get"
2791,cure well smart thriller made dumb peopl http://www. theverge.com/2017/2/8/14544 772/a-cure-for-wellness-review-gore-verbinski-dane-dehaan?utm_campaign=theverge&utm_content=entry&utm_medium=social&utm_source=twitt … pic.twitter.com/rgirrkutrc
2792,cure well review http:// bit.ly/2ld4jrw #acureforwel #gff17 pic.twitter.com/5zty94bxbq
2793,cure well review http:// bit.ly/2ld4jrw #acureforwel #gff17 pic.twitter.com/u21tg5mqli
2794,cure well smart thriller made dumb peopl http://www. theverge.com/2017/2/8/14544 772/a-cure-for-wellness-review-gore-verbinski-dane-dehaan?utm_campaign=theverge&utm_content=entry&utm_medium=social&utm_source=twitt … pic.twitter.com/uumbypltdo
2795,cure well smart thriller made dumb peopl http:// bit.ly/2mi3vmo http:// bit.ly/2mwlunj
2796,"cure well delight fuck up, refreshingli new, pretti dang dark. everyon though enjoy it!"
2797,#googl verge: cure well smart thriller made dumb peopl http://www. theverge.com/2017/2/8/14544 772/a-cure-for-wellness-review-gore-verbinski-dane-dehaan?utm_campaign=theverge&utm_content=entry&utm_medium=social&utm_source=twitt … pic.twitter.com/pxmwwmny42
2798,cure well smart thriller made dumb peopl http://www. theverge.com/2017/2/8/14544 772/a-cure-for-wellness-review-gore-verbinski-dane-dehaan?utm_campaign=theverge&utm_content=entry&utm_medium=social&utm_source=twitt … pic.twitter.com/ot5v1zosak
2799,cure well smart thriller made dumb peopl http://www. theverge.com/2017/2/8/14544 772/a-cure-for-wellness-review-gore-verbinski-dane-dehaan?utm_campaign=theverge&utm_content=entry&utm_medium=social&utm_source=twitt … pic.twitter.com/hvknhtzloz
2800,"' cure well ' gorgeou look film, bad crappi writing."
2801,cure well smart thriller made dumb peopl http://www. theverge.com/2017/2/8/14544 772/a-cure-for-wellness-review-gore-verbinski-dane-dehaan?utm_campaign=theverge&utm_content=entry&utm_medium=social&utm_source=twitt … pic.twitter.com/iixruew5rw
2802,verge: cure well smart thriller made dumb peopl http://www. theverge.com/2017/2/8/14544 772/a-cure-for-wellness-review-gore-verbinski-dane-dehaan?utm_campaign=theverge&utm_content=entry&utm_medium=social&utm_source=twitt … … https:// goo.gl/eicipk
2803,cure well smart thriller made dumb peopl http://www. theverge.com/2017/2/8/14544 772/a-cure-for-wellness-review-gore-verbinski-dane-dehaan?utm_campaign=theverge&utm_content=entry&utm_medium=social&utm_source=twitt … pic.twitter.com/dnhjxu8esw
2804,cure well smart thriller made dumb peopl http://www. theverge.com/2017/2/8/14544 772/a-cure-for-wellness-review-gore-verbinski-dane-dehaan?utm_campaign=theverge&utm_content=entry&utm_medium=social&utm_source=twitt … pic.twitter.com/bbkbvau0bg
2805,cure well smart thriller made dumb peopl http://www. theverge.com/2017/2/8/14544 772/a-cure-for-wellness-review-gore-verbinski-dane-dehaan?utm_campaign=theverge&utm_content=entry&utm_medium=social&utm_source=twitt … pic.twitter.com/otokyknsko
2806,"gotta see "" cure well "" & ""get out"" wknd"
2807,cure well mal sehen ob ich mich im gruselkabinett wieder… https://www. instagram.com/p/bq3telpbkoa9 7vu54kwn8q59flhxnb4xmtzklo0/ …
2808,cure well full seri stream http:// dkn.rolllmovies.com/movie/340837/a -cure-for-wellness.html … https:// twitter.com/djfresham/stat us/835484461726908416 …
2809,"horror sales: cure well , xx, bate motel. http:// wp.me/p1dze6-hj6 via @horrorsocieti"
2810,cure well ????
2811,someon need see cure well asap
2812,c'est bien cure well ? #sondageciné
2813,someon come see cure well thx
2814,odditi ' cure well ' attract me. sure say head (besid mess ending)
2815,cure well review: stun cinematographi plot pitfal http://www. filmandtvnow.com/a-cure-for-wel lness-review-stunning-cinematography-with-a-plot-of-pitfalls/ … #acureforwel pic.twitter.com/vzdodv62f4
2816,"cure well ,"
2817,"next week guest bojan bazelli, cinematograph cure well @cureforwel"
2818,cure well : come trigger warnings. it' fabul utterli disgusting.
2819,everyon go see cure well bc movi shook
2820,cure well : spa break fail hit remedi - belfast telegraph http:// fb.me/1fe5i8ckm
2821,cure well
2822,can't wait see cure well
2823,deal mad all? terrifi & uniqu - cure well show now: http:// bit.ly/2ltz3xl
2824,cure well (2017) iv http:// posterbinge.com/2017/cure-wel ness-2017-iv/?utm_source=reviveoldpost&utm_medium=social&utm_campaign=reviveoldpost …
2825,"also notic obsess verbinski water, poc trilogy, ring cure well"
2826,ich gönne mir jetzt ein doubl featur mit lion und cure well
2827,roomi realli let cure well it. wanna watch more.
2828,'get out' ' cure well ' gonna move today
2829,"new sounds: sp76b: spoilercast - cure well , great wall https:// soundcloud.com/dnashow/sp76b- spoilercast-a-cure-for-wellness-the-great-w … #soundcloud"
2830,"new sounds: siftpop podcast 76: cure well , great wall https:// soundcloud.com/dnashow/siftpo p-podcast-76-a-cure-for-wellness-the-great-w … #soundcloud"
2831,"【hd】film trailer cure well - nu de bioscoop met oa.: dane dehaan, jason isaacs, mia goth, http:// goo.gl/kxbhdi pic.twitter.com/i4bht5u1ar"
2832,“anyon emerg [ cure well ] without need day r&r truli made stern stuff” http://www. empireonline.com/movies/cure-w llness/review/ …
2833,"review: ' cure well ' malevol thrill ride, eel - atlant https://www. theatlantic.com/entertainment/ archive/2017/02/a-cure-for-wellness-review-oh-god-not-the-eels/516738/ …"
2834,cure well charact call hank green got mild whiplash
2835,movi i'v seen far year cinema good shit: 1. cure well 2. split 3. bye bye man 4. ring 5. assassin' creed
2836,wait seen cure well yet?
2837,cure well fuuuuuuuuck
2838,"go see today..."" cure well "" ""get out""..."
2839,cure well batshit insan can't tell love
2840,anyon wanna see cure well ? cuz definit
2841,review: ' cure well ' first good horror film 2017 https://www. forbes.com/sites/markhugh es/2017/02/16/review-a-cure-for-wellness-is-the-first-good-horror-film-of-2017/#744d54c66cad …
2842,vía: alt1040 casi todo se venir de lejo en ' cure well ' - http:// ift.tt/2lufecr
2843,someon date go see cure well tonight
2844,go see cure well tonight. pretti excit alreadi :d.
2845,@labsplic explor critic reaction ' cure well ' along religi lines. it' fascinating: http:// buff.ly/2luhbqi pic.twitter.com/xhy8ca1gsz
2846,should'v went cure well real crazi make think type movie.
2847,cure well suck
2848,sadli you'r clash rugbi today. i'll check i'v chanc see cure well .
2849,"cure well : delight #twist . didn't realli know expect, had… https://www. instagram.com/p/bq8iwoddu8x/"
2850,casi todo se venir de lejo en ' cure well ' http:// hiper.click/ntdmp2 https:// twitter.com/hipertextual/ tatus/835453692035780612 …
2851,cure well (16) gate cinema ambiti young execut sent retriev company's... http:// fb.me/1jxkoxaem
2852,strang attract dane dehaan watch cure well
2853,watch cure well yesterday brilliant film #acureforwel
2854,neeeeeed go see cure well !!!
2855,want go see cure well cinema 18 ugshsh
2856,"first half cure well actual pretti good second half is, like, realli realli silli"
2857,check cure well later. wbu?
2858,saw cure well convinc 5 minut protagonist play leonardo dicaprio ca 1995
2859,"i'm see get hours, guy get 3 delay review today - lego batman, cure well & john wick 2!"
2860,意味わからん… 代わりに cure well 観に行こうかな。
2861,"#nowwatch cure well . exhaust bare stay awake, merci"
2862,realli want see cure well
2863,v excit see cure well @jackwalker59 today
2864,what' cure? well watch video find out. cure well video review: https://www. youtube.com/watch?v=5sb32b 35nyu …
2865,review ' cure well ' http:// jamesfilmreviews.blogspot.com/2017/02/a-cur -for-wellness-review.html?spref=tw …
2866,saturday movi times: cure well (r) run time: 2 hr 42 min 11:15a 8:50p dog' purpo (pg)... http:// fb.me/1rmnuum0n
2867,"@cineworld llandudno own, watch cure well . wish friend tast movi"
2868,cure well one favorit movi
2869,review: cure well http:// ift.tt/2lamlum #cine
2870,"@alachia go blind, watch movi "" cure well ""...it oddest thing"
2871,""" cure well "" ¿e buena?"
2872,cure well policy. #wwemovi
2873,"cure well und 50 shade grey. ^.^"""""
2874,go watch cure well incr beauti @danedehaan it.
2875,cure well snooz fest
2876,#' cure well full movi (2016) » http:// mcaf.ee/me1hf2 «»
2877,wanna see ' cure well '
2878,"dang wanna see it. u seen "" cure well """
2879,cure well strang fascin wick 2 cool need lot suspen disbelief.
2880,haven't seen either cure well look like could intriguing.
2881,cure well amazing. definit would watch again.
2882,ไม่เวิร์คหรอ กินจำนวนโรงเว่อ cure well น้องหายหมด
2883,think cinema. torn john wick 2 cure well . anyon see either?
2884,"cure well crazi good, literally! #neverdrinkingwateragain"
2885,"watch alon - bizarre, disturb & truli weird - cure well show now!: http:// bit.ly/2ltz3xl"
2886,cure well beauti
2887,มีความต้องการเม้าท์มอย cure well มาก อยากฝอย อยากได้คนมาวิเคราะห์หนังด้วย55555
2888,casi todo se venir de lejo en ' cure well ' http:// hiper.click/ntdmp2 https:// twitter.com/hipertextual/ tatus/835453692035780612 …
2889,cure well incredible! love
2890,cure well นี่ทีมงานจำลองกรณีศึกษาวัดพระธรรมกายมาป้าว ละอีกนิดจะเป็นหนังลุงมาโนชล้าววว 5555555555
2891,"cinama plan are; hidden figures, cure well , t2 trainspotting, rings. (cineworld & vue screens)"
2892,http:// sinemaperisi.com/yasam-kuru-a-c ure-for-wellness-izle/ … yaşam kürü cure well pic.twitter.com/rqpwydfpzb
2893,"friday relea see 'get out', 'patriot day' ' cure well ' reach u.k cinema screen pic.twitter.com/ttmj8mf0kr"
2894,bon aprè le bb et le concour g je regard cure well (et pa life oh)
2895,anyon watch cure well ye good
2896,don't watch cure well you'r scare dentist !
2897,so. cure well . who' go see w/me?
2898,realli want watch cure well . look good!
2899,"aktuel im kino: gore verbinski "" cure well "". ziemlich wirr. http://www. filmdienst.de/kinokritiken/ inzelansicht/a-cure-for-wellness,549198.html … pic.twitter.com/620dmp2ngx"
2900,cure well - review https:// snakeintheplane.wordpress.com/2017/02/25/a-c ure-for-wellness-review/ … via @wordpressdotcom
2901,casi todo se venir de lejo en ' cure well ' http:// ift.tt/2labpno
2902,gah damn cure well strang good
2903,plan go see cure well reali run time 146 minutes.
2904,honestli cure well good like genuin love all!!
2905,"psa: cure well mess mind much leav mani unansw questions, it' must see"
2906,#nowwatch cure well .
2907,cure well one mess film
2908,film review: cure well http:// paulowensblog.blogspot.com/2017/02/film-r eview-cure-for-wellness.html?spref=tw …
2909,cure well pretti good
2910,start cure well ..hoe damn
2911,we'r gonna go see great wall.. want see cure well nobodi el want lol
2912,nooo want go see cure well (i mean hello dane dehaan it) reali 18
2913,cure well too. movi trip.
2914,"cure well - bit long, good show peopl consid trip switzerland..."
2915,watch cure well (with dawson) — https:// path.com/p/1oyyau
2916,"recommend "" cure well "" everyon ok go see"
2917,ich mag da @youtub -video von @kinocheck : http:// youtu.be/lz0pkj7ixsi?a cure well exklusiv trailer 2 german deutsch (2017)
2918,รีวิว cure well ไม่สปอยยย ดีมากกกก โอ๊ยยยย เนื้อ นม ไข่ ปลาไหล ครบ pic.twitter.com/2kbfafgd73
2919,casi todo se venir de lejo en ' cure well ' https:// hipertextual.com/analisis/a-cur e-for-wellness?utm_medium=twitter&utm_source=dlvr.it&utm_campaign=feed%3a+hipertextu … via @alt1040
2920,casi todo se venir de lejo en ' cure well ' https:// goo.gl/fb/m1ikpz via @alt1040
2921,cure well soundtrack. fabulous. https:// itun.es/gb/lrxohb pic.twitter.com/rflpidohw2
2922,cure well review https:// flicksandpieces.com/2017/02/24/a-c ure-for-wellness-review/ … via @flicksandpiec
2923,"cure well uk, here’ @bdisgust articl question 146m run time: http:// bloody-disgusting.com/editorials/342 4333/im-worried-cure-wellness-running-time/ … pic.twitter.com/xoomzn44kz"
2924,film review: cure well review http:// bit.ly/2ld4jrw #acureforwel pic.twitter.com/04pdwc8r9i
2925,film review: cure well review http:// bit.ly/2ld4jrw #acureforwel pic.twitter.com/fu5cfgcfhq
2926,casi todo se venir de lejo en ' cure well ' https:// hipertextual.com/analisis/a-cur e-for-wel …
2927,im see cure well tonight im excit
2928,"ufff. ‘ cure well ’, la de gore verbinski, se lleva una hostia tremenda est find en usa. cae un 71% de un find para otro. muerta."
2929,go see cure well later woo woo
2930,still end cure well don't think ever :))))
2931,"#kino wochenende? also "" cure well "" kann ich nur bedingt empfehlen. hier mein filmkritik: http:// szo.de/_arid,10620507"
2932,cure well terrible.
2933,"absolut fuck pig' breakfast. we'r hope see cure well tomorrow, you'r around xxx"
2934,readi someth truli bizarre? check cure well weekend: http:// bit.ly/2ltz3xl
2935,cure well : http:// mcaf.ee/tmpeuv pic.twitter.com/0y5vizuplq
2936,casi todo se venir de lejo en ' cure well ' http:// dlvr.it/ntffrb
2937,casi todo se venir de lejo en ' cure well ' https:// goo.gl/g1jcgm
2938,casi todo se venir de lejo en ' cure well ' http:// dlvr.it/ntffp0
2939,casi todo se venir de lejo en ' cure well ' http:// dlvr.it/ntffn #venezuela
2940,"jon espino review "" cure well "" hollywood chicago https:// chicagoindiecritics.org/2017/02/25/jon -espino-reviews-a-cure-for-wellness-on-hollywood-chicago/ … via @hollywoodchi @dystopianhero"
2941,casi todo se venir de lejo en ' cure well ' https:// hipertextual.com/analisis/a-cur e-for-wellness?utm_medium=feed&utm_source=feedpress.me&utm_campaign=feed%3a+hipertextu … https:// i1.wp.com/hipertextual.c om/files/2017/02/a_cure_for_wellness_gore_verbinski.jpg?fit=600%2c400&ssl=1 …
2942,cure well worth watch minu last 20 min
2943,film review: cure well https:// blackribbonreviews.wordpress.com/2017/02/25/fil m-review-a-cure-for-wel … pic.twitter.com/nu2gjeikm
2944,"blake crane review "" cure well "" ""the great wall"" film racket https:// chicagoindiecritics.org/2017/02/25/bla ke-crane-reviews-a-cure-for-wellness-and-the-great-wall-for-film-racket/ … via @blakecrane_ @filmracket"
2945,ใครดู cure well จบแล้ว มีข้อสงสัยครับ (มีสปอย) https:// pantip.com/topic/36122603 #pantip via @pantip1996
2946,casi todo se venir de lejo en ' cure well ' publicado desd el sitio web smart.cl - smart system ltda. http:// fb.me/5h2sj2wu
2947,casi todo se venir de lejo en ' cure well ' https:// goo.gl/fb/wcqygi via alt1040
2948,casi todo se venir de lejo en ' cure well ' http:// bit.ly/2lkk379 via alt1040
2949,"late night studying/a concert, bare slept 3 day slightli delirious. worst best state cure well ?"
2950,casi todo se venir de lejo en ' cure well ' https:// goo.gl/fb/lgk6rd #tecnología
2951,casi todo se venir de lejo en ' cure well ' http:// ift.tt/2law5ux http:// ift.tt/2lg1jew jotage2014
2952,casi todo se venir de lejo en ' cure well ' http:// ift.tt/2law5ux
2953,casi todo se venir de lejo en ' cure well ' http:// fly-technology.net/feedok/tecnolo gia/2017/02/25/casi-todo-se-ve-venir-de-lejos-en-a-cure-for-wellness/ … pic.twitter.com/ybcfwjsqji
2954,"havnae! see cure well coupl hours. realli verbinski fan, look cronenbergian."
2955,casi todo se venir de lejo en ' cure well ' http:// ift.tt/2law5ux
2956,casi todo se venir de lejo en ' cure well ' http:// bit.ly/2lg3dm3 #tecnologia
2957,#noticia : casi todo se venir de lejo en ' cure well ' http:// ift.tt/2law5ux
2958,casi todo se venir de lejo en ' cure well ' http:// bit.ly/2mnoew
2959,casi todo se venir de lejo en ' cure well ' http:// ift.tt/2law5ux
2960,casi todo se venir de lejo en ' cure well ' http:// ift.tt/2law5ux #tecnología #digit
2961,#noticia : casi todo se venir de lejo en ' cure well ' http:// ift.tt/2law5ux
2962,casi todo se venir de lejo en ' cure well ' http:// ift.tt/2law5ux
2963,casi todo se venir de lejo en ' cure well ' http:// j.mp/2lu8h1k
2964,casi todo se venir de lejo en ' cure well ' http:// ift.tt/2law5ux
2965,casi todo se venir de lejo en ' cure well ' http:// ln.is/hipertextual.c om/ana/errdo …
2966,¿me voy ver cure well hoy? gustan la review que han dado pero pinta de wtf tremendo.
2967,casi todo se venir de lejo en ' cure well ' http:// ift.tt/2law5ux césar noragueda #noticia #tecnologia
