3660,"gore verbinski return grip thriller ' cure well ', star @danedehaan . pre-ord today: http:// hmv.co/cur pic.twitter.com/hhz7q9rh9"
3661,"finish watch cure well 20 minut ago. intriguing, creepi psychological... http:// fb.me/1pkboevgb"
3662,recommend everyon see get cure well
3663,miss opportun mark everett score cure well https:// youtu.be/zy93099sr-w
3664,heard ‘ cure well review - blood shot - ep. 23’ d3rail #soundcloud ? #np https:// soundcloud.com/apieceofschmid tpodcast/a-cure-for-wellness-review-blood-shots-ep-23?utm_source=soundcloud&utm_campaign=share&utm_medium=twitt …
3665,cure well review - blood shot - ep. 23 https:// youtu.be/miahpw51h0k via @youtub
3666,cure well good movi still think haha
3667,"映画『 cure well （原題）』★★★3.7点。 "" cure well "" (film gore v… http:// filmarks.com/movies/69058/r eviews/29827029 … #filmark #映画"
3668,cure well eeli good. water film. pic.twitter.com/swudokl9xj
3669,cure well bomb - that' bad thing - http:// screenrant.com/?p=908338 pic.twitter.com/lnhso5pbgp
3670,even movi yet want say cure well pish
3671,"look forward wholesom quadrupl bill cure well , salo, sin dwarf wash machin"
3672,"cure well easili one worst film i'v ever seen, 2 & half hour utter nonsen"
3673,cure well
3674,definit want go see cure well
3675,"cure well supposedli way underperforming. shame, see thought movi quit good."
3676,"well! cure well intresting, full intrigu also macabr , dark mysteri time"
3677,screenrant: cure well bomb - that' bad thing - http:// screenrant.com/?p=908338 pic.twitter.com/0ojeawt2co
3678,cure well bomb – that’ bad thing http:// screenrant.com/a-cure-for-wel lness-box-office-bomb/ …
3679,cure well bomb - that' bad thing - http:// screenrant.com/?p=908338 pic.twitter.com/ne6zq3uail
3680,"heard quit ambitious, time find guess. see cure well . pic.twitter.com/7refpfp29b"
3681,exclusive: dane dehaan 70s-style scari movi cure well http://www. thehollywoodnews.com/2017/02/21/dan e-dehaan-interview/ …
3682,watch cure well cinema center http:// fb.me/l2h7rfkx
3683,debat see cure well get tonight. choic
3684,wanna see split cure well bad ugh someon take x
3685,cure well review: stun cinematographi plot pitfal http://www. filmandtvnow.com/a-cure-for-wel lness-review-stunning-cinematography-with-a-plot-of-pitfalls/ … #acureforwel pic.twitter.com/edzzpnlsmx
3686,honestli whack part cure well girl leav new mac lipstick dirti bathroom bar
3687,christian critic vs. ‘ cure well ’ http:// buff.ly/2lzoh71 pic.twitter.com/ftzpwft3
3688,still want go see cure well .
3689,can't wait see cure well weekend
3690,cure well great can't even describ weird
3691,wanna see movi cure well
3692,"film | cure well review: 'the sick business, dane’ got bad' https:// candidmagazine.com/a-cure-for-wel lness-review/ … #acureforwel #filmreview pic.twitter.com/copj95yx6q"
3693,can't decid see today jacki get cure well #help
3694,"ok tengo que ver jackie, silence, split cure well est fin de semana, up."
3695,book ticket see cure well tomorrow. excit
3696,i'm super hype cure well verbinski mix bag over imo
3697,reel reviews: film offer cure horror genr tedium: taylor howe say: “ cure well celebrates… http:// dlvr.it/nssgzp pic.twitter.com/f7a4umzjnz
3698,cure well review: styli horror film wear frustratingli thin http:// trib.al/aejkeha
3699,"watch alon - bizarre, disturb & truli weird - cure well show now!: http:// bit.ly/2ltz3xl"
3700,today! new relea #moviepalc #newrelea #popcorn #candi 1 cure well ( r ) daily: 2:00 6:30 friday... http:// fb.me/1ynbfdeih
3701,cure well come tonight uk. go & see enjoy realli laughabl terribl films. http:// karlwebster.com/cineville-cur -wellness-insanely-bad/ …
3702,wanna see: 'logan' ' cure well ' asap
3703,cure well สนุกมากๆถึงแม้จะพลาดฉากแรกไปช่วงหนึ่ง สนุก ลึกลับดี มีการที่ปลาไหลกินเนื้อคน และเป็นโรงบาลที่หน้าอยู่มากๆ8.5/10 เรท r pic.twitter.com/fctipaavmi
3704,"alpenhorror "" cure well "": erholung kann die hölle sein http:// tinyurl.com/gp7wrok"
3705,@everymancinema hi - when/wher show cure well ? relea today & you'b trail leed & harrog :-)
3706,"cure well worst movi ever seen, life."
3707,independent: [review] cure well deliri bonker ★★★ http:// ind.pn/2lufs9d
3708,"littl variety, review movi still theaters! want know see cure well ? https:// sashimipalace.wordpress.com/2017/02/24/na ty-brutish-and-unfortunately-not-short-a-review-of-a-cure-for-wellness/ …"
3709,saw cure well day. made think (which actual make sense)... https://www. youtube.com/watch?v=0ackvd gbk4w …
3710,[review] cure well deliri bonker ★★★ http:// ind.pn/2lufs9d
3711,"https:// youtu.be/hqudw1lmspo late upload, here' review cure well"
3712,[review] cure well deliri bonker ★★★ http:// ind.pn/2lufs9d
3713,final found titl song hannah danc cure well
3714,"cure well . ""grossli disrespect audience."" http://www. thetimes.co.uk/edition/times2 /a-cure-for-wellness-tz52hlj56 …"
3715,"highli reccommend watch cure well it' fuck good, snuck last night it' 18a"
3716,isn't cure well shutter island? #acureforwel
3717,du willst über wochenend kino? wie wäre es mit cure well ? übrigen spielt ein hollywoodstar aus... http:// fb.me/8s8aktubw
3718,cinema... wait fenc start. wish someon w/ cure well later even (creepi look film!)
3719,"icymi: audio review cure well , patriot day american honey https:// audioboom.com/posts/5642550- the-thursday-movie-review-23rd-february-2017?utm_campaign=detailpage&utm_content=retweet&utm_medium=social&utm_source=twitt …"
3720,cure well | teaser trailer [hd] | 20th centuri fox https://www. youtube.com/watch?v=4mcvod jmblu&feature=shar …
3721,hear review tomorrow mkfm 6am. #weekend #breakfast #mk #mk50 #mkfm — watch cure well at... http:// fb.me/5yf3dfk0k
3722,cure well ไม่เลวร้ายนะ ดีใจที่ดูทันจะก่อนหลุดจากโรง
3723,way cinema watch cure well @socalvaleri pic.twitter.com/wtsl5htzqi
3724,let us know think cure well !
3725,want see get cure well badli yall seen cure well pl tell thought movie!!
3726,' cure well ' ambiti young execut sent retriev company' ceo idyl but... http:// fb.me/1hsknbh82
3727,' cure well ' ambiti young execut sent retriev company' ceo idyl but... http:// fb.me/1trrqcwo1
3728,i'm excit haven't seen cure well yet
3729,anyon seen cure well ?? make it? #filmclub #cinema #film pic.twitter.com/twthsieywd
3730,"@jeremyjahn didn't review cure well ? it' get low rate tomatoes, watch last night blew away"
3731,cure well great?
3732,watch cure well
3733,gonna go see cure well bit look like could good movi
3734,cannot wait watch “ cure well ” @20centuryfoxuk https:// twitter.com/i/moments/8286 41613375213571 …
3735,wanna see cure well
3736,"sehr verdient. ich spekuli mal, dass dir cure well ncht gefallen wird, er scheitert ganz einfach der länge."
3737,die woche: - bibi & tina – tohuwabohu total! - bailey – ein freund für leben - cure well - boston –... http:// fb.me/2jdviqxd8
3738,cure well @amc screen 1 #manchest - http://www. lostevent.com/whats-on-in/ma nchester/2017/february/26/90827434 … pic.twitter.com/tddnbfl9pj
3739,cure well today & neeed see !!!!
3740,@cineworld @cineworldgr #cineworldunlimit #acureforwel cure well . cure friday afternoon!!??
3741,明日は「get out」と「 cure well 」の二本立てかな。
3742,ich ' cure well ' sehen. jetzt sofort. aaaaaaah.
3743,go cinema tomorrow.. ' cure well ' lego batman.. tough one!!
3744,"#nowwatch cure well first time watch, cinema trailer https:// youtu.be/jf1rlfcdewu pic.twitter.com/hfsstdzopj"
3745,bc1_ksa #شهريار #photographi | cure well | #photooftheday #travel #photo pic.twitter.com/36xatsrwsu #شهريا … https:// twitter.com/bc1_ksa/statu /835110092483747841 …
3746,amount peopl go see cure well high amaz
3747,director cure well unforgett dental scene http:// dlvr.it/nspnvh
3748,"wasn't sold cure well final act. fulli commit campy, hammer-esqu horror, glorious. #frightfest"
3749,realli wanna see cure well look creepi
3750,realli wanna see cure well
3751,[podcast] cure well (2017) – great wall (2017) –… http:// gruesome.decadesofhorror.com/2017/02/24/pod cast-cure-wellness-2017-great-wall-2017-episode-203-horror-news-radio/ … pic.twitter.com/94nk4rgfku
3752,anyon seen cure well yet? want go tonight review like meh
3753,didn't mention best part cure well . know song fuck movie? augen auf. it' 2017.
3754,"celebr relea cure well , count five creepiest movi locat time https:// tinyurl.com/jre4efq"
3755,"alpenhorror "" cure well "": erholung kann die hölle sein http:// tinyurl.com/gnlk8la"
3756,hollywood setzt die #burg #hohenzollern cure well toll szene – die zuschauer gruseln sich. (paca) http:// zak.de/artikel/353112 € pic.twitter.com/lpp09j8isb
3757,cure well mit dane dehaan: http:// youtu.be/vgukolg3u9g?a über @youtub
3758,"cinema today cure well , fit it' end world. amaz moonlight expand screen too."
3759,find cure well http:// showfilmfirstblog.com/2017/02/24/fin ding-a-cure-for-wel … pic.twitter.com/r8jrgumeqj
3760,cure well (2017) – exerci artist horror https:// marruda3.wordpress.com/2017/02/24/a-c ure-for-wellness-2017-an-exercise-in-artistic-horror … pic.twitter.com/ok0psyxbva
3761,"@dukeofyork hi, tell whether duke komedia show cure well ?"
3762,"forgiv lee, let us know think cure well ."
3763,click discov mysteri #acureforwel . cinema now. “ cure well ” @20centuryfoxuk https:// twitter.com/i/moments/8286 41613375213571 …
3764,movi review - cure well - scribbl geek http:// scribblinggeek.com/index.php/2017 /02/22/movie-review-a-cure-for-wellness/ … via @scribblinggeek
3765,pirat carribean dan cure well juga termasuk film gore.
3766,cure well เปนไงบ้าง สนุกปะ
3767,"mucho temo que "" cure well "" le va sentar fatal que la compar con ""shutter island"". pero va ocurrir."
3768,cure well : ein heilsbr für thrillerfans? https://www. film-rezensionen.de/2017/02/a-cur -for-wellness/ … pic.twitter.com/ubsujxcunt
3769,got spare coupl hour weekend? here' review cure well star dane dehaan https:// tinyurl.com/h7jrt8c
3770,erik went see cure well weird disturb good date movi hahaha
3771,cure well look good
3772,cure well first 'horror' film i'm actual intrigu see also look total freaki weird
3773,still won't watch cure well .
3774,"cure well , film review: flop, betray viewer' trust: #well #health http:// dld.bz/f2wpz"
3775,"cure well , film review: flop, betray viewer' trust: #well #health http:// dld.bz/f2wpz"
3776,"cure well , film review: flop, betray viewer' trust: #well #health http:// dld.bz/f2wpz"
3777,"cure well , film review: flop, betray viewer' trust: #well #health http:// dld.bz/f2wpz"
3778,"cure well , film review: flop, betray viewer' trust: #well #health http:// dld.bz/f2wpz"
3779,"cure well , film review: flop, betray viewer' trust: #well #health http:// dld.bz/f2wpz"
3780,"cure well , film review: flop, betray viewer' trust: #well #health http:// dld.bz/f2wpz"
3781,"cure well , film review: flop, betray viewer' trust: #well #health http:// dld.bz/f2wpz"
3782,"cure well , film review: flop, betray viewer' trust: #well #health http:// dld.bz/f2wpz"
3783,cure well โคตรน่าดู
3784,"hol dir jetzt im #qiibeeshop die kinoticket zum film "" cure well "" von gore verbinski: http:// buff.ly/2lbsu9z #cureforwel pic.twitter.com/zuwhkk7tpo"
3785,spiegel onlin über den horrorthril cure well von ring-regisseur gore verbinski - täglich um... http:// fb.me/60u8cyskm
3786,readi someth truli bizarre? check cure well weekend: http:// bit.ly/2ltz3xl
3787,midnight show movi review - cure well https:// youtu.be/9itd1ganqru via @youtub could got better.
3788,@cineworld cure well & patriot day line today. 30th film year far
3789,wish wasn't broke could see cure well tonight
3790,"ghost shell, bladerunn 2049, valerian, star war 8, cure well , alien: covenant, life, guardian 2,..."
3791,cure well good.
3792,patriot day cure well two great film show irish cinema weekend https:// goo.gl/0ybi3i pic.twitter.com/iib7hj0sjm
3793,#norfolk #whatson - review: failur psycholog thriller cure well total http:// bit.ly/2mju3hv
3794,what` #norfolk - review: failur psycholog thriller cure well total http:// bit.ly/2mju3hv
3795,hope enjoy cure well ! let us know think. think hidden figures?
3796,"cure well uniqu film. first hour long exposit scene & littl motivation, got bored. (c-)"
3797,gore verbinski serv macabr asylum thriller cure well . ★★★★ review: http:// lwlies.com/reviews/a-cur -for-wellness/ … pic.twitter.com/uxf6ruxtnc
3798,"cure well , film review: flop, betray viewer' trust http://www. standard.co.uk/goingout/film/ a-cure-for-wellness-film-review-time-to-fight-back-against-the-horror-a3475026.html …"
3799,"ich bin ja schon sehr gespannt auf "" cure well "". morgen weiß ich mehr."
3800,review: failur psycholog thriller cure well total #acureforwel http://www. edp24.co.uk/going-out/revi ew_the_failure_of_psychological_thriller_a_cure_for_wellness_is_total_1_4904670?utm_source=twitter&utm_medium=social_icon&utm_campaign=in_article_social_icon …
3801,[the /filmcast] ep. 406 – cure well http:// podplayer.net/#/?id=30490509 via @podcastaddict http:// moby.to/irrcmf
3802,excit cure well tonight
3803,saw littl girl look cure well poster look terrified. @cureforwel
3804,cure well review – cult statu beckon mesmer chiller - guardian https:// apple.news/ah2gkbvgztr-ot viqhzayoa …
3805,"alpenhorror "" cure well "": erholung kann die hölle sein http:// tinyurl.com/zcnsox"
3806,cheer cure well last night.
3807,"alpenhorror "" cure well "": erholung kann die hölle sein http:// tinyurl.com/jboqjb9"
3808,watch two movi tonight; get & cure well good!
3809,"great say ""hi"" last night cure well"
3810,preview: cure well (2017) http:// wildfiremotionpictures.com/2017/02/24/pr view-a-cure-for-wellness-2017 … pic.twitter.com/bdsrmoilqm
3811,uk cinema today: cure well @cureforwel #acureforwel #cureforwel @20centuryfoxuk pic.twitter.com/92cd1zbggk
3812,"heut kinomarathon: fences, cure well , elle. quasi ein ganz normal freitag."
3813,cure well http:// moviemarker.co.uk/a-cure-for-wel lness/ … via @moviemark
3814,cure well http:// moviemarker.co.uk/a-cure-for-wel lness/ … via @moviemark pic.twitter.com/oglv9fhdw
3815,หนังปมปัญหา cure well หนังภาพสวยระทึกขวัญ ชวนติดตาม #movi #horror ... pic.twitter.com/v4zic3ftoq
3816,it' final here!! cure well show cineworld chelsea. save seat onlin get 10% off... http:// fb.me/8qps9p48
3817,split opinion cure well crazi
3818,"checkout latest news post : great wall, fist fight, cure well tank us box offic - indepe… http:// ift.tt/2ktvq4w"
3819,"cure well ,, mysteri drama pic.twitter.com/r9jxjvgzp"
3820,cinetrail - cure well : http:// cn3.tv/dk53k via @cinetrail
3821,get in! defiantli watch cure well boiiiiiiiiiiiiiiiiiiiiiiiiiiiiiiiiiiiiiiiiiiiiiiiiiiiiiiiiii!
3822,cure well nayz.
3823,week' popular: cure well give us glimp bioshock movi almost http:// tay.kinja.com/a-cure-for-wel lness-gives-us-a-glimpse-at-the-bioshock-1792524809 …
3824,finish watch cure well .
3825,"last night: seen film "" cure well "" (mysteri 16+). rather… https://www. instagram.com/p/bq3lypmgb6c/"
3826,like @youtub video http:// youtu.be/405xa6z70fy?a cure well review
3827,twentieth centuri fox apolog 'inappropriate' 'fake news' campaign ' cure well ' http:// tinyurl.com/h3ezw5u pic.twitter.com/4gzspolesp
3828,gore verbinski' stylish deepli weird horror cure well uk cinema today. review... http:// tinyurl.com/h7jrt8c
3829,cure well fuckin bomb
3830,"so, plans: five us (jess, nim, ashley, nicol & i) go see "" cure well "","
3831,review cure well https:// film.list.co.uk/article/88873- a-cure-for-wellness/ … @thelistmagazin
3832,"dreamt chip front teeth last night. thank lot, cure well >:|"
3833,movi actual gonna get theater. cure well . can't wait.
3834,@jeremyjahn rude cure well review . person give awesometacular wonder ur thought
3835,eel (the mighti boosh) see trailer cure well !
3836,cure well review – cult statu beckon mesmer #horror http:// buff.ly/2lquget #horrormovi
3837,"showtim friday, februari 24th thursday, march 2nd: cure well : 12:45, 9:25 dog's... http:// fb.me/688ycupeo"
3838,review cure well (dir. gore verbinski) here: https://www. theguardian.com/film/2017/feb/ 23/a-cure-for-wellness-review-dane-dehaan-gore-verbinski …
3839,"cure well : old timey set nomin act can't justifi 2 1/2 hour message-less ""isn't strange?"" set pieces. 6/10"
3840,cure well review: dir. gore verbinski (2017) best luck #jollyllb2 http:// boxoffice-collections.in/a-cure-for-wel lness-review-dir-gore-verbinski-2017/ … pic.twitter.com/ripqqrj5v5
3841,cure well (r) https:// shar.es/19t7ud #acureforwel @cureforwel
3842,cure well review – cult statu beckon mesmer chiller https://www. theguardian.com/film/2017/feb/ 23/a-cure-for-wellness-review-dane-dehaan-gore-verbinski?cmp=share_androidapp_tweet …
3843,メルモ様、お問い合わせありがとうございます。 「 cure well 」ですが、残念ながら今のところ上映予定はございません。 もし、上映が決まりましたらホームページ等に掲載させて頂きます。
3844,"split, cure well , john wick chapter 2 $40mil range, two even make nice profit!"
3845,@tenpara_tw 『 cure well 』( @cureforwel )の公開予定はありませんか？ | offici trailer | 20th centuri fox https:// youtu.be/jf1rlfcdewu
3846,mcm thought cure well cool stori would go see
3847,"auf hohenzollern gedreht hollywoodfilm cure well : aale, aale, überal aal (abo) http:// ow.ly/gnat309jo7"
3848,cure well honestli great movie! kinda twist nasti it' good movie!
3849,go see movi cure well unless want mind perma-fuck
3850,cure well | offici trailer [hd] | 20th centuri fox https:// youtu.be/jf1rlfcdewu @youtub さんから
3851,"cure well was... interesting. beauti visuals, unsettl atmosphere, trippi fuck story."
3852,fuck thought best taglin review cure well : sureel
3853,bro cure well @meganburns024 https:// twitter.com/_rachelc23_/st atus/834985633781321729 …
3854,cure well confu movi ever bye
3855,"alpenhorror "" cure well "": erholung kann die hölle sein http:// tinyurl.com/hsfjadh"
3856,""" cure well "" der film-kritik: der horror der reinen seelen - augsburg allgemein"
3857,"yeah, he' good actor...could definit see transform wolfman. new movie, cure well ,..."
3858,cure well hella weird
3859,watch cure well alreadi start scari
3860,"watch "" cure well "" still don't know it'"
3861,"alpenhorror "" cure well "": erholung kann die hölle sein http:// tinyurl.com/zcvhwgp"
3862,everybodi go see cure well !!! interest send import messag
3863,"""madder box frogs"" cure well top round-up week' relea http://www. radiotimes.com/news/2017-02-2 4/latest-movies-a-cure-for-wellness-patriots-day-best … @20centuryfoxuk pic.twitter.com/cxwyulgiij"
3864,cure well freaki heck
3865,"thank fuck christ didn't pay see cure well . i'm sure saw, i'm gunna shower 8 hours."
3866,need see cure well asap
3867,cure well : worth drive pleasant hill watch 2 half hour
3868,seen cure well ?
3869,made video review cure well . plea check out! tri get youtub channel going. https:// youtu.be/cayoc2kvs2k
3870,"ver cure well , es la nueva pal mindfuck tien una premisa como la de la isla siniestra"
3871,cure well - movi review (spoilers): http:// youtu.be/cayoc2kvs2k?a via @youtub
3872,cure well beyond odd & never want go europ
3873,pe blog despr cure well . film văzut la cinema florin piersic... http:// fb.me/5ot0wned5
3874,read review cure well one fake news gave 40% rt
3875,คุณจะทำตัวเป็นตัวร้าย cure well ไม่ได้ https:// twitter.com/jhweaponx/stat us/835012173684322304 …
3876,actual wrote cure well you'r interest thought https:// letterboxd.com/thevictastick/ film/a-cure-for-wellness/ …
3877,like @youtub video http:// youtu.be/vj1zy_bcwoy?a cure well - movi review
3878,cure well could'v 90 min shorter great movie. ass liter fell asleep twice watch it..
3879,hear cure well kind horribl box offic probabl tri catch one first
3880,"cure well get actual want see two movi theater they'r horror, basic never happen"
3881,gonna catch cure well get out. 2 1 special
3882,"30 second cure well sydney goe ""oh god over"""
3883,"psa "" cure well "" absolut normal 10/10 recommend everyon go see"
3884,อยากดู cure well มากๆ แต่ก็ไม่กล้าดูอะ ป๊อดเกิ๊น
3885,havent chanc see cure well im gonna drop
3886,"cure well disturbing, much enjoy it. sinc i'v seen movi creepy!"
3887,icymi: offici review cure well -- https:// goo.gl/kzqngr
3888,cure well realli weird like lot
3889,ive think cure well like
3890,"cure well odd. gore verbinski disney guy anymore. like shyamalan, hope figur post-blockbust voice."
3891,cure well good plea go spend 10 dollar
3892,"yea u shud watch again. imo tho, 2016 gav us bore movi . hope 2017 different, i'm eager 2c * cure well *"
3893,"cure well : modern aristocraci meet disea shadow. visual sumptuou stodgi narratively. cut loose, tho... (m)"
3894,"well theater i'd recommend split & cure well , dvd i'd recommend witch, conjur 2, 10 cloverfield lane"
3895,damn really? look forward see cure well .
3896,cure well left fuck don't know process anyth anymor
3897,real though cure well breathtak beauti cinematographi ever seen
3898,cure well mayb worst movi i'v ever seen
3899,"watch "" cure well "" unless want a) throwup b) confu entir time"
3900,"seen film 3 times, updat thought cure well . http://www. rencatreviews.com/movie-reviews/ a-cure-for-wel … pic.twitter.com/jdr4j4dbow"
3901,"dope ufo saw insid bathroom see "" cure well ."" pic.twitter.com/qp2ch8vmqd"
3902,film review: cure well @cosliv #music http:// ow.ly/fb6l3094ok2
3903,cure well fuck fuck fuck
3904,"man, cure well . visuals. kinda meander plot. eels. goodnight."
3905,don't watch cure well . idea point
3906,"film | cna review dark brood "" cure well ."" http:// buff.ly/2lbwms9 pic.twitter.com/0rtezvqoia"
3907,cure well one best movi i'v seen long time. absolut amaz twist turns.
3908,get cure well
3909,cure well ambiti weird gothic film. dug quit bit.
3910,swear donkey princ caspian real go see cure well you'r
3911,current stream cure well i'll let y'all know good shot
3912,"saw cure well tonight. @jasonsfolli brilliant, one best actor today. sick masterful."
3913,"checkout latest news post : great wall, fist fight, cure well tank us box offic - indepe… http:// ift.tt/2mdbbnq"
3914,go see tomorrow! mayb even cure well
3915,cure well basic everyth want also thing didn't over great movie.
3916,"bye bye man, rings, cure well disappoint me. get surpass expectations. freakin love it. bingo ="
3917,"ur think see cure well , don't. shit stupid"
3918,want (mostli critical) thought cure well ? you'r luck! https:// sashimipalace.wordpress.com/2017/02/24/na ty-brutish-and-unfortunately-not-short-a-review-of-a-cure-for-wellness/ …
3919,"film "" cure well "" odd disturb scary. meh. https:// m.youtube.com/watch?v=4mcvod jmblu … ."
3920,week review cure well #podernfamili #podcast #podfest #movietwit #film https:// itunes.apple.com/us/podcast/mid night-film-review/id1041671447?mt=2#episodeguid=https%3a%2f%2fmidnightfilmreview.podbean.com%2fe%2fa-cure-for-wellness%2f … pic.twitter.com/chwwfm260j
3921,"cure well downs, prove great movi well worth wait! pic.twitter.com/en9wgqrzt9"
3922,"sorry, voter, wasn't cure well ... great wall. garrett fraidy-cat."
3923,genr made germany: cure well #filmtourismu #verlosung http:// digitaleleinwand.de/2017/02/23/gen re-made-in-germany-a-cure-for-wellness-verlosung/ … pic.twitter.com/8p6vfypbdf
3924,"cure well pretti darn good. though, must warn it' like shining. direction, act stori great. pic.twitter.com/bikav7hrah"
3925,get cure well
3926,cure well liter fuck thing i'v ever seen entir goddamn life fuck want go home
3927,least cure well fire stick
3928,highli recommend cure well it' director go that' worth support
3929,shit. gotta see it. go see cure well ?
3930,wanna go see get cure well !!!
3931,ad video @youtub playlist http:// youtu.be/405xa6z70fy?a cure well review
3932,cure well crazi movie. i'm shook.
3933,last night saw cure well tonight saw get i'm usual alreadi function 10 i'm stress level 6974
3934,"movi i'v watch day "" cure well "" (film gore verbinski who's… https://www. instagram.com/p/bq4xk-vbaiz/"
3935,liter everi one friend group' phobias/trauma cure well
3936,cure well weirdest fuck movi ever.
3937,อยากดู cure well
3938,peep cure well first
3939,cure well one best movi i'v seen. super uniqu crazi psychological. love 9.5/10
3940,watch cure well bro shit gonna go nut
3941,cure well - movi review https:// youtu.be/pbrqknfny-8 via @youtub
3942,"cure well excited, bludgeon 146-minut runtime. dehaan & goth magic, though! https:// fathersonholygore.com/2017/02/24/luk ewarm-gothic-with-a-cure-for-wellness/ …"
3943,"watch cure well , i'm happi announc it' ad list film interpret via nuanc marxist analysi"
3944,"fabul choice...great movie..choice, mikey! — watch cure well regal cinema placervil 8 http:// fb.me/oyvynpzl"
3945,like @youtub video @foundflix http:// youtu.be/x3w7l7gjvc0?a cure well (2017) end explain
3946,"cure well longest, disgusting, mind fucking, disturb movi i'v ever seen."
3947,"yasss, la próxima que pienso ver es "" cure well "", pero sé qué esperar env"
3948,gonna tri hardest catch cure well weekend.
3949,"ever sinc see cure well , harder time trust water."
3950,cure well amaz
3951,"welp... anyon wanna see "" cure well "" me?"
