0,cure well one fuck film i'v ever seen wouldn't recommend anyon
1,"john wick, get out, cure well , logan, kong, ghost shell!! good."
2,saw cure well . would'v made great @fullbright game.
3,saw cure well . complet trippi mindfuckeri realli kind like it. except last 10 minut realli good
4,cure well scatti ass film
5,cure well get seen weekend
6,i'm watch cure well (2017) https:// trakt.tv/movies/a-cure- for-wellness-2017 … #trakt
7,"someon go movi me, we'r either gonna see cure well great wall"
8,might go see cure well weekend.
9,"me, tri explain cure well : pic.twitter.com/39qebyeizz"
10,cure well actual realli good
11,caught late screen gore verbinski’ ‘ cure well ’. flabber. gasted. #movieaddict
12,"cure well actual amaz movie, it' captiv interest"
13,cure well mess film
14,cure well shitiest film ever. it' way hyped!! don't bother
15,like @youtub video http:// youtu.be/cblrjvciwpi?a cure well angri movi review
16,cure well weirdest pervert film i'v ever seen life
17,cure well take long get go basic tick horror boxes.
18,"cure well worst movi i'v seen long time, smh. disappointing."
19,cure well review: - dane dehaan drink like - find mac lipstick villag shop
20,oh god actual love shadow sooooo much! i'll deffo look cure well thank x
21,"cure well creepi n gr8, also watch shadow (a mockumentary, funni cri it)"
22,fuck think wrote third act cure well ? fuck retard
23,"par contr applaudit le trad françai pour "" cure well "" en ""a cure life"". merci bien band de tocards."
24,"ich war gerad "" cure well "" im kino.... da aber auch da einzig ich dazu sage"
25,@micahguzman97 @brandi_hagood @desireehenry97 cure well (2017) https:// twitter.com/guycodes/statu s/837390560365260802 …
26,"last time duncan choic film go see cinema, indur two half cure well"
27,rate cure well (2016) 7/10 underbart foto. 0 jump scare http://www. imdb.com/title/tt4731136
28,cure well review: stun cinematographi plot pitfal http://www. filmandtvnow.com/a-cure-for-wel lness-review-stunning-cinematography-with-a-plot-of-pitfalls/ … #acureforwel pic.twitter.com/y28tvqsx2z
29,movi cure well trippi dont even know go half time.
30,حد يعرف موقع يعرضو فيه الافلام الجديدة ؟ حصلت فلم اسمه cure well وعجبني التريلر ابا اشوفه، نازل شهر ٢ وما لقيته ف اي مكان
31,cure well review!: http:// youtu.be/f0ks5gmdaba?a via @youtub
32,"cure well - gorgeous, epic neo-gothica cour darker fring genre. headi freudian jumble. fantastic. pic.twitter.com/x1mub5xzjm"
33,"watch "" cure well ""...omg it' aw https:// twitter.com/mental_floss/ tatus/837420504709545985 …"
34,review cure well - http:// jermsguy.blogspot.com/2017/03/a-cur -for-wellness-movie-review.html …
35,cure well il confondu ralph fienn et jason isaac...
36,"(@cinépoli plaza apizaco cure well apizaco, tlax., tlaxcala) https://www. swarmapp.com/c/j1d8wvfmxvi"
37,"oh wait cure well show smth? bc somehow misread ""rape cure"" like?? weird ff???"
38,pa osé cell là mai cell de fantast four et cure well m'ont bien gonflé. incultur quasi certain sur
39,"well, cure well weirdest film i'v seen year... howev also nice see someth bit differ 7/10"
40,cure well k! #movi #acureforwel https://www. instagram.com/p/brjrjy9d1yf/
41,sigh tw: rape cure well :/
42,let' add cure well list
43,sordid cinema podcast #507: ‘ cure well ’ - dream? http:// bit.ly/2llazpl pic.twitter.com/krulzmhyak
44,sordid cinema podcast #507: ‘ cure well ’ - dream? http:// bit.ly/2llazpl pic.twitter.com/8t8p8w7pah
45,"cure well hat mich 2,5h ausgezeichnet unterhalten. mehr aber auch nicht. ich werd mir den film wohl kein zweit mal ansehen."
46,"cure well , fist fight, great wall | weekend ticket - cure well , fist... http:// tinyurl.com/zdo2ych #videofunni"
47,anyon seen cure well alreadi friend ask wanna come see worth
48,ad video @youtub playlist http:// youtu.be/ism6yxxyswo?a last night: episod 1- cure well movi review
49,"hater gon' hate, honestli enjoy cure well great deal moonlight pic.twitter.com/yi7u9mfrso"
50,latest obsess includ john wick' badasseri dane dehaan brainwash like cure well . hubba
51,"""the cure"" realli enjoy art direct "" cure well "" work on… https://www. instagram.com/p/brjlcrvjstx/"
52,watch cure well . let' see...
53,caitlin made watch cure well it' liter worst movi ever.
54,excit watch cure well
55,"hiré ver "" cure well "" en el único horario raro que maneja cinepoli porqu es la película de verbinski que llevo año esperando."
56,realli like cure well . bit odd though wasn't #review
57,cure well wasn't best - felt bit like stuck ... 2star pic.twitter.com/gfc4ovd4iq
58,cure well shook
59,"feierabend geniessen mit kino+ #rbtv vielleicht möchte ich mir mal "" cure well "" ansehen."
60,"let say this, get got like perfect rate great review cure well 100x better"
61,งั้น cure well นี่ห้ามพลาดนะคะ ดีกว่า split แล้วก็แนะนำว่าอย่ากินปลาไหลก่อนเข้าโรง 555555555555555
62,want go watch cure well
63,movi i'v seen far year cinema good shit: 1. cure well 2. split 3. logan 4. bye bye man 5. ring 6. asscr
64,anyon seen cure well ? it?
65,"actual like cure well , don't understand peopl didnt"
66,jashykins: mini-review: cure well (2017) http:// jashykins.blogspot.com/2017/02/mini-r eview-cure-for-wellness-2017.html?spref=tw …
67,cure well realli mess
68,cure well แนะนำค่ะ ตื่นเต้นจริง split อีก ระทึกพอกันทั้งคู่ เราดูแล้วหัวใจจะวาย 5555555555555555555555555
69,cure well ...... fuck safe say i'm go think twice drink water
70,love cure well fanci watch
71,still main-them music cure well stuck head
72,cure well (2017) ii http:// posterbinge.com/2017/cure-wel ness-2017-ii/?utm_source=reviveoldpost&utm_medium=social&utm_campaign=reviveoldpost …
73,"like @danedehaan spider-man, ' cure well ' took thing whole level"
74,"love hate relationship it. went downhil fast. speak of, see cure well ?"
75,"übrigens: wer horror mit einer gehörigen portion psycho gewürzt und effektvol kulissen mag wird bei "" cure well "" reich bedient!"
76,seen cure well wtf...
77,oh guy warn cure well graphic blunt anim death go w caution stuff bother ya
78,"start tomorrow 3/3/17, logan john wick: chapter 2! today last day watch cure well ... http:// fb.me/1cnpvenqi"
79,cure well | european screen reaction featurett | 2017 https:// youtu.be/kpw1dwibdsw via @youtub
80,' cure well ' 2hour frankli dull set follow frankli batshit final belong differ film altogether.
81,cure well got weirdest film i'v ever watch
82,"final see "" cure well !"" #solod #yaassss pic.twitter.com/ibrseboef1"
83,saw logan home quick dinner go back see cure well . flip love thursdays! #dayoff #limitless #movi
84,' cure well ' movi review - word http:// thewordwebzine.weebly.com/1/post/2017/03 /a-cure-for-wellness.html … #acureforwel #movi #horrormovi
85,"@cineworld cure well still shown enfield 7.50 2nite, tri book keep get this?? pic.twitter.com/kqeqxh2icq"
86,"access cinema! subtitl cure well , john wick 2, 20th centuri women, founder & more: http://www. yourlocalcinema.com/films.html retweet? pic.twitter.com/f9efiyx9pf"
87,ad video @youtub playlist http:// youtu.be/sj-6kodmqgs?a cure well (2017) review
88,"still haven't seen rings, get cure well . movi need see. soooooo"
89,"fri 6 pm: roller disco (famili session), dancer, rings, ballerina, unit kingdom, john wick - chapter two, cure well"
90,they'v lie us water didn't see cure well ? https:// twitter.com/thejanicexxx/ tatus/837364234736447488 …
91,cure well jetzt
92,cure well twist & expect thriller movie. highli reccomend want see good fuck movi
93,cure well suck ass
94,cure well mess get
95,https:// youtu.be/663w_90umo8 cure well movi review check leav comment
96,time go look cure well .
97,certament cure well foi baseado nest film >< que tiroooo ess film — assistindo ilha medo (filme)
98,ifmca member ley bricknel review cure well benjamin wallfisch. http:// fb.me/6e9gdeslb
99,"first day ny i'm eat lunch besid lead role cure well , dane dehaan. alright. pic.twitter.com/ke7rhgszek"
100,"#dayorespond vist cure well ? estuvo tan mal como lo dijo la crítica, esa pasable, buena cinematografía suspenso"
101,"fri 5 pm: cure well , john wick - chapter two, founder, hidden figures, patriot day, arrival, fifti shade darker, sing"
102,review superb eeri cure well . http:// fb.me/ngkn1kco
103,i'm eat fuck breakfast place main actor cure well wife like
104,review superb eeri cure well . http:// fb.me/6ihourzlk
105,"i'v decid skip see cure well today, even though it' leav basic everi theater near tomorrow."
106,don't go see cure well suck dick btw
107,★★ review cure well (2016) @letterboxd : http:// boxd.it/f1ef5
108,cure well film
109,like @youtub video @20thcenturyfox http:// youtu.be/jf1rlfcdewu?a cure well | offici trailer [hd] | 20th centuri fox
110,second day nyc dane dehaan(th lead cure well ) eat tabl next us. shit wild.
111,"go see cure well tonight,anyon seen"
112,cure well almost worth watch see bonker goe climax. (almost.) pic.twitter.com/pfomww6ba
113,"hmm imma watch "" cure well """
114,"hat jemand schon cure well gesehn?! der trailer macht neugierig, aber hab kein ahnung ob sich ein kinobesuch lohnen würde ^^"""
115,i'v still seen cure well goe cineworld tonight pic.twitter.com/dbzsh3w36z
116,12 screen logan per day local. even cure well relea nearbi
117,"na, seht ihr hier!? cure well - jetzt im kino! zeiten und ticket ☛ http://www. kino-hdh.d http:// fb.me/7kimwqgw"
118,im picki new movi come cure well 10/10! would recommend
119,"na, seht ihr hier!? cure well - jetzt im kino! zeiten und ticket ☛ http://www. kino-aa.d http:// fb.me/7zhlm36nq"
120,cure well review: stun cinematographi plot pitfal http://www. filmandtvnow.com/a-cure-for-wel lness-review-stunning-cinematography-with-a-plot-of-pitfalls/ … #acureforwel pic.twitter.com/jx3h3apeeg
121,saw new movi cure well last night. great! mess head lol
122,"dane dehaan parla di ""la cura dal benessere"" ( cure well ) http:// subtitlesondemand.altervista.org/dane-dehaan-pa rla-la-cura-dal-benessere-cure-for-wellness/ …"
123,"horror kick: also saw cure well , pale comparison, solid gothic horror romp."
124,tonight flick origin thriller/horror rariti cinemat landscap ' cure well ' pic.twitter.com/nwwlpbvnw
125,see ' cure well ' tonight #horrormovi #movienight
126,cure well got one disturb film ever watched.
127,episod 149: logan & cure well – popcorn prosecco https:// huffduffer.com/vanillachief/3 94859 …
128,want see fall. cure well .
129,smile mean end cure well ok
130,amiga film de terror diretor de pirata carib cura é tudo! chama cure well
131,"so, guck ich danach jetzt cure well oder nicht? hat den hier schon jemand gesehen?"
132,cure well essenti storylin etern youth(batman tas) without incest rapey thing..wow
133,cure well probabl one avoid. tri hard profund bare reach interesting.
134,watch cure well i'm never drink water
135,still haven't seen spilt cure well ....
136,christian critic vs. ‘ cure well ’ http:// buff.ly/2mgvt7t pic.twitter.com/z9ckfkuzhc
137,here' review cure well @filmireland yi fanci read http:// filmireland.net/2017/03/01/rev iew-a-cure-for-wellness/ …
138,"peopl theater cure well , could call 'a cure agoraphobia'"
139,"cure well seem creepier interesting, gonna go limb say get classic shitlord holywood"
140,คุณเดน! ฉันยังไม่ได้ดู cure well เลยค่ะ มารีวิวให้หน่อย
141,' cure well ': insan imageri mean http:// ow.ly/lfo2309ofn4
142,check analysi movi ' cure well ' 'bioshock' connect http:// tay.kinja.com/a-cure-for-wel lness-gives-us-a-glimpse-at-the-bioshock-1792524809 …
143,justic ' cure well ' dane dehaan' gloriou eye bag !
144,rate cure well (2016) 7/10 #imdb http://www. imdb.com/title/tt4731136
145,"@bghorror go ""that guy"". old ladi cure well pretti well known actress uk - celia imrie."
146,"awesome. listen now. took $10 cab see cure well , $12 ticket walk 10 min end. diabolical."
147,preview review cure well + gore verbinksi' (sorta) return horror: http:// youtu.be/nwbghlkujfm?a via @youtub
148,new review! enjoy! cure well review – wateri thriller may drown excess runtime. | popcorner. https:// popcorner53.wordpress.com/2017/03/01/a-c ure-for-wellness-review-watery-thriller-may-drown-some-in-excess-runtime/ …
149,"fri 2 pm: construct skill site safeti awar – pre csc test, fences, cure well , moonlight, lion, founder"
150,anyon wanna see cure well today
151,cure well uk/roi cinema now. read review http://www. themoviewaffler.com/2017/02/new-r lease-review-cure-for-wellness.html … pic.twitter.com/z8iidg3n6t
152,abt see cure well love dane dehaan much one understand buzzin
153,got done watch cure well saw way
154,cure well movi current want see right get got mani peopl mad
155,cure well review http:// wp.me/p5oufa-1ti #acureforwel #moviereview #thriller #suspen #review
156,"cure well look like beauti cinematography, need go see"
157,stream cure well ??
158,"@jasonsfolli , want congratul cure well , throughli creep f**k out. fantast film."
159,here' review cure well : http:// gregraymondcallahan.weebly.com/movie-blog/a-c ure-for-wel … #moviereview #cureforwel
160,"quiero ver: el encuentro, miss sloane, cure well , logan."
161,"seat cure well . there' nobodi el hope stay way, shit lit."
162,deal mad all? terrifi & uniqu - cure well show now: http:// bit.ly/2ltz3xl #lastchanc
163,cure well (2017) avail 4k qualiti ★ http:// ow.ly/d7hs309vsbv pic.twitter.com/iklj8rhk3
164,กลัวจบสะเทือนใจอ่ะดิ แม่งงง ดู cure well ยัง
165,cure well http:// ln.is/www.kino.de/fi lm/a-c/e1wz4 …
166,cure well http:// ift.tt/1nzlzfi
167,hidden figur cure well ?? idk saw trailer i'v intrigu ever sinc haha
168,"watch alon - bizarre, disturb & truli weird - cure well show now!: http:// bit.ly/2ltz3xl #lastchanc"
169,schaue ich nachher nur logan oder auch cure well ?
170,cure well score behindthescen video music client benjamin wallfisch & chamber orchestra london http://www. billboard.com/articles/news/ 7694124/a-cure-for-wellness-behind-the-scenes-film-score-video …
171,director cure well unforgett dental scene http:// ow.ly/tisb309oflv
172,cure well mess
173,watch cure well full movi onlin free #putlocker9 @putlocker_9 https:// putlocker9.i /
174,"luxuri studio 5 week hidden figures, la la land, lego batman, cure well + moonlight http:// bit.ly/1oqc52o"
175,"logan, cure well john wick 2 start cinemas. origin version though, money film makers."
176,readi someth truli bizarre? check cure well tonight: http:// bit.ly/2ltz3xl #lastchanc
177,anyon see cure well ? recommend it?
178,"gonna see cure well frankly, can't arsed. tomorrow."
179,cure well summary: https:// youtu.be/nz3vngduvgw
180,"go see cure well tonight get sushi, life good"
181,@aliyahann_ cure well (2017) https:// twitter.com/hilariousedit d/status/837064898270003204 …
182,""" cure well ""? went bit deep"
183,cure well score behindthescen video music client benjamin wallfisch & chamber orchestra london http://www. billboard.com/articles/news/ 7694124/a-cure-for-wellness-behind-the-scenes-film-score-video …
184,"tetszett @20thcenturyfox egi videója ( @youtub ): http:// youtu.be/zlmniejkhxg?a – cure well | ""chill mysterious"" tv"
185,cure well
186,watch ' cure well ' legit ruin life
187,cure well review: stun cinematographi plot pitfal http://www. filmandtvnow.com/a-cure-for-wel lness-review-stunning-cinematography-with-a-plot-of-pitfalls/ … #acureforwel pic.twitter.com/ichxd8iy3p
188,나 아무리 생각해도 더큐어 영화전체에서 더큐어 제목이 마음에 제일 듬... cure well <-건강을 위한 치료/건강한 사람을 위한 치료(영화보고나니까 후자의 의미가 보여서 좋았다 ㅋㅋㅋㅋㅋㅋㅋㅋㅋㅋㅋㅋㅋ
189,cure well fckin weird shit love
190,"hab mich einen guten ansatz für "" cure well "" reingeschrieben. dann musst ich arbeiten gehen."
191,cure well fantast creepi film. #medic #fetish play larg part. want strap someon scare
192,"cure well fängt sehr düster wird aber hinten rau recht wirr und auch etwa eklig, ganz ehrlich. ;) unglaublich innem horrorfim"
193,"tetszett @20thcenturyfox egi videója ( @youtub ): http:// youtu.be/oagtz8k7agk?a – cure well | ""an investigation"" tv commerci |"
194,*interupt like rude bastard* saw cure well thought turd. hope see logan friday morn
195,cure well : ridicul nonsense...but enjoy it. never dull. plu eels.
196,review cure well ! http:// wehaveahulk.co.uk/film/a-cure-fo r-wellness-review/ … @lorrshoward @hcmoviereview @hankbizzl @darrenvhugh @dr_giallo
197,"never heard life, good film cure well weird fuck movi"
198,cure well full'movie'[hd] http:// bit.ly/2ljr4pj
199,"@krupa @cymrogav went see cure well last night. toilet after, heard guy say mate ""remind bioshock that"""
200,cure well ist ein kranker film!!
201,movi today saw trailer cure well get out. appar deer deathtrap nobodi drive without hit 1.
202,cure well 2 1/2 hour long liter reason
203,cure well blow fuck mind.
204,holi shit cure well fuck
205,que pedo con cure well ? puta obra maestra. traumatiz la vez renovadora.
206,"映画「 cure well 」も鑑賞。 スリラーだと思って観てたら後半""なんだこれはファンタジーか？ハリーポッターか？ ""と思って調べたらドクター役がガチでハリーポッター出演してる そしてこの監督パイレーツオブカリビアンとかランゴも撮ってて方向性割とハテナ"
207,yaşam kürü / cure well : @youtub aracılığıyla http:// youtu.be/ja_vsof274c?a
208,cure well vital theater experience. see stun cinematographi product design. pic.twitter.com/cvajajnldi
209,cure well weird af
210,"tetszett @20thcenturyfox egi videója ( @youtub ): http:// youtu.be/dtgxqynxwy0?a – cure well | "" seedi mystery"" tv commerci |"
211,"wrong say best thing "" cure well "" 5 minut @carllumbl it?"
212,cure well anti anderson pass
213,kinda dig cure well incest/rap scene #bummertown
214,"tad bit late, happi #wideshotwednesday ! one' cure well (2016). pic.twitter.com/biqb7gusjz"
215,"saw movi "" cure well "" - called: steal-two hours-of-your-life-and-money-at-the-box-office! 1.5 5 stars. pic.twitter.com/l9bfksqmnh"
216,like movi insan doesn't even matter like it? well cure well almost movi probably(maybe)
217,"haven't seen cure well yet, dont"
218,"cure well , alreadi went see wanna go https:// twitter.com/maelibuu/statu s/713539833323323392 …"
219,male lead cure well definit could new star war movie. young dane dehaan solo! #danedehaansolo
220,ok part cure well broke suspen disbelief girl left mac lipstick bar bathroom
221,cure well sure..and logan https:// twitter.com/ittybittybree/ status/837187278095142912 …
222,cure well blew
223,"cure well ('17): verbinski' visual write check screenplay can't cash, that' hideou final 20 minutes."
224,review: gore verbinski' ' cure well ' gothic creepi hour long: https://www. praguereporter.com/home/2017/2/16 /review-creepy-overlong-wellness-doesnt-cure- …
225,@bobbymovi cure well need english subtitl need chang english
226,yet cure well overlook despit far superior
227,cure well weirdest fuck movi ever seen
228,"i'll probabl end pick get out, split cure well vudu. can't wait logan tomorrow night though."
229,0/10 would recommend see movi cure well unless wanna question saniti afterward
230,definit scari part + made uncomfortable. wasn't like cure well made physic disgust + didn't deliv
231,"whole time watch "" cure well "": pic.twitter.com/06ki0wwacv"
232,"saw get saturday, good!!! also saw cure well ....that movi way to… https://www. instagram.com/p/brh_5v8jr_j/"
233,"crítica/review de la película ""la cura siniestra"" ( cure well ), dirigida por gore verbinski, por... http:// fb.me/1p9ddlapf"
234,"final saw split, great movie, need watch cure well"
235,"holi fuck still need see cure well (fight me), get out, logan come out. fuuuuuck"
236,cure well >split
237,watch cure well realli brilliant brilliant movi
238,"cure well decent, poorli written."
239,cure well was... interest
240,"oiga, @realgdt , ¿ya vio cure well ? si sí, ¿qué le pareció?"
241,hype get 100% accurate. it' seriou wonderful. want see cure well
242,sarah realli like cure well also couldn't help laugh someon el notic mani time fell pic.twitter.com/txnn9ydv0j
243,"cure well fuck wild, solid modern gothic film sure"
244,cure well contest | landmark cinema https://www. landmarkcinemas.com/contests/a-cur e-for-wellness/#.wleqcmozlea.twitt …
245,also don't go see cure well pic.twitter.com/toctvh1h5o
246,"also saw cure well recent thought good, realli fuck up. (tw r*pe)"
247,sacaron cure well del cine la vi who' respon
248,realli want see cure well didn't show 6 like 2.
249,cure well (origin soundtrack album) benjamin wallfisch ♫ http:// spoti.fi/2kxpmz5
250,want go see cure well want watch
251,"leana saw ' cure well ' last night (an unfortunate, confu disappointment) watch 'arrival' today & good!"
252,don't wanna spoil cure well man realli wanna spoil cure well someon talk
253,cure well 'take cure' super bowl tv spot (2017) | movieclip trailer - cure for... http:// tinyurl.com/z2dmq6w #videofunni
254,"i'm cinépoli cure well coyoacán, méxico https://www. swarmapp.com/c/4dh740drqmf"
255,dad went see cure well ! oh god! incredible! wouldn't recommend it! https://www. instagram.com/p/brh2ii3gajk/
256,got back see cure well uh....interesting.....
257,"bruh, cure well well thought all-around good movie, damn confusing."
258,t2: trainspotting-7 20th centuri women-13 (2 actress) prevenge-6 john wick: chapter 2-7 moonlight-10 cure well -2
259,cure well review: stun cinematographi plot pitfal http://www. filmandtvnow.com/a-cure-for-wel lness-review-stunning-cinematography-with-a-plot-of-pitfalls/ … #acureforwel pic.twitter.com/ijmfqijhpq
260,"cure well seri calcul chao choke cinematography, basic 3 hour astound discombobulation."
261,okay cure well spectacularli disturb trek horror mystery. truli incr enjoyable. don't go see it.
262,cure well actual pretti good!
263,cure well straight frazzl
264,"apena honeymoon, littl death e cure well na watchlist"
265,admiremo la fotografía de cure well pic.twitter.com/hphymgphw8
266,cure well #getspook https://www. instagram.com/p/brhyx4jjihb/
267,"chingu su madre, ire ver cure well ."
268,watch one cure well ; conspiraci theori deer evil
269,"movi featur peopl force-f eels, cure well pretti low-key (it also pretti much rules)"
270,wanna go see get cure well one go with...but refu go solo.
271,get number one movi like bitch cure well
272,10 clover field okay till end nowher near horror. look torrent cure well
273,但 cure well 上咗
274,2017/12 - cure well https:// tmblr.co/zk0qcp2j2xdyt
275,cure well got fuck
276,saw cure well ...... feel physic ill
277,cure well way better get opinion
278,"great time chat gore verbinski, cure well & ring @kickseat tonight! #amovieguy"
279,i'm watch cure well (2017) https:// trakt.tv/movies/a-cure- for-wellness-2017 … #trakt
280,cure well super bowl tv spot (2017) | movieclip trailer - cure well super... http:// tinyurl.com/zxlsxd7 #videofunni
281,fifti shade & cure well https:// twitter.com/kalyndabaddest _/status/837107998849912832 …
282,"folk saw ' cure well ,' ask -- like it? it' honest question, i'm seriou curious."
283,"review cure well , mostli 3rd act. pic.twitter.com/hltcnmocem"
284,"vean "" cure well "", de nada."
285,cure well wierd film
286,cure well get movi need go asap
287,cure well good
288,know what' weird film though. cure well . end left bit lost
289,"se nota un chingo que "" cure well "" quier ser como el resplandor. tien cosa buenas, alguna cosa ilógicas... divertida tho."
290,#fashion #eleanor lambert¸ eleanor lambert ‘ cure well ’ screen new york http://www. myeffecto.com/r/zmcg_tp
291,someon gonna find cure well clearli peopl puttin ya happi hole cant https:// twitter.com/xoxoandreaaaaa /status/837137320331653122 …
292,watch cure well ful movie: http:// bit.ly/2mvxroz pic.twitter.com/c9dbwxbkbj
293,"i'm cinemark cure well brasília, df w/ @filipemiranda1 https://www. swarmapp.com/c/0hxg0ot7gcu"
294,cure well
295,"problems, over quit enjoy cure well ! shame it' great box office, lol..."
296,cure well probabl worst movi i'v ever seen.
297,"like @youtub video http:// youtu.be/ub-u19bwidg?a benjamin wallfisch - ""hannah volmer"" ( cure well ost)"
298,see cure well cement need dane dehaan crimson peak modern thriller au.
299,éntrale mi princes... @taggcharalita (at @cinemex cure well ) https://www. swarmapp.com/c/2vxbqvdbho pic.twitter.com/dknaomhmwx
300,cure well contest | landmark cinema https://www. landmarkcinemas.com/contests/a-cur e-for-wellness/#.wleiaz9ida4.twitt …
301,biggest surpri cure well much dane dehaan spend get ass kick
302,"thought sausag parti ruin life wrong, cure well fuck up! #cureforwel"
303,don't wast money even scene point go see ' cure well '... far one worst movi i'v ever seen
304,cure well probabl confu movi time.
305,saw split decid stick around cure well fuck movi date night
306,want go see get cure well !
307,"i'm cinépoli cure well gustavo a. madero, df, méxico d.f. w/ @denissequirino https://www. swarmapp.com/c/2okjomvfg1o"
308,like @youtub video @ralphsep http:// youtu.be/codvy17whoq?a cure well movi review- reel
309,cure well good
310,mmhmmm! it' hard come good psycholog thriller main stream. cure well alright stunk end
311,"saw "" cure well "", wtf cure 17 buck wallet"
312,"yo! good. weird, good. (@riverwatch 12 cinema cure well ) https://www. swarmapp.com/c/2qadq3b4ypv pic.twitter.com/jzsu8htqyd"
313,must see •get • cure well •lala land •a dog purpo
