1280,tri find... cure well @amc theater downtown disney https://www. instagram.com/p/brb5g1ujx-l/
1281,"girl suggest they'd watch "" cure well "" dude said ""it' like shutter island right...? i'm feel it"" (...)"
1282,"patch weekend movi guide: 'the great wall', ' cure well ' 'fist fight' #catonsvil http:// pb.fyi/2lpp"
1283,"j'aim une vidéo @youtub : ""movi review: cure well "" à l'adress http:// youtu.be/9w8qu76kzda?a ."
1284,put cure well ticket cork board wanna fond memori
1285,"saw 'get out' ' cure well ' total differ movies, equal f'd up. love"
1286,cure well weird. kind film
1287,wieso net ;-; wie war cure well ? pic.twitter.com/nztyoz76f4
1288,"would say cure well like entir season american horror story, seen ahs. would wrong?"
1289,"final show great wall, cure well split thursday! open thurs. night: fall & logan. sale tomorrow! pic.twitter.com/ephbie8t2j"
1290,cure well realli good
1291,cure well wast 2 half hours. super disappoint :/
1292,cure well http://www. snipville.com/a-cure-for-wel lness/ … pic.twitter.com/fbo6bthsqo
1293,look forward catch cure well patriot day. #doublebil
1294,cure well better expect
1295,sneak cure well
1296,cant wait see cure well
1297,cure well honestli weirdest film i'v seen
1298,cure well super odd film. it' frustrat arthou chiller realli dumb trash finale.
1299,short review cure well . http:// bit.ly/2mjj5ki #horror #cureforwel pic.twitter.com/tijdxqy7ik
1300,"decid see cure well alreadi cinema, i'v seen long is..."
1301,we'v come cinema watch cure well . . . it' 18 ... i'm littl scared!!!!!
1302,went cinema sunglass normal glasses. patriot day 8/10. cure well next sinc i'm alreadi here.
1303,watch empti theatre....booyah!!!! — watch cure well goodrich qualiti 10 gdx http:// fb.me/wswewi3m
1304,cure well disturb weird creepy. @danedehaan kill though per
1305,cure well (2017) iv http:// posterbinge.com/2017/cure-wel ness-2017-iv/?utm_source=reviveoldpost&utm_medium=social&utm_campaign=reviveoldpost …
1306,like @youtub video @iamthebookfox http:// youtu.be/5afkjbgr68y?a cure well (2016) [film review]
1307,"highli recommend wast 2-2.5 hour life go see cure well , sooooo slow leav feel like.. pic.twitter.com/7svjrxguoc"
1308,i'm go see cure well tonight
1309,seem load creepi thing moment! consid brave cure well earlier thought better.
1310,one day it' gonna you! cure well amaz pump valerian!
1311,reali sittin cinema cure well horror n readi flyin oot fire exit
1312,watch cure well carnikava http:// fb.me/4agdfduuv
1313,i'm watch cure well (2017) https:// trakt.tv/movies/a-cure- for-wellness-2017 … #trakt
1314,"cure well , fist fight, great wall | weekend ticket - cure well , fist... http:// tinyurl.com/zdo2ych #videofunni"
1315,cure well good
1316,whoa. cure well might well weirdest film i'v seen while.
1317,★½ review cure well (2016) @letterboxd : http:// boxd.it/etuid
1318,jag gillad en video på @youtub http:// youtu.be/vj1zy_bcwoy?a cure well - movi review
1319,next list thing see cure well . get out.. bar set realli high
1320,"realli realli want like cure well , didn't :( everi shot beauti though"
1321,"cure well , there' girl blue dress! henc confusion!"
1322,#myrecommend like weird movi go see ' cure well '
1323,cure well werid film
1324,kritik: cure well https:// derplapperblog.wordpress.com/2017/02/27/kri tik-a-cure-for-wel … pic.twitter.com/hajdgq1z8d
1325,cure well easili one favorit movi year. beauti throwback classic univ hammer horror movies.
1326,yo i'm hear cure well isn't well rotten tomato box offic gotta say that' bullshit.
1327,even film ' cure well '
1328,right? check stuff one eye open. i'm gonna tri go wknd. also want see cure well .
1329,cure well ; je durft nooit meer naar de sauna! http:// ift.tt/2m3dssd ring-regisseur gore verbinski hoopt er met zijn nieuwe…
1330,"#ff17 cure well bit long use lot cliches, still reason engaging, decent lead. okay."
1331,"plain, simpl tom review . . . “ cure well ” (2016) http:// ln.is/wordpress.com/ 6hiwf … pic.twitter.com/oszl00l8mb"
1332,like @youtub video @foundflix http:// youtu.be/x3w7l7gjvc0?a cure well (2017) end explain
1333,ah j'avou que fenc et cure well tent bien! peut etr fenc qui l'air vraiment bien
1334,"fenc ou cure well , ou au pire revoir un que j'ai déjà vu"
1335,"moviemantz minute: 'the great wall,' ' cure well ' & 'fist fight': access hollywood film critic scott… http:// dlvr.it/nvdvzp pic.twitter.com/t0hxapukdj"
1336,scary. disturbing. enjoy however. cure well howev whole differ level disturb
1337,buzz watch cure well tonight
1338,go see cure well .
1339,"anyway, cure well pretti damn good."
1340,"end wednesday - "" cure well ."" end thursday - ""fences,"" ""fist fight,"" ""a dog' purpose"" ""john... http:// fb.me/1iml1ul3v"
1341,might watch cure well tonight cinema see it' good :)
1342,"‘ cure well ’ review - stars: dane dehaan, jason isaacs, mia goth, celia imrie, ivo nandi, adrian schil... http:// ow.ly/i4ww509qugk"
1343,watch cure well
1344,incluído na watchlist: cure well (2017) https:// trakt.tv/movies/a-cure- for-wellness-2017 … #trakt
1345,"miss it, review cure well includ special guest discuss movi me! https://www. youtube.com/watch?v=w09pi aoj6s&feature=youtu.b …"
1346,"week' cinema section: friday' doubl bill come monday' doubl review, cure well &... http:// fb.me/3zb12phic"
1347,actual wanna go see cure well
1348,review: cure well beauti live nightmar http:// trib.al/stdno2i pic.twitter.com/eqqxtgfoi7
1349,benjamin wallfisch get recognit cure well score. great work.
1350,"listen podcast review cure well , top 5 film 2005 http:// buff.ly/2m0e5ok pic.twitter.com/lzvda4kqqm"
1351,‘ cure well ’ review http://www. nerdly.co.uk/?p=41819
1352,mountain wellness. review new horror cure well here… http:// nuts4r2.blogspot.co.uk/2017/02/a-cur -for-wellness.html …
1353,"patch weekend movi guide: 'the great wall', ' cure well ' 'fist fight' #sonoma http:// pb.fyi/2lpr #sonoma #realtor #best"
1354,i'm listen score cure well it' good i'm get pretti creep
1355,i'm almost fall asleep i'm way see cure well pic.twitter.com/pfpcygfc1l
1356,realli wanna watch cure well :(:((:( someon leak onlin plea
1357,"cure well extrem predict far long, look beautiful, can't hate much."
1358,"crítica: “ cure well ” (2017) de gore verbinski, ejercicio de estilo que aprueba http:// dlvr.it/nvclsd pic.twitter.com/xgh3jynhip"
1359,"cure well (@genesi cinema cure well whitechapel, greater london) https://www. swarmapp.com/c/izsd8x5lqhd"
1360,u rate forget - (also review cure well !! )
1361,#ดูหนังกับวาฬนู (+ ) - manchest sea - moolight - hidden figur - cure well
1362,gonna lie spent 90% cure well admir pretti dane dehaan
1363,"last week show ""fist fight"" "" cure well "". pic.twitter.com/qmlzodvqda"
1364,"ไปดู cure well เพื่อนอ่านชื่อไทยเรื่องนี้ว่า ""ชี-พอม-ตะ"" 555 #movietwit pic.twitter.com/03q4w3bfjf"
1365,"cure well bomb that' bad thing … : http://www. thebingbing.com/play/4049260 , pic.twitter.com/vnp5g2zk7b"
1366,★★½ review cure well (2016) screed rape fiction @letterboxd : http:// boxd.it/et8br
1367,cure well crazyy
1368,see cure well omg love
1369,""" cure well "" weirdest movi i'v ever seen :s"
1370,"sometim look good sometim creep out, saw cure well way drink water weird"
1371,review cure well : http:// bit.ly/2lxj8km
1372,wanna watch cure well whatev call
1373,saw cure well disappoint start doubt get out… ahahah
1374,ich mag da @youtub -video: http:// youtu.be/vj1zy_bcwoy?a cure well - movi review
1375,like wanna see cure well also spot deep discomfort movi mental institut soooo
1376,@cineworld sort show day before? can't find time cure well friday.
1377,let us know odd boner get watch cure well #ewnodontimkid
1378,cure well bit meh. cure insomnia like @cineworld
1379,cure well movi review https://www. bloglovin.com/blogs/ellis-wo olley-14943071/a-cure-for-wellness-movie-review-5478730027 … @bloglovin
1380,unlimited. year 2 film 53. cure well
1381,"mean lowkey glad didn't get made see theme featur "" cure well "" https:// twitter.com/ign/status/836 252113776820225 …"
1382,"mani advert cure well like realli splash cash one, bad got shite review"
1383,i'm still obsess cure well good
1384,cure well might weirdest movi ever seen
1385,"though verbinski can't escap hollywood' toward end, bloodi hell let get away cure well ?!"
1386,cure well review: stun cinematographi plot pitfal http://www. filmandtvnow.com/a-cure-for-wel lness-review-stunning-cinematography-with-a-plot-of-pitfalls/ … #acureforwel pic.twitter.com/rgbcmgj3ha
1387,want freak cure well . gothic/bodi horror mashup mainli distinguish healthi loath capitalism.
1388,think that' cure well . terribl film
1389,“ cure well ”予告、やっぱミア・ゴスちゃんがたまらない… てゆーかこの映画自体、デハーンとミア・ゴスちゃんとか相当強い
1390,cure well good. conform pretti much everi genr trope psycholog thriller low-rat horror movie.
1391,wanna see cure well get
1392,like @youtub video http:// youtu.be/vj1zy_bcwoy?a cure well - movi review
1393,"example, anyon pretend cure well isn't horror film cheeki melon farmer."
1394,me: assess due friday also me: go meet @stallismilitia watch cure well
1395,cure well bomb that' bad thing … : http://www. thebingbing.com/play/4049260 ... pic.twitter.com/ergjo9fqli
1396,cure well look absolut terrifi brilliant. look forward it.
1397,"cure well , fist fight, great wall | weekend ticket https:// viralboxfeed.com/2017/02/16/a-c ure-for-wellness-fist-fight-the-great-wall-weekend-ticket/ …"
1398,ye thought cure well much better
1399,saw cure well last night oscar happened.stil kinda wtfing
1400,"head anyon think see cure well , don't."
1401,รู้สึกว่า cure well ชีพอมตะ ไม่ค่อยตอบโจทย์ 55555555
1402,cure well gucken – uci kinowelt
1403,same. go see get out! it' good realli similar cure well
1404,hope get see someth soon! <3 saw cure well weekend. i'd interest know thoughts...
1405,haven't seen anyth age apart cure well hidden figur
1406,"horribl mate. yeah moonlight look interesting. went see cure well weekend, weird."
1407,want watch cure well i'm
1408,review: cure well beauti live nightmar http:// trib.al/mj5vvjb pic.twitter.com/yjzkcsqnjo
1409,"i, friendli neighborhood cure well defender, marvel new flesh podcast https:// twitter.com/brettredacted/ status/836231224049881093 …"
1410,"want go see "" cure well "" keep get told it' shite"
1411,"patch weekend movi guide: 'the great wall', ' cure well ' 'fist fight' #brookhaven http:// pb.fyi/2lhz"
1412,"glad final got see get out! need see; split, fifti shade darker, hidden figures, cure well , ring"
1413,"""rest assured, it' toxin leav system..."" ~ cure well | offici trailer ~ https:// youtu.be/jf1rlfcdewu via @youtub"
1414,cure well 누군가를 찾기 위해 알프스에 위치한 묘한 분위기를 풍기는 거대 치료센터를 방문하게 된 한 남자. 하지만 예기치 못한 사고로 부상을 입게된 그는 결국 치료센터에서 반강제적으로 찜찜한 치료를 받기 시작하는데... pic.twitter.com/kkrogocuyx
1415,"want someon take see "" cure well "" bday weekend"
1416,"i'm glad it' good, cure well got super sour last weekend"
1417,review: cure well beauti live nightmar http:// trib.al/fw453m
1418,"j'ai été voir "" cure well "". il est cool mai j'ai l'impress que la fin été un peu bâclé, trop expédié. comprend pa tout."
1419,cure well weirdest movi i'v ever seen.
1420,"hope enjoy cure well , let us know thoughts!"
1421,go see cure well . there' fuck stuff one short scene entir 50 shade film. lot slipperi eels. 10/10
1422,"nunja, heut erstmal cure well"
1423,"luxuri studio 5 week hidden figures, la la land, lego batman, cure well + moonlight http:// bit.ly/1oqc52o"
1424,"thought watch "" cure well "": ""thi isn't right isn't right isn't right"". #lovedit #acureforwel"
1425,cure well uk/roi cinema now. read review http://www. themoviewaffler.com/2017/02/new-r lease-review-cure-for-wellness.html … pic.twitter.com/fzbvej56ft
1426,nuevo #review en cinepollo: cure well (2016) http:// cinepollo.com/2017/02/a-cur -for-wellness/ … pic.twitter.com/r6e1yuwuhm
1427,"wanna see "" cure well "" also wanna see whos' pur big enough sneak 20 piec wingstop theater."
1428,cure well movi review ryan balkwil https:// rdbreviews.wordpress.com/2017/02/27/a-c ure-for-wellness-movie-review-by-ryan-balkwil … pic.twitter.com/xb6f3zelzv
1429,watch cure well – vue cinema grant
1430,half expect cure well replic e.t bike scene end dear film ridiculous.
1431,"back cinema, readi . . . cure well"
1432,cure well — шизофренический ремейк острова проклятых с двойником дикаприо. вербински окончательно сошёл с ума.
1433,unrealist part cure well girl leav mac lipstick pub bathroom go back
1434,"somewhat glitchi #matineecast @rmpixi i'd live morning, dig cure well . http://www. thematinee.ca/episode172/"
1435,like @youtub video http:// youtu.be/405xa6z70fy?a cure well review
1436,cure well weirdest confu film i'v ever seen
1437,saw cure well last night honestli good / haunt i'm still think
1438,cure well follow moonlight mean need see lego batman date.
1439,deal mad all? terrifi & uniqu - cure well show now: http:// bit.ly/2ltz3xl £4.50 today!
1440,tempt go see cure well week
1441,cure well (2017) end explain @jaclynalexande3 eel leach https://www. youtube.com/watch?v=x3w7l7 gjvc0&feature=shar …
1442,"bon, est-c que quelqu’un sait pourquoi lockhart sourit à la fin de cure life ( cure well ) ? parc que ça m’intrigu trop"
1443,#nw cure well
1444,i'm watch cure well (2017) https:// trakt.tv/movies/a-cure- for-wellness-2017 … #trakt
1445,"cure well movi alchemy, good"
1446,cure well cinema scream
1447,"cinema. hacksaw, moonligh, fenc cure well review patreon week."
1448,might sneak cure well afterward
1449,cure well realli good cinematographi everyth el eh
1450,realli wanna watch cure well
1451,feel like hasn't week alreadi took cure well ......wtf cinema
1452,"well suffer vertigo avoid cure well , end sadli fell big cliff lol"
1453,"watch alon - bizarre, disturb & truli weird - cure well show now!: http:// bit.ly/2ltz3xl £4.50 today!"
1454,cure well 'take cure' super bowl tv spot (2017) | movieclip trailer - cure for... http:// tinyurl.com/z2dmq6w #videofunni
1455,"cure well - lockhart patient. really, want ^^ wonder... https:// tmblr.co/zw7oml2iyc8k3"
1456,cure well . bad. bit long batshit ending!
1457,"filmpalast eisenhüttenstadt präsentiert euch "" cure well "". jetzt im kino! https:// youtu.be/xelo8uqw4ny?t= 3s …"
1458,cure well tak masuk malaysia ke?
1459,cure well open uk lacklustr non-fin £406k 388 site - http://www. screendaily.com/news/uk-box-of fice-lego-batman-records-hat-trick/5115384.article?blocktitle=latest-film-news&contentid=40562 … pic.twitter.com/0hlkiyahf
1460,anyon get cinema weekend? anyon catch cure well ?
1461,@jasonsfolli saw cure well . felt like listen 2 some1 spend 2+ hr describ weird dream. saw bc u
1462,might pop cinema later afternoon watch cure well . quit sure got unlimit card not.
1463,"heard there' movi call "" cure well "". #thankyou pic.twitter.com/riqc1aoy1v"
1464,กำลังดู cure well - 2017
1465,readi someth truli bizarre? check cure well weekend: http:// bit.ly/2ltz3xl £4.50 today!
1466,cure well (2016) http://www. moviesnackx.com/a-cure-for-wel lness-2016/ …
1467,planerad uppföljar till cure well : cure wet cure fit cure christma (a holiday special)
1468,cure well | teaser trailer [hd] | 20th centuri fox さて 本邦公開は あるのだか https://www. youtube.com/watch?v=4mcvod jmblu&feature=shar …
1469,"awak 24 hour i'm watch cure well , obviou"
1470,last surpri this: allied. hope cure well next one.
1471,date 3 last night cinema trip . cure well weirdest film i'v ever seen!
1472,cure well review: stun cinematographi plot pitfal http://www. filmandtvnow.com/a-cure-for-wel lness-review-stunning-cinematography-with-a-plot-of-pitfalls/ … #acureforwel pic.twitter.com/psbxskeg4a
1473,time see cure well ! heard it' great i'm curiou anyway. :)
1474,saw cure well yesterday say mess dream last night understat
1475,"cure well , it' sooo weird"
1476,cure well full'movie'online'2016 :~%~[[ http:// mcaf.ee/2z4m5c ]]~%~
1477,got week start 5k run. go see cure well moonlight afternoon cinema.
1478,昨日映画館で一気に見たんだけどさ、やっぱりホラーはいいね笑 いい息抜きになったわ〜 ちなみに cure well の方が評価低いんだけど映画館で見るならget outよりオススメ。すごく綺麗 pic.twitter.com/2kq6oetxjj
1479,i'm watch cure well (2017) https:// trakt.tv/movies/a-cure- for-wellness-2017 … #trakt
1480,immacul cinematographi you'll see 2017. cure well . pic.twitter.com/408slighvl
1481,"that' exactli would describ cure well , it' flaw masterpiece. gorgeous, immacul cinematography."
1482,like @youtub video @foundflix http:// youtu.be/x3w7l7gjvc0?a cure well (2017) end explain
1483,"patch weekend movi guide: 'the great wall', ' cure well ' 'fist fight' #fountainvalley http:// pb.fyi/2lk2"
1484,"patch weekend movi guide: 'the great wall', ' cure well ' 'fist fight' #fountainvalley http:// pb.fyi/2lk2"
1485,"saw "" cure well "" suck high heaven. shell $60 lousi ""movi experience"". never again. i'll wait cable. tyvm https:// twitter.com/frenchfortrump /status/835897013392789504 …"
1486,unser neuen chart 1. fifti shade grey 2. bibi & tina 3. john wick: kapitel 2 4. cure well 5. la la land
1487,cure well . moonlight.
1488,cure well fuck crazzzzyyyyyy
1489,2017/6 - cure well
1490,"cure well pretti good, rewaken long lost love german metal plea unfriend"
1491,review: cure well beauti live nightmar - milton keyn citizen http:// ift.tt/2lmbuy5
1492,"cure well (ou ""life"" pour le anglophob de chez nous) : absolu rien ne va dan ce film. tiraillé entr rire et larme. kwqxz!"
1493,:-) love dane! love cure well !!
1494,"entspannung auf kur: "" cure well "" http:// popcornguys.wordpress.de/2017/02/27/a-c ure-for-wel …"
1495,saw cure well yesterday stranger i'd thought would sick
1496,"woke watch "" cure well """
1497,"cure well , leav cinema thinking, 'what hell watched'! @jameswelch1983 @letticelawn69"
1498,cure well ahhhhh
1499,cure well weird af. lol
1500,"biiiitch omg movi "" cure well "" weird creepi hell also!!"
1501,haven't seen cure well sound conceptu similar well.
1502,review - cure-for-wel 3/5. earn rs.40 per review #writesharewin @mouthshut http://www. mouthshut.com/review/a-cure- for-wellness-review-rrqnupommsm …
1503,luciu malloy good cure well
1504,cure well anyth seek well suffering?
1505,cure well mess film storylin maaad
1506,cure well jack stori still entertain psycholog thriller
1507,cure well was....interesting.
1508,a.wright daili - cure well bomb – that’ bad thing
1509,"usual predict everyth movie, ""the cure well "" got me."
1510,-the artist cut last one- cure well realli like pic.twitter.com/gpfsrlwwug
1511,get cure well best movi i'v seen wouldn't doubt they'll best 2017
1512,"yo ""the cure well "".... noth trip! #wtf #shook #spook"
1513,cure well zdobędzi przynajmniej jednego oscara w przyszłym roku. zobaczyci :-/
1514,get & cure well alreadi best movi year
1515,"cure well bad movie. critic ask ""someth original"" final get it, shit it."
1516,"misread movi titl ' cure well ' cure welshness. bit racist, thought ..."
1517,de lo final creepi que visto es el de cure well .
1518,"eager watch cure well , look good! anyon seen yet?"
1519,cure well está peculiar. esperaba algo má pero sí algo diferente.
1520,"oh, here' review cure well , okay, guess ... https:// cinemaandsilliness.wordpress.com/2017/02/27/rev iew-a-cure-for-wellness/ …"
1521,cure well . beauti cinematographi coat moldi turd.
1522,want go see cure well ?
1523,blown away amaz godddd also. crow titti dude seen cure well
1524,"yeah, cure well thought longer brain."
1525,cure well came disturb cgi/gor ive ever seen prob won't get anyth tho
1526,‘episod 77.1: rip bill paxton - get - negro - cure well - elstr 1976’ #soundcloud https:// soundcloud.com/wagesofcinema/ episode-77-part-1?utm_source=soundcloud&utm_campaign=share&utm_medium=twitt …
1527,new sounds: episod 77.1: rip bill paxton - get - negro - cure well - elstr 1976 https:// soundcloud.com/wagesofcinema/ episode-77-part-1 …
1528,want guy see bad crave discour also get good shouldv seen b4 cure well
1529,cure well ? got ticket free still want money back. total garbage.
1530,cure well fuck
1531,cure well crazi man. dental work without pain med mani eels. 15/10 would kiss dane dehaan. pic.twitter.com/qamr8n0vp
1532,100% recommend cure well
1533,cure well good movie! 10/10
1534,saw cure well theater & absolut enjoy it. astoundingli brilliant & it' imposs truli know answer pic.twitter.com/wl36qpjn5a
1535,"haven't seen get yet, doubl featur cure well . dear god delight mindfuck would be."
1536,' cure well ' fuck movi i'v ever seen
1537,blayyy cure well reall modey may movi lashov cau aunt behind us watch
1538,"cure well trippy... almost vomit one part over enthral movie, suspen"
1539,"saw cure well today tho who' real winner, amirite?"
1540,i'm probabl go see cure well
1541,cure well
1542,cure well got 8 differ kind mess up... like frick
1543,@usamamo @sakurastan saw get y'all see cure well yet
1544,"ever sinc watch "" cure well "" yesterday, sayin fuck water. frfr."
1545,cure well still confused. i'm beyond lost.
1546,"they'v come actual realli good horror movi lately, split, cure well , get :0"
1547,cure well freaki asf love
1548,saw cure well reaction actual fuck
1549,cure well good af
1550,"movi news, cure well well worth ten dollars. fight me."
1551,cure well better
1552,cure well better like pic.twitter.com/dgzlx1zr
1553,cure well was.....fuck. crazi fuck movi
1554,however! love la la land! still good cure well still a+
1555,@danedehaan hope cure well lead role get nomin next
1556,cure well terribl movi holi shit
1557,ive seen ppl say cure well good believ rottentomato like 40% rating.. critic don't know shit
1558,wanna trip watch cure well
1559,cure well pic.twitter.com/qxqnwzfgcx
1560,saw get good im sad bc cure well masterpiec made get seem like. mediocr
1561,whoever thought cure well good idea need good psych eval common sen
1562,cure well best movi i'v seen lonnnnggg time
1563,"saw "" cure well "" (thriller/horror/sci fiction) last weekend. start off… https://www. instagram.com/p/brapqm5jw_o/"
1564,cure well was. movie. just. ?????????
1565,cure well strangest movi i'v ever seen.
1566,i'm tri go see cure well get king cake cheesecak copeland'
1567,im watch cure well it' make feel insan
1568,went go see cure well card im almost 20 year old omg
1569,cure well ok 0/10
1570,soon you! cure well fantastic!!!!!
1571,""" cure well "" fuck weird..."
1572,"anyway, that' done. may cure well pa ba sa rob magnolia?"
1573,get tiiiiiight i'm realli excit cure well
1574,"la cura ciniestra (@cinépoli cure well león, gto., gto) https://www. swarmapp.com/c/iei3dmqosor"
1575,see - arriv - moonlight - get - cure well
1576,cure well ? like cure smellness. it' dooki it' long smh
1577,scare drink water take bath saw cure well
1578,cure well insane. pic.twitter.com/2vgdghqw35
1579,cure well ...i walk old peopl turn zombies.
1580,"still need go see ""get out"", "" cure well "", & ""moonlight"". i'm goin week"
1581,wow. best pictur goe cure well clean sweep.
1582,might see cure well alon need use pass either tomorrow tuesday might die?idk
1583,me: anyone:i- me:yal mind stan dane dehaan bc woooow cure well yessir fuck love good solid man oh fuck god
1584,morgan went saw cure well without #notmylittl
1585,"patch weekend movi guide: 'the great wall', ' cure well ' 'fist fight' #malibu http:// pb.fyi/2l7m"
1586,"2017 alreadi put 3 new favorit movi split, cure well get"
1587,way clean brain bc cure well got lil mess
1588,go onlin buy ticket see cure well thursday night end get advanc ticket see logan #almostforgot
1589,could watch #oscar 10 time still wouldn't feel long cure well
1590,cure well interest say least. kind shutter island vibe somewhat predictable. still 7/10
1591,"amm... entendí (@cinépoli cure well naucalpan de juárez, méxico) https://www. swarmapp.com/c/7jrkf0l3dpq"
1592,see get cure well me?
1593,miss cure well watch ring instead satisfi crave horror. unlik first two franchise.
1594,update: longer see cure well https:// twitter.com/branwright77/ tatus/835936094386450434 …
1595,"cure well realli mess movie, realli like it..."
1596,saw cure well today. 40 minut long still pretti enjoy weird horror movie. dale dehann fantastic.
1597,""" cure well "" es la película má creepi que visto en toda mi vida. 7/10 #acureforwel"
1598,"cure well (2016) stori okay, bodi horror enough freak out, mood & cinematographi great 4/5 pic.twitter.com/4awlciuqwk"
1599,"realli want see "" cure well """
1600,cure well review: stun cinematographi plot pitfal http://www. filmandtvnow.com/a-cure-for-wel lness-review-stunning-cinematography-with-a-plot-of-pitfalls/ … #acureforwel pic.twitter.com/b9y7qlrxmo
1601,"cure well , estuvo"
1602,oscar drag longer cure well .
1603,think see movi cure well ....don't
1604,hmm watch trailer cure well feel like movi like come everi year
1605,cure well fuck up.
1606,"baby! (at @harkinstheatr tucson spectrum 18 cure well tucson, az) https://www. swarmapp.com/c/0gx2sapu97i"
1607,get cure well avail i'm watch sing
1608,cure well wild heck.
1609,someon plea see cure well
1610,opposit get predict wtf cure well didnt figur till https:// twitter.com/samsfrodo/stat us/836066268318949377 …
1611,commerci look cool wanna watch movi cure well
1612,fuck sucked. cure well good.
