1369,layla call child want watch new power ranger she' want watch beauti beast
1370,beauti beast good family!
1371,beauti beast yeh?
1372,i'm see beauti beast tonight get see @niki_sn00kzz
1373,need go see beauti beast !
1374,like @youtub video http:// youtu.be/0f86af0p9k0?a canadian dollar tree review -cottoncandysaltwatertaffi & beauti beast
1375,hast du schon beauti beast geschaut?^^ da bin ich gestorben
1376,think might go see beauti beast tomorrow morn
1377,"[videos] watch "" beauti beast "" last night, remind amaz ""see vest"" si… http:// ift.tt/2nf4agi"
1378,"payday tomorrow final go see beauti & beast again! never cinema before, interest"
1379,vient de regard beauti beast (2012) s01e04 pic.twitter.com/shyvytxmbc
1380,expect beauti beast a+ it'
1381,beauti beast perfect cast i'v ever seen. complet amaz
1382,trini mendez está vacío en día de semana! — watch beauti beast
1383,تروحي بكرا نحضر beauti beast ? 2 1 movi date stranger (friendship date )
1384,excit see beauti beast stepmom tomorrow
1385,beauti beast amaz
1386,want go see beauti beast @emilyclarke97
1387,castl hotels: ' beauti beast ' fairyt @cnntravel https:// cnn.it/2obhnsj
1388,"beauti beast even special second time around, actual ador emma"
1389,omg love beauti beast remak jungl book one that' sayin somethin
1390,#movi news! beauti beast domin box offic kanpai! https:// youtu.be/w9rkrmedkpo
1391,want watch beauti beast bad
1392,love beauti beast cast muchhh
1393,enter #win beauti beast prize pack 2 cineplex passes! #giveaway end 3/28 http://www. naturalbabygoods.com/disney-beauty- and-the-beast/#comment-266125 …
1394,*make futur husband memor beauti beast ballroom scene bomb first danc ever*
1395,draw beauti beast charact beast : วาดอสูร : kid love - http:// beauti ... pic.twitter.com/vth7dshd5l
1396,oh beauti beast
1397,box-off preview: 'baby' muscl ' beauti beast ' http:// feedproxy.google.com/~r/thr/film/~3 /vw8kcd-uiks/box-office-preview-boss-baby-ghost-shell-challenge-beauty-beast-989946?atp … pic.twitter.com/ya7sosh8co
1398,@sarahtherebel need know thought new beauti beast sinc guy day rip apart.
1399,gonna go see beauti beast tonight bless
1400,beauti beast soundtrack amaz make rememb much love movi kid.
1401,saw beauti beast . wasn't aw nowher near good original.
1402,"true, he’ princ charming. there’ someth simpli didn’t see.” bell - beauti beast"
1403,ik vindt emma veel leuker en mooier beauti beast dan harri potter
1404,"beauti beast amaz beautiful, pretti much sob last 30 minut #hotmess pic.twitter.com/btuyaiuzw1"
1405,christian rant much sex traffick beauti beast ?
1406,"dark, twist fairi tale ' beauti beast ' base http:// buff.ly/2npss3l"
1407,"asid naff cgi emma watson' poor posture, beauti beast spectacular!"
1408,like @youtub video @classyjacki http:// youtu.be/nwfyvpa-ex0?a disney' beauti beast (cover)
1409,"like @youtub video @kingbach http:// youtu.be/wrd66npwv_w?a beauti beast trailer parodi | king bach, shay mitchell, pooch"
1410,"""colossal"" like “the tiger’ bride” "" beauti beast ."" http:// bit.ly/2odvhp0 pic.twitter.com/p1mvjbzehw"
1411,*watch beauti beast once* me: pic.twitter.com/9bkrsygg7
1412,u take ur beauti beast weird ass furri love stori home
1413,"saw beauti beast ...ahem, lemm tweet still remember..."
1414,castl hotels: ' beauti beast ' fairyt - cnn http:// dlvr.it/nmgl4k
1415,emma watson reveal one belle' icon ' beauti beast ' outfit made vintag wool bought ebay http:// bit.ly/2nwwtp
1416,guest! join us beauti beast celebr april 1st 11 am. #beautyandthebeast #bnevent
1417,final get see beauti beast tuesday
1418,like @youtub video http:// youtu.be/k-ymkwhuvwu?a beauti beast 1 minute!
1419,like @youtub video @thatdisneymom http:// youtu.be/lxderti3myk?a beauti beast | enchant rose jewelri box | delux babi
1420,i'm seriou obsess beauti beast i'm use music fall asleep
1421,beauti beast soooooooooooooooo beauti oh god :-(((((((((
1422,beauti beast de titelsong. zo lekker catchy. @leesmeenu ik weet wat wij zaterdag de auto gaan luisteren
1423,even mom start laughing. yo whole room belle. whole beauti beast winter colllect
1424,"i'v obsess beauti beast . saw sunday watch last night again, also watch old one"
1425,beauti beast de titelsong. zo lekker catchy. @leesmeenu ik weet wat wij zaterdag de auto gaan luisteren
1426,watch beauti beast third time last night love amazing! anyon realiz bell stockholm syndrome?
1427,like @youtub video http:// youtu.be/i8g1rbu2zcg?a beauti beast - emma watson cast brought song life
1428,"gorgeou film beauti beast was, doesn't love fairyt"
1429,lmao littl cousin said start like beauti beast came like biiiiiiiitch
1430,saw beauti beast love much!!!! emma good bell luke evan gaston best choic ever made
1431,date de mama naar beauti beast
1432,i'm actual listen beauti beast 's soundtrack right reliv film. lmao
1433,'boss baby' 'ghost shell' debut ' beauti beast ' eye third week #1 http://www. boxofficemojo.com/news/?id=4279& utm_source=dlvr.it&utm_medium=twitt …
1434,"#arianagrand & #johnlegend "" beauti beast "" #mashup @radiodisney https:// youtu.be/axysre0kg6k"
1435,ecstat see beauti beast .
1436,anyon wanna see beauti beast feel like i'm one hasn't watch
1437,want see beauti beast
1438,never appreci new version beauti beast ; song movie.
1439,"gonna watch beauti beast lemm know, haven't watch yet"
1440,wanna watch beauti beast bad
1441,need see beauti beast already.
1442,beauti beast 10/10 recommend!!!!! complet childhood sure
1443,watch beauti beast tonight sister #amaz #oldfavourit #greatmemori
1444,someon plea take final see beauti beast
1445,guy saw beauti beast !! i'm pleasantli surprised!!
1446,watch beauti beast yall fuck cri eye wet i'm mess
1447,beauti beast https:// eldiamantedig.wordpress.com/2017/03/30/bea uty-and-the-beast …
1448,want see beauti beast bad
1449,i'v seen beauti beast 3 time lol
1450,loungefli disney beauti beast bell charact girls' laptop backpack http:// ift.tt/2nsrmxr
1451,final saw beauti beast cri start finish
1452,honestli beauti beast good movi
1453,. @mannymua733 sing beauti beast best. thing. ever. hahahaha
1454,beauti beast 2017 hdcam [700 mb] https:// goo.gl/fb/yqynp
1455,"18+ music deadpool music - beauti beast ""gaston"" parodi https://www. youtube.com/watch?v=ptkgr cpi1i&feature=shar …"
1456,final see beauti beast
1457,"ok, i'll admit - beauti beast realli good"
1458,"haha brilliant see beauti beast tonight, it' amazing! good x"
1459,beauti beast song never fail make legit emotional. i’m complex person. #taleasoldastim
1460,free: beauti beast color sheet here-ar ... http:// alisonshaffer.blogspot.com/2017/03/beauti -and-beast-coloring-sheets-are.html?spref=tw …
1461,beauti beast
1462,hello beauti beast can't wait fuckin die
1463,gustó un video de @youtub http:// youtu.be/3_axs_ln4ns?a song kwang sik-- beauti beast (piano
1464,"took mumma bear cinema see beauti beast - good, love good sing along"
1465,real stori behind ' beauti beast ' noth like movi love http:// ctrylv.co/ghn7ami
1466,"would rather shoot face watch video entitl ""jame corden bell beauti beast ."""
1467,"expect zombi treatment beauti beast , someth braver. mayb burton' alic frighten safer places."
1468,see beauti & beast second time im gonna sob
1469,excit go watch beauti beast tomorrow
1470,went see beauti beast sister tonight realli love
1471,"j'aim une vidéo @youtub : ""be guest (from "" beauti beast ""/audio only)"" à l'adress http:// youtu.be/9qq__xruf3y?a ."
1472,"fri 10 pm: get out, beauti beast , logan"
1473,beauti beast https:// youtu.be/bs6knaomgna #عبدالمجيد_عبدالله_في_الكويت ibadan #سندك_هو #totp #wivpak #gameofthron mike penc
1474,wanna watch beauti beast bad
1475,outfit remind beauti beast https:// twitter.com/diodio0013tw/ tatus/847437720024567809 …
1476,don't like mani disney film beauti beast far fav
1477,ha gustado un vídeo de @youtub ( http:// youtu.be/ywy8nybp3ri?a - emma watson dan steven mini beauti beast cute !!!).
1478,olay invit screen beauti beast ...there belle- on!! … https://www. instagram.com/p/bsruct8jnx6/
1479,real stori behind ' beauti beast ' noth like movi love http:// ctrylv.co/ghn7ami
1480,"didn't like fantast beast beauti beast , ghost shell amaz first minutes. awesom made"
1481,beauti beast best film ever seen
1482,beauti beast favorit movi stockholm syndrome. pic.twitter.com/kejjbah1iz
1483,realli wanna watch beauti beast
1484,saw beauti beast again. even better 2nd time! #taleasoldastim #yesims #dontjudgem
1485,beauti beast medley (feat. lexi walker) de mckay crockett https:// open.spotify.com/album/2th1qmtw sbaiitlzdiiy1w … #nowplay
1486,wat 'ie leuk! beauti beast pic.twitter.com/pqxgs2ectx
1487,need see beauti beast bad
1488,im final go see beauti beast ajdvahhansb favorit princess movi im excit
1489,beauti beast better thought gonna lol
1490,@matsw beauti beast
1491,beauti beast (2017) bill condon. pic.twitter.com/6rbhlhjl2g
1492,everyon didn't like emma watson bell : go away. far away! beauti beast amaz movie. #foreverinlov
1493,@lorealparisuk plea tell beauti beast make rang avail u.k.
1494,el sábado por fín veo beauti beast
1495,beauti beast #movietim
1496,ariana never south korea alreadi 5 number #1 hits: beauti beast problem bang bang santa tell best mistak pic.twitter.com/ksqaqbaahh
1497,"i'm enter beauti beast sweepstak disney magic kingdom chanc win iphon 7,"
1498,want watch beauti beast
1499,"beauti beast , beauti (if cheesy) trip memori lane. https:// reelfilmmoviereviews.wordpress.com/2017/03/30/bea uty-and-the-beast-review … pic.twitter.com/qctydcokcl"
1500,seven #beauti beast #jewel fall #love http://www. thejewelleryeditor.com/jewellery/arti cle/beauty-and-the-beast-jewellery-rings-earrings/ … pic.twitter.com/rrr5vdmfba
1501,viciado beauti beast ya voy por la ultima temporada ver si muero que hago yo despué de acabarla
1502,"beauti beast , beauti (if cheesy) trip memori lane. https:// reelfilmmoviereviews.wordpress.com/2017/03/30/bea uty-and-the-beast-review … pic.twitter.com/9sdevmwqx5"
1503,"beauti beast , beauti (if cheesy) trip memori lane. https:// reelfilmmoviereviews.wordpress.com/2017/03/30/bea uty-and-the-beast-review … pic.twitter.com/c0zdrg72q2"
1504,podemo hablar de lo absoluta brutal que ha sido ' beauti beast ' por favor gracia
1505,beauti beast sooooo good!
1506,"jame corden bell "" beauti beast "" best thing i'v seen day https:// twitter.com/crudes/status/ 847290645534330880/video/1 …"
1507,"jame corden bell "" beauti beast "" best thing i'v seen day https:// twitter.com/crudes/status/ 847290645534330880/video/1 …"
1508,"jame corden bell "" beauti beast "" best thing i'v seen day https:// twitter.com/crudes/status/ 847290645534330880/video/1 …"
1509,"jame corden bell "" beauti beast "" best thing i'v seen day https:// twitter.com/crudes/status/ 847290645534330880/video/1 …"
1510,"jame corden bell "" beauti beast "" best thing i'v seen day https:// twitter.com/crudes/status/ 847290645534330880/video/1 …"
1511,"jame corden bell "" beauti beast "" best thing i'v seen day https:// twitter.com/crudes/status/ 847290645534330880/video/1 …"
1512,"jame corden bell "" beauti beast "" best thing i'v seen day https:// twitter.com/crudes/status/ 847290645534330880/video/1 …"
1513,beauti beast girli film ever love
1514,"jame corden bell "" beauti beast "" best thing i'v seen day https:// twitter.com/crudes/status/ 847290645534330880/video/1 …"
1515,"jame corden bell "" beauti beast "" best thing i'v seen day https:// twitter.com/crudes/status/ 847290645534330880/video/1 …"
1516,"jame corden bell "" beauti beast "" best thing i'v seen day https:// twitter.com/crudes/status/ 847290645534330880/video/1 …"
1517,y3ne mesh ha5osh beauti beast wala eh?
1518,"jame corden bell "" beauti beast "" best thing i'v seen day https:// twitter.com/crudes/status/ 847290645534330880/video/1 …"
1519,"jame corden bell "" beauti beast "" best thing i'v seen day https:// twitter.com/crudes/status/ 847290645534330880/video/1 …"
1520,' beauti beast ' offer deeper truth human ident forms. http:// buff.ly/2okqyzr
1521,can't even tell much cri beauti beast
1522,beauti beast ariana grand & john legend — https:// path.com/p/on1vj
1523,"cold, rainy, dreari day? daddy/daught date see beauti beast , starbuck light reading. pic.twitter.com/a6qvzgj3b3"
1524,eu queria um icon da emma em beauti beast não acho nenhum
1525,love beauti beast soundtrack tew much
1526,watch new beauti beast
1527,christian critic miss disney’ beauti beast http://www. philcooke.com/what-the-chri tian-critics-missed-in-disneys-beauty-and-the-beast/ … via @philcook
1528,beauti beast press confer (pictures) http:// goo.gl/pzgbi via @desireeeaglin
1529,beauti beast musical??? still haven't seen
1530,can't get good beauti beast
1531,man realli wanna see book mormon...also saw beauti beast today.
1532,jame corden bell beauti beast hilari https://www. facebook.com/itsafunnystori /videos/1521882791158241/ …
1533,new beauti beast guest book made readi send made colour rose ad please... http:// fb.me/6blfgeemd
1534,hoje tocou beauti beast na rádio e alguém aqui chorou ouvindo kkkkkkkkkkkkkkkkk imagina vendo film
1535,emma watson dan steven talk bell beauti beast - two kid coupon http:// crwd.fr/2mqco22 pic.twitter.com/iak4kfkln2
1536,beauti beast peasant twirl dress ruffl lunapink http:// etsy.me/2oe2vpn via @etsi
1537,beauti beast ?!
1538,beauti beast bloodi amaz cri mani time
1539,#disney disney pin beauti beast bell locket valentine' day 2006 le oc #43890 http:// dlvr.it/nmg4rc plea retweet pic.twitter.com/kxuodsazel
1540,im see beauti beast saturday im bless
1541,carla wyzgala fairyt graphic novel adapt beauti beast went live kickstarter... http:// fb.me/18nlvstpb
1542,sat think seen beauti beast yet?
1543,still haven't watch beauti beast
1544,excit beauti beast tonight #movienight #beautyandthebeast
1545,"like @youtub video http:// youtu.be/ptkgrecpi1i?a deadpool music - beauti beast ""gaston"" parodi"
1546,' beauti beast ' done rapper!! https://www. youtube.com/watch?v=ulqxul -2r1e&feature=shar …
1547,see beauti beast beauti omg
1548,concern much relat miser old clock beauti beast
1549,love beauti beast shirt :o
1550,brayc treat patient ' beauti beast ' open night http:// fb.me/8cxzneosm
1551,brayc treat patient ' beauti beast ' open night http://www. shorenewstoday.com/egg_harbor_tow nship/news/brayces-treats-patients-to-beauty-and-the-beast-opening-night/article_508cddb3-848f-57e3-84ea-53f4f7839388.html …
1552,"beauti beast set bar high, disney need add aladdin & littl mermaid mix"
1553,#nowplay beauti beast de emma thompson ♫ http:// spoti.fi/2ng3rx3
1554,beauti beast tonight mitch.. he'll say forc go. that' lie
1555,would thought beauti beast would music
1556,#canada #u #win iphon 7 gc gems! #disneymagickingdom beauti beast sweepstak #enter here: http:// ln.is/com/nbxsb
1557,"beauti beast sai mut kyyneliin, johon harvat leffat pystyy. oij että soundtrack toi mieleen lapsuuden alkuperäsen animaatioleffan"
1558,beauti beast good tho
1559,beauti beast everi bit magic hope
1560,"""sorri michael i'm busi teach peter beardsley line beauti beast . would love got attic!!!"" pic.twitter.com/voylfjhjnh"
1561,https:// youtu.be/ovw_l8stu5 beauti beast breathtakingli stunning. made cri lot.
1562,beauti beast great movie!
1563,#boxoff 'boss baby' 'ghost shell' debut ' beauti beast ' eye third week #1 http:// dlvr.it/nmg1q7
1564,wonder watch beauti beast go sleep
1565,want go see beauti beast
1566,"‘ beauti beast ,’ still cautionari tale smart home http:// ow.ly/oqr030ag6na"
1567,@jenn_smith_ beauti beast
1568,still haven't watch beauti beast )':
1569,disney swarovski collection: beauti beast http:// thedisneydrivenlife.com/2017/03/30/di ney-and-swarovski-collection-beauty-and-the-beast/ …
1570,got admit beauti beast pretti awesome!!
1571,still need see beauti beast .
1572,mum think i'm old watch beauti beast
1573,saw beauti beast 3d imax! spectacular!! @emmawatson @thatdansteven @joshgad @thereallukevan https:// twitter.com/beourguest/sta tus/847478537825034241 …
1574,okay beauti beast amaz highli recommend
1575,i'm watch 1991 version beauti beast miss voic @thereallukevan
1576,beauti beast #ps4 #ps4pro @playstationd pic.twitter.com/mcw3zgrkzz
1577,night dark beauti beast .. #goodmorn #godbless #keepintouch https://www. instagram.com/p/bsrs2thaekj/
1578,urher compo alan menken' ' beauti beast ' world premier red carpet interview. http:// buff.ly/2odecfq #beourguest #film pic.twitter.com/iz0svh4juo
1579,@arianagrand fifth number #1 south korea intern gaon chart beauti beast rise #1 (+7)! pic.twitter.com/xgindwa9x1
1580,ben want go see power ranger tomorrow instead i'm drag go see beauti beast winninggg
1581,beauti beast good
1582,can't find anyon go see beauti beast
1583,leut beauti beast ist schön oh mein gott ich kann es nicht wort fassen
1584,mee beauti beast snsjsj https:// twitter.com/girlhoodposts/ status/847539974996152320 …
1585,beauti beast emotional..
1586,got beauti beast
1587,crosswalk musical: beauti beast @djfarinelli crosswalk!!!!...what sayyyyyy?!?!? https://www. youtube.com/watch?v=nu4pz olyhg&feature=shar …
1588,beauti beast good omg
1589,saw beauti beast @odeoncinema - love it! pic.twitter.com/o2pnskmew3
1590,movi date brittney tonight final gna see beauti beast
1591,djfjckd beauti beast film fuck amazingg
1592,encontrado una grabación genial de « beauti beast » en #smule : http://www. smule.com/p/115004047_11 53031644 … @disney #singkaraok
1593,like @youtub video http:// youtu.be/syyco0qvkzo?a beauti beast stockholm syndrome?
1594,beauti beast !
1595,#10: disney beauti beast rose glass dome silver plate pendant necklace: disney… https:// goo.gl/fb/de68kq #necklac #pendant
1596,still haven't seen beauti beast yet. want date?
1597,movi beauti beast good i'm emot
1598,beauti beast good. gorgeou
1599,beauti beast good
1600,""" beauti beast "" could 15 min long, drag thank songs. hollywood' music bollywood' karan johar film."
1601,may balak nanaman siguro yung nanay ko manood ng beauti beast mamaya
1602,#5: disney beauti beast offici movi merchandi tree life pendant necklace… https:// goo.gl/fb/ylsoma #necklac #religi
1603,convinc friend listen new beauti beast song bombard gif pic.twitter.com/xnm4ys1ft
1604,j'ai ajouté une vidéo à une playlist @youtub - diy disney : la bell et la bête (français) beauti beast room decor
1605,v excit see beauti beast tommorrow
1606,pa habi paper kene make sure date dengan ' beauti beast ' omg cant wait
1607,"finish watch beauti beast . mother told me, don't someth nice say, don't say anyth all."
1608,@me 24/7 mom want make sleep outsid cau won't stop sing beauti beast
1609,beauti beast ....swt film
1610,moment headphon comput play beauti beast starbucks.
1611,ultim disney quiz cast beauti beast https:// youtu.be/a9qdzaoomta via @youtub
1612,bitch im see beauti beast wednesday im excit
1613,"like @youtub video http:// youtu.be/ptkgrecpi1i?a deadpool music - beauti beast ""gaston"" parodi"
1614,"went see beauti beast left hour so, shite"
1615,♬♫celin dion peabo bryson beauti beast
1616,net naar beauti beast eerst dag dat de film uitkwam vandaag super druk wij hadden echt kut plekken
1617,"tanbién desaciertos. bell beauti beast parecen muy flojas, funcionan, son punto importantes. hablemo de emma..."
1618,"beauti beast thank make forget horribl thing happen today emma watson, love"
1619,anytim see beauti beast anywh think @adelainemorin pic.twitter.com/tku7w34v3o
1620,beauti beast amaz
1621,"like @youtub video http:// youtu.be/tpcxqpmbcsg?a dan steven - evermor (from "" beauti beast ""/audio only)"
1622,beauti beast good movi
1623,la cancion de beauti beast para lo pelos.....
1624,افتكينا من beauti beast جاتنا حفلة عبدالمجيد ع السناب انزين طالعوا بروحكم ..
1625,beauti beast ost loop
1626,i'm liter cinema alon watch beauti beast like get sad lmao ?
1627,beauti beast - leroy sanchez & lorea turner (music video): song love https://www. youtube.com/watch?v=71jb7p jvexs&feature=shar …
1628,emma watson * beauti beast * costum made eco-friendli http://www. glamour.com/story/emma-wat son-beauty-and-the-beast-costume-eco-friendli …
1629,`check @jessicaesanchez beauti beast song https://www. youtube.com/watch?v=pzyrwu yzq1e&feature=youtu.b …
1630,"ha gustado un vídeo de @youtub ( http:// youtu.be/q62lyshwizm?a - día de sol (de ""la bella la bestia ( beauti beast )""/audio"
1631,took long realiz live-act ghost shell motiv live-act beauti beast .
1632,quiet saturday gerry!! pictur indi & jett think beauti beast time
1633,see beauti beast second time tonight.
1634,excit final see beauti beast tonight!!! curiou see peopl say they'v cried.
1635,‘boss baby’ ‘ghost shell’ debut ‘ beauti beast ’ eye third week #1 http:// ift.tt/2oe3id3
1636,im excit watch beauti beast omgggggg
1637,"daili box office: wednesday, march 29, 2017: beauti beast (2017) top wednesday' box offic $6.3… http://www. boxofficemojo.com/daily/chart/? ortdate=2017-03-29&utm_source=dlvr.it&utm_medium=twitt …"
1638,simpl way get emma watson' princess look beauti beast http:// dlvr.it/nmfvyf
1639,town: beauti beast http:// upflow.co/l/2rxc pic.twitter.com/cxpiualri
1640,beauti beast good wowowowoow
1641,think i'll watch origin beauti beast
1642,sooo excit see beauti beast tomorrow
1643,"""right are, love likewise."" xemeni held waist elegantli spun beauti beast shit, clearli excited."
1644,@krbirchfield look like librari beauti beast https:// twitter.com/alythuh/statu /745867074136846336 …
1645,omg beauti beast
1646,saw beauti beast today cri littl it' freak good
1647,#9: disney beauti beast offici movi merchandi tree life pendant necklace… https:// goo.gl/fb/bqxtex #religi #jewelri
1648,final persuad roddi go see beauti beast
1649,"#shortfilmreview beauti beast worthi watch, success music direction. however, edit rather choppy. (1/2)"
1650,beauti beast https:// twitter.com/femaletexts/st atus/847549747334270976 …
1651,desper need see new beauti beast
1652,thought live action remak disney’ beauti beast http:// prettyinbabyfood.com/2017/03/30/my- thoughts-on-the-live-action-remake-of-disneys-beauty-and-the-beast … pic.twitter.com/dilsjwgwl
1653,beauti beast next level magic shit
1654,kept composur beauti beast turn back human . celin dion play credit gone
1655,"emma watson: sing beauti beast terrifi thing!! me, sat besid paig o'hara shrine: it' can't, emma"
1656,@planetjedward watch beauti beast second time made love even that' possibl
1657,plea don't leav me. love you. –bell ( beauti beast )
1658,beauti beast - cover matt bloyd jessica sanchez https:// youtu.be/pzyrwuyzq1 via @youtub
1659,beauti beast magic
1660,beauti beast alway bring mani deep emot me. turn phone now. see afterward. @alamodenv
1661,do! maar eerst morgen beauti beast
1662,sob beauti beast
1663,""" beauti beast "" theori perfectli explain plot hole http:// fb.me/1dnzzkgz5"
1664,'boss baby' 'ghost shell' debut ' beauti beast ' eye third week #1 http:// dlvr.it/nmft3n
1665,naiyak ako sa beauti beast !
1666,'boss baby' 'ghost shell' debut ' beauti beast ' eye third week #1 http:// dlvr.it/nmft0z
1667,'boss baby' 'ghost shell' debut ' beauti beast ' eye third week #1 http:// dlvr.it/nmfsyt mark n tompkin
1668,wanna see beauti beast good
1669,beauti beast goooood
1670,beauti beast cupcak avail friday saturdays! #beautyandthebeast … https://www. instagram.com/p/bsrrr2efr7t/
1671,"jame corden bell "" beauti beast "" amaz https:// twitter.com/crudes/status/ 847290645534330880/video/1 …"
1672,beauti beast good
1673,someom plea take see new beauti beast time fave need see
1674,awww beauti beast good
1675,set done beauti beast . open night tomorrow! get tickets! #athenaeum #btindiana pic.twitter.com/kyeuk49jyj
1676,beauti beast finallyy!
1677,biggest regret highschool .. listen ms.p mr.hall beauti beast lazi
1678,time blatant self promotion! recent review remak beauti beast well raw. http:// samrakowski.com/2017/03/30/raw -review/ …
1679,snuggl n get sleep new beauti beast pjay #ataleasoldastim pic.twitter.com/kxbd1cgmsa
1680,wow beauti beast beat power ranger everyth
1681,"join us saturday beauti beast celebration! hear story, sing your… https://www. instagram.com/p/bsrrig8hesk/"
1682,like @youtub video http:// youtu.be/ivgxwmnptwg?a ♪ beauti beast music - anim parodi song
1683,still need see beauti beast !!!
1684,imma go see beauti beast today
1685,got beast! beauti beast charact you? | quiz https:// ohmy.disney.com/quiz/2015/10/1 0/quiz-which-beauty-and-the-beast-character-are-you/ …
1686,see beauti beast make life significantli pleasant.
1687,i'm hear lot beauti beast band hall though
1688,outfit view beauti beast last night! absolut beauti movie!… https://www. instagram.com/p/bsrraj2fyhv/
1689,pit stop way home final see beauti beast !
1690,ha gustado un vídeo de @youtub de @toysgamesvideo ( http:// youtu.be/lyzcxefaemw?a - toy r us beauti beast super toy hunt lol
1691,beauti beast trailer parodi (ft. king bach & pooch hall) | shay ... https://www. youtube.com/watch?v=q6yiio up1ls&feature=shar …
1692,like @youtub video @warpzonetweet http:// youtu.be/tzkgj8r2cgy?a beauti beast facebook
1693,beauti beast disappoint good movi
1694,need see get beauti beast
1695,actual can't get much love beauti beast
1696,shittest week ever can't wait go see beauti beast saturday
1697,"go see power ranger her, come see beauti beast @tomasssilli"
1698,someon get beauti beast dvd come
1699,swamp thing ivy: #dc 's beauti beast https:// twitter.com/dcworldswampy/ status/847210683389411328 …
1700,'boss baby' 'ghost shell' debut ' beauti beast ' eye third week #1 pic.twitter.com/tl30grlbmp
1701,"deadpool music - beauti beast ""gaston"" parodi https:// youtu.be/ptkgrecpi1i via @youtub"
1702,beauti beast beauti
