3648,"salah satu terjemahan yang salah di film beauti beast waktu di bioskop adalah, harpsichord diterjemahin jadi piano."
3649,anyon wanna watch beauti beast me????
3650,watch beauti beast
3651,total wasn't listen sound track beauti beast ...
3652,readi beauti beast #beourguest #movietim pic.twitter.com/nqnr1vtjpo
3653,beauti beast (2017) es hermosa; aún estoy fascinada con la escenografía la fotografía. e n c n ó
3654,realli need go see beauti beast even though alreadi seen
3655,"ahahahah shit, ok didn't realiz power ranger - it’ either beauti beast power... https:// tmblr.co/zpqqjr2k5vwiw"
3656,like @youtub video @thefamilyfudg http:// youtu.be/sa7jbvbxfnq?a march favorit || banana beauti beast !
3657,so...did zack snyder shadow-direct beauti beast ? liter couldn't see thing scene #toodark
3658,awesome! watch beauti beast without go theater free! thank dragon box!!!!... http:// fb.me/cmur4tsh
3659,cada vez que escucho beauti beast pongo llorar liter
3660,takd sape ke nak teman aq tgk beauti beast
3661,seen new beauti beast yet? read latest blog find i'v learn great … http:// ift.tt/2od0l2g pic.twitter.com/uxewsjbgn7
3662,like @youtub video http:// youtu.be/fx9vkm_vlak?a beauti beast cappella medley | byu vocal point ft. lexi walker - 4k
3663,"""haha, i'd bang him""- sister, 30/03/17, 18:03, talk specif beast form beauti beast"
3664,famili went see beauti beast that' hope go
3665,"final found english soundtrack new beauti beast movie. much watch movie, smile won't drop."
3666,wanna see beauti beast bad
3667,beauti beast worth watch second time
3668,fresh hot 'cast ep we'r get mad emo abt og beauti beast week!!! https:// twitter.com/iconicpodcast/ status/847494518865666048 …
3669,beauti beast tale old time hd https:// youtu.be/xduhinw3sp via @youtub
3670,semua pakat tengok beauti beast ... kkkkkk
3671,beauti beast love.
3672,moral beauti beast : suara sedap apa pun boleh
3673,patutnya aku ajak geng ni layan beauti beast
3674,ya tohannn tengok cartoon ni teringat yang real person tadi even need rewatch beauti beast !!!!!
3675,bright side im see beauti beast tonight yay
3676,want watch beauti beast .. mom doesn't like watch movies.. @nabisonyeol hello let go movi date.
3677,"beauti beast everywh moment, inspir brilliant nails. some... http:// fb.me/4tdxtedxw"
3678,beauti beast . beauti work @typewa __ featur @thedailytyp … http:// dlvr.it/nm9hsl #typographi #design pic.twitter.com/6ko8cwc2wx
3679,"show tomorrow: beauti beast , time lives, kong: skull island reservoir dogs. pic.twitter.com/deg6wh2ve4"
3680,cinema clips: beauti beast http:// dlvr.it/nm9hbi pic.twitter.com/xfqhhs6k6r
3681,put unnecessari scene live-act beauti beast peopl hate it. doesn't work.
3682,im mood watch beauti beast ... more.
3683,beauti beast housemate..last outing dgn kak jan n kak… https://www. instagram.com/p/bsrrynlbtmvg gklkf6gou-5bf_rcbjlg1ut3uu0/ …
3684,beauti beast
3685,current sat alon movi theatr see beauti beast . #dedic #imsoexcit
3686,beauti beast rose crown felt floral crown http:// pinterest.com/pin/1825365911 27715607/ …
3687,i'd pretti stoke see someth beauti beast inspir @mannymua733
3688,guest break format 2 discuss love beauti beast (1991) & share thought reboot https:// soundcloud.com/user-363724713 /our-most-topical-episode-yet …
3689,beauti beast bikin baper. padah udh ditonton 2x aaaa
3690,beauti beast soundtrack abl listen past week amazingli done
3691,clearfield jr./sr. high' ' beauti beast ' open tonight. http://www. theprogressnews.com/news/local/cl arfield-jr-sr-high-s-beauty-and-the-beast-opens/article_fda12713-6f03-55ad-b59c-8a92339e768a.html … pic.twitter.com/ybi0kkrwpk
3692,‘ beauti beast ’ clock $400m+ overseas; global box offic $751m http:// ift.tt/2ofdfdp #hollywood
3693,new beauti beast movi lit https:// youtu.be/jcgvxr4m8t0
3694,magandang altern sa kape yung beauti beast hahahahha nagfafangirl habang nagplapl yasss new achievement!
3695,sorri spam sebab mmg gila-gilakan beauti beast dari kecik sampai zaman degr pun tenguk lagi
3696,castl hotels: ' beauti beast ' fairyt http:// edition.cnn.com/2017/03/30/hot els/best-castle-hotels/index.html …
3697,beauti beast
3698,"beauti beast (from "" beauti beast ""/offici video) https://www. youtube.com/watch?v=axysr 0kg6k&feature=shar …"
3699,im gonna go see beauti beast tomorrow
3700,alreadi watch beauti beast
3701,"live-act beauti beast music good. dan steven sing ""evermore"">>>>>"
3702,done watch beauti beast
3703,"marquei toda série "" beauti beast (2012)"" como vista http:// bit.ly/neifmh #bancodeseri"
3704,beauti beast
3705,saw beauti beast last night ye sang everi song ye also cri heart couldn't happier
3706,vote #arianagrand & #johnlegend “ beauti beast ” #mashup @radiodisney
3707,wanna see beauti beast
3708,[hd/720p] smrooki koeun ft doyoung - beauti beast https://www. youtube.com/watch?v=crb5b3 u0_ce&feature=shar …
3709,im go see beauti beast im excit
3710,[hd/720p] smrooki koeun ft doyoung - beauti beast http:// ln.is/www.youtube.co m/zfrke …
3711,oh.. rupanya beauti beast old version happi end xda unsur lgbt
3712,it' time see beauti beast .
3713,"ntar kita jadi pasangan beauti beast , ofc lu beastnya"
3714,"tell i'm period bc start cri watch ""jame corden bell beauti beast """
3715,dan steven beast beauti beast blend...so sloppy..i think gonna stick cartoon version.
3716,like @youtub video @mca_mu http:// youtu.be/a0axptxjwie?a beauti beast - ariana grand & john legend (cover elha
3717,im okay abl watch beauti beast
3718,girl saw beauti beast week. love let experi classic theatre.... http:// fb.me/6ib7i8z4u
3719,young girl' respon see beauti beast save day http:// buff.ly/2ocolna pic.twitter.com/qazvwcism5
3720,appar fake love beauti beast soundtrack. happen? pic.twitter.com/qnpgtonsww
3721,beauti beast thankyou belanja! (@tgv bukit raja) https://www. swarmapp.com/c/1lbhabylnp2
3722,disney tsum tsum - march 2017 - bambi collect beauti beast bag set: http:// youtu.be/ieqbtholkpm?a via @youtub
3723,listen beauti beast soundtrack studi library.... judg
3724,nostalg habi bila tenguk beauti beast . teringat zaman kanak-kanak tenguk disney movi
3725,"guest (from "" beauti beast ""/audio only) https:// youtu.be/9qq__xruf3i via @youtub"
3726,ad video @youtub playlist http:// youtu.be/7-bu9-h6hw8?a beauti beast - ido media ft. nadia khristean & corey mann
3727,beauti beast truli masterpiec love ittt
3728,beauti beast chipotle... @gjh40 https:// twitter.com/chelseywebb3/ tatus/847492126275391492 …
3729,kakak nak balik . boleh ajak tengok beauti beast
3730,super excit see beauti beast tonight!!! #disney #inspir #beautyandthebeast https://www. instagram.com/p/bsrrvohh3mv/
3731,realli love beauti beast soundtrack
3732,absolut love new beauti beast movie. childhood favorit movi came life i'm liter aww.
3733,beauti beast ! https:// soundcloud.com/user310637994/ nice …
3734,"beauti beast (2017) worldwide: $744,867,333 distributor: buena vista pic.twitter.com/htwbib11bo"
3735,"esperándola sin má (de ""la bella la bestia ( beauti beast )""/au... https://www. youtube.com/watch?v=clqitj rr3ai&feature=shar …"
3736,hahahahah bunga beauti beast kan tu
3737,beauti beast ♡
3738,new beauti beast sooooo good
3739,im actual extrem excit watch beauti beast !!!! bought ticket alreadi and.... what?
3740,that' felt saw beauti beast !
3741,box office: ' beauti beast ' earn $750m worldwid http:// ift.tt/2od7iuj
3742,‘ beauti beast ’ clock $400m+ overseas; global box offic $751m http:// deadline.com/2017/03/beauti -and-the-beast-crosses-400-million-overseas-750-global-box-office-1202055875/?utm_source=dlvr.it&utm_medium=twitt …
3743,‘ beauti beast ’ clock $400m+ overseas; global box offic $751m http:// dlvr.it/nm9b8j
3744,‘ beauti beast ’ clock $400m+ overseas; global box offic $751m http:// deadline.com/2017/03/beauti -and-the-beast-crosses-400-million-overseas-750-global-box-office-1202055875?utm_source=dlvr.it&utm_medium=twitt … pic.twitter.com/grec9zb33a
3745,someon take watch beauti beast
3746,deadline: ‘ beauti beast ’ clock $400m+ overseas; global box offic $751m http:// deadline.com/2017/03/beauti -and-the-beast-crosses-400-million-overseas-750-global-box-office-1202055875?utm_source=dlvr.it&utm_medium=twitt … pic.twitter.com/zxchv93imi
3747,beauti beast brother. ain't shame game.
3748,‘ beauti beast ’ clock $400m+ overseas; global box offic $751m http:// dlvr.it/nm9ztj pic.twitter.com/s3ktmxwiki
3749,‘ beauti beast ’ clock $400m+ overseas; global box offic $751m http:// deadline.com/2017/03/beauti -and-the-beast-crosses-400-million-overseas-750-global-box-office-1202055875?utm_source=dlvr.it&utm_medium=twitt … pic.twitter.com/lmnts3l5yi
3750,‘ beauti beast ’ clock $400m+ overseas; global box offic $751m http:// dlvr.it/nm9ztr pic.twitter.com/54s9f9a3ka
3751,‘ beauti beast ’ clock $400m+ overseas; global box offic $751m http:// dlvr.it/nm9zvi pic.twitter.com/mxifgpzejt
3752,box office: ' beauti beast ' earn $750m worldwid https:// goo.gl/m0wuda
3753,fell love beauti beast
3754,one belle' ' beauti beast ' outfit made vintag wool bought ebay https:// read.bi/2ogrip7 via @bi_contributor
3755,"one best friend book vue extrem ticket beauti beast tomorrow, say don't worri pay :')"
3756,huurmmm esok larat tak nak g tgok beauti beast ... ?
3757,box office: ' beauti beast ' earn $750m worldwid http:// ift.tt/2od7iuj #yycwalk
3758,someon pl visit kl take cinema watch beauti beast tgt pl iz sad
3759,hello everyon watch beauti beast beauti heart full love everyon everyth
3760,box-off preview: 'baby' muscl ' beauti beast ' http:// buff.ly/2ocqyuq
3761,"feel like cover soon, perhap someth beauti beast ."
3762,beauti beast done download
3763,esok beauti beast dgn byond. hahaha . pat kit sampai kontan yond . aku tunggu ni.
3764,gostei de um vídeo @youtub http:// youtu.be/wihwzauimz8?ama ísa lacerda - moment last forev ( beauti beast ) - cover
3765,"saw beauti beast twice wouldn't mind watch again, i'm readi"
3766,beauti beast - guest [high quality] https:// youtu.be/afzmwakuppu via @youtub
3767,#win iphon 7! i'm enter beauti beast sweepstak disney magic kingdoms! https:// wn.nr/hs4scl
3768,"beauti beast (from "" beauti beast ""/offici video) http:// ln.is/www.youtube.co m/fkdnr …"
3769,watch video @jkcorden perform bell beauti beast middl zebra cross made day
3770,#beauti _ _ the_beast sing-a-long * costume's* activ * storytim april 1 @11am pic.twitter.com/pjfvrhfpq1
3771,sumpah mid sabtu beauti beast dah full
3772,beauti beast addict
3773,"save date beauti beast bounc come thursday, april 6th. access ticket here: http:// bit.ly/1t8u4x4 #paramu #njkid pic.twitter.com/3e5xvssivc"
3774,"day school mean go out, take kiddo see beauti beast #kiddo … https://www. instagram.com/p/bsrqyuwgjhu/"
3775,went beauti beast without me...
3776,dr. keller beauti beast time favorit doctor sure! #nationaldoctorsday #batb https:// twitter.com/pscoordsen13/ tatus/847478418673287170 …
3777,"beauti beast theatres. peopl wear thin, metal rim glasses. time-travel reagan' america."
3778,pump see beauti beast tonight
3779,said beauti & beast relat learn & put hate us i'm laugh hard @joshuadtown pic.twitter.com/dmroqh2u7q
3780,"beauti beast amazing, proud @emmawatson"
3781,beauti beast - thai pop version https://www. youtube.com/watch?v=mxi1b8 ldkmo&feature=shar …
3782,want someon go beauti beast laugh cri
3783,finish watch beauti beast think i'v never love emma watson
3784,tak expect pulak aku menangi tengok beauti beast
3785,beauti beast
3786,beauti beast sr best dah la princ sem
3787,wanna see beauti beast bad
3788,wanna go movi sat sunday watch power ranger beauti beast . someon come get chipotl somethin
3789,want go see beauti beast me?
3790,castl hotels: ' beauti beast ' fairyt - http://www. usnewsheadlines.net/castle-hotels- your-own-beauty-and-the-beast-fairytale-2/ …
3791,late beauti beast but... worth naman ang pagpili ko ng last full show kesa sa pagtulog! slow clap gay
3792,#8: disney beauti beast rose glass dome silver plate pendant necklace: disney… https:// goo.gl/fb/zejq12 #necklac #pendant
3793,nak tengok beauti beast
3794,"it' cool get readi work listen beauti beast soundtrack, right?"
3795,gay scene beauti beast yg kecoh nak mampu tu turn 2 sec scene two men danc together. pic.twitter.com/e9wnu5xskz
3796,beauti beast soundtrack. #nohomo
3797,biasa² je beauti beast tu.. tapi sebab dia puaskan hati adik² aku.. dan pelakon dia lawo giler.. thumb lah..
3798,"watch "" beauti beast "" soooo sweet stori bell very… https://www. instagram.com/p/bsrqi9kja6_/"
3799,beauti beast best princess remak realiti . truli best . beauti n touch . love much
3800,want watch beauti beast
3801,readi beauti beast !!! pic.twitter.com/4syqz9tyui
3802,"review! subjective, poorli written, super long rant beauti beast xd https:// boxd.it/fzjq1"
3803,beauti beast (origin motion pictur soundtrack/delux edition) http:// dlvr.it/nm9tgc
3804,beauti beast amaz expect
3805,addicted! ♫ beauti beast ariana grand & john legend — https:// path.com/p/38s7g0
3806,‘the boss baby’ ‘ghost shell’ fight second behind unstopp ‘ beauti beast ’ http:// buff.ly/2oc6czc
3807,"beauti beast (minor key version) - chase holfelder, kh cover https://www. youtube.com/watch?v=9_6hnn dvwke&feature=shar …"
3808,beauti beast . one word. awesome.
3809,done beauti beast !
3810,"jeff victor #23: bell first saw beauti beast kid, bell revelation. disney... http:// fb.me/1x5ywhi30"
3811,also aesthet begin beauti beast ... make up...
3812,"beauti beast , like beast high school music"
3813,"gustó un video de @youtub http:// youtu.be/ptkgrecpi1i?a deadpool music - beauti beast ""gaston"" parodi"
3814,"gustó un video de @youtub http:// youtu.be/ptkgrecpi1i?a deadpool music - beauti beast ""gaston"" parodi"
3815,crosswalk musical: beauti beast - words! https://www. youtube.com/watch?v=nu4pz olyhg&feature=shar …
3816,win ticket new beauti beast movi program afternoon. pic.twitter.com/2pbqzgc8lo
3817,box office: ' beauti beast ' earn $750m worldwid http:// dlvr.it/nm9rj9 pic.twitter.com/bl6sefvekw
3818,princessi shit beauti beast decent realli went emma watson lol
3819,see beauti beast space us gay???
3820,id like danc beauti beast . make wed dance.
3821,watch~ beauti beast - 1991 full movi watch -} http:// cutt.us/hnqzg pic.twitter.com/kiq7tqxpoy
3822,فلم beauti beast .. جميل pic.twitter.com/10j2uo5ib1
3823,narinig ko na naman yung beauti beast
3824,mi è piaciuto un video di @youtub da @cimdrp : http:// youtu.be/gyobm8juz-a?a queerbait beauti beast || parità pillol #55
3825,aw beauti beast amaz
3826,"siapa yang dah tengok beauti beast tu plea jgn spoil org yg mood nk tengok ni , plea okay please."
3827,beauti beast
3828,need go see beauti beast
3829,watch beauti beast (with danar ambar nurul tartilah @cinema21 ) — https:// path.com/p/hkdxr
3830,happi birthday favorit littl fish! can't wait watch beauti beast tonight ana! pic.twitter.com/pgdoxghxbu
3831,omg absolut favourit beauti beast
3832,give 9 10 beauti beast
3833,bought beauti beast sound track came score. best deci day.
3834,beauti beast damn good
3835,see beauti beast
3836,box office: ' beauti beast ' earn $750m worldwid http:// dlvr.it/nm9q7j pic.twitter.com/brlvere480
3837,like @youtub video @xbenqcatx http:// youtu.be/u496dsv2k_g?a beauti beast trailer 2 - 1991 vs 2017 comparison/sid side
3838,watch beauti beast
3839,emma watson * beauti beast * costum made eco-friendli http:// dlvr.it/nm9phf #fashionfil
3840,beauti beast awesom
3841,emma watson * beauti beast * costum made eco-friendli http:// dlvr.it/nm9pwn #fashionfil
3842,beauti beast fuck good
3843,นี่แบบวนอยู่กับ beauti beast ทั้งวันทั้งคืนฮือออออออ หยุดฟังเพลงไม่ได้เลยอ่ะ
3844,one favorit detail beauti beast inspir invit suit rose… https://www. instagram.com/p/bsrqf0kalfu/
3845,@iamcheesethief gonna go cinema can't decid watch. beauti beast kong skull island??
3846,"beauti beast 1 minute! @miranda bravo bravo, encor encor xxxx https:// youtu.be/k-ymkwhuvwu"
3847,nak tengok beauti beast jealousnyaaa saliah dah tengok
3848,giveaway // beauti beast chip https:// goo.gl/gxct4x pic.twitter.com/jfiynco8du
3849,gusto ko ulit panoorin yung beauti beast !
3850,beauti beast #cergi #essec #beatyandthebeast #relax #sun #chill #weekendsoon https://www. instagram.com/p/bsrp__adij9/
3851,"pirat 5, deadpool 2 beauti beast ? stfu dont love romantic' movi"
3852,"yay, it' time beauti beast !! @forox"
3853,go see beauti beast saturday i'm :d
3854,wanna see beauti beast
3855,"jame corden bell "" beauti beast "" best thing i'v seen day https:// twitter.com/crudes/status/ 847290645534330880/video/1 …"
3856,$9.49 beauti beast (origin motion pictur soundtrack) http:// amzn.to/2mk1snr retweet #cd #vinyl #music pic.twitter.com/mrj2w3lap1
3857,#nowplay ariana grand — beauti beast helita sousa ♫ http:// spoti.fi/2mthto
3858,castl hotels: ' beauti beast ' fairyt @cnntravel https:// cnn.it/2ob8u1p one castl dalian
3859,beauti beast stun second time round @beourguest
3860,rate beauti beast : 6/10 beast charact turn real human exciting. it.
3861,"beauti beast filem yang best, cuma agak terganggu dengan orang di depan yang macam cace kepanasan bila... http:// fb.me/3slb4krq"
3862,auftrag: beauti beast -spotlight schreiben. ergebnis: 12.100 zeichen gesellschaftskritik und noch nicht fertig.
3863,boycot beauti beast - oddlandish http://www. oddlandish.com/7/post/2017/03 /to-those-boycotting-beauty-and-the-beast.html …
3864,"watch beauti beast one time , i'm go scream"
3865,ayaw na ko lubayan ng beauti beast
3866,"logat emma watson masih terdengar british, mengingat settingnya seharusnya… ★ beauti beast (w/ fadli) — https:// path.com/p/1kopuv"
3867,"like @youtub video http:// youtu.be/ptkgrecpi1i?a deadpool music - beauti beast ""gaston"" parodi"
3868,beauti beast dulu mnggu nie. mnggu dpn saatbi dinantikan… https://www. instagram.com/p/bsrpwt8dbeeo smrjt2dsdzzzbmht1giidy7e3u0/ …
3869,beauti beast - gaston https:// youtu.be/vujtqmpbni0 via @youtub
3870,beauti beast versi indonesia
3871,beauti beast main theme celin dion/peabo bryson >>>>>>>>>>>>>>>>>>> ariana grande/john legend. even close
3872,cannot wait beauti beast dvd. need watch again.
3873,even french professor yell @me see beauti beast yet
3874,teringat meliat movi tadi.. beauti beast ..tahan2 ni mcm x move on..sbb endingnya kencing... http:// fb.me/1zbazjuhi
3875,im gonna watch beauti beast final cinema
3876,live action beauti beast soo mani poc it!!!! made happy!!
3877,beauti beast bomb. like seriouslli reliev my… https://www. instagram.com/p/bsrprughatvg te7whg_2catm3oywhvqwxwry7y0/ …
3878,j'aim une vidéo @youtub de @knmosca - guest - beauti beast - disney ragtim piano cover http:// youtu.be/ogkcpk56tci?a
3879,nw: beauti beast :)
3880,"new review elle, get beauti beast http://www. greercn.wordpress.com #getoutmovi #ell #beautyandthebeast"
3881,beauti beast pic.twitter.com/5r56fcz0fr
3882,go see beauti beast :))
3883,beauti beast sugoii ne
3884,can't wait see beauti beast !!!!!!!!!!!!!!!!
3885,moral story: everi guy beast woman -alex beauti beast
3886,' beauti beast ' final offici trailer (2017) | emma watson https:// youtu.be/fymxig0xlwc via @youtub
3887,membuak buak pulak rasa nak tgk beauti beast zzzzzz
3888,cinema wait see beauti beast ! : )
3889,"maaaan guys, beauti beast broke mid valley."
3890,nk g tgk beauti beast .. beastnya ada beautyni takde..
3891,"harri potter, suicid squad, beauti beast"
3892,last part beauti beast cutteeeee. princ freak growl smexyly.
3893,hype make wanna see beauti beast
3894,best beauti beast joke i'v heard https:// twitter.com/libyaliberty/ tatus/847172526245646336 …
3895,"ad top hit indonesia spotify: "" beauti beast - "" beauti beast """" ariana grande, joh… http:// ift.tt/2kwod3h pic.twitter.com/juufphqgpx"
3896,beauti beast ミュージカルたのしみ！！ https://www. instagram.com/p/bsrpexdj7fs/
3897,beauti beast 2017 (reseña) http://www. mamaxxi.com/beauty-and-th -beast-disney-opinion/#.wn01tfgjqwm.twitt …
3898,nak ajak siapa ekk tengok beauti beast ?
3899,ehh takpe2. kita tgok beauti beast . okay?
3900,go see beauti beast w one best friends!
3901,"céline dion - moment last forev (from "" beauti beast ... https:// youtu.be/wnlsacldomq"
3902,also val beauti beast last year doubt they'll give
3903,still need catch this. love main guy beast beauti beast though
3904,best version ever beauti beast http:// fb.me/15wl1hfdf
3905,beauti beast 9/10! recommended!
3906,"tomorrow work day, we'r late. but, it' worth see beauti beast . pic.twitter.com/wvc6ay7itj"
3907,see beauti beast tonight
3908,beauti beast live stage - disney' hollywood studio - walt disney world resort https:// youtu.be/snrdphmma0c
3909,nak tengok beauti beast
3910,mind boggl film guy — watch beauti beast
3911,"si aún la viste, en el blog reseña opinión de beauti beast !... http:// fb.me/22kes5cr1"
3912,make adam go see beauti beast lol lol #excitedboyfriend
3913,لم تذهب لكوريا الجنوبية قط ولديها هناك ٥ اغاني وصلت للمرتبة الـ١# bang bang best mistak santa tell beauti beast problem pic.twitter.com/4dvdvw6jko
3914,excit round 2 @killowentweet beauti beast jr 17 #proud #talentedkid pic.twitter.com/fsf8wgphnu
3915,mind-blow beauti beast theori may final answer major question https://www. google.com/amp/amp.timein c.net/time/4715468/beauty-and-the-beast-time-loop-theory/%3fsource%3ddam …
3916,beauti beast
3917,"beauti beast movie, magnifique, absolut masterpiece, @disneystudio amazing, actor perfect,u shld see"
3918,watch hercul beauti beast instead
3919,see beauti & beast adult suck lol i'm go sit back forget past shitti 2 week x pic.twitter.com/iqr97ncyqg
3920,mob song beauti beast art
3921,new disney beauti beast movi http:// giveawaybandit.com/new-disney-bea uty-and-the-beast-movie/?utm_source=reviveoldpost&utm_medium=social&utm_campaign=reviveoldpost … @giveawaybandit
3922,#thursdaythought beauti beast realli ladi sex romanc sasquatch? dad ted nugent? stink here.
3923,beauti beast round 2
3924,go drake' album beauti beast real quick
3925,paulit-ulit na sa utak ko yung kanta sa beauti beast . lintek di ako makatulog
3926,#tbt stori beauti beast meet fair ladi meet everi fear onlin date http:// trib.al/6imivsw
3927,watch beauti beast omg emma watson she' perfe-... cant even #girlcrush
3928,beauti beast come
3929,⌂ lego brickheadz 41595 bell 41596 beast disney beauti beast ne... http:// ebay.to/2o7jf5 pic.twitter.com/olntxhw1ra
3930,"""tunggu lepa spm la pulak tgk beauti beast tu"" me: okey *sambungkdrama"
3931,one favorit detail design beauti beast inspir invitation… https://www. instagram.com/p/bsrpisnahcq/
3932,like @youtub video http:// youtu.be/syyco0qvkzo?a beauti beast stockholm syndrome?
3933,mom want go see beauti beast ..
3934,beauti beast durat movi berapa lama ??
3935,like beauti beast
3936,beauti beast summer camp ask multi famili discount! http:// fb.me/3rcjultx4
3937,im watch new beauti beast third time
3938,movi preview review ep 274 - beauti beast http:// ow.ly/w4hz30ap3on
3939,movi preview review ep 274 - beauti beast http:// ow.ly/zpvv30ap3zk
3940,i'm also watch beauti beast
3941,"meu deus, você entendem meu nível de desespero? eu ouço música beauti beast e já quero chorar"
3942,first time tido masa tgk cter lam cinema....mngantuk namateyi tgk cter beauti beast
3943,"90 movi bracket complet toy stori come top anim film "" beauti beast ""."
3944,beauti beast day
3945,beauti beast . take
3946,classic music stories: beauti beast https:// ifmermaidsworesuspenders.com/2017/03/30/cla ssical-music-stories-beauty-and-the-beast/ … via @wordpressdotcom
3947,https://www. youtube.com/watch?v=71jb7p jvex … best cover beauti beast @iamleroysanchez
3948,beauti beast es la mejor película de el mundo
3949,see power ranger boy tonight complet transpar wish go see beauti beast
3950,"first 15 minut watch beauti beast : ""hah?? apaan sih nih?? "" nyebelin emang *so sorri fan"
3951,"*busca su vestido para bailar* beauti beast (from "" beauti beast ""/offici video) https:// youtu.be/axysre0kg6k?li st=plrenwor732-d67iteoi6dpdjh1opjaujt …"
3952,"beauti beast (them "" beauti beast "") [duet peabo bryson] céline dion — https:// path.com/p/1gindd"
3953,show beauti beast rate pg show time wednesday & thursday 12:30pm & 7:00pm monday - friday... http:// fb.me/1fyglq7l
3954,okay impress beauti beast
3955,tak sabarrrrr nak tgk beauti beast esokkk aaaaaaaa
3956,nak tengok beauti beast
3957,"beauti beast (@golden screen cinema (gsc) shah alam, selangor) https://www. swarmapp.com/c/0vhcobunegh"
3958,"guest (from "" beauti beast ""/audio only) https://www. youtube.com/watch?v=9qq__x ruf3y&feature=shar …"
3959,box office: ' beauti beast ' earn $750m worldwid via @forb http://www. forbes.com/sites/scottmen delson/2017/03/30/box-office-beauty-and-the-beast-has-now-earned-750m-worldwide/#2664380342ec …
3960,work tuesday nice even main girl @shellsnead watch beauti beast tea..noth better
3961,awww mannn wanna go see beauti beast
3962,best part beauti beast part lumièr sang 'be guest'
3963,previou on: beauti beast https:// youtu.be/2nvh-1qf75a via @youtub
3964,beauti beast 8.0 3/19/17
3965,mak aii beauti beast pun ada lipstick ni haihh bottl ke lipsticks? auchhh hard deci betul hewhew
3966,realli want go see beauti beast
3967,"watch last episod #legionfx (for year, boo) beauti beast today. it' @thatdansteven kind day."
3968,absolut love beauti beast (minu beast solo)
3969,realli want see beauti beast
