2667,""" beauti beast "" rise #1 (+7) south korea' intern gaon chart week! @arianagrand 's fifth #1 chart. pic.twitter.com/mzv1mmqamm"
2668,beauti beast http:// dlvr.it/nmcnhp pic.twitter.com/2ugk25i0jf
2669,need see beauti beast asap
2670,watch beauti beast absolut love it! #cinema #film #fairyt
2671,"doubt will! lol! do, deal! i'll go see beauti beast theater see me."
2672,"nick pitera sing ""belle"" beauti beast | oh disney โคตรเก่งง คนเดียวเปลี่ยนเสียงได้หลายเสียงมากก https:// youtu.be/jrkpzhamgwk"
2673,beauti beast favorit person world today
2674,"#np "" beauti beast "" >> @justinbieb ☓ @nickiminaj"
2675,beauti beast time!!!!
2676,ashl won't let great take see beauti beast !!
2677,"whole movie, beauti beast , total ruin human 'beast' rawr last 30 sec sooooo cring"
2678,beauti beast
2679,beauti beast cute movi pic.twitter.com/zf5mivhq7k
2680,"i'm cinemex platino beauti beast san andré cholula, puebla https://www. swarmapp.com/c/0befitt3tqp pic.twitter.com/uz3qgxzt5i"
2681,one new life goal enact whole ariana song beauti beast man sing far better john legend ikr
2682,got invit go see beauti beast
2683,want see new beauti beast
2684,"you'r look seriou look beauti beast , check actual scene movie: https:// youtu.be/nu4pzsolyhg"
2685,realli wanna see beauti beast
2686,i'm disappoint see beauti beast yet
2687,"e essa capa maravilhosa livro "" beauti beast "" feita pela @minalima ? quero sim ou claro?"
2688,beauti beast byk sgt nanyi. think kenot..
2689,want see beauti beast
2690,honestli cant get sunset beauti beast good
2691,"keep think thing beauti beast miss bollywood flare romant drama. drawn sexual tension,eg"
2692,gustó un video de @youtub http:// youtu.be/q6yiioup1ls?a beauti beast trailer parodi (ft. king bach & pooch hall) | shay
2693,realli want go see beauti beast
2694,watch beauti beast
2695,@emmawatson saw beauti beast today. incr emma. thank moment. love much.
2696,contribut seminar today tell peopl beauti beast best movi ever & everyon go see it... a+
2697,see beauti beast ? check personali bell tee http:// fb.me/8bdydvmdc
2698,scusat quanto è bella evermor di beauti beast ?
2699,beauti beast - collabro https:// youtu.be/mb5ce4ppr8c via @youtub
2700,need watch beauti beast get home. got date power ranger
2701,girl cinema watch beauti beast . time continu bourbon tale part 2 @bourbong
2702,"bell star upcom product beauti beast . est trè belle, non? sophia,... http:// fb.me/wq70dayj"
2703,beauti beast (2017) pic.twitter.com/gexnwsgeln
2704,disney' beauti beast (cover): http:// youtu.be/nwfyvpa-ex0?a via @youtub
2705,ik vind een @youtub -video van @mca_mu leuk: http:// youtu.be/a0axptxjwie?a beauti beast - ariana grand & john legend (cover
2706,rate beauti beast (2017) 8/10 #imdb solid movi love #beautyandthebeast http://www. imdb.com/title/tt2771200
2707,"yasss it' friday, can't wait saturday i'm go watch beauti beast friend"
2708,ad video @youtub playlist http:// youtu.be/ir2vn4trleo?a beauti beast - make way gaston!
2709,beauti beast one @nuaimi9
2710,go take beauti beast pure want go
2711,checkout latest news post : beauti beast magic help uk box offic surviv spring sunshin - guard… http:// ift.tt/2omgmo
2712,still haven't gone see beauti beast yet
2713,one thing say beauti beast
2714,btw i'm still beauti beast cutest movi i'v ever seen
2715,beauti beast cute
2716,can't wait watch beauti beast tomorrow
2717,final see beauti beast tonight yessss! who' seen it?
2718,"week talk make us nostalgic, logan, beauti beast , spider-man, justic league. link show @lwadpod pic.twitter.com/qt4cyjl4q"
2719,like @youtub video http:// youtu.be/mxfn65ce3nc?a evermor ( beauti beast 2017)
2720,nooo mi sto ancora riprendendo dal video di beauti beast
2721,"oh hey new beauti beast movie, gay one dude get? gaston hold hand rub donk anything?"
2722,beauti beast - make way gaston!: http:// youtu.be/ir2vn4trleo?a via @youtub
2723,beauti beast 《美女与野兽》 ……电影院…… http:// mmsns.qpic.cn/mmsns/v7t6azsz xgl3ldelajycexiby6oaxxm8oyfgibjeje8puk5y630iasdun8an1tzeqr8k90ltqmwlju/0 …
2724,mngantuk tgk beauti beast nii.mcm cerita hindustan daa.brnyanyii je lebihh
2725,want watch beauti beast
2726,oh god beauti beast was... mazinggg
2727,aurora beauti beast ...? pic.twitter.com/o9ze8cdai6
2728,want go cute date see beauti beast .
2729,beauti beast one loudest may right. one weak may wrong. pic.twitter.com/gyy59cr4k7
2730,final watch beauti beast ! quit like even dub song godaw part
2731,gua ingat beauti beast pun ok lagilah nak compare.
2732,think beauti beast @joe_liotti
2733,watch beauti beast ... listen whole list disney songs.
2734,definit rank emma' musicals: 1) emma stone (la la land) 1b) emma watson ( beauti beast ) 3) emma thompson (same 2)
2735,beauti beast - mari le princ de beaumont | fiction... #fiction &literatur http:// ebooks-free.jkmesh.com/post/159002494 418?utm_source=dlvr.it&utm_medium=twitt … #fictionampliteratur
2736,new photo relea tea new live-act beauti beast => http:// url9.co/akq
2737,wanna see beauti beast
2738,know name everi ' beauti beast ' character? => http:// url9.co/ajx
2739,beauti beast favorit
2740,beauti beast .
2741,might treat cinema trip saturday. housem gonna home beauti beast call name
2742,adicionei um vídeo uma lista de reprodução @youtub http:// youtu.be/a0axptxjwie?a beauti beast - ariana grand & john legend
2743,beauti beast
2744,uk box office: ' beauti beast ' near £40m http://www. screendaily.com/news/uk-box-of fice-beauty-and-the-beast-nears-40m/5116244.article#.wn1rhjxnqwe.twitt …
2745,beauti beast good!
2746,i'm upset bc seen new beauti beast yet.
2747,beauti beast time! super excit
2748,""" beauti beast ii: kiss rose"" #wattpad http:// my.w.tt/uinb/j2gfpa5xwb http:// my.w.tt/uinb/e9wbod5xwb"
2749,beauti beast unreal shaken guest mr pott lay kiss camera? u ok hun????
2750,like @youtub video http:// youtu.be/qpxh3v5cvii?a josh gad' kid terrifi face beauti beast
2751,saw new beauti beast movi last night i'm honestli still fuck shook core
2752,beauti beast still king box offic http:// bxffc.bz/2ody85l #disney #beautyandthebeast #usboxoff via @geektothech
2753,skip work watch beauti beast instead?
2754,watch: littl bell beast interview ' beauti beast ' live action cast cute http:// trib.al/5hwuacg
2755,"damnit! disney know weakness. @mcgregor_ewan aka obi wan new beauti beast . way around it, see now..."
2756,"checkout latest news post : box office: 'boss baby,' 'ghost shell' top ' beauti beast '? - varieti http:// ift.tt/2ofrvfd"
2757,beauti beast good film carnt stop pictur emma robert steal chanel bag bling ring still love
2758,could guy watch beauti beast low cinema
2759,hilari jame corden bell beauti beast .. http:// fb.me/1smxue33r
2760,damn two fav beauti beast & aladdin
2761,buy anyth beauti beast i'll love forev
2762,"ad video @youtub playlist http:// youtu.be/tpcxqpmbcsg?a dan steven - evermor (from "" beauti beast ""/audio only)"
2763,beauti beast pic.twitter.com/hbtyc0p7qr
2764,beauti beast beauti stori ! brought back sweet childhood memories!!
2765,castl hotels: ' beauti beast ' fairyt @cnntravel https:// cnn.it/2ob8u1p
2766,"quinceanera makeup, theme beauti beast https://www. instagram.com/p/bsrczijgjmm/"
2767,beauti beast movi disappoint !! great
2768,"kinda wanna go tonight, kinda wanna go see beauti beast"
2769,evermor - beauti beast (cover): http:// youtu.be/9xbtcdu1hpq?a via @youtub
2770,beauti beast good
2771,beauti beast 3.8/5 #kacangmovi
2772,beauti beast good omg
2773,beauti beast https:// soundcloud.com/shahlaa-kh/bea uty-and-the-beast …
2774,va ver beauti beast esto es lo que pasa pic.twitter.com/ogkwsniaai
2775,beauti beast keep get better better https:// twitter.com/dory/status/84 7500910490144769 …
2776,"week, south korea download chart #9(+93): beauti beast download count: 53,199 @arianagrand #arianagrand @johnlegend pic.twitter.com/i23sybhrgf"
2777,beauti beast best thing i'v seen long time
2778,saya suka video @youtub http:// youtu.be/fx9vkm_vlak?a beauti beast cappella medley | byu vocal point ft. lexi walker - 4k
2779,privat show beauti beast 3d
2780,miss sisters! saw beauti beast togeth wore freak awesom shirts… https://www. instagram.com/p/bsrcjspjrsj/
2781,i!!!just!!!want!!!to!!!see!!! beauti !!! !!! the!!!beast !!!oh!!!my!!!god!!!
2782,i'm honestli excit see beauti beast tonight might cri lmao fave princess
2783,poorli eldest work disney. snow white pretti slow dull love beauti beast (the original).
2784,still can't believ haven't watch beauti beast yet
2785,go see beauti beast today. childhood self freak inside. adult self tri let show.
2786,cri much beauti beast oh day
2787,"initi plan beauti beast au, turn differ haha"
2788,beauti beast
2789,"power ranger finished, 20 min get walk see beauti beast @emilyjwat ...top even"
2790,beauti beast dh ada cd cetak rompak padah bru keluar harini
2791,beauti beast https:// twitter.com/galwaygai/stat us/820421027373072384 …
2792,acabo de ver beauti beast encantó
2793,forgot mention saw beauti beast weekend... tbh felt kinda? messy?? best luke evan way better
2794,"beauti beast (minor key version) - chase holfelder, kh cover todavía supero esto https://www. youtube.com/watch?v=9_6hnn dvwke&feature=shar …"
2795,"magic even "" beauti beast "" pic.twitter.com/s1f9ry8csw"
2796,see beauti beast & power rangers.
2797,buzz go see beauti beast girl night tomoz fave
2798,ahh beauti beast good
2799,beauti beast
2800,"beauti beast , i'm glad littl girl watch #win"
2801,don't like ariana/john legend remak beauti beast . don't. never prefer angela lansbury' version.
2802,"like @youtub video http:// youtu.be/tpcxqpmbcsg?a dan steven - evermor (from "" beauti beast ""/audio only)"
2803,"shayn actual tweet said reason he' see beauti beast saturday emma watson, thank mate"
2804,seen remak beauti beast ? [purse: hot topic] pic.twitter.com/yvpwo5lxt9
2805,seen beauti beast ? @bookriot compil list librari could movie: http:// ow.ly/agew30appss pic.twitter.com/b4hhfdotqa
2806,beauti beast shit
2807,watch beauti beast onlin free | full movi https:// cartoonhd.cc/full-movie/wat ch-beauty-and-the-beast-2017-online-fr …
2808,watch jame corden beauti beast dead! hilarious!
2809,best thing you'll see today! haven't caught beauti beast yet...here' cliff note version... http:// fb.me/2mdcpfm2t
2810,"watch beauti beast nagina cinema, faislabad http:// fb.me/188wqgohb"
2811,"dan steven - evermor (from "" beauti beast ""/audio only) https://www. youtube.com/watch?v=tpcxqp mbcsg&feature=shar …"
2812,beauti beast 10/10 got emot scene
2813,like @youtub video http:// youtu.be/syyco0qvkzo?a beauti beast stockholm syndrome?
2814,like @youtub video @christendtweet http:// youtu.be/h2zvorotxke?a ariana grand beauti beast makeup tutori
2815,"inspir new ' beauti beast ' movie! ""someth there"" #smule : http://www. smule.com/p/179141931_11 52823777 … #singkaraok @beourguest"
2816,"there' one scene beauti beast wardrob fight the"" musketeers"" put dress one"
2817,"beauti beast paint ladi cabochon! grabs, comment sold want her. go in... http:// fb.me/7wbo97d5w"
2818,last night break histori class teacher get ask she' seen beauti beast teacher like pic.twitter.com/x8i0pqrnsa
2819,"power ranger beauti beast earli 90's, man"
2820,"ad video @youtub playlist http:// youtu.be/tpcxqpmbcsg?a dan steven - evermor (from "" beauti beast ""/audio only)"
2821,' beauti beast ' earn $750m worldwid (and still haven't seen it!) http://www. forbes.com/sites/scottmen delson/2017/03/30/box-office-beauty-and-the-beast-has-now-earned-750m-worldwide/#7c3d32a042ec …
2822,quem vou assistir beauti beast hoje de novoooo?
2823,"lwad game talk logan, power rangers, beauti beast , spider-man, justic league. whew that' lot pic.twitter.com/z2rnti44c6"
2824,anyway im tri see beauti beast
2825,#beauti #makeup ' beauti beast ' clock $400m+ overseas; global box offic $751m - deadlin http:// ow.ly/gt4x50axbz9
2826,"beauti beast met vriendjelief en tantelief (@pathé - @path rotterdam, zuid-holland) https://www. swarmapp.com/c/80dawvsgre3"
2827,conchita go beauti beast day!! how' even question hny?
2828,beauti beast (origin motion pictur soundtrack) [delux edition] - variou artist https:// goo.gl/fb/5mq4jj #soundtrack
2829,"beauti beast controversi show good, bad ugli lgbt right malaysia http://www. pinknews.co.uk/2017/03/29/bea uty-and-the-beast-controversy-shows-the-good-the-bad-and-the-ugly-of-lgbt-rights-in-malaysia/ …"
2830,best gilaaaa beauti beast !
2831,wow live action beauti beast look good https://www. youtube.com/watch?v=nu4pz olyhg …
2832,haven't cinema month made see beauti beast !!! amazing!!!!
2833,"deadpool music - beauti beast ""gaston"" parodi https://www. youtube.com/watch?v=ptkgr cpi1i&feature=shar …"
2834,"yet watch beauti beast , realli want watch it."
2835,mayb i'll go watch beauti beast work sunday make day littl bit better actual
2836,entertainment: real “ beauti beast ” gay moment https:// queerscifi.com/entertainment- a-real-beauty-and-the-beast-gay-moment/ …
2837,watch beauti beast littl one
2838,crosswalk musical: beauti beast omg https://www. youtube.com/watch?v=nu4pz olyhg&feature=shar …
2839,"alright folks. i'v turn "" beauti beast "" watch @austinpeay 's 1st board meeting. watch along: https://www. youtube.com/watch?v=lo5ujq ha7lg …"
2840,go see beauti beast tomorrow. ain't even sorry. best film year hand
2841,beauti beast littt
2842,أنا زهقانة و عاوزة أخرج أشوف beauti beast
2843,im movi watch beauti beast emma watson gorgeous!!!!
2844,"beauti beast , checked!"
2845,ohh tak sempat nak ber beauti beast la ni eh?
2846,"ever watch beauti beast , real version kid?"
2847,spirit beauti & beast live action.... go see beauti beast live #hollywoodstudio ? #beautyandthebeast #chip pic.twitter.com/ny3uzdponc
2848,great video annoy beauti beast argument. https:// youtu.be/syyco0qvkzo
2849,i'v listen beauti beast soundtrack day still can't stop listen
2850,would throw hand gaston beauti beast i'm farthest thing fighter.
2851,"love origin beauti beast , 2017 edit didn't me."
2852,new beauti beast amaz
2853,"beauti beast , power rangers, boss baby. three movi row"
2854,beauti beast great movi
2855,impati see beauti beast #emmawatson
2856,seen beauti beast ? like this! http:// cbsloc.al/2na824b pic.twitter.com/i6ptbh4eot
2857,i'v enter @imax 's beauti beast enchant rose competition. tweet #fallforimax chanc win! https:// cards.twitter.com/cards/18ce54bm 3o2/3qbjp …
2858,final saw beauti beast . much like emma... could pick someon littl better. :(
2859,@aimenken deepli move amaz score music beauti beast you'v inspir justic poetri journey israel much
2860,someon go w watch beauti beast
2861,beauti beast give hope love life stockholm syndrome. #singlelifehaiku
2862,beauti beast boooooti
2863,"“ beauti beast ”, ariana get 5th number #1 south korea offici chart! pic.twitter.com/karv657qb6"
2864,beauti beast - parabl https://www. opednews.com/articles/beaut y-and-the-beast--a-p-by-harold-novikoff-evil_justice_peace_purpose-170330-550.html … pic.twitter.com/isiojycwrg
2865,nak tengok boss baby.. nak tengok kimchi untuk awak sebab ada babi janna i.. nak tengok beauti beast sebab ada babi emma i..
2866,see beauti beast w
2867,want go see beauti beast ?
2868,felt urg cri watch beauti beast .
2869,"saw beauti beast cinema! well made, cried. gandalf 10/10 emma watson 10/10 i'll give movi 8.5/10. recommend it!"
2870,"might go see beauti beast tomorrow, realli depend it' gonna spontaneu deci i'm pray"
2871,done watch beauti beast
2872,beauti beast good
2873,@jenna_andersonn see beauti beast tomorrow?
2874,open 3-31-17 1. boss babi 3d 2. ghost shell 3d 3. chip 4. beauti beast 2d 5. power ranger 6. life
2875,beauti beast beauti movi love much
2876,beauti beast soundtrack seriou sensat
2877,beauti beast one romant movi
2878,final go see beauti beast movi tonight can't wait
2879,"zach sing song beauti beast past 2 days. can't stop, won't stop"
2880,brighten kid’ bedroom ‘ beauti beast ’ inspir décor #beautyandthebeast - http:// bit.ly/2npb3zu
2881,georg r.r. martin help write produc version beauti beast 1987.
2882,m'a enjaillé c'est potc... et svp.... j'entend la sublim musiqu d'intro de beauti beast ---
2883,went go see beauti beast last night & can't believ one fave movi grow storylin ridicul
2884,beauti beast - mari le princ de beaumont | fiction... #fiction &literatur https:// goo.gl/fb/gnaiad #fictionliteratur
2885,final go see beauti beast
2886,think go see beauti beast
2887,book ticket beauti beast greenhil promenad mall. download gmovies. http:// po.st/gmoviesapp http://www. gmovies.ph/movies/beauty- beast …
2888,sat floor listen beauti beast life rn
2889,me: *watch lafeu move beauti beast animated* nice me: *watch live action version* oh
2890,"'helen, want go cinema watch beauti beast ?' don't need ask twice! cinema go"
2891,"jame corden bell "" beauti beast "" best thing i'v seen day https:// twitter.com/crudes/status/ 847290645534330880/video/1 …"
2892,would great beauti beast music know everi song
2893,beauti beast good.
2894,seen beauti beast ?
2895,thought grown cri whole way watch beauti beast
2896,فيلم beauti beast حلو فشخ بأمانة
2897,well bloodi awful. — watch beauti beast
2898,"even grow old, home heart is. –bell ( beauti beast )"
2899,must believ lover day sun come shin through. –mrs. pott ( beauti beast )
2900,didn't notic gay charact beauti beast ... hmmm
2901,beauti beast time!!! @amc showplac 17 imax https://www. instagram.com/p/bsra2lua2u2j oisaakxzb3f9ynrobrvkk-scfo0/ …
2902,#disney disney pin bell beauti beast disney galleri le 5000 box #7781 http:// dlvr.it/nmcgzz plea retweet pic.twitter.com/anew0llcdu
2903,vanaf vandaag te zien: beauti beast 3d (ov)! http:// fb.me/8m0wdp28h
2904,""" beauti beast : fairi tales, morality, make thing new"" - review @revtedgi : http://www. canadianlutheran.ca/beauty-and-th -beast-fairy-tales-morality-and-making-all-things-new/ …"
2905,beauti beast 2017 film review http:// upflow.co/l/0qdq pic.twitter.com/ftuwpfotd
2906,"видео ""all beauti beast hairstyles!"" ( http:// youtu.be/iersqraojsc?a ) на @youtub добавлено в плейлист."
2907,need watch beauti beast get movie.
2908,we'r line get beauti beast cup
2909,"beauti beast good (@golden screen cinema (gsc) - @gscinema kuala lumpur, wilayah persekutuan) https://www. swarmapp.com/c/eytftdwyifd"
2910,retweet emma watson ( @emmawatson ): thank everyon saw film beauti beast ! saw many... http:// fb.me/1lt3q9blr
2911,watch beauti beast
2912,best reenact beauti beast !!!!! https:// twitter.com/girlposts/stat us/847291459350839297 …
2913,emma watson alway nail wear dress harri potter beauti beast .
2914,maar hij ensembl bij beauti beast
2915,menina que choram muito escutando beauti beast
2916,want see beauti beast bad
2917,beauti beast emmawatson pretti . . #emmawatsonfan #emmawatson … https://www. instagram.com/p/bsraoubadtm/
2918,beauti beast bad aa
2919,pengen beauti beast
2920,@diogeneslamp0 i'm fun now. one monday tell everyon see beauti beast gay
2921,"ad video @youtub playlist http:// youtu.be/gna-ibt_uwm?a emma thompson - beauti beast (from "" beauti beast ""/audio"
2922,watch beauti beast onlin free | full movi https:// cartoonhd.cc/full-movie/wat ch-beauty-and-the-beast-2017-online-fr …
2923,beauti beast - leroy sanchez & lorea turner (music video).mp4 https:// youtu.be/qomgv8wsjlu qua @youtub
2924,beauti beast great movi
2925,beauti beast (1991)(theatric version) - http:// eshoppingtime.com/product/beauti -and-the-beast-1991theatrical-version-3/ … pic.twitter.com/mep5ax91c4
2926,beauti beast konon....last2 cancel..puihhh
2927,worri beauti beast won't live 1991 expectations? read review websit - link bio. pic.twitter.com/ul26o1a6dc
2928,mom want us go see beauti beast realli want stay home sleep
2929,"13 reason why, beauti beast ,logan, ouat one exam hang"
2930,someon come watch beauti beast pl xo
2931,guest beauti beast stuck head whole day & well start annoy
2932,beauti beast amazingggggggggg
2933,"beauti beast , de nieuw film uit ... prachtig ! binnenkort ook bij studio ine pic.twitter.com/ulzeae0zk8"
2934,such. a. memorable. night! thank @numetro & @portiacele22 beauti beast . #extrem #vip #numetro #movienight pic.twitter.com/pzmo9o6k8d
2935,beauti beast amazing. love
2936,same. even go see beauti beast gay male friend straight femal friend without undu lust .
2937,omg beauti beast trailer parodi shay mitchel https://www. youtube.com/watch?v=q6yiio up1ls&feature=shar …
2938,beauti beast touch place i'v never touch
2939,beauti beast soundtrack play work today liter sing way through.
2940,beauti beast trailer 2 - 1991 vs 2017 comparison-sid side.mp4 https:// youtu.be/xhk86vqzdq0 qua @youtub
2941,fab afternoon mum watch beauti beast x fab film . #bigkid#singingallthesongsnow#stuckinhead lol
2942,darik might boy beauti beast screen #progress
2943,excit date night chummi @cazzalynharveey beauti beast yassss
2944,clayton definit one enjoy villians. sad gaston written beauti beast .
2945,beauti beast
2946,"usual don't like fairytale/fantasi movies, got tell love beauti beast ah"
2947,i'm feel gay-ish watch beauti beast .
2948,im sad @byunsol went see beauti & beast without suppo date pic.twitter.com/9h5dyjci6a
2949,think im one hasnt see beauti beast lol
2950,dh tgk dh beauti beast
2951,beauti beast @jordanpettyx
2952,"deadpool music - beauti beast ""gaston"" parodi funny! https://www. youtube.com/watch?v=ptkgr cpi1i&feature=shar …"
2953,watch beauti beast pathé haarlem http:// fb.me/8cbjcpbjv
2954,let ruin // beauti beast - hollywood found necessari give world live-a... http:// ow.ly/hswm50axasv
2955,beauti beast - lindsey stirling.mp4 https:// youtu.be/8tji2oc3abu qua @youtub
2956,plu point beauti beast there' emma watson it!
2957,beauti beast 10/10
2958,got back see beauti beast fam. disappoint one bit <3
2959,beauti beast
2960,want see beauti beast friend lazi prick
2961,like @youtub video http:// youtu.be/hvo0pk1fedq?a guest - beauti beast (disney) ~ cover jonathan young
2962,watch beauti beast (2017 film)
2963,beauti beast amaz
2964,u go see beauti beast end enjoy much start sing song tesco #bonjour #beautyandthebeast
2965,like @youtub video @thefamilyfudg http:// youtu.be/sa7jbvbxfnq?a march favorit || banana beauti beast !
2966,low key wanna go see beauti beast weekend
2967,ad: beauti beast trailer & first imag #beourguest http:// bit.ly/2fuur8v
2968,#8: beauti beast : 25th anniversari edit - (bd+dvd+digit hd) [blu-ray] http:// dlvr.it/nmc7mc
2969,beauti beast bomb!!!!! pic.twitter.com/scla7hpncb
2970,han 'frozen' gaston ' beauti beast ' two youngest disney villain 23 25 year old.
2971,time mom daughter date see beauti beast !!
2972,boleh tengok dah beauti beast @ayien_11
2973,environmentalist emma watson didn't let star role beauti beast chang feel ecofashion! http:// ow.ly/vdrh30apb74
2974,environmentalist emma watson didn't let star role beauti beast chang feel ecofashion! http:// ow.ly/vdrh30apb74
2975,environmentalist emma watson didn't let star role beauti beast chang feel ecofashion! http:// ow.ly/vdrh30apb74
2976,environmentalist emma watson didn't let star role beauti beast chang feel ecofashion! http:// ow.ly/vdrh30apb74
2977,environmentalist emma watson didn't let star role beauti beast chang feel ecofashion! http:// ow.ly/vdrh30apb74
2978,environmentalist emma watson didn't let star role beauti beast chang feel ecofashion! http:// ow.ly/vdrh30apb74
2979,environmentalist emma watson didn't let star role beauti beast chang feel ecofashion! http:// ow.ly/vdrh30apb74
2980,environmentalist emma watson didn't let star role beauti beast chang feel ecofashion! http:// ow.ly/vdrh30apb74
2981,environmentalist emma watson didn't let star role beauti beast chang feel ecofashion! http:// ow.ly/vdrh30apb74
2982,environmentalist emma watson didn't let star role beauti beast chang feel ecofashion! http:// ow.ly/vdrh30apb74
2983,fan de beauti beast nivel baño con el soundtrack de fondo
2984,"jame corden bell "" beauti beast "" best thing i'v seen day https:// twitter.com/crudes/status/ 847290645534330880/video/1 …"
2985,beauti beast sing along class! paint enchant rose sing along soundtrack the... http:// fb.me/6szgfg5fh
2986,seen beauti beast yet?
2987,want go see beauti beast again:(
2988,beauti beast girl
2989,"1 week nang lss si sa beauti beast . nung dati, hina-hum lang niya. ngayon kabisado na lyrics."
2990,beauti beast : magical!
2991,"jame corden bell "" beauti beast "" best thing i'v seen day https:// twitter.com/crudes/status/ 847290645534330880/video/1 …"
2992,sick hear beauti beast
2993,"""wild, vivid, crazi beautiful""- beauti beast trailer (aka everyth describ bee )"
2994,new: beauti beast review https:// theglamourreel.wordpress.com/2017/03/30/bea uty-and-the-beast-review/ … @bloggeration_ @femalebloggerrt #thebloggershub #grlpowr
2995,beauti beast .... it' lit! https://www. instagram.com/p/bsrztcnjhro/
2996,"also, beauti beast pretti damn good, watch that."
2997,i'm see beauti beast tonight
2998,beauti beast amaz
2999,someon plea go see beauti beast
3000,greetings! ever wonder would like beauti beast 's gaston voic johnni bravo? http:// youtu.be/bbrbqlqcldi?a
3001,realli want watch beauti beast
3002,go conchita wurst concert se cinema + watch beauti beast tomorrow?
3003,"jame corden bell "" beauti beast "" best thing i'v seen day https:// twitter.com/crudes/status/ 847290645534330880/video/1 …"
3004,"jame corden bell "" beauti beast "" best thing i'v seen day https:// twitter.com/crudes/status/ 847290645534330880/video/1 …"
3005,"jame corden bell "" beauti beast "" best thing i'v seen day https:// twitter.com/crudes/status/ 847290645534330880/video/1 …"
3006,"cooki cake, pizza, daiquiris, beer beauti & beast girl ask friend haha"
3007,beauti beast amaz everyon need go watch
