0,beauti beast spectacular. magical. amazing.
1,"@neontrigger_ pag nag katuluyan tayu jian. ang pangalan sa lovestori natin "" beauti beast "". ako ang beast ikaw ang beauti"
2,crosswalk musical: beauti beast https:// youtu.be/nu4pzsolyhg via @youtub
3,"gostei de um vídeo @youtub http:// youtu.be/r41ibt7ikrk?ab eauti … beast (finale) (from "" beauti beast ""/audio only)"
4,box-off preview: 'baby' muscl ' beauti beast ' http:// dlvr.it/nmjhr1 #hollywood pic.twitter.com/lhriykivfw
5,still seen beauti beast
6,snap og beauti beast disc flood hou copi remak potato
7,"ha gustado un vídeo de @youtub ( http:// youtu.be/axysre0kg6k?a - beauti beast (from "" beauti beast ""/offici video))."
8,vote #arianagrand & #johnlegend “ beauti beast ” #mashup @radiodisney http:// vitw.it/link/zoppx
9,beauti beast @tamster_c http:// dlvr.it/nmjh3z pic.twitter.com/yuet0o8otd
10,beauti beast @tamster_c http:// dlvr.it/nmjh7k pic.twitter.com/1rgkbukm8c
11,chip [ beauti beast ] chaoscoretech http://www. thingiverse.com/thing:2112440 #iwannaprint #davinci1pro #hatchboxpla
12,hermion belle! noth better. beauti beast review | thursday review completelykarin https:// youtu.be/1bwr9nc4a0i via @youtub
13,◆全米デイリーtop10 [3/29] [順] 1位 [題] beauti beast (2017) buena vista #boxoff #映画 pic.twitter.com/eldqv25uuw
14,beauti beast حلو اووي
15,someon bring see beauti beast pl thank
16,hope beauti beast good movi
17,beauti beast tonight!! can't even wait!
18,sent isaac mission find beauti beast cup disneyland proud.
19,mission: listen everi cover beauti beast
20,beauti beast lit @emmawatson gorgeou pic.twitter.com/zwj5xtlpig
21,danandphilcraft video get watch beauti beast @ourtimeasus_16 tomorrow good day!!!
22,like @youtub video http:// youtu.be/nu4pzsolyhg?a crosswalk musical: beauti beast
23,like @youtub video @christendtweet http:// youtu.be/h2zvorotxke?a ariana grand beauti beast makeup tutori
24,"saw beauti beast today...hand best @disney movi thu far! @emmawatson perform moving, cried."
25,beast mention again: http:// sch.mp/0amyaf - rt @mudron animatron beauti beast restaur attract sound like wo...
26,todavía visto beauti beast :((((
27,vote theatric career? curli oklahoma! gaston beauti beast ! peter allen boy oz!
28,"@jkcorden saw ""crosswalk beauti beast ."" plea come play us arizona. great!"
29,someon go see beauti beast plea
30,yet watch beauti beast
31,someon take go see beauti beast
32,mr pott container! [ beauti beast ] http://www. thingiverse.com/thing:2195875 #iwannaprint @polymaker_3d #davinci1pro #robofila
33,"thought i'd share ""3 leadership lesson beauti beast "" 12 min #podcast episod http:// teachonomy.com/beast hope enjoy! pic.twitter.com/xkkrlbp5fz"
34,guest beauti beast collection. you’ll fall love first sight. #beautyandthebeast #makethemgelish pic.twitter.com/t9glayxd9g
35,enter #win beauti beast prize pack 2 cineplex passes! #giveaway end 3/28 http://www. naturalbabygoods.com/disney-beauty- and-the-beast/#comment-265816 …
36,beauti beast 2017 film review http:// upflow.co/l/ivo pic.twitter.com/er9vaf9wai
37,beauti beast amazing. nearli perfect film. streak watch good movi yet end.
38,me: *i watch beauti beast * good movi wonder ends.
39,"no, beauti beast , don't want bad dream tunight"
40,bare even friend somebodi bend unexpectedli littl scare neither one prepar beauti beast https:// youtu.be/pgyejhjxfb4
41,i'v alreadi seen beauti beast twice wanna see
42,beauti beast review | thursday review completelykarin: http:// youtu.be/1bwr9nc4a0y?a via @youtub
43,テンション上がる～ > beauti beast cappella medley | byu vocal point ft. lexi walker... https:// youtu.be/fx9vkm_vlak
44,mini beauti & beast meet emma watson dan steven liter cutest thing ever!
45,walk hour theatr see beauti beast . worth
46,"new movi schedul start tomorrow beauti beast 3d friday- 7:00 saturday sunday- 12:30, 7:00 rated... http:// fb.me/3byioissz"
47,"there' someth sweet almost kind so, i'v whole beauti beast … https://www. instagram.com/p/bssauweavm2/"
48,"beauti beast -inspir rose print cocktail dress chic neck tie detailing, partial butt http:// pinterest.com/pin/2656420780 01696343/ …"
49,like @youtub video http:// youtu.be/xcenkwpiuu0?a mob song (gaston' plan' success) - beauti beast
50,@midnight geisha shogun aka beauti beast #japanamovi
51,go watch beauti beast
52,feel v sick enter comp also forget take med think i'll prob take date beauti beast
53,por fin !!!! — watch beauti beast
54,chocada que existem sere humano que nao gostaram de beauti beast
55,walk beauti beast . cinematographi direct fuck atrocious. new song garbag boot.
56,one who' never seen origin beauti beast either???
57,beast beauti beast cute deserv world
58,live action beauti beast musical?
59,beauti beast good trap music
60,evermor fav song beauti beast soundtrack i'm cri
61,beauti beast amazing. @emmawatson perfect belle. extra touch amaz @thereallukevan stole show!
62,"beauti beast good, definetli recommend haven't seen yet"
63,"ich mag da @youtub -video: http:// youtu.be/ptkgrecpi1i?a deadpool music - beauti beast ""gaston"" parodi"
64,&#039;boss baby&#039; &#039;ghost shell&#039; debut &#039; beauti beast&#039; eye third ... http:// plurk.com/p/m5ssn1
65,beauti beast give librari
66,amoamoamoamoamo la nueva version de beauti beast . la semana que vien voy de nuevo.
67,hey gang. went see beauti beast podcast tomorrow. million trailer cast hour late
68,ei... vim ver beauti beast ... desidratei
69,get guy treat like beast treat bell beauti beast
70,la voz ariana en beauti beast da mil paro
71,saw beauti beast today. made even gayer ok thx
72,dulu aku takminat beauti beast yg kartun sbb aku tgok beast dia tu garang sangat hahaahhaha
73,me: ask gf pau vid rant possibl beauti beast otayuri au. hasn't even seen like 3 ep
74,"¤ beauti beast vhs, 1992 clamshel case check http:// ebay.to/2n1zfy2 pic.twitter.com/fcl3bngn2i"
75,"sooo ghost shell out, yet tomorrow go see beauti beast ... why?"
76,22yr repeat beauti beast cd scratch beyond recognit #mourn #rachaelbeck #hughjackman #beautyandthebeast #rip pic.twitter.com/s7pghe9ryb
77,watch beauti beast
78,beauti beast . https:// twitter.com/galwaygai/stat us/821213292907536384 …
79,new podcast soon. talk alot shitti match late beauti & beast . #wrestlingwithmyself
80,watch beauti beast
81,"hugh jackman' best role 1995/6 gaston beauti beast . saw twice, loooov it. #moviefightsl"
82,romantic? shakespear love new beauti beast ?
83,u reali voic olaf beauti beast
84,11 ilustrasi klasik beauti beast sebelum disney | pepatung http://www. pepatung.com.my/hiburan/11-ilu strasi-klasik-beauty-and-the-beast-sebelum-disney.htm …
85,saw beauti beast . visual appeal i'v alway felt beast eaten gaston chance.
86,@dirkhoop #boxoff : ' beauti beast ' top 'batman v superman' and... http:// pri.ml/azfi2idp via forb pic.twitter.com/rtubn8ovyf
87,lovee beauti beast
88,final gonna get watch beauti beast babi
89,idk like beast turn human..i like better beast @kaitlinkil talk new beauti beast y'all
90,i'm see beauti beast tonight i'm realli excited!
91,interest beauti beast gave nod batman v superman titular charact bond lost mothers.
92,doesn't @enew ever talk @thatdansteven talk beauti beast ?
93,beauti beast está muito aw e é grand tb
94,make trip theater weekend still need see kong beauti beast
95,childhood didn't watch fricken classics!! saw origin beauti beast thank
96,"beauti beast , amaz film"
97,@trussmimaddi watch beauti beast
98,beauti beast spectacular
99,ha gustado un vídeo de @youtub ( http:// youtu.be/8fxmjvwmfeu?a - beauti beast - kiss - emma watson & dan steven - moments).
100,vote #arianagrand & #johnlegend “ beauti beast ” #mashup @radiodisney
101,wanna watch beauti & beast pls. @anisajamel sik pua ati put blame u
102,beauti beast review: nice disney tale. haven't seen origin forev i'm glad got see live action version
103,"‘boss baby,’ ‘ghost shell’ battl ‘ beauti beast ’ weekend http:// dlvr.it/nmjxkl pic.twitter.com/m9x1ptryqd"
104,"beauti beast review twitter instagram!! definit go watch today, hook crook donch care"
105,beauti beast ata yon.
106,"checkout latest news post : box office: 'boss baby,' 'ghost shell' top ' beauti beast '? - varieti http:// ift.tt/2nqmrbg"
107,yung nanay tsaka tatay ko nagduduet pa sermonan kami. buti ba kung beauti beast yung kinakanta eh. eh hindi.
108,taray ng beauti beast inspir rose. https:// twitter.com/thatbucketlist /status/847594762341203968 …
109,still haven't seen beauti beast . someon go see
110,want see beauti beast
111,tale that' old time hope brung fortifi wine see beauti beast
112,"i'm @cinemex beauti beast puebla, pue https://www. swarmapp.com/c/4t86jedb0dz"
113,"saw power ranger beauti & beast week, still fantastic. gotta see life, ghost shell, i'll caught"
114,u seen beauti beast yet.
115,beauti beast review: joyless perform emma watson http://www. irishtimes.com/culture/film/b eauty-and-the-beast-review-a-joyless-performance-from-emma-watson-1.3010021#.wn2x7iytwqs.twitt … via @irishtimescultr
116,beauti beast
117,box-off preview: 'baby' muscl ' beauti beast ' http:// rincon-celebnews.com/index.php/2017 /03/30/box-office-preview-baby-muscles-in-on-beauty-and-the-beast/?utm_campaign=twitter&utm_medium=twitter&utm_source=twitt … #blog pic.twitter.com/rsnrnhyrud
118,still haven't seen beauti beast yet
119,first movi date. beauti beast pic.twitter.com/z6vrr9j1jo
120,bethlehem' frank banko cinema screen 1946 ' beauti beast ' http:// dlvr.it/nmjwpv #laker
121,"beauti + beast censorship attempt show good, bad ugli lgbt right malaysia http:// theconversation.com/beauty-and-th -beast-censorship-attempt-shows-the-good-the-bad-and-the-ugly-of-lgbt-rights-in-malaysia-74995?utm_source=twitter&utm_medium=twitterbutton … via @_tcglobal"
122,beauti beast bring back mani memori
123,bestnya tengok beauti beast
124,beauti beast cousin andrew duff domiination.… https://www. instagram.com/p/bsr_jfth6sko br7h35_hzd7snorsthmktkhm3s0/ …
125,side note...i final found way home watch beauti beast awesome! x
126,"love peter pan, mulan, beauti beast , tarzan, raiponc (idk english ok)"
127,take momma bear see beauti beast . she' excit
128,hahaha tengok beauti beast ni teringat aku semangat panggil nama prmpn tu blair hhahaha confid tu pent
129,beauti beast (2017) pic.twitter.com/waizgafxa
130,listen beauti beast soundtrack loop week.
131,"right, held long could, i'm go beauti beast . spoiler hot take follow."
132,"hey guy beauti beast start soon know means, #ff @the_best_smart cuz i'll live-tweet suicid"
133,bought beauti beast soundtrack. it' serious.
134,final watch beauti beast pic.twitter.com/kf3pkbbcp
135,anyon want see beauti beast tonight?
136,like @youtub video @hasanjun http:// youtu.be/bh9-qrn0ie0?a raisa - beauti beast (cover) - salmon trax fm jakarta
137,see beauti beast dinner bread co @shelbyswann princess herself! lmk you'v see anyth cuter... pic.twitter.com/dv1iwg7goo
138,beauti beast ju lit
139,want see beauti beast !
140,beauti beast good
141,upon second view beauti beast tell emma' voic isn't auto tune (the kid' is) it' mic echo problem
142,emma watson dan steven mini beauti beast cute !!! https:// youtu.be/ywy8nybp3ri via @youtub
143,beauti beast good gaston fuck boy af.
144,realli wanna see beauti beast
145,beauti beast ... favorit book http:// tinyletter.com/all_about_roma nce/letters/beauty-and-the-beast-in-our-favorite-book …
146,"aww yeah new beauti beast movi fuckin' excellent, realli love josh gad lefou @blaze_tfd"
147,like @youtub video @bigmacbabi http:// youtu.be/ub1add0ibku?a brother caught sing beauti beast !
148,"oh man, everyone' make excu #ghostintheshel , love it. i'm actual glad ' beauti beast ' crush u.s."
149,rise shine darlings! im gonna go watch beauti beast ohmygod inner princess come yall https:// youtu.be/qmgtadil3ri
150,bruh i'm tri go see beauti beast
151,やはり beauti beast 癌版は制限なしで進める模様。
152,gustó un video de @youtub http:// youtu.be/ywy8nybp3ri?a emma watson dan steven mini beauti beast cute !!!
153,emma watson beauti beast funni interview moment (cute!!!) https://www. youtube.com/watch?v=smer_g iqa8q&feature=shar …
154,muero por ver beauti beast
155,still haven't seen beauti beast i'm fake fan
156,beauti beast everyth hope would be. magical. got teari sever time #dreami
157,like @youtub video http:// youtu.be/_s2_a7dw4eq?a beauti beast ft. julian jacob | covernya jeha
158,number time listen beauti beast soundtrack day get hand
159,i'v alreadi seen beauti beast twice wanna go see :(
160,need beauti sleep. beauti sleep look like grinch without beauti sleep look like beast . pic.twitter.com/v5vri0obcf
161,"i'm thwart see beauti beast everi turn. first, flu. now, showtim list fandango site..."
162,like @youtub video @tamangphan http:// youtu.be/r9mmr9gnrpq?a ' beauti beast ' bell makeup tutori !!!
163,need go see beauti beast weekend idc
164,like @youtub video http:// youtu.be/nu4pzsolyhg?a crosswalk musical: beauti beast
165,like @youtub video http:// youtu.be/ivgxwmnptwg?a ♪ beauti beast music - anim parodi song
166,lmao cri watch beauti beast wasnt bad roosa @xjessicafaith
167,"nice namaaan si ate pagkatapo ng versace, beauti beast naman ayaw q na"
168,need go watch beauti beast lol
169,ladi night!!! carissa mama h's!! see play beauti & beast ⚘ @midland… https://www. instagram.com/p/bsr-6vajxev/
170,still havent seen beauti beast
171,want fri go watch beauti beast
172,sorta remind like. live action beauti beast tri make beast human look
173,insta stori semua penuh dgn beauti & beast sushi king??????
174,beauti beast
175,"gostei de um vídeo @youtub http:// youtu.be/egqbadrmxgi?a bell (from "" beauti beast ""/audio only)"
176,beauti beast !
177,beauti beast @disneylandtoday pic.twitter.com/fnxmfmg91l
178,wanna see beauti beast soooooo bad
179,"best sgt — watch beauti beast 3d (1991) tgv i-max 3d , one utama http:// fb.me/90bo2wxwv"
180,beauti beast good could beat someon
181,top 50 femal charact (a vote followers): #31: bell ( beauti beast ) http:// ln.is/tumblr.com/otk r0 …
182,gostei de um vídeo @youtub de @tamangphan http:// youtu.be/r9mmr9gnrpq?a ' beauti beast ' bell makeup tutori !!!
183,beauti beast
184,still haven't watch beauti beast .. needa treat real soon.
185,#beauti beast
186,checkout latest news post : beauti beast magic help uk box offic surviv spring sunshin - guard… http:// ift.tt/2nqzc9d
187,10 candlestick would make beauti beast 's lumièr jealou http:// dlvr.it/nmjqn pic.twitter.com/wuxsceqn6u
188,"today littl girl work interrupt mom tell look like ""the girl beauti beast "" just... wow"
189,10 candlestick would make beauti beast 's lumièr jealou http:// dlvr.it/nmjqn pic.twitter.com/axy0np5yai
190,beauti beast
191,25 thought watch new ' beauti beast ' http:// amzn.to/2fk7yxp elyt
192,final see beauti beast #happyday
193,castl hotels: ' beauti beast ' fairyt - cnn https:// apple.news/avls5qxlkt9iwj yr_egjjrg …
194,25 thought watch new ' beauti beast ' http://www. kqzyfj.com/click-7347826- 12408710-1464611445000 … :)
195,final saw it! went see new beauti beast film awesom @l_e_ellis… https://www. instagram.com/p/bsr-o9lb_kb/
196,watch th beauti beast movi could think namjoon song came pic.twitter.com/htnzelnaoc
197,"you'r sweet. even saw beauti beast ! sound relaxing! spring time perks, heh."
198,beauti beast fuck
199,review disney' live-act beauti beast . spoilers. https:// libraryoffables.wordpress.com/2017/03/30/rev iew-disneys-beauty-and-the-beast-2017/ …
200,like @youtub video http:// youtu.be/x0m1hbuljzi?a beauti beast - mini bell beast - offici disney | hd
201,"jame corden bell "" beauti beast "" best thing i'v seen day https:// twitter.com/crudes/status/ 847290645534330880/video/1 …"
202,"jame corden bell "" beauti beast "" best thing i'v seen day https:// twitter.com/crudes/status/ 847290645534330880/video/1 …"
203,"jame corden bell "" beauti beast "" best thing i'v seen day https:// twitter.com/crudes/status/ 847290645534330880/video/1 …"
204,"jame corden bell "" beauti beast "" best thing i'v seen day https:// twitter.com/crudes/status/ 847290645534330880/video/1 …"
205,offici cannot stop listen beauti beast 's soundtrack
206,beauti beast (origin motion pictur soundtrack) [2 cd][delux edition] http:// dlvr.it/nmjnnt
207,watch beauti & beast mom !!! im happiest person aliv soso beauti cri entir movi
208,mi è piaciuto un video di @youtub da @cimdrp : http:// youtu.be/gyobm8juz-a?a queerbait beauti beast || parità pillol #55
209,ha gustado un vídeo de @youtub ( http:// youtu.be/ywy8nybp3ri?a - emma watson dan steven mini beauti beast cute !!!).
210,si te fascinó la nueva versión de beauti beast escucha aquí el track completo https:// goo.gl/guq9jm pic.twitter.com/js8qyhkzcf
211,beauti beast #emmawatson gorgeou
212,animatron beauti beast restaur attract sound like would'v bonkers: http:// the-disney-elite.tumblr.com/post/159014893 429/the-disney-that-almost-was-the-beauty-and-th …
213,日本語実写歌詞、 beauti beast がそのままな辺り、訳すのを諦めた感じある
214,"bela e fera (@cineart - @cinemas_cineart beauti beast belo horizonte, mg) https://www. swarmapp.com/c/3sqva1d2ib"
215,beauti beast come!!!! @amanda_lou01
216,ad video @youtub playlist http:// youtu.be/x-ajhxhk19u?a beauti beast - lindsey stirl
217,#nowplay beauti beast de ariana grand ♫ http:// spoti.fi/2nurvpc
218,beauti beast last night w/ fam ang gondooooo
219,emma watson perfectli channel bell gorgeou yellow gown ' beauti beast ' event http:// amzn.to/2dq0hhj *
220,introduc music beauti beast liter get everytim
221,beauti beast
222,absolut love beauti beast
223,［定期投票ツイート］ 投票しましょう #arianagrand & #johnlegend “ beauti beast ” #mashup @radiodisney
224,【定期投票ツイート】 good morn japan! #arianagrand & #johnlegend “ beauti beast ” #mashup @radiodisney
225,want see beauti beast
226,"machine, trapped, aa gaya hero, beauti beast – 1st monday box offic collect https://www. hollybolly24.com/machine-trapp d-aa-gaya-hero-beauty-and-the-beast-1st-monday-box-office-collections/?utm_source=reviveoldpost&utm_medium=social&utm_campaign=reviveoldpost …"
227,joe see beauti beast second time! pic.twitter.com/w6ltxseoco
228,allow say beauti beast fantast
229,want see beauti beast
230,"littl chang beauti beast (from "" beauti beast ""/offici video) https:// youtu.be/axysre0kg6k vía @youtub"
231,read right walk movi theater watch beauti beast laugh way home bless you.
232,"let honest, @joshgad real star beauti beast"
233,gostei de um vídeo @youtub http:// youtu.be/w2dyhaph4pi?a beauti beast hot pepper karaoke!
234,drink local craft beer eat cheesecak factori right head next door theatr see beauti beast
235,beauti beast dah keluar. jum la :')
236,i'm barn & nobl they'v play beauti beast soundtrack.
237,"bell (from "" beauti beast ""/audio only) https://www. youtube.com/watch?v=egqbad rmxgi&feature=shar …"
238,like @youtub video http:// youtu.be/x-ajhxhk19u?a beauti beast - lindsey stirl
239,beauti beast beauti movi i'v ever seen...
240,yeay beauti beast ! #beourguest
241,vote #arianagrand & #johnlegend “ beauti beast ” #mashup @radiodisney
242,new beauti beast good
243,beauti beast good
244,aaaaa odeio isso tipo foi mesma coisa com beauti beast eu tava pronta e cancelaram nem falam pq raiva
245,watch beauti beast http://www. beourguest.com/?g=6d522bad
246,cri 6 time beauti beast it' fine
247,beauti beast trailer parodi (ft. king bach & pooch hall) | shay ... https:// youtu.be/q6yiioup1l via @youtub great video @shaymitch
248,"last weekend, watch beauti beast ."
249,beauti beast
250,final got see beauti beast
251,haven't seen beauti beast yet i'm super depress
252,box office: ' beauti beast ' earn $750m worldwid http:// bit.ly/2on3moz
253,inivindy: inspirasi riasan wajah ' beauti beast ' https:// goo.gl/mz65hl pic.twitter.com/v5rvaho92w
254,inivindy: inspirasi riasan wajah ' beauti beast ' http:// ouo.io/npaodn pic.twitter.com/knpcnri8va
255,beauti & beast ! emma rock hard! beauti beast anazing!
256,inivindy: inspirasi riasan wajah ' beauti beast ' http:// dlvr.it/nmjgc0 pic.twitter.com/k5xiyt01z2
257,inivindy: inspirasi riasan wajah ' beauti beast ' http:// ouo.io/nxdbvh pic.twitter.com/zotyyhitz2
258,beauti beast incr #beautyandthebeast #disney
259,best one second moment ever beauti beast pic.twitter.com/8eerbfuivg
260,"beauti beast fuck bad like everything, includ gay representation... go logan guy bc yikess"
261,inivindy: inspirasi riasan wajah ' beauti beast ' hijab malang ini tak tanggung mengubah wajahnya mirip... http:// fb.me/7ceddlzjw
262,beauti beast quit good isn't
263,beauti beast virtual reality! | disney movi vr (htc vive gameplay) - ... pic.twitter.com/0etmu3abqr
264,it' 3 week beauti beast soundtrack still best thing spotifi
265,discov enchant world witch cur princ steami modern retel beauti beast . http:// a.co/3uqu3g9 pic.twitter.com/5gsotvpvco
266,discov enchant world witch cur princ steami modern retel beauti beast . http:// a.co/3uqu3g9 pic.twitter.com/d12zdrtgeo
267,urher emma watson' ' beauti beast ' world premier red carpet interview. http:// buff.ly/2naiajn #beourguest #disney #music #film pic.twitter.com/f9veo68qar
268,beast cgi new beauti beast look like belong shrek... movi 2001!
269,see beauti beast one saw origin with! #26yearslat @uncglindsey @buzzbakewel pic.twitter.com/oxbp57c3di
270,well beauti beast classic movi count
271,nick pitera sing bell beauti beast exactli need asdfghjkl https://www. youtube.com/watch?v=jrkpzh amgwk …
272,dream come true! love u abigail! beauti beast !! #r1 … https://www. instagram.com/p/bsr9u-nbbplu zkyrt8jo5mglzaz_v373eosmsy0/ …
273,@mannymua733 beauti beast inspir look beauti zaya lil beast! ⚘
274,beauti beast bomb
275,beauti beast good
276,like @youtub video http:// youtu.be/q6yiioup1ls?a beauti beast trailer parodi (ft. king bach & pooch hall) | shay mitchel
277,watch beauti beast
278,beauti beast went see last night. started. got goosebumps. final answer to... http:// fb.me/5vt3p6vbl
279,realli wanna go watch beauti beast one come watch
280,sober hate new beauti beast
281,"exato!! foi mesma coisa q eu pensei, acho que diretora quer tirar shang por causa da polêmica q causou um gay em beauti beast"
282,beauti beast good
283,kanang imong manghod na laki nagpa speaker ug beauti beast movi soundtrack u okay?
284,"eto talaga yung reason kung ba't ang ganda ng beauti beast . nag ""shine""/stand kasi sya lol pic.twitter.com/x6x9gqrvzq"
285,doubl tap like live-act beauti beast . #rose #bestoftheday #instacool … https://www. instagram.com/p/bsr9jpvbjsj/
286,beauti beast made emot omfg love much pic.twitter.com/cv69ttl6g3
287,drunk realli hate new beauti beast pic.twitter.com/l99iztapjf
288,still haven't seen beauti beast it' make sad everi time someon tell good is...
289,beauti beast (rate pg) final weekend show march 31 thru april 2 ~ friday 7:45pm... http:// fb.me/leydedtb
290,go #emmawatson #ethcalfashion everi look emma watson' ' beauti beast ' press tour http://www. elle.com/fashion/celebr ity-style/news/g29672/emma-watsons-beauty-and-the-beast-press-tour-outfits/ … via @ellemagazin
291,final go watch beauti beast tonight
292,"indeed. park incident, incid man overdo insid movi theater ' beauti beast .' died. https:// twitter.com/sousleradar/st atus/847589206121644034 …"
293,see lot coupl beauti beast . i'm mom #singlelif
294,beauti beast xd
295,get jewel' car she' play beauti beast soundtrack....
296,still need see beauti beast .
297,beauti beast make emotional. tho
298,seen beauti beast last night lol
299,"i'm see beauti beast mom tonight, probabl can't convinc see power rangers."
300,inivindy: inspirasi riasan wajah ' beauti beast ' hijab malang ini tak tanggung mengubah wajahnya mirip... http:// fb.me/8cpghuwwv
301,disney swarovski collection: beauti beast http:// fb.me/3ozs7umso
302,want say love beauti beast goodnight friend
303,"wow can't believ wasn't go go see beauti beast , amaz beauti i'm majorli impressed!"
304,beauti beast truli beauti film
305,let' go see beauti beast wanna go bad
306,"complet lost beauti beast movi hardli ever cry, lol how' day going?¿"
307,beauti beast magic omg love
308,"tale old time, song old rhyme, beauti beast #beautyandthebeast #showca pic.twitter.com/wqfoehebcc"
309,"closest celeb look-alik probabl beast beauti beast (2017). transform me, though."
310,"@the_overton cover ' beauti beast ' relea australian @spotifi 10 hour ago, i'm final listening! love it, boys!"
311,"estamo escuchando la banda sonora de ""the beauti beast "" todo lo que da. amo mi equipo de música amo má la película"
312,final see beauti beast
313,go see beauti beast
314,"i'm scare years, children say they'v seen beauti beast . won't seen beauti beast"
315,beauti beast bore af. fyi. pic.twitter.com/1kkthmqh1
316,frickkkk love beauti beast
317,beauti beast open night!! @phmsbcp @lperry_lisa pic.twitter.com/ohb0gb5vzl
318,wanna go see beauti beast
319,face plant driveway!! + perform beauti beast musical!!: http:// youtu.be/muc73smile0?a via @youtub
320,gostei de um vídeo @youtub http:// youtu.be/sqjcajpts4g?ag abriel … aplin - beauti beast (cover)
321,brother take see beauti beast .
322,today' count: lemonades: ||| andi bathroom visits: ||| beauti beast cups: |||| brand new shirts: |
323,"sorri ig friends, feel na feel ko talaga beauti beast"
324,watch star beauti beast come face face mini bell mini beast! http:// z104fm.iheart.com/onair/katie-kr uz-40200/beauty-and-the-beast-actors-get-15696144/#ixzz4cqdhlm8 …
325,top 10 listen act!vat stori #podcast countdown #4 beauti beast http:// activated.libsyn.com/beauty_and_th _beast … #folklorethursday
326,im still hum beauti beast song
327,"disney present beauti beast photoshoot sofitel wentworth hotel hair @wentworth, latest... http:// fb.me/1qthblra"
