2432,"""your whole life ? doesn't anyon ever come see besid mother?"""
2433,determin far go life nobodi else.
2434,ball life * https:// twitter.com/nbatv/status/8 50131310639169537 …
2435,doubt includ movi life one day. #tebowtim #gogat https:// twitter.com/carsonannmason /status/850132869141987332 …
2436,gonna worst thing i'v made life pic.twitter.com/j2ivth6t04
2437,"half life , i'v tri catch viktor."
2438,"know life rough guy tax says, ""oh boy."""
2439,life bless actual consid make ig public hater hate
2440,life isn't go great #badboymikey pic.twitter.com/eql2ehi3tu
2441,life definit need white josh nathaniel it. http:// tvline.com/2017/04/05/cra zy-ex-girlfriends-season-3-scott-michael-foster-promoted/ …
2442,don't know left right ito life rn
2443,one record chang life ?
2444,self: u accept fr u don't want see ur dramat life #regret
2445,"life give lemons, squeez juic eyes. fool."
2446,r text ask skul life progress wat tell
2447,"hahahaha wag na naman bes. maawa ka sakin. ang haba na nga nung 3 days, rest life pa kaya. hahahaha"
2448,hear xo tour life first time pic.twitter.com/qhvwdzauco
2449,stori life https:// twitter.com/sexpanther209/ status/849903007017836544 …
2450,locker style... danc life ... https://www. instagram.com/p/bskcennh5tx/
2451,rooki life
2452,world 45 get grand exchange. think need repol would bring life dmm
2453,peopl talk matter life . it' want believ they'r saying.
2454,treat someon like shit walk back life feel entitl place
2455,"« him? never met weaker guy life ."" alex' tone harsh, felt like justin deserv let »"
2456,life make it.
2457,"littl bit youtube, littl bit day day life"
2458,someon told 2 month ago life would good wouldnt believ
2459,need life ! https:// twitter.com/artofmmignola/ status/850133699253329921 …
2460,"could pay someon do, fold put away laundri rest life , would heartbeat. pic.twitter.com/gmoektta0d"
2461,love i'm happi life rn life head like thing upppp
2462,alright everyon stop live life log tri win twitter!
2463,"well, sign life away 3rd job. hope mean retir 45"
2464,took 10 minut eat one chicken tender bc mouth hurt bad that' life go
2465,sicko alway favorit daughter keep company. seem been...al life . sad! pathetic!
2466,life http:// fb.me/rcyhlse8
2467,"life like roller coaster. up downs, it' choic scream enjoy ride"
2468,"would nice could think like ration person, analyz everi singl thing goe life"
2469,"pinterest real life ...and get part it! shop, make creat hearts… https://www. instagram.com/p/bskcjpfj1s-/"
2470,that’ see futur think trip oversea can’t imagin life without you..
2471,clay honest hannah felt might save life .
2472,"relationship wrong person , realli fuck life ."
2473,i'm readi sleep life away bomb ass pizza
2474,"happi birthday life long friend, love soo much!! hope fabul day babe, deserv it!! @sarahbenson08 pic.twitter.com/jc46l6lgap"
2475,haha ye girl. peopl pleas life . i'm jesu pleas life . https:// twitter.com/m_robinson98/ tatus/850101444409741314 …
2476,#life pic.twitter.com/scvddcbz03
2477,ad video @youtub playlist http:// youtu.be/defff6nqzgq?a life yours...lov arab christian song(middl east)lyr
2478,kid cudi- balmain jean life chang music
2479,i'm thank mom & sister. they'r life lines. never feel alon anyth them.
2480,move somebodi knew love half life
2481,bouta cut peopl life !
2482,life problem
2483,mani dem aren't one gonna hurt. i'm watch ppl say care harm life ...
2484,ye life ! work hard deserv it. send love whole biscuit famili pic.twitter.com/sah8ektfqw
2485,"super proud all! seriously, you'v commit save life to. that' big!!!"
2486,"see y'all watch snap stori think ""that person still care life !?"" #flatteri"
2487,idk man look life sentiment
2488,rip @donrickl mr. warmth made laugh whole life #ripdon
2489,"@aeriqui pleas sop gootecks, tri life guru thing. alway explain twice meant 1st time"
2490,first got kpop/when first becam sone :] best day life . snsd alway hold special place heart :]
2491,ship v life sentenc prison
2492,whole life lie...? mix two peopl one person? #how
2493,"... famili dream afford house, car, yard."" assum citizen drone that' respons life aspir to."
2494,"difficulti life intend make us better, bitter. #llwhereisdaddi"
2495,"(to creat person who' said one word, ""etern return"" entir life ...)"
2496,"mayb actual career, someth life , wouldn't search twitter name pick fights?"
2497,sentenc suggest words: don't want play idea want life .
2498,"@patrick_oshag spot on! life advice, career advice. https:// twitter.com/margowatroba/ tatus/849591007918403584 …"
2499,"life short, tweet weird thing"
2500,even eat mango didn't bite top suck life outta seed
2501,sick tire sick fuck tired! real life don't even know even bother son.
2502,everybodi want skateboard point life
2503,got music...mi life perfectli fine
2504,long-forgotten nightclub '40 come back life - lo angel magazin http://www. lamag.com/askchris/forgo tten-rhythm-room-nightclub-is-coming-back-to-life-downtown-los-angeles/ …
2505,smh i'm poor nothing' chang rt @riqross_ : @notkem how' rich life ?
2506,spirit life embassi http:// youtu.be/ywo1qpz0ub8?a
2507,magandang umaga world!thank god!i'm love life becoz #mbkathniel
2508,im content satisfi life right
2509,think video save life
2510,william clark green life dude???
2511,good life come eat good food.
2512,"""a neg mind won't lead posit life ."""
2513,true life : can't stop eat fast food
2514,don't let twitter get fuck real life .
2515,*buy $102.72 worth nicktoon pop drop today* ...*anxious await @originalfunko announc hey arnold + rocko' modern life line*
2516,don't trust guy talk loudli sex life afraid box tampons.
2517,christ' salvat liber us introduc share divin life ... -- fr. cessario @thomisticinst pic.twitter.com/qypouzwdsn
2518,surviv life use crockpot
2519,"would never made past pitch section, b/c one would believ perpostor plot!"
2520,"pretti sure die #swco , die real life ."
2521,toni padilla done noth wrong ever life
2522,"anoth good one ""i kind success hitwoman help drag queen only"" - actual life ."
2523,liter @hannahmaelalala know anyon life i'm thank alway vent without judgment
2524,today real life . https:// twitter.com/anniekarni/sta tus/850133611164598272 …
2525,"damn, y'all real life mad went date lmfao hate real.. smh... let life https:// twitter.com/dailymailceleb /status/849971214634364928 …"
2526,"alan king: profession life , alway assum you'r surround assassins."
2527,strang life tho
2528,alotta y'all bitch bitter live life hoe
2529,start watch life piec it' funni
2530,"want live happier life , nice others. it’ realli simple. nicer you’r it."
2531,don't love life one els enjoy everyday
2532,"dead man, jesu life . sinner, savior. broken, restorer. this... http:// fb.me/qswdni0z"
2533,"dusty, prom date + one (platonic) love life , incred work berlin: http:// artfcity.com/2017/03/28/lon g-live-dusty-whistless-new-flesh-with-no-apologies-to-david-cronenberg/ …"
2534,casey said want throw parti meanwhil i'm still get life togeth last night lmaaoo
2535,shiiid imma least get colleg paid https:// twitter.com/hibachi_ray/st atus/849712209198493696 …
2536,"alon , part life . everi thing, need go , goes. leav room someth better, love."
2537,one life wanna live you. -jb https://www. instagram.com/p/bskchvfjzvq/
2538,recognis manipul fuckwit impact upon life .
2539,think imma get anoth back thigh tatt right ass creas & gonna say thug life lol
2540,できる人は、必ず休息を大事にします。スポーツ選手でも、オフのときは、意識してしっかりと身体を休めます。休みを摂ることは「悪」ではなく、より良いパフォーマンスを出すための円滑剤となります。堂々と休息を摂るようにしましょう。
2541,"""to live pure unselfish life , one must count noth one' midst abundance"" #buddha @brainyquot"
2542,first time life i'm exit saturday!!
2543,like @youtub video http:// youtu.be/nc72zrla6ia?a life prison - rough trailer
2544,life isn't right need make right live best way feel
2545,life short. period. http://www. dailymail.co.uk/health/articl -3733070/it-s-official-time-does-quicker-older-ageing-bodies-partly-blame.html …
2546,today worst day entir life
2547,@paidleaveforct life lesson event- live 8 pm cptv! paid famili leav panel @cath980 . tune tonight! #cwealf
2548,definit https:// twitter.com/bossyanna_/sta tus/850133928174374912 …
2549,"love thrive life ! eas joint discomforts, improv mental clariti & energ me! #lifechang http:// laventi.le-vel.com #askm"
2550,work hard life get harder. good morn guys! #enjoylif — feel chill
2551,"iphon charger, anker lightn usb iphon cabl 3ft / 0.9m high life span cabl with… https://www. quanrel.com/iphone-charg -anker-lightning-to-usb-iphone-cable-3ft-0-9m-high-life-span-cable-with-compact-connector-head-for-iphone-7-6s-6-se-5s-and-more-white/ … pic.twitter.com/ojsj5fgu9"
2552,"social life , work"
2553,"good storytel n appreci messag still feelin suicide, wish ppl stronger, that' life ."
2554,@torres2karen happi bday go crazi life short
2555,dream u akala ko totoo #ytffph na daw tapo kasama ko kayo. real life hindi ako nakakuha ng ticket kahapon @wil_dasovich
2556,wooooowww wish whole last year life never happen yike
2557,"wait till 18 hun, life changeee"
2558,rock interest human point life .
2559,liter floor wonder life means.
2560,sometim teach u lesson u rememb whole life
2561,wonder mani thing i'v fuck life
2562,aren't biolog grandfath you'v alway grandfath figur life ili https:// twitter.com/briiperrin/sta tus/849038952929644544 …
2563,love best part life
2564,"got truck back new phone case, life good today"
2565,"one thing fasho mf life , i'm live"
2566,life hit fast well chevi malibu hit fast https:// twitter.com/en_jajaja/stat us/850019467329495040 …
2567,never adopt anoth grown man life
2568,"”how happi fun chang world"" - transform life world. #happi #peac pic.twitter.com/hlimyqekfa"
2569,"@anncoult trump life -long corrupt, fraudul machiavellian intern criminal. it' coincidental. illness.."
2570,care short even life
2571,today offici worst day entir life hope get hit bu
2572,"around conserv life (wa one grew up) & biggest concern taken advantag ""lesser people""."
2573,"want wast 2 minut life , littl clip made great barrier reef pic.twitter.com/utwzowageg"
2574,life time fit amaz yoga classes. mani class too. free pass! http:// bit.ly/2nij15g
2575,swear!! https:// twitter.com/tommieshit_/st atus/849824391223361536 …
2576,wonder porn star life leav industry. get regular job? wonder relationship & kids?
2577,"quai são música chão fav de vocês?? me: life party, light on, don't foll, mercy, imagin e bad reputation//jhulião"
2578,1. he' never taken subway. 2. 2nd ave subway chang commut life
2579,pics?? need joy life right
2580,"hi mom, pl repli asap, life danger! thank"
2581,"kid gone i'm still watch tangl , life came"
2582,hope alex lives. trulli regret done. love jessica. coupl wrong choic ruin life
2583,"need panera, roosters, chick fil a, bullwinkles, bill skylin back life #3moreweek"
2584,life hack > get entree/salad bar combo go get soooooo mani contain fill much food fit them!
2585,polit battl liber corporat liter life death matter.
2586,better yet-lin um pull trigger-it take low life sob burn flag-pul trigger
2587,"""the speaker confer room."" sign life assembl dem head conference. #nybudget"
2588,match game favorit show ever hilarious. 70 game show life . i'd give anyth live 70s!! #dream
2589,fuckkkkkkkk came first first time life
2590,"life throw someth you, probabl duck"
2591,sometim forget im 16 still much time figur life out.
2592,jesu came life jesu came life https:// twitter.com/doucefeline/st atus/850123697637732353 …
2593,i'm sure i'v ever care less anyth entir life . https:// twitter.com/milb/status/85 0132400441094144 …
2594,true i'm judg charact know kind man is. prais govern favor life
2595,life best pt. 1 - walter veith https:// youtu.be/v4mtfzouokg via @youtub
2596,can't chang alreadi happen stop stress it. let go let god move life
2597,i'm gonna like... blood everywhere... life 's short let dan smith live
2598,in: headlin report brooklyn' new avocado bar give life https://www. timeout.com/newyork/blog/a n-avocado-bar-is-coming-to-brooklyn-because-of-course-it-is-040417 …
2599,@donrickl dear family. deepest condolences. brought joy & brighten mani life . rip #donrickl
2600,king life
2601,peopl deadass mad arizona told rigg derek love meredith' life lmaoo fuck right
2602,thank everyon life rn.
2603,actual go colleg movin beach somewher & beach bum rest life
2604,"neg isn't lifestyle, it' movement throw life come back hit you. are... http:// fb.me/5xjzvvh2u"
2605,took best selfi life today i'm put every… https://www. instagram.com/p/bskcgj6gml3- dwddlrttrvbzrwquxfszt8jde80/ …
2606,"life tell give up, give up. life beauti gift wast stop live it. pic.twitter.com/tvjcr3zyik"
2607,abus person life father: http:// youtu.be/lxbvdtxx7mu?a via @youtub
2608,"also - find tail bike close possibl blare horn, perhap rethink thing life ."
2609,"someon popular post - life 20 like 4 retweet 6 comment - ""someth inspir kind"" 0 like 0 retweet 1 comment ""gay"""
2610,start one job tomorrow aka start downhil slide littl social life left
2611,12 year slave aka: 4 year collag life
2612,took best nap life
2613,retweet ugi ltd ( @ugisltd ): it’ move. who'll u trust w/ life ’s possess employees’... http:// fb.me/1a1ytcefb
2614,"a2: middl school relat idea life , imagin new end would charact #mercerlits17"
2615,live life love peopl !!! life way short hate i'm tell y'all !
2616,"that' probabl @meredithvieira get hype traffic. what' better someon live best life , crank tune traffic."
2617,oh wooooow fat b thought sooo tough watch grey anatomi w mom life look crazi
2618,"rt martinturnerdcr ""alisanport happi 17th birthday kelly. pleas help us save life . … https:// twitter.com/i/web/status/8 50133592164401158 … """
2619,life would give https:// twitter.com/sopharush/stat us/850133630852661248 …
2620,"rt martinturnerdcr ""_king_lil happi 17th birthday kelly. pleas help us save life . … pic.twitter.com/dyzhgae20r """
2621,"[hellbot] you, life parti dunc corps?"
2622,phenomen empow tweet. feel motiv accomplish life this. https:// twitter.com/dhxxraj/statu /850131639544033280 …
2623,"rt martinturnerdcr ""xtina happi 17th birthday kelly. pleas help us save life . http://www. justgiving.com/kelly-turner20 00 … … pic.twitter.com/7adajt3flv """
2624,anné 90 third eye blind semi-charm life (1997) http://www. radionomy.com/pokairmix
2625,"don't want say anything,but hate life ."
2626,life callin hit ignor shit bore
2627,"dream where, order spend time someone, lot. i'm gonna take sign current life ,i won't give"
2628,もう離さないでね♡ pic.twitter.com/f6jmdzb3f5
2629,i'm imagin life wobbl
2630,cant keep dick pantss
2631,"1st life experienc snow, seen two full winters, & 92° degre day. went tram palm springs. pic.twitter.com/cv4dsnz1s5"
2632,green life ! #ireland #cork #blarneycastl @blarney castl https://www. instagram.com/p/bskcfi3flyq/
2633,i'm tri devour burrito can't tast hardli breath nose stuffed. life
2634,35 gift mesh-lov fit girl life http:// dld.bz/fgv9r
2635,listen can't help fall love remind @mitchgrassi light life . love much babi #ptxvol4
2636,want someon life
2637,life look like turn 30 http:// fb.me/1x8aet7s8
2638,honour champion life name 200 #businessesoftomorrow great challeng ahead live award! @westpac
2639,ja tô juntando dinheiro desd agora p compra todo os lust life q eu pela frent
2640,aka might ruin day/week/ life .
2641,ok sinc social media like big part everyone' life kinda annoy want show sometime?
2642,cooki butter ice cream @traderjoeslist life .
2643,sit floor watch love life read cook babi dinner. thursday night look real peaceful.
2644,"analysis: eric trump call nepot ""a factor life ."" here’ may understand privilege. http:// wapo.st/2oevezg"
2645,can't food look good real life ? #foodwar pic.twitter.com/bwxvvdy5mc
2646,chuck norri alreadi mars; t.at' wvi sign life .
2647,{ @debonairaplomb }; ~ insid whole time! guts! never wrong whole fuck life !” short ~
2648,verbal attack woman? father men life ? coward
2649,someon close becom distant? life 's crazy.
2650,foot condit get runner. hell run life . much pain.
2651,life short world wide. #getoutther #travel #wanderlust #travelislif #adventur pic.twitter.com/oye4rei0lf
2652,livin' life imagin
2653,either life simpl
2654,don't understand fragil life
2655,check classroom @donorschoos ! i'd love help bring project life : https://www. donorschoose.org/project/creati ng-collaborating-and-engineering/2498705/?utm_source=dc&utm_medium=project&utm_campaign=twitter&rf=twitter-siteshare-2017-04-project-teacher_3205155&challengeid=20665988 …
2656,idk u? would want save life could.
2657,i'm done life can't go see jacob satoriu idk life anymor
2658,"i'v known want life sinc 3rd grade now, one year graduation, i'm crisis."
2659,"wow! "" #art might season life ."" - @imuhammadnow https:// twitter.com/beartist_beart /status/850130344393285632 …"
2660,"wanna walk life , don't expect stop you."
2661,took crack. far less devast sport moment life you. team give slow burn.
2662,. 春のデザインて何かワクワクしますね♪ 今日は割と暇してますんで御予約お待ちしております♪ －－－－－－－－－－－－－－－－－－ life dramat hairstyle. * イ… http:// ift.tt/2nj5eqd pic.twitter.com/j7hkj78ewh
2663,appli friend anyon life https:// twitter.com/hnsvtre/statu /849940570306785282 …
2664,never think you'r 100% thing right life .. there' alway someon someth prove wrong.
2665,ad video @youtub playlist http:// youtu.be/fk8x8ybchx8?a kid temper tantrum go animate/ground style video real life [
2666,"@teamsavage6_ dead hahahaha @savage_mikoto got fuck himself, rest fire like evr ya dickhead! #getfuckingrektm8"
2667,stori life
2668,im reevaluatong life
2669,life sentenc yorkshir man murder former partner #york http://www. newslocker.com/en-uk/region/i ork/life-sentence-for-yorkshire-man-who-murdered-former-partner/ …
2670,miss too. how' life ?
2671,"suara pengharapan ""your success"" - ""success christian life ""<br/>""kesuksesan anda… https:// goo.gl/fb/ongsdn"
2672,"life precious. don't wast petti things. spend love peopl have, appreci have."
2673,"i'v met @parkebarroww 2 times, still better friend 98% bitch life ! love u girl!"
2674,make sure life use others.. @american corner umi https://www. instagram.com/p/bskcekohwey6 bwgzzaxixnxbwdsyt4pou2agta0/ …
2675,"yeah, kratom amazing. realli chang life well. kilo organ kratom 75 http:// bit.ly/2ofvjaa fresh"
2676,yorkshir head teacher tamper exam paper ban life #york http://www. newslocker.com/en-uk/region/i ork/yorkshire-head-teacher-who-tampered-with-exam-papers-is-banned-for-life/ …
2677,need find full part time merchandis job like ..... feel it' call life
2678,make work. yup. feel guy put life risk. keep thing simpl me..
2679,love life alway
2680,kiss save life . pic.twitter.com/wbe5v65thh
2681,"thank god life , could'v worst..."
2682,gave life
2683,i'v got great peopl life
2684,correl energi word speak w/ creat & manifest life . #toledo http:// bit.ly/1lsrhbr
2685,ad video @youtub playlist http:// youtu.be/v4mtfzouokg?a life best pt. 1 - walter veith
2686,"'when someon special life , don't ruin make stupid decisions.'"
2687,life cruel sometimes?
2688,1 soulmat life . pick wisely. #kawaiibot
2689,peopl need realiz rper life outsid twitter.
2690,life divid horribl miserable. (woodi allen)
2691,"threaten like that, prefer valu life ."
2692,prompt heat july. never pray day life
2693,need someth that' plastic like life proof realli want see mostli see haha
2694,"life come fast, @senjeffmerkley https:// twitter.com/frankluntz/sta tus/850045538279895040 …"
2695,the key life accumulation. it contribution. - stephen r. covey
2696,life imit terribl soda art! portland man hand mayor pepsi courtroom conflict! http:// perezhilton.com/2017-04-06-por tland-man-carlos-enrique-hands-mayor-can-of-pepsi#.wobupheh9fy.twitt …
2697,私と仕事どっちが大事なのとかいう女にはジャーマンスープレックス(第８７話)
2698,must read: car accidents: expressway next life https:// goo.gl/n7nlyc
2699,life realli suck sometim
2700,#great alive? pleas rt
2701,fuh boy 101: bruh life pic.twitter.com/clxn9zx9ez
2702,"life must rough, littl man. pic.twitter.com/0yemeuzhit"
2703,"april 6, 2017 vers day ear heareth reproof life abideth among wise. refuseth... http:// fb.me/32y0i3lhc"
2704,"3-year-old swallow popcorn kernel. 6 month later, doctor forc pull life support http:// fb.me/4i7zf9xlc"
2705,"think long ago averag day life american student age, least suburban/rur area https:// twitter.com/theblaze/statu s/850086840359104514 …"
2706,key success y.u make habit thryughout life thing fear. - brian traci
2707,nutrit yeast save life
2708,#itgetsworseshow real peopl need see real life realli like that' okay normal
2709,everyon deserv happi matter go life https:// twitter.com/passionposts/ tatus/850133521855266816 …
2710,21 top podcast listen healthi work- life balanc #product #podcast http:// buff.ly/2ofv3ru
2711,nobodi die virgin. life fuck us all. #b
2712,hip video relat http:// youtu.be/c6jwmtcsoqw life coach berlin - wann läufst du los?
2713,thank god man around offer vast expertise. shudder think you'd life without him. phew.
2714,だって楽しいんですもんwww
2715,crossdress save life
2716,life
2717,hate life
2718,can’t fall don’t climb. there’ joy live whole life ground. –unknown
2719,alway patienc hear shitti life pic.twitter.com/6v299owx5q
2720,hot girl date low life dude get fat.
2721,life updat sinc while: current pack even tho leav day !
2722,readi adult life https:// twitter.com/greybull2015/ tatus/850054037965869058 …
2723,u see someon ... remind better thing life
2724,hi @camilacabello97 it' bday today i'm littl bit upset... u turn happiest day life wish happi bday? pic.twitter.com/nfkerkeufx
2725,need older dude hood teach lil nigga real life shit dumb street shit grew
2726,life
2727,can't believ life pic.twitter.com/xlahdcnzg8
2728,like @youtub video http:// youtu.be/v4mtfzouokg?a life best pt. 1 - walter veith
2729,roller coaster life boiiiiiiiiii #overit
2730,kid report sadi recent opportun speak w/ conservationist @janegoodallinst life ’s work: http:// bit.ly/2ojn0dc pic.twitter.com/hcqukqzh6m
2731,like @youtub video http:// youtu.be/oszul-g_gs8?a hg clan member real life ! hg power clan member irl(nba2k17)
2732,"fast-pac life , ever paus moment meditation—even thought timeless truths? @thomassmonson"
2733,"you'r brave enough say goodbye, life reward anoth hello. - anonym"
2734,jeremiah met ja cartoon real life : http:// youtu.be/ha41vp2fbna?a via @youtub
2735,white helmet video fake life -save procedur deceiv un sec cou... https:// youtu.be/9nj6fc69qjm via @youtub
2736,hack life https:// twitter.com/keamo___/statu s/850133395506163713 …
2737,think live life want :) make autom ;) #freedom #lifestly #laptop #mobil #online#makemoney #http:// digitalmk.onlinesalespro.com/opp1
2738,give thank prais life
2739,"#i 11! 2. 2 static, 11 dynamic. think appli life . balanc theme month. https:// twitter.com/shantafabul /status/850094783066460161 …"
2740,stori life tbh
2741,life fli year far - alreadi april??? lili bloom my… https://www. instagram.com/p/bskcdfybcsc/
2742,"easi choices, hard life . hard choices, easi life ."
2743,pet exposur may reduc allergi obesity: research show dog earli life may alter gut bacteria immune-boost way http
2744,honestli proud come far life done mani good thing . @salice_rosee pic.twitter.com/o7vdieu2qb
2745,rememb life career legendari comic rickl http:// nydn.us/2oje6w7
2746,"check http:// youtu.be/ndefrgrlemm life coach berlin - weshalb es sinn macht, mit profi zusammen zu arbeiten"
2747,life 's journey without risk
2748,silver 2 ak47 vulcan!? im ruin life .: http:// youtu.be/b8x7-j5ocnc?a via @youtub
2749,life 's make
2750,"tri might cannot find tweet redistricting, i.e. chang rules."
2751,sex life let let meme i'm beg help i'm scream help pleas come let pic.twitter.com/3nxqyk1zi9
2752,life
2753,#workinprogress #sketch #oilpaint #wieth #fineart #still - life #wine #whitewin #wip pic.twitter.com/rx02ezsvq
2754,today laziest day whole entir life
2755,"real life ""simba""-digit draw #throwbackthursday #art #artoftheday #disney @disney @disneystudio #paint #draw #anim #lion pic.twitter.com/nnutwezyjj"
2756,could hornet nest epic proport loss human life great put inept leadership
2757,"life popular contest, marth would win. it' pretti much imposs like guy. pic.twitter.com/telucjipmz"
2758,rice krispi life
2759,make life bitch
2760,ok exit import peopl life
2761,#thursdaythought get one life .... i'm glad corey taylor it...... pic.twitter.com/scyovolhbp
2762,"i’m strong believ whoever meant life alway gravit back toward you, regardless far wander."
2763,mysonn goe troy ave promot thug life got shot two differ times.: http:// youtu.be/bhmydiq1i5w?a via @youtub
2764,"""the life chang show celebr 8 year air"" http://www. linkedin.com/pulse/life-cha nges-show-celebrates-8-years-air-filippo-voltaggio … @iamfilippo @linkedin"
2765,emoji perfectli describ life #itsfin
2766,happi life right
2767,actual put metro card because... life .
2768,mind tell 2 mean smile said sure skull life gambl almost die year back
2769,"""that' life ."" - nhl dops, prob"
2770,"fell love you, i’m love life ."
2771,bogo life
2772,got #ordain onlin minist univers life church! https://www. themonastery.org/ordin via @ulcmonasteri
2773,"yup, one saddest day life . thought live america."
2774,#syriahoax miracl happen? suddenli alleg victim come back life . @potu @realdonaldtrump https:// twitter.com/syria_protecto r/status/849985673734107136 …
