0,life work mysteri way
1,"remov neg peopl life . peopl spend time influenc attitude, thought success think."
2,"""all eyez me"" trailer give brief glimps tupac' short yet impact life http:// blbrd.cm/uj2fli pic.twitter.com/pu30htbo6x"
3,"life spent make mistak honorable, use life spent nothing. ― georg bernard shaw #quot"
4,touch new life
5,@13reasonswhi thank make mani eye open problem peopl don't talk enough. important. everi life matter
6,one person alway come back life i'm hella tire shit
7,"read book live life . white kid privileged, entitled, dumb hell."
8,reason hard us now... 7 minut video biggest scam life . victim http:// bit.ly/2nd2pyl?3gs8
9,"wish ""never marri kids"" - stori life ."
10,mani lifestyl brand life coach pyramid scheme nice font pretti insta
11,茨城に友達(悪友)は居てもつくば周りで観光する場所って言われると首を傾げるしかないのつれえ
12,classrom teach part system someon life .
13,love life pic.twitter.com/xk20a6wimd
14,"life good right now, cant wait coupl month pass & everyth get even better & thing start fall place"
15,lightn mcqueen buy life insur car insur pic.twitter.com/y7lajzg90n
16,"88 years. perspective. precious, preciou life , i'm unendingly… https://www. instagram.com/p/bskc9_adik3p kyjezn10r5uygmmjxy66khd39a0/ …"
17,never base life decis advic peopl don't deal result decisions.
18,answer warren buffett life disabl insurance? https://www. quora.com/did-warren-buf fett-have-life-or-disability-insurance/answer/saul-gritz?srid=imbi …
19,tf get 41 tripl doubl season lol don't ever life speak ill russel westbrook man vision
20,"think you'r win situation, life hit you. pic.twitter.com/bzyr4sywe7"
21,"start everi sentenc ""look bitch"" watch life drastic improv"
22,田中圭いちいちかっこいいのせこい
23,"“then jesu declared, “i bread life . whoever come never go hungry, whoever believ never thirsty.”"
24,realiz #clemson death valley life pic.twitter.com/pawujr2bfa
25,thank #favoriteukbasketballseason sinc @antdavis23 @karltown you; watch nba. #5godcreatedanim . #enjoy life !
26,rt you'v never seen march meme life . https:// twitter.com/onetwopee/stat us/848800049891094528 …
27,don't wana forc joke custom life
28,love life . rickl funnier right death comic life . pic.twitter.com/jcwihdjsgx
29,"hate we'v drift apart again, won't make effort keep life ... i?"
30,new orlean katrina> that' nigga real y'all real life tryna someth y'all now!
31,hate miss ppl know won't let back life
32,jeff atkin could destroy life would liter say thank pic.twitter.com/hitoinga7
33,real reason life simpler kid didn’t figur make dinner night.
34,#bless #lucki 2 femal life one #amaz wife #incred niec #lifeisgood #charmedlif #awesom pic.twitter.com/fbqdd7dvi5
35,there' life sleep get high you. https:// twitter.com/_bbyrios/statu s/850127128951529472 …
36,"way cbbc stay till 9pm , kid day idea life luxuri they'r live"
37,nice know life exceed expect won't long pic.twitter.com/jidohmz3x
38,god life light steadi true
39,eat porridg think life live
40,"miss opportun life , don't look back lurk it, look forward catch next one."
41,happi birthday beauti bride best friend @tarandagreen - life ! thank love way do! pic.twitter.com/ejjvvqiith
42,import trip life meet peopl halfway. -henri boyl
43,anyth goe slightli wrong life . pic.twitter.com/huqsxmbxii
44,solid two year cat doesn't like univers life . good choic
45,life line rae
46,"harder life , stronger you'll become. stronger become, easier life be."
47,stun drone footag south africa look like real life lion king https:// goo.gl/fb/itilvi #elephantparad #southafrica
48,jeff atkin could destroy life would liter say thank pic.twitter.com/hitoinga7
49,didn't choos grey' anatomi life grey' anatomi life came told push one epi
50,"ilysssm, you'r bless cruel world! im lucki one bc life https:// twitter.com/dornanbabes/st atus/850134060647063552 …"
51,"@littlecaesar i'v never disappoint life . box say pepperoni, got chees pizza...... #littlecaesar #worstday pic.twitter.com/zvkvbpsvzo"
52,life discoveri #54678853: i'm rosita movi #sing
53,jeff atkin could destroy life would liter say thank pic.twitter.com/hitoinga7
54,sad i'v ever whole life right see lee soo hyuk' new nose job filler pic.twitter.com/utcaovdbyb
55,"walk away anyth give bad vibes. need explain make sens it. it' life , make happy."
56,ball life pic.twitter.com/vxamcxh58f
57,renew leas life
58,readi solo harri take life
59,dynam narrative. need string singl player game experi life .
60,#itgetsworseshow real life saver lot peopl feel like happen would extraordinari shane
61,"im torn & lost rn. wanna closer mum, miss close friend & anxieti rule life . idk want anymor"
62,life su u never know what gonna happen. even u dont get ya way u want there alway reason behind u dont know yet
63,"greatest day life jimin perform yoongi ""toni montana"" wig flew 24,791 mph rate"
64,it' better cut peopl life .feel pace leach that' find similar peopl hang with.
65,@pascosheriff #wa profesion felt like realli care people. life never met outstand polic officers.
66,know want #life wont stop till get it.
67,#free #nookbook seagul summer. get beach on. run life . http:// tinyurl.com/llfqutw #novella - http:// bit.ly/2dnmqvk
68,weekli remind everyon @domosexuai love life bc she' hot & give fuck & luv ok byeeeee
69,"fail vision life , gifts, & talents, someon els will."
70,"charli hoffman, round life . keep you'll jacket match weird shoe you'v alway worn!!! awesom"
71,"check book - 'diari gay nerd: life child abuse, get better!' - #bookbuzzr - http:// bit.ly/2ddjk9"
72,"you'll learn get everi day expect god' favor, you'll see god begin amaz thing life ."
73,"life could like fairi tale, perfect fantasy, noth dream. –cinderella (cinderella 3)"
74,older get realiz mom fr best friend life
75,best thing i'v seen life
76,sorri babe
77,"you'r follow @cyclessometh & @natsuuchiha19 , probabl rethink life decisions. dude awesome! pic.twitter.com/gu0vse4ii"
78,mf life get wors
79,joy real life told childhood busi im guh
80,earn good thing life make worth it.
81,men' want mi life dead presidents!
82,offici use ink two pen it' third week class love life
83,look still can't understand wood black peopl vote 4 trump shame shame shame dr king gave life 4 pic.twitter.com/jzj2vaw2vg
84,όσα herbal life και να μπουκώνεστε αν δε κουνήσετε τον κώλο σας κορμάρα δεν έχει
85,"40k singl adult entri level posit good money stop let social media skew ""keep up"" life style"
86,sketchbook save life pic.twitter.com/wkqytfvqdq
87,know i'm 22 seen life chang i'v seen life whole chang . thing realli chang
88,major s/o guy check bag let bag 10+ limit go... free owe life brotha thx!!!!
89,"life unpredictable, control illus"
90,perfect cosplay. life complet pic.twitter.com/dwansntezf
91,#ibew brother make unthink sacrific help save life anoth ibew member. http:// ow.ly/jqgd30adua
92,@bluezon love practic idea improv life radius. let' revolution #eriepa @eripublichealth @jeffersoneri @emerge2040
93,love watch homi grow up/wis life watch move make get closer good life
94,"life feel down, keep word mind... http:// fb.me/1vuoi1gnv"
95,cesped use circl life walk song?
96,"hillari clinton life election: ""a person, i'm okay. american, i'm pretti worried."" http:// snpy.tv/2o7tyio"
97,greatest challeng life wait puppeteer' house. use promot code «rsp2f» join https:// itunes.apple.com/app/id603432379
98,"tell dad said hi. strong, stabl presenc realli tough time life ."
99,"philippian 2:30 work christ nigh unto death, regard life , suppli lack servic toward me."
100,kendri moral regard human life homer
101,"chanc someth go wrong, conclus aren't like give life armor vehicl differ kinds, care"
102,wise man everi day new life .
103,"soon stop care peopl think you, life get much fun"
104,"""how' life depress seem depressed"""
105,恋ヘタ良き
106,"world go judg you, matter do. live life way want to."
107,life rn https:// twitter.com/coliegestud /status/850015719563694085 …
108,talk like dog! that' how. told doesn't make good life decis area lol
109,see life
110,modern life take toll us https:// twitter.com/natgeophotos/ tatus/850035643342352384 …
111,life simple.
112,"life , love, football: check book - 'adjustments' - #bookbuzzr - http:// bit.ly/2dbilpr"
113,new #tattoo day !!! life @masterchefcda #masterchefcanada #cheflif pic.twitter.com/re7uox4mch
114,ain't life .. https:// twitter.com/sodamntrue/sta tus/850100857614020609 …
115,can't wait see matti tmr tbh. enough matti life caus sad heartach
116,right back ya gene bean!!! lyla (rememb old dorky/crusti sign off? silly-but still true!) grate life
117,bad yan daili life ka jan. wag masyado hahah
118,ju 2nd kith raffl life .
119,she' back life remi drag slash like mf https:// twitter.com/nickiminaj/sta tus/850130062913425409 …
120,"us foreign aid account 1% us dollar, it' differ life death world' vulner"
121,"3 life path number!!! you'r pulling? don't matter, thank youuuuuuuu!!!"
122,hey god ik you'll busi resurrect jesu easter you'r resurrect social life too?
123,"feel good, life good, god good. feel bunch weight complet lifted. feel content life ."
124,"chanc 19 fuck year ago life , didn't wanna come fuck room see daughter. https:// twitter.com/teslamaylynnnn /status/850135656906989568 …"
125,daripada mencurigai lebih baik mempercayai orang lain [ tessho iwashiro – wild life ]
126,"i'm done search , god peopl come life thing build . god think ready? you'll"
127,stori life lol
128,"advic receiv today: enjoy & enjoy do. make feel happiness, it. love & appreci life & yourself."
129,@bmthoffici @beartoothband concert tomorrow i'v never pump someth life
130,"year live natur breath fresh air, live fastfood. perspect life ?"
131,movi this. can't rememb save life https:// twitter.com/bbygiri_/statu s/850045417807114240 …
132,life lesson #savemoney hoe
133,best girl life pic.twitter.com/795kahxvy8
134,「これにて閉廷、カァン！」
135,bape life style
136,chri star - interview talk life march 2017 https:// m.youtube.com/watch?v=a7rtrt vwdee&feature=youtu.b … @chrisstarmusic1 #interview #dancehal #kingston
137,"shit make sad, pleas respect limits. you'r life valuabl risk good time ): https:// twitter.com/actionnewsnow/ status/850026597897969664 …"
138,buhay parang life
139,"peopl coma can't breath x amount time taken life support without murder,"
140,car aunti girl play drake life car fml!
141,gramfam life !!!!!
142,fuck person
143,dat destini life . orix realli made hate ppl
144,"#qotd "" life short live badly."" - marjan satrapi"
145,deja vu kind like remind you'r right path life . keep you'r
146,bastard scotland charg small number rel rich peopl £400 year make life better most. bastards.
147,@taitalksshit call snapchat diddler. dj diddler. i'm scream i'v never taken l hard life .
148,sometim life burn bridg make new one
149,"@mommymus thank follow @life _nest breathabl babi mattress prevent & treat flat head, bald spot improv sleep!!! pic.twitter.com/p4absiwlfk"
150,【夢診断】 夢に「故人」が登場したら メッセージ ◎よい暗示 なくなった人と会話する（金運上昇） なくなった人と抱き合う（願いが叶う） なくなった人から何かをもらう（運勢上昇） ●悪い暗示 故人が手招きする（死・病気） ◇警告 故人がアドバイス（メッセージ）
151,dyi project guess get done life time pic.twitter.com/r9zluhj6wv
152,"i'm seek god ""forgivnes"" live life see fit i'd appreci god mind business. thank"
153,"great time appreci art life yesterday dearest, joiceee. https://www. instagram.com/p/bskc7zgdt6v/"
154,would even https:// twitter.com/ifiwasperfect/ status/850026360827523072 …
155,bruh i'm bed tryna evalu life tonight lmao
156,"live life worri other think you, you'll never live happili"
157,say life 's bitch got know treat her!!
158,it' good luv life
159,sad...but thank life ! rest peace!
160,miss boston life big time tonight #simplelif
161,u ever feel like alway give peopl advic come someth ur life mess
162,bet life u definit watch show https:// twitter.com/howlmalia/stat us/850020128498622466 …
163,anoth vacat day! love live life guys!… https://www. instagram.com/p/bskc7l-gc9j- q_cjpkwjzhstdbwrthsxxlkdm40/ …
164,"@bhaasgolf good luck masters, bet entir life save"
165,work whole life lie final caught – twice
166,quinn tri california roll method put duvet cover was.. life chang
167,言ってみてえええ
168,life game gotta learn play
169,life lie
170,1-800-get-a- life https:// twitter.com/fdarbs/status/ 850135822942732289 …
171,wow colleg life
172,want fat ass smoke sesh close friend like old time busi grown life .
173,"lmao right , play life https:// twitter.com/_moochieb/stat us/850135796959064064 …"
174,"know cannot live hope alon without hope, life worth live #milk"
175,start chang life
176,love life
177,"need companion dog , cat, boyfriend, friend, somebody' side someth i'm real life lone"
178,musicli life pic.twitter.com/nayl7cua6
179,"everyon part someone' life . may never know fit actual role without us, live won't complete."
180,keep you'r tho. remind everyon take life serious got 50 year undergrad fix shit
181,"""test: lg g6, beauti screen, excel batteri life ... shock camera"" : http:// youtu.be/u3i3u57ieau?a via @youtub"
182,*those friendship pretti sun stars* #lola #life #yolo http:// ift.tt/2o2nsjl pic.twitter.com/o3ekjwrlma
183,life suck rn
184,marjani beauti & wrap life collabor creativ beauti shoot https:// nicetynuptial.com/2017/04/06/mar jani-beauty-wrap-life-collaborate-creative-beauty-shoot/ … pic.twitter.com/2lb2dmqs01
185,life 's fuck mess rn tri stay happi
186,want vote come on...mtv
187,realli want spray paint something. normal? urg part normal life ??
188,uuuugh know. want normal life peopl leav us alon live childless forev two hors size dog https:// twitter.com/therealcesar42 0/status/850134318852620288 …
189,let white man take life much pic.twitter.com/pbz1hffwmn
190,still rememb watch video first time laugh much! he'll get far life make peopl smile laugh!!
191,like @youtub video @typicalgam http:// youtu.be/0kvysofgs4q?a gta 5 real life mod #52 - ralli racing!! (gta 5 mods)
192,@tvonetv hate that casey dog grow around dam boy chang life minut
193,life
194,havent seen lego batman batman relat thing protect robin life
195,that' colleg life
196,"yr ago today life liter chang forever, bittersweet"
197,hashimoto' protocol: 90-day plan revers thyroid symptom get life … https:// goo.gl/fb/8ipyca
198,don't need kind neg life :-)
199,"hillary, enjoy life whatev democrat win next election, lot trash clean up. idiot wh idea he'"
200,it' 8 i'm realli bed.... what' life come
201,"one could donat ankl (mean live rest life without ankle, would donat harri winks?"
202,peopl differ walk life ..
203,"life 's short tomorrow guarantee. make happy, make smile, love life . :)"
204,"primadonna life , rise fall"
205,misunderstood_queen @treysongz @lastchance4luv eminem wanna know life plp been… https://www. instagram.com/p/bskc4vbgao0/
206,quickli life turn around
207,typic liberal. decid ignor fact throw insult instead. hope nice life play victim card.
208,"turn @790kfgo ""the mighti 790"" first time life . hear someth dike failing. began."
209,"stori life , m8"
210,stori life
211,buspiron chang life man
212,jaebum life https:// twitter.com/l33chan/statu /848338977849565184 …
213,start game pneuma: breath life http:// tinyurl.com/hlo6axp
214,life rollercoast !!!! up' down one anoth !
215,right way enter code shinobi life : http:// youtu.be/h6jiqt4k77q?a via @youtub
216,need work/ life balance.
217,delet neg vibe life
218,marjani beauti & wrap life collabor creativ beauti shoot. - https:// nicetynuptial.com/2017/04/06/mar jani-beauty-wrap-life-collaborate-creative-beauty-shoot/ … pic.twitter.com/fvqhcum4s2
219,"good see good swing put ball. feel like that' first one year. hopefully, meat order jump life #jay"
220,it' rough life broke.
221,huge wast time money. earth creat man henc life there. http:// nyp.st/2ku5ty via @nypost
222,applesupport: schmickzz app use batteri life set > battery? dm answer here. https:// twitter.com/messages/compo se?recipient_id=3309375033 …
223,ugh magazin life https:// twitter.com/thefemaieb /status/850131038709977091 …
224,もう払っといた！
225,see? want take action oppos real life annoy orange. peopl vote popular vote
226,know mention but... right bless life . put broccoli. there' noth can't make better. pic.twitter.com/iq0eogor5x
227,"probinsyal- life masyado dun nas. haha di maka ano, alam mo na. hahaha"
228,get peopl ya life homi
229,life mysterious. stop guessing. start right things.
230,"spent approxim 5 hour klink, i'v time reflect. life continu outsid here. outsid world forget"
231,known imag life like millenni pink pic.twitter.com/rqw2tr23gw
232,hannib life magic use
233,can't base life people' expectations. -stevi wonder #aldubxdtbybyf
234,ocean protect sound investment. life & planet depend it! help #save #ocean please.
235,sister say live life luxuri get 8 hour sleep night.
236,cut much hair life goooood
237,go continu woeful pattern self destruct behaviour rest life ? probabl
238,tuesday wednesday rest life .
239,ik maylen beij keep life save bucket
240,real life . pic.twitter.com/sma6eqxybv
241,"ruu 355 tabled, najib n pa life line malay heartland. #politikmatang"
242,thing go well life : job relationship financ got fresh haircut
243,"feel you, i'm die right now. penalti took 5 year life expect"
244,jake gyllenha ryan reynolds: frankenstein se encuentra con alien en « life » http:// ift.tt/2nib6a4
245,sad say may 2 year left life pic.twitter.com/5xpmdtsluy
246,life choic get wors play persona 5 one morning... ...............i'm idiot
247,"pauper spirit, intellect & heart would drink tiptop' life -transform brew everyon http:// rftgyc.com"
248,". @briscoecain w/draw amdt, wd've strip $275k palli care interdisc'i adv'ri council, educ'l effort end life . #txlege pic.twitter.com/uxtzqjlukg"
249,"entitl live best lives. best you, someon else. connect soul-to-soul interact & live best life . pic.twitter.com/vzu72kzvkg"
250,"safe doctor away - buy real life , sã¤ger ã¥klagaren."
251,gift life : famili late joshua hs athlet meet organ donor recipi http:// via.cw33.com/ldutm via @cw33 (mi son aaron singleton)
252,"period pachelbel life least document one, unknown whether stay pic.twitter.com/0kipep2zdm"
253,dap sex....let know ya homi life ...
254,life altern condition? need financi help? provid grant string attached. info http:// uat.cc/53ff5 pic.twitter.com/ri1eovsmhr
255,brother life dude. https:// twitter.com/doubteddrews/ tatus/850135309287399424 …
256,squirt life .
257,swear life bro.
258,worst mistak life
259,noossaaaa ess ano tá sendo melhor dá minha life pprt
260,"took 3 hour nap, that' i'm life"
261,"wish i'd courag live life true myself, life other expect me. - #1 deathb regret pic.twitter.com/stu27hrg2i"
262,"might surpris cornucopia anaesthesia. help chronic condit called, life ."
263,biggest fear? — abl lead normal life bc anxieti ... https:// curiouscat.me/calzonacapshaw /post/130860213?t=1491523161 …
264,omg need life !!! @shanedawson #itgetsworseshow thoroughli shook right now!!
265,sleep well friend
266,drunkest ever life tequila. yike
267,it’ unlimit power care love make biggest differ qualiti life .– @tonyrobbin #quot
268,"new life style don't even like go anymore, wanna get money ."
269,depress goe mean won't hit men go. i'll live stress free life . win. https:// twitter.com/abstractnight /status/850135089459728385 …
270,bitch live life think everybodi els think would miser bitch
271,"one day you'll cruis street love life , bump oldi & everyth alright"
272,"yes! give poor fat kid struggle, give real life experience, give fight family, give show #itgetsworseshow pic.twitter.com/ychkjopuat"
273,steven told tell love everyday rest life still won't enough explain much love
274,"look like ""where life ?"" pic.twitter.com/ohcskmpnzz"
275,know it' said realli life short fragil don't worri peopl think make happy!
276,live humbl privat life promis prosper. #2017goal #dontaskmeaboutm
277,หูยอนิเมซีซั่นนี้เรื่องนึงร้องโดย usss คนแต่ง halyosi อีกเรื่อง rain //เอามือทาบอก
278,"swear god life i'll see least $1,000,000 cash hand die."
279,"mine but, i'm grate wall built. & deep appreci life now."
280,#radiochrysalisclub #hit #80 #90 #nowplay dr. alban - life (mix) síntonizano http:// streaming.radionomy.com/chrysalisclub
281,it' search someon forever.. it' find someon want life without them.
282,pictur sum life red bull pic.twitter.com/pwcdnlkgxd
283,code day. code night. code life #dewahack
284,overheard: jongin: date anyone? kyungsoo: *get flustered*ar kid me?!? love life is... https:// tmblr.co/zu5-wk2klzwn1
285,bring apart life flowers. galleri may spark decor ideas! take look: http://www. pineviewvillagesite.com/photogallery.a spx …
286,sure hell lol never fast runner usaf ain't 22 minut life lol
287,ive never hangri life
288,don't even know what' go w life late
289,#9877 #top #buy #rt restor energi level improv qualiti life dramatically...guaranteed! http:// dlvr.it/nqnybj pic.twitter.com/dzqahhxwoa
290,life parti
291,best thing i'v seen life
292,power testimoni godli life .
293,"dream got nippl pierc didn't hurt, hope it' like real life"
294,"want, would love tri life time. here' free pass! http:// bit.ly/2niqvfd"
295,"thing, matter anyon says. it' life ."
296,"thing move quick, life chang suddenly, peopl move forget. that way is."
297,see y'all tomorrow polic spare life https:// twitter.com/briiperrin/sta tus/849041055722991616 …
298,whatever. i'll go listen meryl streep sing winner take repeat figur life
299,amaz life -chang experience!! if...what it… https://www. instagram.com/p/bskc4rcltxh vs7kq4jjou1-ifc4bq5xedbvco0/ …
300,absofreakinloutley!! life throw kind challeng year. stumbled… https://www. instagram.com/p/bskc4rtj5gt/
301,realli thought quicksand go bigger threat life younger
302,bye life https:// twitter.com/svtananas/stat us/849831851573342208 …
303,bless beyond words. love truli greatest part life https:// twitter.com/9thefix/statu /850130464555839488 …
304,wanna take nap. rest life
305,wanna spend life ok twitter show i'm best
306,"stress free, life good...."
307,"life message. stori legacy. gandhi said, ""truth, peac love uniqu a... http:// fb.me/1ldcvzy2i"
308,‍ come experi sunni side life tomorrow ugbs. @abeikusantana @destinationleg @elikpodo @lmaami @100plusgh
309,i'm done *throw arm hand air* i'm fuck done *walk away* *find rope* *hang myself* *dies* rip one love
310,thing find hilari : 1. peopl tri relev life 2. bob burger
311,i'm sit island coast africa sip champagn love life
312,"#itgetsworseshow watch show would bring much joy real, raw stori shane' life aghhh"
313,it' amazing. life -changing! i'm obsessed.
314,alway wonder emma stone thing she' cri huge smile face real life break ups.....
315,man said life earth 2017 year
316,tri chees chic-fil-a sandwich today. life ??
317,ok. jeff atkin deserv life live couldn't kill bryce leav jeff alon
318,stori life lmao https:// twitter.com/breehawkins11/ status/850135605950521344 …
319,@pat_wand feel jay final show life pic.twitter.com/vv31wwo0cd
320,"scroll thru twitter readin' yall bullshit think myself: ""damn life stupid hell"". pic.twitter.com/biaufd8obp"
321,"condol john glenn' famili & friend celebr life honor man, husband, father, grandfath rip https:// twitter.com/cbsnews/statu /850116129636986880 …"
322,see life right now? #thestressninja #lifecoach pic.twitter.com/ycogawed1p
323,めっちゃ好き
324,everi day life
325,"@indusnephro thank follow @life _nest breathabl babi mattress prevent & treat flat head, bald spot improv sleep!!! pic.twitter.com/2u16p2ttfx"
326,i'v never embarrass life
327,keep ur head move forward. life ain't easi https:// twitter.com/knxk_/status/8 49816646730608640 …
328,real life ? once. time came close bruis ego. https:// twitter.com/vanessaveasley /status/850085699667849217 …
329,don't play come life ! hitch brought upon
330,yoongi smaller taehyung life still make aw everytim notic pic.twitter.com/hxdu7kioet
331,student realli passion life right now.
332,"funni dog photo | comedi life - funni photos, cartoon & joke pic.twitter.com/6qaimsgyxm"
333,"don't chase people. example. attract them. work hard, yourself. peopl belong life come find stay!"
334,singl life nice also love amaz
335,"happi birthday soulmat @batoolsaga ,wish great year full happi i'm lucki life ,i love"
336,jake gyllenha ryan reynolds: frankenstein se encuentra con alien en « life » http:// ift.tt/2nib6a4
337,someon forgot use origin life
338,forgot twitter life like.
339,like @youtub video http:// youtu.be/w8kz31cie_4?a 10 video game caus real life deaths!
340,young thug best thing life
341,wish could freez frame life right now. want feel happi forev
342,高梨臨良すぎる
343,former purdu player give east chicago student tast colleg life http:// dlvr.it/nqny5x pic.twitter.com/xlxpgwbug5
344,life pictur moment heaven see face face fall. hear song son see cri wonder why.
345,oh god ladi call babbl life fall apart 40 min
346,finish work out... i'm stand shower stall contempl life
347,thought i'd listen continu life look like pal ?? pic.twitter.com/tmneryrhik
348,realli dislik dad think tell can't life
349,live life let god make way
350,うわあものすごく懐かしすぎる
351,swear i'm go cri funeral. life damn beauti
352,he right he right~ got 1 thing wrong long life call greed eat america...
353,"u big vision 4 life ,& u want 2 know you'r like 2 achiev it.. http:// dld.bz/dhb2w pic.twitter.com/itlnughin1"
