3460,can't believ beauti girl 17 2day! gone? life fun w you. look forward 2 mani . u mama' 4ever pic.twitter.com/gh4bodcdbz
3461,life happening. .
3462,@cats_ life _22 si teigusta la buena musica srutalisima! https:// youtu.be/v6gop540yymgjss
3463,"life soon disgaea 5 come out. series, properli consoleized, also mobile? yikes."
3464,73-year-old woman say fitbit detect life -threaten heart issu - http:// goo.gl/news/dhac8 via http:// news.google.com
3465,person stress school absolut belong life
3466,i'm glad i'v got bad piec life remov !!! onto better day !!
3467,ja acho um estranho os migo da real life seguindo imagina outra galera da escola deu livr credo
3468,life great i'm truli bless !!
3469,u somon ur life remind u tumor cuz ur life u deal cuz that everyday
3470,"life , choices. yours."
3471,"go later noon, didnt get blink sleep yet lurk social medias. life good"
3472,swear god sabrina love life dude.
3473,thank lord savior anoth year life #22
3474,@msdhoni know lot barrier emot stage life overcom everyth that' ur pic.twitter.com/q1uj9l0fxh
3475,factor life ...wow!
3476,"oh grace free, wash me! it' endless love pour us! made us new life begin you!"
3477,wow eunji slay life pic.twitter.com/1bd6kqy1b
3478,kickin door in. matter life death
3479,"7 way enjoy life provence, franc http:// buff.ly/2oongog #travel #franc #wanderlust #provenc #traveltip pic.twitter.com/xf9s4wuiil"
3480,“the goal life simple: level much possible.” https:// twitter.com/ibravanibby/st atus/850132059800711169 …
3481,use twitter time ( like life ) ? i'm realli connect time i'm tweet i'm bore
3482,feet cold ate half watermelon. life right now.
3483,"accord arby' commercial, i'v mispronounc word gyro whole life !"
3484,"second earth directli side sun, wonder life would evolv there."
3485,ever wanna go outsid middl night walk around actual anyth observ think life ?
3486,peopl get paid teach mf roll blunt.... man wtf life ?
3487,i'm get elsewher life fuck man
3488,you'r one kind. don't spend life tri like everyon els
3489,damn weird life . i'm write hilari emot toll bring back up. almost like inner child work
3490,soundtrack journey life :-))
3491,panel import life pic.twitter.com/ug141hv74i
3492,you'r ad le creuset even life ?
3493,"it' fine, real life a2. learn adjust equip way around"
3494,would miracl certain time life . https:// twitter.com/knkxfm/status/ 850128490385092609 …
3495,thank peopl life accept awkward
3496,put bread away littl dun ya life . word up.
3497,someon bring beer i'll make fire food life .
3498,hope sleep claim life tonight!
3499,"words, 3 worst moment sport fandom life ."
3500,"see scholarli am, school life"
3501,kung may problema ko nd ko man pwd mahamb sa parent ko wla man ko bestfriend... sad life ba itago nlng ni kag ikadlaw hahaha
3502,life endless cycl growth decay.
3503,cisco know life
3504,"want happy, matter me. love life happy."
3505,aye i'm chill live life fuck shit up!
3506,life reset button
3507,"life ain't joke, dead? dead!"
3508,un-stan. hahah! make life easier.
3509,life sacrifice.. offer #aldubxdtbybyf
3510,lmao you'r fuck asshol hope you'r enjoy life friend shitti attitud
3511,don't need anyth els life uptight about. especi someth option deal with.
3512,"#7c compet work, life play @c21can @ceoplaybook https:// twitter.com/unesco/status/ 849942284787474433 …"
3513,"""don't excus life today pretens past!"" #gym #music #abr"
3514,"el mar, la playa... #vida | zee, strand... #leven | sea, beach... #life http:// ln.is/www.instagram. com/p/7qzm5 … pic.twitter.com/cuwhcr7pqh"
3515,that' love. need life
3516,need show life bad. #itgetsworseshow
3517,wish could redo last 5 year life
3518,giant virus found austrian sewag fuel debat potenti fourth domain life | scienc | aaa http:// bit.ly/2nq9upf pic.twitter.com/ec9ewm5xoh
3519,y'all kaitlin let child ass boy run life . tell shit like daddy. got fuck up.
3520,i'm never gonna stop talk get hit car think i'm gonna salti rest life
3521,okay allow wonsik ruin life w/ cute laugh cute pup
3522,life ! https:// twitter.com/jimmytatro/sta tus/850095497591136256 …
3523,"taint wealth last value, right live save life . -proverb 10:2 #holyb"
3524,circl life
3525,bro life complete!
3526,lmaooo life
3527,@hala_ozil hav idea hw much respect fam! honestli you'v influenc life way don't even knw! true inspir
3528,"remember: election, mcconnel gop talk block *any* scotu nomine hillary. new way life ."
3529,5 life lesson learnt wedding: http:// trib.al/9ar6l1q
3530,"el mar, la playa... #vida | zee, strand... #leven | sea, beach... #life http:// ln.is/www.instagram. com/p/aityd … pic.twitter.com/xmt3thxm69"
3531,ir tan fumada k estén haciendo un document k te interes mil te concentr te entr paranoia hello la ansiedad te visita life :-)
3532,love peopl life goddamn
3533,"love it, ace combat 5 chang life . pleas need ps4"
3534,still need protect real life tho...... https:// twitter.com/cthagod/statu /850007770569084928 …
3535,ion care neither kid father life still gone straight
3536,life https:// twitter.com/regionaldoubt/ status/850132768726044672 …
3537,"puppi die hand like serious call anim hospit couldn't save life , i'm heart broken"
3538,sware life .... dawg aint never type shoot slug beef internet… https://www. instagram.com/p/bskbyf3fkbc/
3539,it' time take nap love life
3540,nyesha nashay arrington play. idk gone get life togeth friend play damn much
3541,fenway health. i'm dead. it' singl iron thing life
3542,crazi devalu life certain favour imagin pie sky
3543,perfect life true thank https:// twitter.com/sandihkaye/sta tus/849376866599350272 …
3544,ハトアリの守銭奴双子は本当にいい。 アリスが双子の見分けに失敗したことがショックで、個性を出そうとするの。 大人になれる能力を手に入れたら、片方は短髪のまま、もう片方は長髪にするベタな差異を付けるの。
3545,stori life https:// twitter.com/officialmerret t/status/850128595800514560 …
3546,6 año tien ya #dragon #tattoo #strength #manor #respect #life #courag #youth https://www. instagram.com/p/bskbyhnlbx3/
3547,life
3548,could watch southpaw everyday happi life
3549,we'v made video beauti life journey - click see it! http:// fb.me/37iqvk1gc
3550,don’t wast life tri impress people. love love do. pic.twitter.com/fq8ydl6ly1
3551,hate life
3552,bert happi get life partner back sesam street https:// twitter.com/arisacox/statu s/850132702145769472 …
3553,need ppl life say let' get food
3554,.i can't cook rice save life . it' alway hit miss. mostli miss:
3555,<3 vicki #photographi #poetri #art #love #life #famili #music #quot #travel #roadtrip … https://www. instagram.com/p/bskbyluhwvb/
3556,shit happen liter hate life .
3557,"new life stomach, regardless i'm wife, new life imma love"
3558,want adventur want laughter want excit can't ordinari person don't want ordinari life .
3559,currently... pic.twitter.com/rcxn7jfzk1
3560,ruin life @omglove_ pic.twitter.com/sfx2mmfytx
3561,look eye tell realli #life
3562,"""fast life "" #w #wilsonsumthin #wsakalhommedelombr #lhdelo #lhommedelombr #imcrazi #imcrazi … https://www. instagram.com/p/bskbwtedo5l/"
3563,need go sleep brain rest fulli prepar listen #lovelylittlelon repeat rest life .
3564,follow moonlight. guidanc lead darkest place life . sun rise shine i'm alreadi home sleep.
3565,空中であぐらはまずいですよ！
3566,thank bro i'm stop i'm ban life either
3567,uma narrativa sobr life
3568,manhattan ave bodega cat new bodega kitten friend! count big news life .… https://www. instagram.com/p/bskbxtulcik/
3569,"istri: ""you impot man life ."" | suami: ""...."" *hening* #badenglish"
3570,veil life transparent!
3571,life good silk boxer
3572,idk releas day film it' best thing i'v ever read life
3573,doodl still life use colour pink
3574,day time uss ike remain definit life highlight especi tail hook landing! https:// twitter.com/wardcarroll/st atus/849973688170622976 …
3575,mani life chang once. great couldn't thank lord it' stress
3576,"@masseffect persona 5, i'm gonna life soon."
3577,"found wrathion ̶t̶h̶e̶ ̶l̶i̶t̶t̶l̶e̶ ̶b̶r̶a̶t̶, seem like warlock time life . #worldofwarcraft pic.twitter.com/0fpx7dnvq4"
3578,=actual represent life rn
3579,"el mar, la playa... #vida | zee, strand... #leven | sea, beach... #life @claromecó, buenos… http:// ln.is/www.instagram. com/p/c7ycx …"
3580,"father love me, oft invit me, still question stori life year year, battles,... http:// fb.me/8zqzzmnod"
3581,blame bill clinton.he' one given victim mentality. kick curb & own life .
3582,time life ever grate mother natur
3583,alreadi know life deep still dig
3584,it' life @bonjovi (at @jogjastud ) — https:// path.com/p/3bs7z
3585,"without research, tag someon sell prices? get life"
3586,watch @planetearthtwo #life #beauti #magic #brutal #amaz #geniu
3587,awesom read chang guy life . hope pray heal victim life . http:// fb.me/7hfa4httk
3588,want get part life make dinner love shirt & littl basebal boy bed upstairs.
3589,don't understand skull say life gambl also rose butterfly'
3590,flマイ主人物ファイル・・・〔ロキ〕さん ロンとよく絡んでくれるとても賢い人。お姉さんであるユメノさんのキャロキャノンをよく受けていて、ロンが治療する・・・といったコンビネーション抜群の関係。ロンはめんどくさそうに薬持っていってたりするけど治療は必ずやってるから大丈夫なはず！
3591,上位の存在が正しいという思想から抜けるにはどうしたらいいのか。やっぱ革命の成功体験?
3592,awesom chapel today @davie_high_softball! alway rememb purpos life this: know jesu make jesu known! pic.twitter.com/zgchzjwt2a
3593,never knew life except one time went friend hous middl school shock
3594,10 minut drink night( life ) away
3595,"life preciou stress worri everything. relax, fun, enjoy learn process."
3596,alway keep smile face even life easi
3597,pleas leav alone. perfectli happi life moment don't want peopl tri mess
3598,guy this. weird life . https://www. youtube.com/watch?v=ijer-j hb3rq … https:// twitter.com/seemurphstweet s/status/850132419751620613 …
3599,what' problem? he' suppos nice someon tri life ? lol
3600,"thing i'll never understand life , like bu driver keep call don..."
3601,life part 3: http:// youtu.be/skkffwgsig8?a via @youtub
3602,"life short precious, let us cherish it, let us griev alone. rip jose"
3603,would like stay life want leav that' fine
3604,sad life must self worth defin peopl think you.
3605,drive back road davenport think realli hard life realiz go 15 7 car behind
3606,song realli great?? lyric true life uplift guitar spectacular
3607,one great joy life enter time 1:90 cook burrito 2 1/2 minut
3608,stat read facebook mf broke whole life touch money that' respect money much sad
3609,"rough life . blue water, beaches, fishing. — feel awesom bay saint loui http:// fb.me/cbon6zu2"
3610,"case get mangl weekend, rememb like this. pretti life . pic.twitter.com/2oz1wjfif7"
3611,♧› life size saint bernard dog puppi cute plush stuf cuddli larg gian... get fast! http:// ebay.to/2hia7x7 pic.twitter.com/ckswhvvea5
3612,life 's tragedi get old soon wise late. - benjamin franklin #quot
3613,"second round found beat death, miracl life"
3614,"unfortun one escap day life stressors, bring sadness, anger, hurt.… https://www. instagram.com/p/bskbwmyla9r/"
3615,"take hand, take whole life ,"
3616,“you want chang life fast? trade expect appreciation; you’ll whole new life instantly.” #tonyrobbin pic.twitter.com/lebmsgjmvl
3617,honestli live life ehh saw
3618,“you want chang life fast? trade expect appreciation; you’ll whole new life instantly.” #tonyrobbin pic.twitter.com/c2swq3bjsm
3619,broke phone today got lost hollywood sign trail life grrrreeeattttt
3620,"i'd real life kill bitch man, even joke don't play come"
3621,nandi hiccups: nandi: horribl thing that' ever happen cat life !!! me: tri giggle. *giggles*
3622,life . pic.twitter.com/3wbg8gxkn5
3623,"rooftop life return friday, april 14, mother natur play along. right time @mwmusicfest open night. pic.twitter.com/rxf964ewxr"
3624,harri styles' music come tomorrow i'v never readi someth life
3625,life banana republ ain't bad gelato good chocol sprinkl & fresh whip cream. #merica2017
3626,"life pro tip: don't post boyfriend girlfriend 3 time week, everyon forget you'r dating."
3627,slow down. life savored. also. paid via paypal didn't we? slow last time too.
3628,"life though,"
3629,never trust someon doesn't keep handgun load saftey times. dont need danger peopl life .
3630,update: worst shape life unsur i'll play defens inning year #ucl https:// twitter.com/grantvwillefor d/status/840956071447523328 …
3631,"life , 2 loves: 1 chang way see world & 1 put back togeth you'v lost first."
3632,persist digit ident sat life death? dead yet still alive? via @akim8510
3633,gonna say someth fake show care much rememb watch wrestl everyday life
3634,new editori artist metro featur real life artist http:// dalemoody.art photographi |… https://www. instagram.com/p/bskbwbkb54i/
3635,save life https:// twitter.com/butler_did_it/ status/850126513651548169 …
3636,eu odeio minha life
3637,mother must thing love addit mother live sustain life .
3638,life joke like.
3639,"child didn't like life style religion, still respect you, would do?"
3640,reorgan life i'm current attempt wean 5 hour sleep night..
3641,memoir forgotten rabbi: troubl life rabbi tzvi hirsch ferber episod v https:// jewishhomela.com/2017/04/06/mem oirs-of-a-forgotten-rabbi-the-troubled-life-of-rabbi-tzvi-hirsch-ferber-part-five/ … via @thejewishhomela
3642,@russellthevoic come home pub russel sing bonker nightli show?? life complet fantast
3643,610 tweet like life don't mean shit smh
3644,need life asap https:// twitter.com/girlposts/stat us/850127709430788098 …
3645,¿uno como para qué necesita un ' life coach'?
3646,hug love kiss princess mildrett life pleasur hug beauti pic.twitter.com/o9scr8sgm
3647,life dream.. realiz #aldubxdtbybyf
3648,haven't talk cute girl school long today smile life ok guess
3649,@cyber_digicult persist digit ident sat life death? dead yet still alive?
3650,"life isn't perfect, i'm thank everyth have."
3651,life 's great right now...minu final
3652,mind bodi & soul.. 3 import thing life right
3653,hagan’ plastic chain slowli choke life him. https:// networkforanimals.org/newsletter-pag e/hagans-plastic-chain-slowly-choked-the-life-from-him/ … via @network4anim
3654,it' circl life move us
3655,"take break return fabul life , still buy goodi https://www. niteflirt.com/profile/mistr ss%20gigi%20lauren?un=c50d … ."
3656,"he' noth piec shit, graham kristol & everi neocon fcks. regard life vision world"
3657,c'mon 3 day left vote #onedirect #youknowyoulovethem @radiodisney
3658,real life mowgli? girl found live monkey forest http://www. oneindia.com/india/real-lif e-mowgli-girl-found-living-with-monkeys-in-up-forest-2395948.html?utm_source=article&utm_medium=tweet-button&utm_campaign=article-tweet … via @oneindia
3659,life amaz late
3660,life footbal want go berkeley bad lol
3661,oppos real life
3662,think time. feel peopl ignor ignor amaz interest life actual
3663,know want want life amazing. special everyth plan out.
3664,"thing break fall apart, realis everi piec fall perfectli should'v been, life goe on."
3665,"think life , rememb this: amount guilt chang past, amount anxieti chang future."
3666,映画観なければ1300円くらいアドが得られるな！w
3667,i'll alway i'm glad friend like laugh with! make life much easier love best frandddddd https:// twitter.com/dukeshelley/st atus/850131019068035073 …
3668,today run 0 sleep. god bless life .
3669,no. i'd rather stay & fight 4 care way life . #thingsiwontapologizefor self absorb ass
3670,แล้ว adventur life time ของเจ้ล่ะ จะได้ฟังมั้ย
3671,i'm live life u never knew
3672,littl thing life make go hmmmmmmm — feel love sofia ristorant http:// fb.me/1ltekhl0n
3673,love life liter go drain lol
3674,"quote: ""go confid direct dreams. live life imagined."" - henri david thoreau #ace"
3675,pray god everyday ask watch family& babi caus life short somebodi life line
3676,like noth put life perspect like semester. mani peopl say did?
3677,best thing life free. rest expensive.
3678,ikon love life get marri
3679,"democrat hypocrisi expos equat women' reproduct right abil end life . yeah,that comput either"
3680,walk dead: first day rest life http:// imdb.com/rg/an_share/ti tle/title/tt5207772/ … absolut muck
3681,13 reason make realiz don't need peopl life
3682,it' crazi get support peopl i'v known 3 year folk i'v spent life around m.i.a
3683,amount time dab listen bet life imagin dragon total unsavori say least
3684,dj booth houston' premier nite life venues! ...from tx 2 la & beyond! #bookwithconfid hit ig resume: @djtrublu pic.twitter.com/ftqjqvwjta
3685,"life isn't snapchat , fuck stories. thx josman. @home… https://www. instagram.com/p/bskbvtja5zoj 07tjaqyjopuydeflcgwxzknfbc0/ …"
3686,squidward name word 'squid' he' octopu feel like whole life lie
3687,"you'r showered, shaved, got drama yah life , andddd outfit make point https:// twitter.com/parkerkithill/ status/849786066458611712 …"
3688,media need want show portray real life situations. make happen. #itgetsworseshow
3689,swear noth hurt wors watch person love fuck life day .
3690,life over.
3691,cant get honest shawti save life
3692,"feel today, pretti much know best throw two peopl life , still feel bad"
3693,wifi dorm. i'm hate life rn
3694,slept barker basic 12 7. life . fart least once. wonder asleep snore lol
3695,don't ask siri need make import life choic pic.twitter.com/pf8icdni
3696,i'v never felt unmotiv anyth life :)
3697,don't assum add someth life .- @danvforb #leadwithgi #leadership #coach pic.twitter.com/azvgm6gdtf
3698,everyon life diet. feel like they'r tri tell something..
3699,don't need toxic peopl life
3700,y'all claim struggl life y'all starch food time can't relat say y'all bless
3701,"you'd like know life go like cover season, call me, @davidwaldstein ."
3702,#nowplay wherev - grum remix human life ♫ http:// spoti.fi/uj8yb7
3703,gostei de um vídeo @youtub http:// youtu.be/qvqqbdcewyc?ag reen … day - good riddanc (time life ) (versao brasileira)
3704,<3 vicki #photographi #poetri #art #love #life #famili #music #quot #travel #roadtrip … https://www. instagram.com/p/bskbuwzb_zh/
3705,think chick fil employe friendli must never experienc taco 4 life
3706,筒井康隆は日本を代表する作家では無い。有名な作家の中の一人と言うだけだとは説明して欲しい。
3707,"thepa_ life look like bomb dot com 'thank but, namast pa' tee! https://www. instagram.com/p/bskbuwcjuog/"
3708,total time quarter- life crisi right
3709,i'm tire much life lol https:// twitter.com/queenxpicasso/ status/850062385964605442 …
3710,nigeria need $139 oil price balanc budget – fitch http:// dlvr.it/nqnrk8
3711,"life made moment shape us. thank good one learn tough ones. everi moment, trust allah.."
3712,neiti seek probe $15.8bn nlng dividend http:// dlvr.it/nqnrj4
3713,n15bn debt: group ask efcc prosecut airlin oper http:// dlvr.it/nqnrgl
3714,take social life back... #limitless #sonofdk
3715,eagl move fifa rank http:// dlvr.it/nqnrd9
3716,room petti resent any1 thing. life lit. best year i'v far. #elevation2017
3717,i'v thrown 200+ hour splatoon. game life .
3718,"offici guys! want start chang life ? dm #bestselftrain meal plans, workout plan more! start now! chang pic.twitter.com/brlqthk1nn"
3719,don't rush grow fast. take time enjoy life .
3720,futur babydaddi ain't like fail life https:// twitter.com/austinmcbroom/ status/848747821368881152 …
3721,fg record n3.21tn fiscal deficit 2016 – cbn http:// dlvr.it/nqnr9d
3722,"damn dont leav walkway go fish that life , anyth els flood"
3723,human champion real life one w power michael brian joseph mahani
3724,"#supersoulsess hoe artist thrive, creativ explor no-fear life style. #art spririt"
3725,offic hour #life #pet #homepet #dog #dog #pugpuppi … https://www. instagram.com/p/bskbuu5l-az/
3726,"realli ""ride die bitches"" insta photo? know fact ya'll hate real life ."
3727,like @youtub video http:// youtu.be/gma6v96lgw0?a mcdonald drive thru toy pretend play food * cri bad babi * kid toy real life
3728,may abl make differ everyone' life certainli make impact mani people' lives. that' duti
3729,hahahaha es chistoso como gent que un dia fue modder ahora es un fuert critico del uso del mod. #bowitch life
3730,nap right hea nap right cheaaa bouta life bbl
3731,yo hablo español
3732,"rang morning, hour master coverag twilight nine. retire life suits… https://www. instagram.com/p/bskbujsdhcu/"
3733,can't believ theyr watch star war talk real wars? im liter watch rogu one rt this. life ? https:// twitter.com/abc/status/850 119001523048449 …
3734,start 13 reason i'm readi ruin life ;-))
3735,nice life lmao accept
3736,"analysis: eric trump call nepot ""a factor life ."" here’ may understand privilege. http:// wapo.st/2oevezg"
3737,#life #love #felizdomingo #prisonbreak #budgetmovi #agentsofshield #verdugoespañolmc #cor http:// bit.do/tick-tock-video pic.twitter.com/uimy8tqxjr
3738,@johnbirmingham everi click herald scum link get block paywall. it' genuin qualiti life improvement.
3739,come thru life
3740,hate love & basketbal passion. overr movi i'v ever scene life https:// twitter.com/auntiebaecc_/ tatus/850005293668978688 …
3741,insgeheim willst du' wirklich wissen
3742,"life , eyeliner, everything. wing it! #lifestyl #booshgyal #market #africanstyl … https://www. instagram.com/p/bskbuiyd0cy/"
3743,"peopl make laugh littl louder, smile littl brighter, life littl better."
3744,"long think justifi unforgiv affect life ?onc pure ,innoc kind becom evil"
3745,핏기
3746,swear refus bore life . that' i'm alway someth new. sport cosmetolog armi etc. alway move
3747,shouldn't take break life ?
3748,07.04.2017 в 14:49 мск начинается 12 лунный день: https://www. life-moon.pp.ru/moon-days/12/
3749,細かい数字はともかく「70年前の女性は、生理が一生で50回」というのは、「高分子ポリマーが皮膚から吸収」並みの眉唾話。「16で初潮→21で結婚」したら、既に50回超え。
3750,virtual sweatshop futur work? mechan turk' life may offer glimps what' come #darknet http:// voc.tv/2nz5ona pic.twitter.com/x84c57f07d
3751,"don't matter bad think be, life way bring knees..."
3752,"remember, one promis tomorrow. make everi day great! work everi day. life incred thing waste. #grate"
3753,love life walk nik never sadder
3754,"i'm go made fun rest life everyone' parent buy car, mine won't. gotta love life ."
3755,love life https://www. instagram.com/p/bskbt4hhekx/
3756,earlier think bad day like metaphor paper cut & later manag give real life paper cut
3757,i'm tebow life . https:// twitter.com/milb/status/85 0132400441094144 …
3758,"tell who, would without you? matter much lose. everi time bet life"
3759,unschool convent wisdom: @garzarvtravel not-so-tidi rv life . #outdoorfamili #outfam http:// goo.gl/pcigzj via @outdoorfammag
3760,awwww that' sweet!! chang life ... nikki amazing!! u ur super inspiring... i'm grate u two!!
3761,"judg fish abil climb tree, live whole life believ stupid. #quot"
3762,kpop kdrama ruin life
3763,#cut & #color life #bob life kiela kelli hair brand co. 1220 execut blvd. suit 101 chesapeak va. 23320... http:// fb.me/hz2mmmf
3764,new post whole life productivity: laura' desk - 5 april 2017 pic.twitter.com/knqmtfvfsi
3765,longest week life
3766,need good book life
3767,@kmcester @tarahcovington feel like haven't talk guy forever. how' life
3768,life would nice actual great birthday.
3769,girl happi life https:// twitter.com/fillwerrell/st atus/849849209473970176 …
3770,pretti much everyone. need move away start life over. peopl it' becom littl much late . pic.twitter.com/pfriughkwx
3771,"time limited, don't wast live someon else' life . -steve job #inspir #quot"
3772,"choos job love, never work day life . -confuciu"
3773,yes! get education. gain experience. learn life . grow up! run office! that' like it.
3774,"お前に出会えことで俺は変われた気がするんだ。all day, night, life をかけて応援するyour life 【おまえに。/ハジ→】 #歌詞定期"
3775,well goe fuck life never fuck end world
3776,get real life short wait till lose weight till start live it!
3777,aportan president @maloroacosta ayuntamiento cruz roja #hermosillo e invitan donar. dale click a: http:// hermosillolife.com/hmo/30427 pic.twitter.com/ggeoozn2ni
3778,jake love jake life
3779,lmao . don't understand richi .. stuff best thing life . haha
3780,kill haven't even live life ? #changethestori
3781,"life start two reflected, fix eye street, lest lie times."
3782,fkin asian ruin ur life
3783,whatev rumor u heard like would true i'v live life .
3784,（□д.□）「おや、そんなに重そうなものを持ちあげられるのですか。頼もしいですね。…室内生活が長引くと、フォークとナイフより重いものが持てなくなりますよ。気を付けなさい。」
3785,hello love montrose. love sister. love life . pic.twitter.com/z95akwyov3
3786,@polqnm9ozpmls4r ななこ誕生日おめでとう お互い高校生 life 楽しもうねー
3787,three word sum everyth i'v learn life : goe on. [bot]
3788,nba player' broken leg worth life ? http:// bit.ly/2o2n8ld pic.twitter.com/itwnm9dedn
3789,ha gustado un vídeo de @youtub de @drawmylife_ ( http:// youtu.be/jxqvdxyqajg?a - la terrorífica historia de (eso) - draw life
3790,life complic mess. one beauti aspect one day die goe away.
3791,shower gonna life tonight
