1393,tryna buy right life ? lemm least make money hot mess https:// twitter.com/chizzle28/stat us/850129080703963139 …
1394,"“god creat man, breath life him, also gave intelligence, abilities, and... http:// fb.me/1awzis1z5"
1395,"@stagehand would happi provid follow up, good time bad. life carri on. eye open experience."
1396,can't sleep i'm f**king excit !!! #signofthetim #hescom #onedirect #youknowyoulovethem @radiodisney
1397,see friend progress well life make happi
1398,"strict diet consist subway, panda express, taco bell soup. almost never mcdonalds. eat healthi life -chang"
1399,"life holodeck i'm call arch. ""end program"" alarm goe 5.24 hours. #sleepdebt"
1400,excit see #life tomorrow pic.twitter.com/pbd8ba9qxc
1401,"don't ask much day realli , want life friend , famili , gwap, lorin bass head 808 gang gang"
1402,life goal https:// twitter.com/axcsha_/statu /850119809073381377 …
1403,kno life hell https:// twitter.com/leftsentthis/ tatus/849745014229946368 …
1404,zipper broke @katespadeni bag. life meaningless.
1405,life great
1406,@_skykay_ happi belat bday gf dang glad met court year ago. thank come life alway bring joy pic.twitter.com/ua4aeouwwb
1407,da um toqu que eu vou morar contigo em nova york like life you'r crazi babi love aaaaaaaaaaaahhhh pic.twitter.com/xyva3a6vu3
1408,seh mi like yuh enuh yuh ah waah good woman mi seh nuh botha like mi enuh i'm enjoy singl life — feel stress free
1409,take day sad mope around build bridg get hell it. life goe you.
1410,sonic youth tシャツ / sonic life http://www. rockcrime.jp/product/2954
1411,life 's much differ
1412,"don't know valu lose it- dear uni life , miss"
1413,life
1414,peopl rl make turn life style
1415,visual import aspect build success life . visualize… https://www. instagram.com/p/bskcfrugjyi/
1416,learn languag #app travel life http:// bit.ly/2k2uso9
1417,man' life consisteth abund thing possesseth. - luke 12:15 http://www. biblicaletv.com http:// jesustweeters.com
1418,"hurt open phone case, guess could say today worst day life"
1419,buy @official_yizzi 's new ep: life ! support good music man #lewisham pic.twitter.com/zmqzjbol6j
1420,use chase peopl someon leav life it' like stay gone.
1421,"school prisons, earth live matter life mars. god good!! jesus. reason vote coin toss. https:// twitter.com/mccarthj11/sta tus/850125565252317184 …"
1422,love friday's. alway fun work day titu e.s. hang nephew stevi after! life good!!!
1423,umbrella can’t stop rain make us stand rain.confid may bring success give us power face challeng life
1424,"lmao, live differ life now! unread texts, annoy me."
1425,life tweet https:// twitter.com/disickreact s/status/850000536938192896 …
1426,that' josh help guid life .
1427,turn 21 ruin life
1428,taco bell real life equival chum bucket y'all eatin
1429,peak life . https://www. instagram.com/p/bskce48deejf 0tshzxqyr3dcddp_lanuqrwsdk0/ …
1430,"i'm watch teen titan robin said ""i need spice life drop one grain salt"
1431,"""if great grandfath never 19 wive darl u would love life "" sound legit. use it."
1432,errrmmmm could life go wors
1433,"feel aren't anyth provide, love, support realli there' place life . wast time"
1434,heart break loss innoc pure syria. seem mid east fire sanctiti life anywher
1435,come life accid stay purpos
1436,cu straight peopl want spread ideal heteronorm isn't possibl home don't live life style.
1437,life everyth
1438,"would like thank @jimmyjohn meal go hit best routin life . thank you, made final pic.twitter.com/kqv2o0wh1w"
1439,☆ life short give shit think live life way want live :d☆
1440,"aunqu sea pata voy, pero el sábado en life lo pierdo por nadaaaaaaa"
1441,don't think live life without cute littl doggi it. convinc root happiness.
1442,life voss lane. pic.twitter.com/jhdqmdxkoj
1443,wish serv rest life —a tactician husband!
1444,life advic one @thenamesnotray pic.twitter.com/ac3wbezq0z
1445,life https:// twitter.com/dammmncam/stat us/850063001382203392 …
1446,schmickzz app use batteri life set > battery? dm answer here. https:// twitter.com/messages/compo se?recipient_id=3309375033 …
1447,focu promis god life problem life ! http:// jesustweeters.com #jesu
1448,hate life https:// twitter.com/gallagherreaga n/status/850082137894211584 …
1449,"everi time straight man call pussi respond ""i eat,"" liter lose year life ."
1450,life alway good late get better better #bless
1451,life dred
1452,life mess
1453,need excit life
1454,can't life figur navig amazon
1455,i'd total go get burrito now... life
1456,حقين الحكومي ابدا محد حكئ تجاربه
1457,jay give life ! https:// twitter.com/jayversace/sta tus/850092565453864960 …
1458,thing life soul destroy watch basebal game tv tropicana field.
1459,one thing beg somebodi life
1460,reli allah subhanahu wata'ala everyth want #life &he give best possibl way never imagined.
1461,يله قدام
1462,life
1463,"#fenderprosweepstak need pro offset jaguar life beautiful, desirable, oh offsexy!"
1464,"think come back term ""unlearned"". need find better way talk bc greek life v touchi"
1465,let live life
1466,(blackadder) dougal mcangus: hope life doesn't get bore can't pass law scotland. edmund: [laugh feebli (1/2)
1467,room mess like life
1468,playing: thirteen minut - life
1469,hate twitter know life https:// twitter.com/comfade/statu /850129979962675200 …
1470,@jeremyjahnsth maze limit power situat could use while. u save life crime ami
1471,may life preach loudli lips. #llwhereisdaddi
1472,"j'aim une vidéo @youtub : ""[thug life ] melenchon domin lenglet"" à l'adress http:// youtu.be/zvyrzelp3dk?a ."
1473,#jesu proverb 12:28 righteous road life ; wicked road death.
1474,@villalobosseba thank u arriv life
1475,sometim u gotta weeeeeeeeeee life
1476,"live life , divine, love #peaceloveandsunshin"
1477,never life https:// twitter.com/jmgxo_/status/ 850115989454934016 …
1478,"dear person read this, deserv life full happi adn positivity. don't let other get believ"
1479,feel like i'v wait whole life kendrick joeybadass album
1480,"love billie, season base 2016 election? seriously? sometim real life stranger fiction..."
1481,bowl cut prime time life https://www. instagram.com/p/bskcdxydafa/
1482,david lynch: art life http://www. cinesargentinos.com.ar/pelicula/7078- david-lynch-the-art-life/ … vía @cinesargentino
1483,like @youtub video http:// youtu.be/lrvvnzryx2s?a laugh loud challenge!!! w/ littl ropo real life !!! - babi angel
1484,life insomnia
1485,come slum peopl valu materi life . think twice
1486,tweet sum life don't even cat
1487,like @youtub video @andyroidnet http:// youtu.be/pjv1wy00suo?a mobil game come life (short version)-andi os 2.0 emul
1488,life https:// twitter.com/springcdt/stat us/850039697539813377 …
1489,live life fullest 🖒
1490,easybib alway life saver
1491,smoke life - mario joy https://www. instagram.com/p/bskccrbfp2b/
1492,could life .
1493,goal life invit wed look better bride.
1494,easili one favorit fact him. someon make forrest gump like movi life music industry.
1495,play @japzsoul good life https:// m.youtube.com/watch?v=0dsnog 5kpog …
1496,weak ass bee almost put coffin take trash. never tri open slide door fast life & cut damn finger
1497,bex taylor klau never play straight charact life aspir legend becom actor
1498,get ! complain ! reason life ! (appreciate) !
1499,excit play coupl song see improv base gregory' life road touring! love... http:// fb.me/ctafrfk0
1500,rememb 3 second rest life https:// twitter.com/wiebesunsport /status/850134602731720704 …
1501,altern found 1000 famili #ugccgolfnoidasec96 paid life save &left merci #unitech wait 7 yr
1502,applesupport: schmickzz app use batteri life set > battery? dm answer here. https:// twitter.com/messages/compo se?recipient_id=3309375033 …
1503,could ruin life
1504,ｗａｎｎａ ｒｅｍｅｍｂｅｒ ｔｈｅ ｌｉｆｅ ｔｈａｔ ｉ ｕｓｅｄ ｔｏ ｈａｖｅ． pic.twitter.com/pdjthmyjfi
1505,it' kinda nice tell peopl deep thing life . it' kinda relief way.
1506,day 19 update: life still fuck flame
1507,"life good. whole area winning, couldn't ask much more. #glorybe2god"
1508,id insan didnt @romanocarli & @reannah_xxox life ..
1509,"bornk moseley, san jose citi colleg mainstay, die front daughter devot life - me… http:// ift.tt/2o80w2o"
1510,cw ace discours get real life ?
1511,set appoint tomorrow massag envi life !!
1512,i'll live home rest life then.
1513,it' beauti day love life
1514,"so, luminaria made relay life malacca. cost rm5. profit goe ncsm provid support patients. pic.twitter.com/y0hm7mhxmw"
1515,life 's fun. realli gottado livendi
1516,make rest life best life . #aldubxdtbybyf
1517,finna ju sit car wast life away .. lol
1518,babe. pictur it? life could live
1519,ugh pearl jam give life rn
1520,shout student athlet @sanpasqualh @bc_bears_sb champion life #nationalstudentathleteday
1521,even though live dat hard life im gon alright one could'v said better
1522,chuck norri: alreadi mars; that' sign .f life .
1523,"don't ""hold"", wait experi life ; tri accommod others. believ , arnt extend favor."
1524,hbd @rgvzoomin. i'v celebr ur bday ever sinc i'm conscious. thank ramuism episodes. wish u sex fuck life .
1525,it' #worldhealthday . apt @livingfutureia lead forum improv qualiti urban life ...across @brainmind_usyd ! pic.twitter.com/jz7vpalonl
1526,life short. clue ride end. stay present live fearlessly. - brenden dilley #quot
1527,say ye lay life pic.twitter.com/i05ydqomrf
1528,"live life girl, leav alon"
1529,10 awesom second bay life choir prepar hymn - bay life spring music may! http:// fb.me/1e31aawol
1530,purpos life .
1531,"celia lose perfect life ultim betrayal, dax help celia believ love. http:// dld.bz/f8dh6 #romanc #kindl #book pic.twitter.com/eiod0xvrzv"
1532,life give live s.d never thought id hate way becom ....end time come peopl .better find god soon
1533,everi time watch @iyanlavanz fix life
1534,everytim hear word societi lose year life swear
1535,surrend seat heaven 33 year give us life .
1536,real pic contempl continu life spend much money food pic.twitter.com/iny0g1nqa9
1537,"life funny, someon make sitcom lmaoo"
1538,it' actual pretti fing fun alway someon hangout oh yeah.... love rest life ???? https:// twitter.com/vitaminndeee/ tatus/849001087273193472 …
1539,"almost 3 am, watch buzzfe video n crave sushi. life fall apart around"
1540,life vs everybody. realiz wont succeed.
1541,"similar convers least 1 grad student/term. today' 40 veteran. life death, fail."
1542,""" life beauti short, make happi make happy...… https://www. instagram.com/p/bskccsbbyy5/"
1543,real life hurt! like nigga gatta mean
1544,i'm handl life pic.twitter.com/k5facieusw
1545,im@ life pic.twitter.com/anjgdtmxhc
1546,love life crew @new york met https://www. instagram.com/p/bskcb8tloci/
1547,retweet maria popova ( @brainpick ): zen master explain death life -forc child... http:// fb.me/4nhelkelx
1548,might actual get third job summer??? haha @mi life
1549,fear face triumph move onto next chapter life .… https://www. instagram.com/p/bskccf5gcq6/
1550,life 's good faaaaaar
1551,art flower card can't make yamato look good save life
1552,regrann life _of_icezzi - wait it..gon b lit asf!!!.. @nuzi_de _c_a_t_h_r_i_n_a -… https://www. instagram.com/p/bskcch1hksg/
1553,protest pepsi advert real life didn't end well http://www. mirror.co.uk/news/world-new s/protester-kendall-jenners-pepsi-advert-10175454#icid=sharebar_twitt …
1554,"point life , swear ain't got time waist !! perittt"
1555,life would better unlimit food coupon
1556,“the ear heareth reproof life abideth among wise. refuseth instruct despiseth own... http:// fb.me/1krzm20s5
1557,"call it. she' color purpl harpo shit. ""all' life fight...and nigga brian can't stop think bout ass"""
1558,donat blood today joy save three life 's need know nurs exactli wanna do!(:
1559,life 10% happen 90% react it. ~ charl swindol http:// ln.is/org/1c40g pic.twitter.com/rkt8lh2mgx
1560,"i'm wanna life , i'm work toward it."
1561,know what. life ain't half bad day
1562,bad i'm wait someth go wrong caus life good late
1563,i'm bad talk peopl lmao come bitch bc don't repli it' realli caus anxieti run life pic.twitter.com/lgovwjbndb
1564,"monday wednesday could worst day life year, know"
1565,"prana, may 11th jacob burn film center' medit life festiv https:// burnsfilmcenter.org/series/the-m itative-life-consciousness-spiritualityand-the-kitchen-sink/ … #burnsfilmcent pic.twitter.com/b7lonrdmpi"
1566,"step comfort zones, motiv uncomfort situat level growth chapter life i'm at."
1567,least life back
1568,13 brother got marri flower girl one uncomfort experi life
1569,"best friend full movi dreams, like whole life happen said long like wtf"
1570,lmaooo real life
1571,life suck
1572,"life highway, drunk wheel"
1573,"rapmon rapmon alway expect best solid understand life , yet, spirit live right."
1574,violin tambourin / candi cane magazin / preacher sermon street / kill man life cheap…
1575,day say let get marri happiest day life ....
1576,schmickzz app use batteri life set > battery? dm answer here. https:// twitter.com/messages/compo se?recipient_id=3309375033 …
1577,#read life magdalin slatewood: brief summari #read #marriag @mil102 http:// amzn.to/2mlvdgj pic.twitter.com/okepdkdsdk
1578,life
1579,jdm stole al' spot nr' life kp stole nr' spot mmb' life . guess goe around come around @@@nr.
1580,他人または自分の気にくわない人にちょっかいを出して 楽しむのは とても簡単で 楽しい娯楽なのかもしれない。 しかしふと気付くだろう。時間の無駄だと。
1581,"91-92 w/ ""the doubl life veronique"" iren jacob beauti talent woman world. https:// charlierose.com/videos/9464"
1582,love chaylan! alway stress night life
1583,@realalanarkin i'v enjoy work whole life . thank that!
1584,boy live life make friend spineless harpi ruin 4 he' alon *scream oblivion*
1585,@blackandredu googl fu fail me. last season shot taken film. cannot life rememb photog. help?
1586,rt @amz0n suicid man' life chang found man mountain http:// smarturl.it/mtntg #amread #ebook
1587,london' bells: visit great tom st paul’ cathedr | spitalfield life ( @thegentleauthor ) http:// ow.ly/jap830adzzz
1588,free trip life time sun im
1589,#jumatberkah life shorter often seems. sometim given minut #networknumberon .com #heris3832
1590,love life could way perth right pic.twitter.com/pksbevzio
1591,"i'm favor reduc them, erad them. use languag like sparingli make life easier reader . . . good goal."
1592,stori life
1593,life highway !!!!!!!
1594,mustach let live life sis. https:// twitter.com/____lenese/sta tus/850130594629652481 …
1595,lol... life like sometim https:// twitter.com/blesst_23/stat us/850134653302341632 …
1596,"kid situat mom straight , life 's good"
1597,@hamillhimself life made richer fill beauti artistri creativ endeavors. #dontstopbeliev #wewont
1598,don't get peopl stay & dismal long period time. neg time inevitable. that' life .
1599,"@ehesketh thank follow @life _nest breathabl babi mattress prevent & treat flat head, bald spot improv sleep!! pic.twitter.com/kxmej5ovxv"
1600,surround truli happi peopl great way live truli happi life
1601,schmickzz app use batteri life set > battery? dm answer here. https:// twitter.com/messages/compo se?recipient_id=3309375033 …
1602,"birthday greet ita.kaymus musicphil #ita -kay ( u life ) @kingston, jamaica https://www. instagram.com/p/bskcbaybqzk/"
1603,me: hey hold minute? *hand life run hills*
1604,cop engag alleg jewelri store burglar life death struggl caught video http:// ift.tt/2nybozd
1605,any1 know good women/poc sci-fi book club? readi @nkjemisin fifth season it' give life .
1606,ever happen love life god know ..
1607,omg life . also love see hot sec!
1608,power thing life actual test patience.
1609,co-co life のホームページ、見てくれた？ 季刊誌として順調に発行中(*^-^*)そしてまだまだ協力者を大募集♪ 悩まず・畏まらず、やれることをやれる分だけ、お手伝い宜しくm(_ _)m http://www. co-co.ne.jp / #c_clife
1610,"far ""high school musical: ryan evans"" ""suit life zack cody: zack"" throw suggest"
1611,ugh it' like know life hahahahahaha
1612,schmickzz app use batteri life set > battery? dm answer here. https:// twitter.com/messages/compo se?recipient_id=3309375033 …
1613,life full brick walls. recommend use sledgehamm knock >:)
1614,inaccurate. dad huge part life & #1 fan https:// twitter.com/yeoshinlourd /status/848321904956125184 …
1615,fail school doesn't mean fail life rememb
1616,life hard man https:// twitter.com/kimwhogyeom/st atus/850002366787067906 …
1617,f life
1618,love life treat respect honor - skip marley #wisdomfortheday
1619,funniest shit ever seen life internet i'm cri til i'm die !!!!!!! fuck https:// twitter.com/thatniggakmac/ status/850016617954131968 …
1620,live life https:// twitter.com/greasynigga/st atus/727198590305734657 …
1621,psa.119:50...your promis preserv life . (niv translation)
1622,"unbeliev happi past days. keep up, life !"
1623,91 day til see vesperteen 77 day til see josh tyler life . good
1624,check classroom @donorschoos ! i'd love help bring project life : https://www. donorschoose.org/project/spr -has-sprung/2482214/?utm_source=dc&utm_medium=project&utm_campaign=twitter&rf=twitter-siteshare-2017-04-project-teacher_1445446&challengeid=233364 …
1625,@lastchance4luv eminem wanna know life plp tri figur there… https://www. instagram.com/p/bskczmmgsm2/
1626,guy discov proof life caus massiv amount suicides. son meet girl tri figur thing out.
1627,"#redditor , heartbreaking/difficult experi life end benefici end? goo.g…"
1628,"ye course,jack child, life"
1629,@sr0820 stephen curri new life coach https://www. youtube.com/watch?v=xs1smq pc1om&feature=shar …
1630,least it' shit worth talk about. like bore ass life .
1631,gym life
1632,stun drone footag south africa look like real life lion king http:// ift.tt/2o2rxcf
1633,bro life good pic.twitter.com/8ljfwldc2z
1634,say i'm heartless i'm live life way need fam
1635,let live life way want https:// twitter.com/parvollen/stat us/850134623447285760 …
1636,want life right make enough money mom doesn't worri hous payment anymor
1637,hahaha life https:// twitter.com/gawdtrill/stat us/850124623563825153 …
1638,like @youtub video @kennokevin http:// youtu.be/_5hrs1jgeu8?a day life : wrestlemania 33 axxess!
1639,"point life decid profil picture, pictur everyon associ with, anim girl fuck"
1640,begin take oh mitch love life
1641,""" life either dare #adventur noth all."" - helen keller #travel #quot #adventur pic.twitter.com/xzinpgjtlh"
1642,come life ~
1643,saya suka video @youtub http:// youtu.be/fg9m0aepjge?a g-eazi & kehlani - good life (from fate furious: album) [music video]
1644,life ! pic.twitter.com/gbtsjkjoun
1645,like @youtub video http:// youtu.be/taln9n0qgfm?a rickl afi life achiev award tribut shirley maclain
1646,need cheddar life within next hour i'm gonna spaz
1647,life . probabl labor tri kill spider.
1648,feel like whole life knock line go see ghostfac town?
1649,anddddd fuck bitch move hous mommi bought her. way work anyth life sweetheart. oh wait dont
1650,abus person scream help — think life
1651,give 13 consumpt habit 13 week better life healthier planet http:// ow.ly/hfzb306htkh pic.twitter.com/3biry0knzj
1652,life bless live etern love that' never lost #orjay
1653,thing chang life goe
1654,cannot wait see freak man tomorrow!!!!!!!! gonna best day life
1655,"life short. break ego, forgiv quickly, live truly, laugh loudly, faith self, never avoid anyth make smile"
1656,affirm life natur christ—th second adam—in spirit. put imag the... http:// fb.me/1fyahhvmo
1657,belief life death - religion islam https://www. islamreligion.com/articles/38/b lief-in-life-after-death/#.wobvvdz77c8.twitt …
1658,"joy strength, joy, offer strength peopl god place life ."
1659,thank guy countri music life . love
1660,commit life #god .
1661,...light love life https:// twitter.com/sonshinelwt/st atus/850134270412640256 …
1662,i’v fail life succeed. michael... $ ell /฿uy http:// bit.ly/2mdyd3u #bitcoin
1663,life constant declin can't help laugh
1664,life 's short seriou time #tbt #majesticquan #clowndizon pic.twitter.com/j6ymqoj6hi
1665,god don't pick & choos worthi life . everyth born die death chill. u die isn't god' choos either.
1666,mean met chick would awkward wouldn't talk suck it' life
1667,kid fart one time i'v never heat life . fuck elementari school. https:// twitter.com/jiggaray/statu s/849375513714069504 …
1668,littl superhero life . http:// bit.ly/kapowhelmet #kapow #superhero #popart pic.twitter.com/agybslasob
1669,overtli thank gift life much
1670,simon hare: save kron' life - sign petition! https://www. change.org/p/simon-hare- ave-kron-s-life?recruiter=260727316&utm_source=share_petition&utm_medium=twitter&utm_campaign=share_twitter_respons … via @chang
1671,"everi time feel like odd succeed life low, alway look this. #feelsgoodman pic.twitter.com/me8fadt6ff"
1672,"peopl come go, that' life ""الناس تأتي وتذهب ، هذه هي الحياة""."
1673,life ... pic.twitter.com/qabnec8lyw
1674,"aeon-embrac knowledge, great race chose everi era life -form thoughts, arts,"
1675,he' put littl thought entir life .
1676,"it' merrit garland ,juan. give up. life move on. mayhap futur vision merit garland resurrect. life goe"
1677,happen life ? don't think i'm drunk enough this.
1678,here’ tell idea worth month year life : http:// buff.ly/2ng1ubd pic.twitter.com/pygdhr330l
1679,think curl ball life goe crazi total ok response. #nosham pic.twitter.com/4xsfdtzzjp
1680,tryna go mud
1681,"3rd grade spell bee got ' life ' spell 'live', tough first round elimin"
1682,life 's muthafuck
1683,way flirting: stalk everi social network
1684,"""let run life .."" foto•bart #streetphotographi #event #fashion #photograph #london #artist #art pic.twitter.com/7obmdnl8gc"
1685,wonder ever abl repay due you'v done life thanks… https://www. instagram.com/p/bskczndgjoq/
1686,boy b send girl booti pic lol love life mine
1687,"icymi: @ntrich ’s film @allskatedoc chronicl life ""miss doris,"" roller-sk septuagenarian. @fullfram http:// bit.ly/elonallsk"
1688,don't need balanc work & life . need balanc surviv today progress toward better tomorrow.
1689,"""there moment life show mean leav behind peopl don't.""— @_alexel"
1690,"lately, stuff holdin choos speak on, see dream shit happen real life ."
1691,"best day life ! thank beeb, love @justinbieb pic.twitter.com/3cy2xegdq1"
1692,i'll miss carefre life huhu.
1693,greatest moment life @islandboy_turk @theveryhairyman pic.twitter.com/oexwcac3dw
1694,"it' ""factor"" life . pompou punk! #usadoom"
1695,"right here, right now.. rememb great thing god done! realli see it! realli give thank 4 it! much great life ."
1696,say lot truli believ life fall apart everyday
1697,"feel like life would better without it, ain't mad atcha."
1698,"poverti &amp;amp; misfortun life , true friend sure refuge."
1699,１つ１つの部屋がオートロックなとこもあるよね！学生寮とかそーゆーとこ多い気がする
1700,learn accept life start live it. http:// youtu.be/q60cox4srja?a
1701,right you. consid couch life partner.
1702,"salvador, ella mae- super duper fangirl ni lee min ho kdrama life na ba itech? lingaw pud ni makauban. kagrupo mi ani sa fishnok"
1703,"well, finish aftermath: life debt. han solo leia part beautiful."
1704,like mental institut select put in!?
1705,"@erictrump , nepot may ""a factor life "" monarchi ... government! pleas go back civic 101 book."
1706,tebow realli live life . love
1707,mani reason enjoy beauti life .
1708,"forgot tweet yesterday....(fail life )to j-hors ball sunshine, #armyslovehoseok pic.twitter.com/t2okmfss1b"
1709,update: man get life brutal stab clovi mom. http:// bit.ly/2nj4h1a
1710,life fall apart piec piec
1711,wow kourtney life amaz
1712,"bro delet -_- rt: "" @synergysiren gotta live ya life peopl https:// twitter.com/greasynigga/st atus/727198590305734657/video/1 …"
1713,s/o og nigga put game throughout life .
1714,gil. it' bad like ... fast points. major life chang ryder x'd
1715,retweet save life https:// twitter.com/carterjwm/stat us/849813577770778624 …
1716,there life sleep get high https:// twitter.com/_bbyrios/statu s/850127128951529472 …
1717,life happen you'r busi make plans.
1718,@joe_sugg i'm kind freak life @caspar_le
1719,pasadena man sentenc 77 year life prison kill sister text girlfriend http:// on.ktla.com/wplow via @ktla
1720,"""mi life cost efficiency. that' eat jimmi john' everi singl day life .""--aaron leonard kall"
1721,uzi life
1722,peopl say life isn't perfect. actual it' perfect make it.
1723,haha is. entertain life listen peopl drama https:// twitter.com/therealjcann/ tatus/850134634121891841 …
1724,lotta good thing bad you.. life . go figure.
1725,life homi decid
1726,life empti talk football. take us back مش هنصاحب بقى ولا ايه؟
1727,stori life https:// twitter.com/mcleodszn/stat us/850132176343629824 …
1728,"thee bore person ever lately, tryna juggl work, placement, college, assess social life ain't easi"
1729,que vaya tela la distribuidoras. había fine de semana para poner peli espacial que la meten el mismo día de estreno de ‘ life ’.
1730,everyon achiev dream everyon mad life
1731,"know overal happy! moment it' great. meanwhil life ""jack can't happi come exams"" pic.twitter.com/slolmjlogk"
1732,#judgeatom #gammaraygorsuch gorsuch taint life
1733,would let jeff atkin ruin life know good guy wouldn't have. https:// twitter.com/trustmels/stat us/848953119761420288 …
1734,"te lo quitaba, te daba má años, má sabiduría, má experiencia de la life jajajajaja"
1735,fell asleep watch live video april giraffe.. yeah that' life
1736,"one us differ life status, compare?"
