0,"anoth b1g honor nittani lion @saquonb21 ! @chicagotribun silver footbal recogn best player @b1gfootbal . congrats, ! pic.twitter.com/3nuq0mm2wn"
1,nemb es safr tírala lion
2,wildebeest refus let friend die deadli attack lion succe that' friend for. pic.twitter.com/xobh08d1
3,googl this: lion quietli tell stori indian orphan' search home - http:// goo.gl/news/vroqu via http:// news.google.com /
4,"мы живем в школе ее на одну словечко: скажет, потом, течет трусы имеют в деревне над два дня, не нанимался. pic.twitter.com/dewitrunzr"
5,何でもないわ
6,う～ん…？
7,ainda bem que você sabe
8,"dubious famou name get possibl lion share profit even move finger , without anyth j"
9,"come #savagekingdom , i'm team lion ! i'll watch tomorrow 9/8c @natgeochannel . https:// cards.twitter.com/cards/aehgr/2r uz5 …"
10,ah siim
11,gonna make one lion name lion :)
12,ジンさんの幼少期がジンさんすぎて笑う pic.twitter.com/d6cqk4vfuk
13,"хуй с тобой, в этом докатилось до такой как бы хотел верить. пусть даже хуже: прежнего. самое тыкала палочками pic.twitter.com/80yxna2xvk"
14,u heaven
15,chip'ndal
16,往復ちっぷ
17,bricaaaando bb
18,"nittani lion , @nittanylion trend #pittsburgh https://www. trendsmap.com/r/us_pit_fmdxpc pic.twitter.com/lujxqiehln"
19,"lion brand new fall collection: 15 free crochet scarf patterns, afghan patterns, - ...… #craftsamphobbi http:// dlvr.it/mrgqqd"
20,rsrsrsr
21,#эвакуатордешево #дляавто ! #ремонтавто #карта #дляводителя всё тут http:// vk.cc/5wfjoy pic.twitter.com/6jchdqln10
22,today good-ass day. made ate big ol dinner i'm lie like fat dog bear lion even gorilla?
23,readi lion bandwagon? pic.twitter.com/yancc72c84
24,ebaaa
25,agora já era.. papai noel já vai passar na sua casa
26,いやまじでゆーりどうなってんの？(╬⁽⁽ ⁰ ⁾⁾ д ⁽⁽ ⁰ ⁾⁾)(まだ観てない)
27,"ну, а что. там в этот простой невозможно. пусть она повернет к ним случалось естественна, не стыдно , все, для pic.twitter.com/k7fhwyy2rq"
28,gooood morn dear lion heart papa ji #biggesthitlionheart pic.twitter.com/xasy30v5e0
29,ma mereço vc? q lixo
30,*grope @lion _taek dare want to*
31,"- got one say ""onli strong survive"" - like cats? - huh? what' tha... - massiv fuck lion !!! next... #tattoofix"
32,仕事行ってきます
33,9.sea lion #aldubgenderrev
34,selamat pagi. happi friday! (at pt. batam teknik (mro lion air batam)) [pic] — https:// path.com/p/38sqg7
35,tá bom amiga rsrsr
36,claro
37,"come #savagekingdom , i'm team lion ! i'll watch friday 9/8c @natgeowild . https:// cards.twitter.com/cards/aehgr/2r wp4 …"
38,"леди гага в экстравагантном наряде 30-летняя американская певица, продюсер, дизайнер и актриса леди гага (lady... http:// fb.me/10qbdksjh"
39,vão dar os present mesmo?
40,妙に冷静で朝の雰囲気はまるでないよね（笑） どんよりもするけど、テレビであんなにさらけ出せるなんて自分の中できちんといろんなことが消化出来てて純粋にすごいなぁって思ってしまったよヽ(；▽；)ノ
41,http:// fb.me/11kk2zvj6
42,gemini twin mosaic @artnsoulmamma #kitten #dove #dream #nightmar #art #twin #gemini #lion … https://www. instagram.com/p/bnxocjpjmmc/
43,安心してあたしめっちゃ目の前にいたのにキラキラボードにでさえ気づいてくれなかったから！( ◜◡◝ )絶対私かわいそうな透明人間！それかテヒョンくんに人間として認めてもらえてないかも！( ◜◡◝ )
44,bae quer q eu vá passar final de semana lisboa com ele.. e voltar na segunda.. qria tanto..
45,mother mani sing got voic lion 103 pound lay high vocal
46,"в трамвае из себя. прошла разы. во рту да лавка в переписке они там никого не будем ныть, о чём pic.twitter.com/s9hrwkgpvo"
47,ぬーん pic.twitter.com/rahe4euomf
48,#biggesthitloinheart thank lion heart papa g bless
49,porra amanda só um bolinho casão
50,: would lyin' lion ?!
51,apaga que da tempo
52,"botswana' top predators, lion favorite. i'll watch #savagekingdom friday 9/8c @natgeowild . https:// cards.twitter.com/cards/aehgr/2r wpt …"
53,youngest lion famili carri heart pride...swear #blessedneverstress
54,"ahhh, só quero uma surpresinha e roupa ta, pode ser simples, até um cupcack"
55,"botswana' top predators, lion favorite. i'll watch #savagekingdom friday 9/8c @natgeowild . https:// cards.twitter.com/cards/aehgr/2r wpt …"
56,#адвокат #юридическаяконсультация #консультацияюриста #услугиюриста #юрист круглосуточно https:// vk.cc/5bjtep pic.twitter.com/yhbq8gxvyn
57,"jetzt live, #geil und #heiß http://www. cam4.com/url/rybb54st soll ich machen? sag' du es mir #porno #cam4"
58,"""if live gun, die one. even deer run jungl 'til lion come"" -cassidi"
59,let tell women i'v deal . . .
60,【野菜不足度0％】私は、野菜をしっかり摂れてました！忘年会などで忙しいこの季節、あなたも #あなたの野菜不足度診断 をやってみよう！ #野菜生活 http:// kym.tokyo/kagome/share/r esults_04.html …
61,#tbt @atrak @kanyewest pic.twitter.com/amaza67ub8
62,mine lion king
63,"botswana' top predators, lion favorite. i'll watch #savagekingdom friday 9/8c @natgeowild . https:// cards.twitter.com/cards/aehgr/2r wpt …"
64,"17. я еще но ты не случилось, получил на блядки, но вроде получилось. те годы, ходил действия какая-то хворь в pic.twitter.com/utatdcknqn"
65,"prais lord, prais lion tribe juda!!!! glori hallelujah!"
66,"da bolo,salgadin e refri q noix da present"
67,lion judah pic.twitter.com/cvpnmcfgbr
68,"come #savagekingdom , i'm team lion ! i'll watch tomorrow 9/8c @natgeochannel . https:// cards.twitter.com/cards/aehgr/2r uz5 …"
69,内田篤人が復帰！！！！！ 感動！！！！ 内田篤人が復帰 1年9カ月ぶり - y!ニュース #yahooニュースアプリ http:// news.yahoo.co.jp/pickup/6223552
70,best soar eagl sit hungri lion ! #coolrun @seanswardrob
71,ハイテンションキャラでいこうかな？いややっぱやめとこう鬱陶しい
72,kid led believ lion king realis it' slight lie watch planet earth #planetearth
73,playback: dev patel ‘ lion ’ diversity’ double-edg sword http:// dlvr.it/mrgpkd pic.twitter.com/qiema0qqsa
74,~~ golden lion tamarin ~~ tiniest monkies! saw zoo atlanta adult http:// pinterest.com/pin/1821143786 62367905/ …
75,"quer tudo tbm, ai n vale"
76,そろそろ鬱やめよかな、流石に飽きてきた«٩(*´ ꒳ `*)۶»
77,"se você fizerem uma surpresa pra mim, sim"
78,"а потом дядя гриша. ты ваще охуел сука, вайпер, и хвастать орденами. столько ничего не приедалось и ничем ни его pic.twitter.com/nzpabyml7"
79,"botswana' top predators, lion favorite. i'll watch #savagekingdom friday 9/8c @natgeowild . https:// cards.twitter.com/cards/aehgr/2r wpt …"
80,【取寄せ】ディズニー disney ライオンキング ブランケット 毛布 布団 タオル ベビー 幼児 子供 赤ちゃん [並行輸入品] lion king wear... http:// rkt24.com/?p=34112 pic.twitter.com/zuzoe0utim
81,sige..saan ba alam mo pwede na lugar?
82,掃除機、ちょっとまだ待機でいいよ
83,"come #savagekingdom , i'm team lion ! i'll watch friday 9/8c @natgeowild . https:// cards.twitter.com/cards/aehgr/2r wp4 …"
84,pq acabaram os ing sábado
85,number crunch past day - 4 new follow unfollowers. stat via http://www. crowdfireapp.com/?r=td
86,眠過ぎてアホなこと言ってる
87,mom want get rid old toy gave lion cri pic.twitter.com/19kqmr00l8
88,#эвакуатордешево #дляавто ! #ремонтавто #карта #дляводителя всё тут http:// vk.cc/5wfjoy pic.twitter.com/c4cg5w6wqb
89,vai ter bolo?
90,【取寄せ】 ディズニー disney us公式商品 ライオンガード ディズニージュニア おもちゃ 玩具 トイ セット [並行輸入品] lion guar... http:// rkt24.com/?p=44024 pic.twitter.com/etbrphpovr
91,n vai pq ?
92,"free advanc movi screen lion ( @lionmovi ) calgary, ab via @dorkshelf (contest) - http:// bit.ly/2ghaurv"
93,"free advanc movi screen lion ( @lionmovi ) calgary, ab via @dorkshelf (contest) - http:// bit.ly/2ghaurv"
94,"come #savagekingdom , i'm team lion ! i'll watch friday 9/8c @natgeowild . https:// cards.twitter.com/cards/aehgr/2r wp4 …"
95,メキシコ便できるんだ！？行きたい(^q^)便利すぎる(^q^)
96,costum inspir charact simba ( lion king musical).… https://www. instagram.com/p/bnxnp7yd9-z/
97,put cage lion dont eat muhfuckin lion doesnt mean mufuckin lion aint gon eat
98,胸の調子がおかしい。
99,"не хватает. у меня внимания. меня нет. ха-ха. знаешь, что, чем я был убиты горем согласились. дома в твоей друзь pic.twitter.com/zvlsacecgn"
100,"【男子用】 ｌｉｏｎ 授業に使う柔道着（正課用背継晒柔道衣） 色：ホワイト、白帯付き j-250 （上下＋帯の３点セット） ｌｉｏｎ (64) 新品： ￥ 3,956… http:// dlvr.it/mrgn5x ... #柔道 #柔道着"
101,"come #savagekingdom , i'm team lion ! i'll watch friday 9/8c @natgeowild . https:// cards.twitter.com/cards/aehgr/2r wp4 …"
102,sorri heh
103,estilo lion man.
104,amanhã último test primeiro período
105,#партнеркадляютуба #заработок на #ютубе #просмотрынаютубе жми http:// bit.ly/28iipd0 pic.twitter.com/9wkyw6bcl5
106,new inform santa visit east jordan lion ’s club light villag east jordan... http:// fb.me/hyvom1lw
107,そういやlovのカードもいらないのは欲しい人に配ろ。
108,lion heart ライオンハート kingdom command ブラックストーン シルバー シングルピアス 04e13kd3-1 (01ea0181b... http:// rkt24.com/?p=40136 pic.twitter.com/jyq0gqrez4
109,angri ice cat scari rugbi lion !! nnnnnn
110,اللهم إني أستخيرك بعلمك وأستقدرك بقدرتك وأسألك من فضلك العظيم فإنك تقدِرُ ولا أقدِرُ وتعلم ولا أعلم وأنت علام الغيوب http:// d3waapp.org /
111,но в моменты в руках широкий доску кругом; где я зарабатываю и не раз из-за отсутствия цнс и с собой pic.twitter.com/xwltgtgihn
112,babi lion https:// twitter.com/whatsebastian/ status/807009661014736896 …
113,الذكر عند الخروج من المنزل:بسم الله توكَّلْتُ على الله لا حَوْلَ ولا قُوةَ إلا بالله http:// d3waapp.org /
114,foi trist
115,ええ？直行便？？<ｒｔ
116,queria tanto ir rockzin amanhã
117,"@funnyordi scarecrow, tin man lion ; one would day drink with???"
118,pastor levi i'm read eye lion . thank share story.
119,lion lamb // leeland // offici lyric video http:// ln.is/www.youtube.co m/pxrbl … via @youtub @leelandmoor
120,おはよう華金スカイウォーカー
121,"come #savagekingdom , i'm team lion ! i'll watch friday 9/8c @natgeowild . https:// cards.twitter.com/cards/aehgr/2r wp4 …"
122,"один раз за дырки не надо, доставать валы. 29. все еще сто с красными звездой в твою тугой бугры мышц. pic.twitter.com/kwllyqkqmh"
123,"""supa gostosu"""
124,7-11 lion air. @dearloveswhit https://www. instagram.com/p/bnxnzbjjhlm/
125,yesterday saw #lion movi show differ kind struggles.. end cri cinema! realli touch much!
126,"lion , você é lindoooo!!!!"
127,say lay mat par gay car car se car lion
128,rememb are. - mufasa (the lion king)
129,"watch lion guard episod dan phil it, christ aw act xd"
130,"come #savagekingdom , i'm team lion ! i'll watch friday 9/8c @natgeowild . https:// cards.twitter.com/cards/aehgr/2r wp4 …"
131,"botswana' top predators, lion favorite. i'll watch #savagekingdom friday 9/8c @natgeowild . https:// cards.twitter.com/cards/aehgr/2r wpt …"
132,hmmmm batí
133,"botswana' top predators, lion favorite. i'll watch #savagekingdom friday 9/8c @natgeowild . https:// cards.twitter.com/cards/aehgr/2r wpt …"
134,少女時代 / lion ❤︎heart https://www. youtube.com/watch?v=n6xxqj rryak …
135,"botswana' top predators, lion favorite. i'll watch #savagekingdom friday 9/8c @natgeowild . https:// cards.twitter.com/cards/aehgr/2r wpt …"
136,ブブキ・ブランキの一番くじあるの気付いて「うぇえええ！？」って声出したけど秋田でやってないことを知りそりゃ知らなかったわけだと納得してしまった…
137,"с ним. мухтар есть я начал конца. он то спросил, что я вовсе не поверите. вся радость, наслаждение, на хуй. pic.twitter.com/c782uddjeq"
138,pull lion center console. @terrelnelson impress
139,quoi sert d'être lion en cage ?
140,true stori behind lion : lost child saroo brierley found birth mother 20 year later - http:// people.com …
141,"botswana' top predators, lion favorite. i'll watch #savagekingdom friday 9/8c @natgeowild . https:// cards.twitter.com/cards/aehgr/2r wpt …"
142,supa aí joão
143,おはよう ハルさんはハルさんやね(*ˊᵕˋ*) 変わらないの ブレてないの そこが魅力なんだろな 『いいな』って素直に思える 今日もファイトだよ とりあえず私は いつも応援してるからねー( *´艸`) ちょっと恥ずかしい←
144,ぼく…トイザらスが憎いよ…憎いよ…！！！
145,ayi got gap
146,"imagina ele falando ""chupa"", hmmmmmmm"
147,"sober, vigilant; adversari devil, roar lion , walketh about, seek may devour: (1 peter 5:8)"
148,old antiqu decor porcelain armour silver & jade lion lid incens burner http://www. buyantiques2day.com/us/landing-sta tic/twitter24/?id=http://rover.ebay.com/rover/1/711-53200-19255-0/1?ff3=2&toolid=10039&campid=5337920652&item=182382624477&vectorid=229466&lgeo=1 … pic.twitter.com/5apzpfnuiz
149,sea lion get bigger!
150,お疲れ様！
151,すーぐソシャゲやるー
152,lion video offici tomorrow!!!
153,ええ
154,そっかな
155,"ты мне было желч. в камере немного отдохнуть друг на речку была, силы: ударил ногами я остановился умоляла что же pic.twitter.com/wuhatb8woa"
156,rahm met match #trump . lion devour rat-rahm. https:// twitter.com/truthfeednews/ status/806933338162274304 …
157,aquel sexo anal com jorg pó educação física
158,"botswana' top predators, lion favorite. i'll watch #savagekingdom friday 9/8c @natgeowild . https:// cards.twitter.com/cards/aehgr/2r wpt …"
159,ん、、、それって私もユンギさんには見えてないってことか！！なるほど〜〜人生出直してきます！！
160,lion teach cub new trick https:// twitter.com/frampcamp/stat us/806762778413305856 …
161,"it' lot fun otherwise, particular system terribl"
162,je propos lanc maëll dan la fauss au lion deja
163,ほぼランク100でもつくれる形( ͡° ͜ʖ ͡°)
164,rewatch chronicl narnia: lion witch wardrob like damn mr.tumnu pic.twitter.com/nedsr2vdri
165,"fiesti like ah lion , forgot ah leo"
166,"yuki, kenshi yonezu perform march come like lion anime' new theme songs: 'sayonara bystander,' 'orion' to… http:// dlvr.it/mrgjwn pic.twitter.com/i3p1hd1ctd"
167,wildebeest refus let friend die deadli attack lion succe that' friend fo… pic.twitter.com/gwvlp57ewq
168,"botswana' top predators, lion favorite. i'll watch #savagekingdom friday 9/8c @natgeowild . https:// cards.twitter.com/cards/aehgr/2r wpt …"
169,http:// fb.me/5qsclguuo
170,"fome fora normal, minha barriga ta enorm kkkk"
171,@superwhitesmurf let know left comment topic lion vienna website.
172,"botswana' top predators, lion favorite. i'll watch #savagekingdom friday 9/8c @natgeowild . https:// cards.twitter.com/cards/aehgr/2r wpt …"
173,fio terra
174,"lyft ride went ""you littl lion baby"" #leo pic.twitter.com/2ymegwglqx"
175,"я дура вооб-ще-то. а тот почему-то умнее голова у медведей, просто так хэппи-энд не в этот сайт я приму мои pic.twitter.com/uxeouxgacx"
176,#biggest hit lion hurt punjab no1 hea trea meher ha pleas satsang bhi farma baba ji
177,never listen @anotherround ?! they'r sing favorit song lion king 2 they'r hilari amazing?!
178,西野カナ ♪会いたくて 会いたくて 720phd kana nishino https:// youtu.be/fia8t9jbg9q ♫
179,transadeirozudo vc heim
180,lion 's club present check instal wheelchair swing mcwhorter park. pic.twitter.com/wpclwwohe0
181,lion regga - luna.
182,ふん…良い傾向だ
183,fome
184,муж сделал для жены большой рождественский календарь со множеством подарков бенджамин хьюинс из великобритании... http:// fb.me/388hwccl
185,"get shit done library: listen rbi rout 4, level 1 lion king kokiri forest replay."
186,"botswana' top predators, lion favorite. i'll watch #savagekingdom friday 9/8c @natgeowild . https:// cards.twitter.com/cards/aehgr/2r wpt …"
187,"sober, vigilant; adversari devil walk like roar lion , seek h… http:// bible.com/114/1pe.5.8-9. nkjv … pic.twitter.com/e0uw8daklq"
188,"botswana' top predators, lion favorite. i'll watch #savagekingdom friday 9/8c @natgeowild . https:// cards.twitter.com/cards/aehgr/2r wpt …"
189,nittani lion drop hammer pitt panther. https:// twitter.com/nittanylion/st atus/806958393378357248 …
190,ありがとう！ いつでも、気軽に声かけていいのよ。
191,افضل ممثل بيمثل افلام ماساوية بس تتحب علي الارض http:// fb.me/5u9r49izn
192,"lion brand new fall collection: 15 free crochet scarf patterns, afghan patterns, - ...… http:// 1000-ebooks.a10-news.com/post/154214427 759?utm_source=dlvr.it&utm_medium=twitt … #craftsamphobbi"
193,"come #savagekingdom , i'm team lion ! i'll watch friday 9/8c @natgeowild . https:// cards.twitter.com/cards/aehgr/2r wp4 …"
194,つよいー_(:3 」∠)_
195,"если и никогда не ной битарду открыл и спустя какое ни рукой, к сигаретам. я ж надо да где вы pic.twitter.com/xplrp4hvhc"
196,"live #periscop : lion 's den - dec. 8, 2017 https://www. pscp.tv/w/axixedfnv0v3 zhdczgfnuwj8mvbss1ffdmvowfllrahlatu9kqwi-ezb7ipzrz4aii4nst7ek1nl92bmpbf …"
197,gift card holiday food lion #foodlion1216 #ad http:// couponsavingsinthesouth.com/2016/12/173704/ pic.twitter.com/3lrcme461o
198,"botswana' top predators, lion favorite. i'll watch #savagekingdom friday 9/8c @natgeowild . https:// cards.twitter.com/cards/aehgr/2r wpt …"
199,グラブルばっかしてる
200,"и, предупредить: что почти не волнуйтесь, разливается ласковое тепло. но почему у которых я тоже одни а если я бы pic.twitter.com/s1h1m5e1st"
201,prof... apa benar pak di anggota rotari & lion club ? bisik2 ini sdh lama di temlen. saya bertabayyun ke bapak...
202,al-mukhtar muhammad ibn farhat bredan . lion desert . pic.twitter.com/8usdcqbmb6
203,хочешь работать не выходя из дома? тебе нужна подработка или в твоем населенном пункте трудно найти работу? есть... http:// fb.me/x5ywyovk
204,trinket die zu eurem gedächtnis!
205,heart lion . ain't takin nothin.
206,dream got attack lion last night...
207,wildebeest refus let friend die deadli attack lion succe that' friend for. pic.twitter.com/xobh08d1
208,"i'm golden lion south milwaukee, wi https://www. swarmapp.com/c/0f1l0rvkwzh"
209,"и девушку. это есть такие вот, один мудак. как будто человек а там всё плохие помню, только. я гусевым. перестав pic.twitter.com/v2jxm5vyyr"
210,"botswana' top predators, lion favorite. i'll watch #savagekingdom friday 9/8c @natgeowild . https:// cards.twitter.com/cards/aehgr/2r wpt …"
211,"ｌｉｏｎ 授業に使う柔道着（正課用背継晒柔道衣） 色：ホワイト、白帯付き j-250 （上下＋帯の３点セット） ｌｉｏｎ (64) 新品： ￥ 3,956… http:// dlvr.it/mrggsk ... #柔道 #柔道着"
212,この時間の lion のcmってどれもbgmもcgもないし、素人のwindowsmoviemakerレベルなの何なん？
213,i'm sorri see lion
214,gerne! auf euer wohl sein! ;-)
215,"oh girl. watch lion king, ""hey, fart lot like pig!"""
216,como la gent supera el amor tan rápido?
217,david brock want cash creat @cnn ?
218,yeah sun lion moon bat made babi https:// twitter.com/nightlycanroc/ status/807007589527470081 …
219,opa mateu president isso msm
220,dare? tri gentl
221,"они на само-лет: нельзя ставить там в одну одеялом, по магазинам купил но годы я забрал телефон и помогают, но pic.twitter.com/hogoksx3rv"
222,tarzan golden lion - 1927 http:// ln.is/www.youtube.co m/h6mkd … via @youtub
223,sl student section twitter quit tweet tiger emoji instead lion one it' embarrass
224,also @tidalwitch lea chaotic neutral lion who real cool -
225,"nemo impun lacessit. sorry, isso. - sherry?"
226,"#disenchanteddecemb / #25booksofchristma day 8: set winter christma - could find lion , the... http:// fb.me/5ypvwf2w0"
227,反対方向の電車へー
228,"botswana' top predators, lion favorite. i'll watch #savagekingdom friday 9/8c @natgeowild . https:// cards.twitter.com/cards/aehgr/2r wpt …"
229,"come dh support give kid christma project, hear pride play concert,& watch hoop durant lion classic! pic.twitter.com/8zamdj2zap"
230,"не было. все о которой не напоминали букву е написал что кто-то отходил на ихом отношения а зачем. и смолк, pic.twitter.com/u3ny8by1e0"
231,tarzan golden lion - 1927 http:// fb.me/8cnninkcw
232,#willsmith think secur camera caught footag real lion yard: https:// yhoo.it/2hqzrha pic.twitter.com/jvrgfmas6g
233,welcom newest member red lion chevi family. #satisfiedcustomers#famili . 100% credit approval: http:// bit.ly/100percentcr itapprov … pic.twitter.com/jefp5ddqk
234,クリスマスの夜 lion heartが 【したいこと】：押し倒す 【されたいこと】：ハグ https:// shindanmaker.com/684765 診断ってなんでこう、、！？
235,オナ水はエロいなwwなんか知らんけど
236,プロになるということは、止まらない列車に飛び乗るようなものだ もう二度と降りる事はできない負けて転がり堕ちるまでは by桐山 零 pic.twitter.com/clm9zskyzp
237,#nom @the white lion https://www. instagram.com/p/bnxmydbh8otm 5hhvyqjoriwuaevu12m5wdkz180/ …
238,"@amazingphil come #savagekingdom , i'm team lion ! i'll watch friday 9/8c @natgeowild . https:// cards.twitter.com/cards/aehgr/2r wp4 …"
239,オナ水！しごおわw
240,https://www. facebook.com/groups/2819663 88549016/permalink/1183044601774519/ …
241,isso q importa ne bb
242,"большая доме. тема временем, мы решили самому скромные и накрыл я погулять вечером. а я понимаю, что у тюлена при pic.twitter.com/4hea8szi9q"
243,누가 민이한테 치여요;;
244,「 lion heartってる 」【言葉の意味】 1)恋愛で負けることがないさま。 2)誰にでも公平に親切であるようす。 3)高度な知能を持つ状態。 https:// shindanmaker.com/234317 まぁな。
245,"come #savagekingdom , i'm team lion ! i'll watch tomorrow 9/8c @natgeochannel . https:// cards.twitter.com/cards/aehgr/2r uz5 …"
246,rewatch narnia adult like bro get lion jesu calm down.
247,１限ない曜日最高か
248,サミシオス！
249,da wird wohl sein. ich kann mich nicht mehr bewegen und da mauert grade einer den eingang zu! zu hil
250,vei kkkkkk é mto sério
251,"lion , snake goat encompass slow circle, head slap ag favor haunt camera intimat"
252,"lion would never cheat wife, tiger wood."
253,abri grupo e vamo focar auxilio mini pizza pic.twitter.com/pdcfjmhkol
254,だよねー。わかるー。
255,like lion zion https://www. instagram.com/p/bnxmp_jhcrq- -m1ihupc7sejbhgflkf900u_bk0/ …
256,beauti danger mountain lion ...and doesn't look fulli grown
257,"зачем. почти. 2. ты понимаешь, стэ, и ебут суигинто лапласа, барасуишиу, угорайте по всему, этим но если бы pic.twitter.com/m9ydbbrxhi"
258,"botswana' top predators, lion favorite. i'll watch #savagekingdom friday 9/8c @natgeowild . https:// cards.twitter.com/cards/aehgr/2r wpt …"
259,origin lion animacion theory: http:// youtu.be/36-bogarmfm?a vía @youtub
260,первый официальный инет-работодатель в рф! жми https:// goo.gl/sbgi #работавакансии #работанадому #работавдекрете pic.twitter.com/vzxpdd4ktg
261,マギカ！！ 寝ないとあかんでほんまにーww おはようさん！
