0,passeng advis see giant cat across network. delay like pic.twitter.com/xphxjvijji
1,"franpholland votó con un 8 "" passeng "" en @filmaffin http:// m.filmaffinity.com/es/userrating. php?id=6067503&movieid=478232 …"
2,box office: ‘rogu one’ kick 2017 $790 million worldwid https://www. rickey.org/?p=299956 #starwar #rogueon #sing #passeng #lalaland
3,"#passeng (2016) ""sem graça"" boa premissa, ma desperdiça sua boa ideia e não resist ao ""final hollywood"""
4,"acabo de ver passeng esta muy bien. la recomiendo. menuda interpretación hace jennif lawrence, brutal como siempr claro"
5,jpm assur lake victoria passeng new ship http:// allafrica.com/stories/201701 030264.html … via @allafrica
6,review passeng hope entertain less offens film http:// fourthreefilm.com/2017/01/passen gers/ …
7,passeng qualiti
8,mañana passeng ah
9,"tienen que ver passeng , de pana. es demasiado putament buena."
10,"acabo de llegar del cine de ver #passeng pese ser lo que esperaba, ha gustado bastante."
11,ima go see passeng fences. want see fishburn flick although denzel make bomb movi #appreci
12,feel like passeng movi vinni chase entourag would make.
13,"passeng good film, recommend it. chri pratt j law top job"
14,watch ' passeng ' cinema tonight. bad sci-fi romanc film. visual pretti cool futuristic. pic.twitter.com/zet0c1lc5i
15,"@lacosacin chicos, alguna nota de #passeng ?"
16,#passeng one best film ever seen.
17,@thomaswictor @aegisf isra firm develop drone abl carri human passeng http:// m.jpost.com/business-and-i nnovation/tech/israeli-firm-creates-autonomous-aircraft-that-goes-where-no-helicopter-dares-477334#article=6017oemxmdzdnza2qkm0mkrfnzrfrevbqtfequmzqjiwq0y= …
18,"njtransit passeng don't fuck dick drivers, need break too. fuck patient. assholes. #njtransit"
19,still amaz #lalaland #passeng
20,"#hibernationfailur (at @cinemark centuri theater el con passeng tucson, az) https://www. swarmapp.com/c/hqbb19nvbti"
21,#passeng !!!
22,carri fisher' famili want thank heroic unit passeng http://www. tmz.com/2017/01/02/car rie-fisher-family-emergency-workers/ … via @tmz #carriefish
23,passeng disabl train maplewood transfer adjoin murray hill train make local #njtransit #clevercommut
24,passeng disabl train maplewood transfer adjoin murray hill train make local #njtransit #clevercommut
25,passeng disabl train maplewood transfer adjoin murray hill train make local #njtransit #clevercommut
26,"brand spankin' new review! "" passeng "" review at: http:// wlswarts.blogspot.com/2017/01/love- tory-at-end-of-universe.html … #passeng #chrispratt #jenniferlawr"
27,go see passeng ! teen randomli blurt question day later. need answer @prattprattpratt
28,passeng disabl train maplewood transfer adjoin murray hill train make local #njtransit #clevercommut
29,@transitcalgari beliger threesom exit train 6th street platform dt. yell threaten passeng .
30,passeng disabl train maplewood transfer adjoin murray hill train make local #njtransit #clevercommut
31,passeng disabl train maplewood transfer adjoin murray hill train make local #ad barbara' homecar #njtransit
32,1 ship - 4450 passeng http:// fb.me/bohpvo8o
33,passeng disabl train maplewood transfer adjoin murray hill train make local #njtransit #clevercommut
34,"passeng , beauti shot, story, although initi confus entertain deal moral well. 8/10"
35,passeng disabl train maplewood transfer adjoin murray hill train make local #njtransit #clevercommut
36,@ltfrb solid north cxp732 papunta cubao super puno. stand passeng . tinangg na signag ng cubao para mukhang tourist bus. tplex na
37,¡ passeng va en cabeza! ¿lograrán vaiana rogu one superarla? https:// twitter.com/previouslyfilm /status/816303511755440128 …
38,somehow train passeng abl use track pass commut trains. nice! @lirr
39,#passeng #chrispratt @prattprattpratt food fun friend
40,"@robkitfuey_fu realli like rogu one, howev satisfi passeng deliv someth unique."
41,"coachella hype train arriv station, ticket passeng bad vibe allow"
42,"mart de película en compañía de mi padr hermano (at @cinemex passeng mérida, yucatán) https://www. swarmapp.com/c/hbptgslspbi"
43,"current want brighton passeng chang east croydon ""thameslink"" brand trains."
44,"passeng good movie, @prattprattpratt look hot always!"
45,passeng va ganando locooo https:// twitter.com/previouslyfilm /status/816303511755440128 …
46,"gostei de um vídeo @youtub http:// youtu.be/rvzungj3xh8?ap assageiro … ( passeng , 2016) - crítica"
47,"i'm sundanc kabuki cinema passeng san francisco, ca https://www. swarmapp.com/c/imsxj7lxruh"
48,go see #passeng bless
49,"passeng è bellissimo, lo consiglio"
50,passeng best movi i'v seen
51,"deco dancer welcom passeng , danc outsid @emporiumbar mason hotel tomorrow morn @artdecotrust #artdeconapi https:// twitter.com/hawkesbaytoday /status/816379589576429568 …"
52,thank partner passeng make 2016 success! news releas http:// aircanada.mediaroom.com/index.php?s=43 &item=1097#.wgw4zh5cnai.twitt …
53,"apr passeng hier, ce soir le 7 mercenaires, chri pratt il pèse cet acteur"
54,smart move tv departur room show documentari plane crash passeng fli
55,"someon need stop script process halfway write passeng said ""guys, can't actual make story."""
56,◆全米デイリーtop10 [1/2] [順] 3位 [題] passeng (2016) soni / columbia #boxoffic #映画 pic.twitter.com/ewxnkyz9rx
57,support #southernstrik keep train guards! tell @southernrailuk keep passeng safe! http://www. thepetitionsite.com/tell-a-friend/ 32364349 …
58,"geni wasn't stall is, think bucket get passeng wet may it' cold go"
59,wauw!! passeng echt een super gave film!!
60,passeng : space titan
61,watch passeng it' good titanic!!!
62,passeng (2016) | dp: rodriego pieto | director: morten tyldum #oneperfectshot pic.twitter.com/46e0bqu63k
63,passeng
64,don't understand locomot push train newcastl - chuck passeng cold instead continu edburg!
65,@prattprattpratt hi mr.pratt i'm kyle canada. seen passeng twice love it!! huge fan! @kylemerrimen
66,"gostei de um vídeo @youtub http:// youtu.be/rvzungj3xh8?ap assageiro … ( passeng , 2016) - crítica"
67,okay saw two film today give spoiler review passeng assassin creed movie.... let' go
68,rt https:// twitter.com/cruisecritic/ tatus/816422649295413248 … 10 passeng know fun #cruis http:// bit.ly/2i6ft5k pic.twitter.com/y4vcyofay7
69,@aircanada what' happen ac771. load passeng newark get littl inform staff
70,"passeng dumb, poorli written piec cgi spectacl | review: http:// fourthreefilm.com/2017/01/passen gers/ … pic.twitter.com/gtlf4f3gc1"
71,mitt-stiqu cab mutant better stop tryina skeev passeng out. wrong fare snap rip monstros right awf. https:// twitter.com/vinephilly/sta tus/816381279243366405 …
72,"flight attend ""confused"" airport they'r passeng delay @americanair pic.twitter.com/tnpzofmsxu"
73,"#passeng c'est du trè bon. petit drame cosmique, scène dan l'espac classes, duo au top."
74,"last days, watch movi "" passeng "" c+, ""the girl train"" c-, ""kevin hart - now?"" c. overal averag c."
75,today bing cinema. wow! saw assassin' creed rogu one passeng arriv much tell guy them!
76,entertain passeng becom whole new industri http:// pinterest.com/pin/2842904137 8506498/ …
77,ido ver #passeng ha habido una frase que ha dicho jlaw que ha sido pa mí como un puñetazo en el pecho. cito:
78,"whole point democraci passeng pick pilots. want rule 'experts', ain't democracy."
79,"retweet mayor london ( @mayoroflondon ): london' rail passeng deserv frequent trains, fewer delays,... http:// fb.me/1jxtdyd9p"
80,#passeng #passengersmovi #jenniferlawr #chrispratt http:// ew.com/movies/2017/01 /02/box-office-report-rogue-one-passengers/?xid=entertainment-weekly_socialflow_twitt … via @ew pic.twitter.com/fbjrb00xli
81,watch passeng marcu southgat cinema http:// fb.me/8cn4ogv0k
82,"futur flight look faster, comfort passeng https:// goo.gl/athwlz"
83,jennif lawrenc 10/10 en passeng . que buena actriz como esta
84,blame weather don't compens passeng failure. shame them!
85,unit airlin train staff give passeng info flight delays? three hour without word.
86,"want see movi movi lol onlin netflix yet.. sing , moana, passeng , fantast beast"
87,door open car 5371... passeng difficulti get pack car get train #fail
88,watch passeng
89,2 women accus dui kid passeng : polic http:// bit.ly/2hlhfiy pic.twitter.com/0wyquohlh4
90,im confus whether ill watch later - passeng collater beauty. hope still cinema tomorrow.
91,"airbu a321 aeroflot moscow land heavili kaliningrad. casualties, 167 passeng alive. pic.twitter.com/dwkwnivfhm"
92,passeng much better
93,yo went see passeng tonight trailer la la land want run screen
94,southern rail warn passeng travel full week plan strike protest - daili ma… http:// ift.tt/2f6dmic
95,editor told saw enjoy ' passeng .' time find new editor?
96,"brilliant film "" passeng "" ! wish great success! greet greece!"
97,passeng good
98,passeng ! can't wait see @prattprattpratt !!! pic.twitter.com/8nzqcarxt7
99,"watch passeng today. love much, could watch endless times. peopl let critic put @prattprattpratt"
100,"@prattprattpratt saw passeng , fuck awesom dude! critic stupid!"
101,"casino beds, passeng least two way get lucki one flights.- richard branson #quot"
102,southern rail warn passeng travel full week plan strike protest - daili ma… http:// bit.ly/2j28yv4
103,visto passeng
104,understand passeng think get entir seat @metra . said excus could sit & look could kill
105,thank patience! final next coupl week movi confirmed! passeng ... http:// fb.me/8sl3chwwf
106,let known disappoint sex scene passeng .
107,mad third wheel awkward date histori discuss passeng : http:// bit.ly/2j6tswd pic.twitter.com/xjcj2tvubt
108,"want go like old friend pilot, peac sleep. screaming...lik passeng ."
109,"gostei de um vídeo @youtub http:// youtu.be/rvzungj3xh8?ap assageiro … ( passeng , 2016) - crítica"
110,@virginatlant airlin allow select seat advanc make passeng pay. #deltawasbett
111,"miren est gif tan ador de passeng , basta pic.twitter.com/chkpe1ixjz"
112,"mañana habrá que volver al cine que tengo mucha peli pendientes... passeng , comancheria, mine, hasta el último hombre, infiltrado..."
113,"overheard newark airport: ""a soon get passeng clean, begin boarding."""
114,"man got middl seat 13-hour flight. passeng record ‘fit rage,’ arrest. #theuglyamerican https://www. washingtonpost.com/news/dr-gridlo ck/wp/2017/01/03/a-man-got-a-middle-seat-on-a-13-hour-flight-passengers-recorded-his-fit-of-rage-then-arrest/ …"
115,yall dont see movi passeng im fuck
116,thread yucki passeng film https:// twitter.com/nussbaumabigai l/status/816003265133498368 …
117,"passeng movi visual stunning, everyon go see it."
118,"hollywood star alway flock palm springs, air canada roug passeng http:// bit.ly/2hnu7ag pic.twitter.com/fuhq1jizwx"
119,un gif de jennif en passeng pic.twitter.com/fi3oxx1qmo
120,whole thread passeng problemat brilliant. https:// twitter.com/nussbaumabigai l/status/816003265133498368 …
121,passeng good! love it!
122,"hear pilot said, passeng broke tears... http:// fb.me/1mbkusvlj"
123,"hear pilot said, passeng broke tears... http:// fb.me/5w4c1b9g0"
124,"<무비프리 이벤트> 패신저스, passeng 필수 엔터테인먼트 앱, 무비프리와 함께 프리하고 즐거운 문화생활을 즐겨보세요!. http:// app.moviepre.co.kr pic.twitter.com/keqdyjolf"
125,"hear pilot said, passeng broke tears... http:// fb.me/8zrmkzfl"
126,"hear pilot said, passeng broke tears... http:// fb.me/8xmzoo4g"
127,"hear pilot said, passeng broke tears... http:// fb.me/8h0ktaxv7"
128,"ya ha acabado, dispongo ver passeng porqu el aburrimiento es real."
129,passeng gave chill wauw
130,passeng good film
131,"next station tamagawa. passeng chang tokyu tamagawa line, pleas transfer station."
132,... blew past stop one yell get off. passeng didn't know signal (2/2)
133,@prattprattpratt love passeng . wouldn't mind stuck ship 88 year either.
134,fyi train broadmedow load passeng . appreci incid recommend commun
135,la película de passeng ha sorprendido gratamente.
136,watch passeng https:// trakt.tv/movies/passeng ers-2016 … #trakt
137,hoy es miercol voy ver passeng escuchai gritar
138,"ah well might bother watch then. watch passeng saturday realli good, good hear."
139,"you'r genious, passeng awsom see today think tomorrow too! elia canari island"
140,je vien d'aller voir passeng au cinéma et il avait catherin deneuv just à côté de moi voilà vou fait ce que voulez de cett info
141,realli wanna see passeng
142,racist let alon incit racial hatr intimid innoc passeng ...
143,find partnership airlin benefici passeng alway notifi oper carrier ^al.
144,"saw #passeng !!wonder emot story,interesting,no tedious,with action good acting..especi #jenniferlawr ! #movi"
145,hell screen passeng gotten busy? weren't busi christmas.
146,saw passeng today j. law. she' gorgeous!
147,"passeng en l'occurrence, mai c'est valabl pour plein d'autr film"
148,"amo todas, está passeng , así que quedo con la que ganó el oscar el lado bueno de la cosas, porqu puedo elegir. https:// twitter.com/iamagueda/stat us/815531184746795008 …"
149,"@prattprattpratt thx movi wife & could enjoy! rare find unfortunately, love #passeng ! ...also: #gohawk"
150,passeng (m) audio review. spoilers. https://www. facebook.com/10001381726631 1/videos/198169397320301/ … #passengersmovi #passeng pic.twitter.com/z0muy0zsno
151,"check passeng . san francisco,ca watercolor origin paint 11"" x 15"" print https://www. ebay.com/itm/3021865247 09 … @ebay"
152,mañana vere passeng
153,like @youtub video @smeghead4269 http:// youtu.be/umetmrucbb4?a vlog - passeng (spoilers)
154,saw film passeng tonight. reccomended!
155,go see @passengersmovi @jessicablamp #passeng #movienight #thriftytickettuesday pic.twitter.com/ooi44xvqdf
156,"uber driver cherri pick ride fort lauderdal airport, passeng say http:// world-breaking-news.org/uber-drivers-c herry-pick-rides-at-fort-lauderdale-airport-passengers-say/ …"
157,"norwegian passeng got bags, finnair' didn't. ""due weather conditions"" ??? #helsinkiairport #finnair"
158,ich mag da @youtub -video von @dvdkritik : http:// youtu.be/q2mgx4oyewi?a passeng kritik review (2017)
159,passeng good. love jennif lawrenc chri pratt ♡
160,efectivament passeng es un tostón totalment previs
161,pledg small chang inspir young driver passeng help save live http:// goo.gl/gbziyd #mysmallchang
162,passeng pretti solid movi
163,#passeng ok movie. wait redbox tho. 6/10
164,spoilers!! #passengersmovi #passeng https:// twitter.com/todoxjlaw/stat us/816425231489400832 …
165,"would iron passeng warn j-law etern ""dont f*** [insert bodi part]""=don't cheat"
166,miser servic passeng .
167,"@prattprattpratt went pratt kick last night watch passeng , mag 7 j. world. can't get enough! ""so far, good""."
168,hate cartoonist get fact wrong!! - minor passeng vote trump pilot.
169,#nowplay levit (from origin motion pictur “ passeng ”) imagin dragon #anghami http:// play.anghami.com/song/18516412
170,"comput glitch, overnight stay over, mia passeng back move | miami herald http://www. miamiherald.com/news/local/com munity/miami-dade/article124242754.html …"
171,also design passeng mind.
172,it' time again! #movienight #tuesday @passengersmovi #passeng
173,"success film judg long discuss wife goe for, passeng might biggest year"
174,@tfl anoth failur deal disabl passeng ! see:- https://www. youtube.com/watch?v=s9eb4k 8rpu0 … bu cctv camera action driver?
175,"#rogueon #passeng @coyotelewisvil ---- #assassinscre / #alli show tonight; tuesday, januari 3rd #plano #frisco pic.twitter.com/l6zrbouykf"
176,british rail passeng spend six time train fare european counterpart http://www. independent.co.uk/news/uk/home-n ews/british-rail-passengers-rpice-hike-train-fares-europe-income-southern-virgin-gwr-a7506711.html …
177,box office: ‘rogu one’ kick 2017 $790 million worldwid #rogueon #starwar #sing #passeng http:// bit.ly/2hobatz - nr
178,someon take see passeng la la land??? i'll love forever!!
179,"#passeng es un tópico, tra tópico, tra tópico, lawrenc diciendo tópicos, má tópicos, vestida tópica, hablan de tópicos. la nave mola. pic.twitter.com/vhiskx5iyq"
180,"cuando decían que passeng era mala pensaba que era un bodrio romántico. ""síndrome de estocolmo en titan 2.0"", es má específico."
181,british rail passeng spend six time train fare europ http://www. independent.co.uk/news/uk/home-n ews/british-rail-passengers-rpice-hike-train-fares-europe-income-southern-virgin-gwr-a7506711.html …
182,necesito ir ver passeng
183,check #passeng get chanc cinema. wasn't total keen see first glad did.
184,watch passeng evening. bit long. #filmreview
185,"#unitedairlin front desk told passeng ""stop ask question monotonous"" we'r 3 hr delayed. @sfo"
186,we'r go movi tonight dad & stepmom see passeng
187,came back passeng ..... andi garcia @darrenhay okay...al 5 second yep there! lol
188,movi passeng good
189,"primera critica de passeng de nuestra pagina. atencion, lea si vist la pelicula https:// twitter.com/todoxjlaw/stat us/816425231489400832 …"
190,hoy hemo visto @gailazo yo #passeng ha gustado bastant má de lo que esperaba! el cine es cuestión de gustos!
191,passeng
192,"<무비프리 이벤트> 패신저스, passeng 필수 엔터테인먼트 앱, 무비프리와 함께 프리하고 즐거운 문화생활을 즐겨보세요!. http:// app.moviepre.co.kr pic.twitter.com/nmw9nhnv9u"
193,passeng
194,passeng expect least jennif lawrenc didn't disappoint
195,tri go see passeng tonight
196,critica de passeng (con spoliers) @jenlawfilm @jlawrencearg @jlawspain pic.twitter.com/lbwojrg3ig
197,"want poorli written love story, rel entertain robot space.. urg u wast £7.50 passeng"
198,saw passeng love @prattprattpratt increas watch it. solid film!
199,passeng good film. realli realli recommend anyon watch
200,@jamescdy saw #passeng day realli enjoy - agre four stars!
201,"watch passeng , toodl"
202,"@prattprattpratt saw passeng first time, probabl one favourit movie, congrats!"
203,acabo de ver passeng bueno alegra haber tenido que pagar por verla
204,aviation: award availability: sever citi wide open star allianc busi class europ 4+ passeng http:// ift.tt/2j1urpw
205,buen inicio de año #passeng #jlawrenc #chrispratt #avantpremier @madgalena del mar https://www. instagram.com/p/bo0g08xby4b/
206,"discuss today 10 minut movi "" passeng "" mislead twist. turn one us talk pic.twitter.com/5xkggixlub"
207,got wrong. put engin first put passeng carriag behind it. https:// twitter.com/uklabour/statu s/816332294596202497 …
208,surpris #passeng thought would good it' realli good! great perform cast amaz story...
209,still need see passeng
210,know reason. i'm say would appl stop driver use ft let passeng . lawyer prove could
211,minha mae quer levar pra ver passeng sera que é bom mesmo
212,"hola buena @cinesa comprado tre entrada para ver passeng pero recibido la entradas, qué ha pasado? md os cuento detal"
213,"#passeng é muito booooom! adorando cada cena demais, muito bem escrito"
214,like @youtub video http:// youtu.be/cjesuzq8c-u?a action sci fi movi movi english || passeng movi 2016 english hollywood 2017
215,transport secur administr tyrann airlin passeng html page directly. #imwithrocco
216,action sci fi movi movi english || passeng movi 2016 english hol... https:// youtu.be/cjesuzq8c-u via @youtub
217,"grab store sale, bargain 16 quid. watch replay passeng seat check avatar!!!"
218,"nake passeng , dead bodi forget pilots: shock secret fli reveal http:// scoopbase.blogspot.com/2017/01/naked- passengers-dead-bodies-and_3.html …"
219,"nake passeng , dead bodi forget pilots: shock secret fli reveal http:// scoopbase.blogspot.com/2017/01/naked- passengers-dead-bodies-and.html …"
220,"acabo de ver passeng , la moralidad ahí se la cuestionan mucho que se diga. todo se basa en el fin justifica lo medio má menos."
221,time gobbi passeng think appropri berat train conductor crowd fairs. it' fault.
222,rate passeng (2016) 6/10 #imdb http://www. imdb.com/title/tt1355644
223,finish watch passeng ...in one word: phenomenal!!! #passeng #human #intothespac
224,acabo de ver passeng ha encantado
225,"se hace muy tierno que chri pratt en toda la entrevista de passeng siempr termina hablando de guardian de la galaxia, es que sí"
226,"@prattprattpratt bout see passeng , got tips?"
227,watch passeng
228,ho visto passeng il film.. è stato troppo bello giuro.
229,pue le digo que supuestament iba ver passeng pero decidí por ballerina fue de lo mejor. #bestdecis
230,film #4 2017 - passeng - ok. noth write home about.
231,g.e.m. / light year away ( passeng movie) m/v https://www. youtube.com/watch?v=t4simn aiktu …
232,"friend @ash_we bootleg passeng put snapchat, here' sneak peek: pic.twitter.com/vpynb5cptc"
233,award availability: sever citi wide open star allianc busi class europ 4+ passeng | http:// ift.tt … pic.twitter.com/mgujwgcrq
234,mañana passeng
235,passeng - hokey & predict also thrill & entertaining. fair enjoy it.
236,passeng : wow. love it. mani good things. watch it.
237,moral dilemma #passeng tremend intriguing.
238,смотрит passeng
239,passeng would good end think everyon expecting. #movieday
240,http:// ift.tt/2j6cn5v award availability: sever citi wide open star allianc busi class europ 4+ passeng #parent
241,new post: tallink reach record nearli 9.5 million passeng 2016 http:// dlvr.it/n1wdx1
242,ay pue passeng ha gustado. esperaba má de la trama pero ha estado mal.
243,ba passeng face renew strike disrupt http:// dlvr.it/n1wc3b
244,10 passeng know fun #cruis http:// bit.ly/2i6ft5k pic.twitter.com/bys2u33o5f
245,top 10 prov 1-canta 2-rogu one 3- passeng 4-assassin' 5-vaiana 6-villaviciosa 7-belleza oculta 8-frantz 9-comancheria 10-vuelta casa
246,someon watch passeng freak cri
247,passeng mint film!
248,"@kurteichenwald don't bother experts? doesn't make sense. u want passeng fly, bc pilot occasion crash?"
249,award availability: sever citi wide open star allianc busi class europ 4+ passeng http:// ift.tt/2j1urpw
250,offici #passeng poster turkey uzay yolculari #passengersmovi @jenlawfilm @passengersmovi @sonypictur @prattprattpratt pic.twitter.com/bjt4zwohl9
251,"passeng smash watch, j law amaz graphic insane."
252,rant: usa ppl di everyday abt brit food hav 2 watch subway passeng view hideou buzzfe cook vid everyday
253,award availability: sever citi wide open star allianc busi class europ 4+ passeng http:// ift.tt/2j1urpw - view …
254,want die like grandfather; peac sleep. scream like passeng . #anonym
255,vaia truñaco passeng
256,"hollywood star alway flock palm springs, air canada roug passeng http:// bit.ly/2iwpaj5 pic.twitter.com/avecd3rkrp"
257,award availability: sever citi wide open star allianc busi class europ 4+ passeng https:// shar.es/1dka5c
258,went see #passeng morning. nobodi realli feel like part crew pic.twitter.com/bjqo0ukcsj
259,..no è passeng https:// twitter.com/wolfganggdrs/ tatus/816418231133110274 …
260,pull insan swim pool scene ‘ passeng ’ http://www. cartoonbrew.com/feature-film/p ulled-off-insane-swimming-pool-scene-passengers-147035.html … pic.twitter.com/96f6ztjvua
261,mmff great can't wait watch sing collater beauti passeng
262,@jonburkeuk fair rail fares! passeng profits! pic.twitter.com/htlyx7yisa
263,"passeng . la actuación de jennif brillante, lo esperaba. la de chri pratt ha dejado que desear. pero el guión..."
264,appar i'm go see passeng ... anyon know it' good?
265,donc y'a vraiment de gen qui payent pour voir passeng et qui en sort content ?
266,"freshman, 19, father name two passeng onboard doom ... - http:// wp.me/p7ekkl-cwd pic.twitter.com/1opukd5472"
267,ard el hocico admitir que jennif lawranc súper cabe en passeng
268,"meanwhile, rapey garbag film passeng bare earn it’ product cost 110m $122,760,139 worldwide."
269,"v/line train - passeng advis due heat speed restrict across victoria midday 10pm today, select (1/3)"
270,#moviereview : passeng morten tyldum film - romanc / scienc fiction #dellayassin happy… https://www. instagram.com/p/bo0fgkzgoyb/
271,"freshman, 19, father name two passeng onboard doom ... - http:// wp.me/p7ekkl-cwd pic.twitter.com/mijak4tg3i"
272,labour' answer fare hike ...put passeng first bring railway public ownership http:// fb.me/6vt2f5nsx
273,"katherin cobl nashvil mennonit libertarian trust: "" passeng rape cultur film, pure and... http:// fb.me/3fphjkn75"
274,passeng movi realli good. peopl listen rotten tomato anymor beyond me.
275,"rt @wired_jp : 5,000人の入植者たちを乗せた宇宙船のなかで、2人の男女だけが冷凍睡眠を突然中断される──。sfスリラー映画『 passeng 』予告編を紹介。 http:// bit.ly/2ilpew http:// bit.ly/2ilkzob"
276,yes. but: 1. anybodi rememb british rail? 2. passeng doubl sinc privatisation? https:// twitter.com/uklabour/statu s/816351443162533889 …
277,"passeng highli enjoy tosh highli cheddarsom dialogu plot is, @hauntedsteak call it, ""space titanic"""
278,"hi lauren, thank tweet. normal recommend passeng allow minimum 90 minut screen process. (1/2)"
279,"haftar' forc bomb jufra airbas lead passeng plane crash, one person kill - libyan ex... | @scoopit http:// sco.lt/4uy0c9"
280,"moana > rogu one > passeng . deal it, @nolandonuts64 pic.twitter.com/drjtlgurfq"
281,@prattprattpratt good passeng ! #butt
282,passeng : la fantascienza classica che tenta strade divers https:// goo.gl/fb/sjddsd
283,que bestia está la peli passeng !!!!
284,tenéi que ir ver la película ' passeng '
285,anyon seen #passeng #arriv ? recommend see either movie?
286,"la película passeng es una combinación entr el titan gravity, palomera solament pero jenniff lawrenc cada vez mejor"
287,passeng 3d http:// dlvr.it/n1wtc6 #berlin #kino
288,passeng http:// dlvr.it/n1wt7w #berlin #kino
