0,@finnskata star @gamegrump dude
3492,"aki-p compar hirat yurina yamaguchi momoe, star qualiti make read much everyth do. https:// sakamichinotes.blogspot.ca/2017/11/aki-p- once-again-compares-hirate-with.html … #keyakizaka46 pic.twitter.com/emryxhxl9z"
3493,とりあえず、お腹が空きました。 “俺にはイズムより 明日のパンだぜ” star club 1991 「slash knife」 （これもまた、ひとりごと）
3494,trash. ain't great either. star power cast though...blinding! #murderontheorientexpress
3495,"""climb high climb far goal sky aim star ."" inscript steps, william colleg"
3496,fucker high right now...
3497,"look star siriu right seem flash red blue, almost mistook plane helicopt it’ definit not!!"
3498,laker everyth brand star . realiti kuzma ingram star right https:// twitter.com/lakers/status/ 936096650400903168 …
3499,star tribun articl arrest lmao
3500,selamat tengahari bos.
3501,like lectur came share star war toy collect like yessss feel bond!!
3502,"audio movie, "" star "" - pr. ted giese, 11/27/17 http:// issuesetc.org/2017/11/27/331 3-the-movie-the-star-pr-ted-giese-112717/ … #cinema #entertain #movi #lcm"
3503,"watch star spangl banner end broadcast day. tv, still use term “sign sign off” refer commerci fall old time parameters."
3504,like @youtub video http:// youtu.be/-1bie0xtngk?a empir dream stori star war trilog 2004
3505,mysteri rey' parentag extend star war filmmak http:// ift.tt/2i0b2zx
3506,"( {{{{{{{{l v e}}}}}}}} ) ☆☆☆☆☆☆☆☆☆☆☆☆ love star , everi song everi movie... #love star world! : ) #muchlov -j. leon (c.t.)"
3507,인큐베이터에선 모유수유가 안 되는 이상하네.
3508,"honestli can’t blame woman, that’ lot exposur deal first movie. point star war gravi train stop. give us new adventures/sid stories. https:// twitter.com/mtvnews/statu /936065812246482944 …"
3509,excite. booti even without star !
3510,http://www. ramleemarahaban4semporna.com/2017/11/bersam a-anak-muda-dan-masyarakat-di.html … @pmomalaysia @tonypua @shahrizatjalil @tengkuadnanr @tonypua @thesundaili @staronlin @nst_onlin pic.twitter.com/skfod3wsrp
3511,shrine' go help star energy. you'r longer useful; it' etern 'skip one turn' here!
3512,"forex rci: financ minist conceal facts, pm implic http://www. thestar.com.my/news/nation/20 17/11/30/forex-rci-finance-minister-concealed-facts-pm-implicated/ … pic.twitter.com/twfpqplz6i"
3513,mysteri rey' parentag extend star war filmmak https:// trib.al/xplbmpq
3514,"time stone reason bucki star arm, thor hammer, steve stealth suit??? pic.twitter.com/maqpcmbhc5"
3515,makali star ??? https:// twitter.com/olivermatheng /status/935871712637472768 …
3516,"look landscap care sure recogn it, travel africa someday, desert. happen pass here, beg hurri past. wait little, star ! child come you, laughs, golden"
3517,fear star cinema #eaglehawk could close 2 month $30k isn’t raised. actor john flau get behind campaign save it. @9newscentralv 6pm pic.twitter.com/nqblkazwol
3518,3.6.5 want christma promis she' dream star
3519,"me: love beetlejuice, it' one burton movi w/o woman beater star rememb alec baldwin beat wife: wha"
3520,star christma tree year? one better suggest i'm put sebastian aho there.
3521,ok notic day ago seem everyon els also. what’ the”star labs” shirt similar seat @notethansmith_ @noahhazel55 @jakerunorri . @ruleedward seem big chief. kinda underground society?
3522,star emphasis bbu bbu https:// twitter.com/kfkwheein/stat us/936107524620566529 …
3523,"klik>> http:// goo.gl/cmu7ek knife attack flat: woman killed, man serious hurt - star onlin"
3524,get don’t even know star show
3525,star arriv saturday nake tree
3526,"fantastic. love writing. mysteri star elves, dwarven speech like two stone grinding. it’ descript yet sparse. sorri injury, glad found write videos. hold light."
3527,liter whenev i'm sad watch jackass @bam__margera make laugh everi time. pleas bring jackass back. i'll star 4th one idc ride bike roof fire fuck pool i'll shit. i'm robin want jackass back
3528,mysteri rey' parentag extend star war filmmak : http:// ift.tt/2i0b2zx
3529,"girl, know made much food left over left overs. #oop shari known cook larg portions. caus girl, know shari star chef event #shari #fabul #stuf #leftov #cook #food #eat #followm"
3530,"star night, @iamaarongordon , put career-high 40 point 15 rebounds. @… https://www. instagram.com/p/bcg58n3fgm6/"
3531,think there' reason star center want play you..
3532,angel babi mid star moonlight
3533,emperor palpatin lost star trooper chang room then?
3534,star emoji found phone. one look for? :o pic.twitter.com/tfjencxglu
3535,kiss star war theme song die happi
3536,"2016: year ""star trek future"" died. may yet see technolog wonders, warp drive aside. certainli see societi star trek."
3537,"also didn’t add anyth new star war sandbox, one favorit aspect seri"
3538,carri daughter arm put star top christma tree fill heart greatest joy.
3539,@eastarwar guy pleas fix game! good game made muddi mess guy want rush con star war fans! pleas care consum pic.twitter.com/03ip4jh64p
3540,@daronnefci portrait insid star' mind ecips cloth there' moon star ecips look garden scene it' there. what' that?
3541,"far away,curr malaysia watch star war high blood pressur gsc popcorn,how borong bake give support u ?"
3542,star > eu say need concret evid turkey deem gulen network terrorist http:// ow.ly/paex50fsaoo
3543,hrithik roshan star month | bollywood news https:// videostap.com/hrithik-roshan -is-the-star-of-the-month-bollywood-news/156792 … pic.twitter.com/mdrlrwe3z8
3544,1820 alabama-rama join star fest. one stephen king' biggest inspir maine-bo-baine. easi genocid guy we'r go flag year. #nflboycott #takeakne #usflag #potus45 pic.twitter.com/jd8sgoe3dr
3545,"star online: forex rci: financ minist conceal facts, pm implic https:// goo.gl/fb/bjfq2"
3546,star online: forex rci: bank negara loss affect malaysia’ economi https:// goo.gl/fb/yjddvr
3547,star online: najib: malaysia continu benefit japan’ invest https:// goo.gl/fb/j5g548
3548,know littl star war universe. i'm like one girl tri explain story. https://www. youtube.com/watch?v=rdflqi nigwk …
3549,"star war trivia challeng googl home, gave correct answer, told wrong, told differ answer one previous listed. okay then."
3550,lewi crimin mind wasn’t shown one star cast season 11? new member wasn’t intro why?
3551,slow clap star campaign bjp ... ... terrif person @officeofrg & & actual true caus congress' downfall. https:// twitter.com/ani/status/935 878197236850689 …
3552,xma season want non tradit take star . inspir norwegian spiral- alway like think bifrost. #art #paint #landscap #surreal #thor #loki #fantasi #bifrost #spiral pic.twitter.com/fmsvimzzzn
3553,hear star apprentic next.
3554,late i'v get back watch star trek shows; tonight start watch star trek:... http:// fb.me/43vbaqec0
3555,first clue star trek futur horrifi appear first: one ever eat pizza
3556,thank like & help star trek trivia
3557,"matt lauer axe someth pale comparison danni masterson alleg done... violent rape 4 women get you, 1) arrest prosecution, 2) still abl ""star "" @netflix show. hmmmm..... what' wrong picture?"
3558,one star game theori reaction pictur
3559,@star star take video show alex she’ star attention. #empir
3560,"continuamo con el torneo de la adem sr, #ademdeport , lo esperamo en el club star pic.twitter.com/ze2y0ne0or"
3561,look sound like still smoke stuff.
3562,"last jedi predictions: thread. (these opinion base research footage, analyz interview hint mannerisms, star war channel follow. i‘ll repost new channel but.. follow @thekybercantina )"
3563,"everyon talk star war kinect han solo danc like bad thing best thing come star war ever,"
3564,"name is...th bright morn star, star came of… https://www. instagram.com/p/bcg4w9ag6jxb yrigp6ez0st3ivr84xb1xzfi2c0/ …"
3565,"intrepid scientist, mari wise, vs hive armada want occupi star dreadnought fix everything."
3566,replac @ismellmysteri cardboard cutout. wonder long it’ go take star lab crew notice.
3567,today star bright light way we'll go(今日は星が輝き、僕らの行く先を照らしている) - cold hand
3568,proud phi delt brother tristen perform peter star catchers! show run sunday 7:30 everi night 2pm matine sunday! #yaygreekssupportinggreek pic.twitter.com/7catnigoiv
3569,star war legaci comic also good think. darth talon
3570,"「look star .」この""at""で、星を指差しているイメージを持つと""at""の特性がズバッと理解できちゃいます‼︎"
3571,"morning! anoth chilli one. star say we'r head 'coldest decemb record.' we'v got latest chillenden murder show today, we'll propos reinvent hospit kent. join us 6am @bbcradiok x"
3572,"star > forex rci: financ minist conceal facts, pm implic http:// ow.ly/qj9r50fsapu"
3573,gostei de um vídeo @youtub http:// youtu.be/sojt9tfj-kk?am ariah … carey sing star -spangl banner! (2008)
3574,nissan chosen star war inspir rogu sport yet get see shown online?
3575,""" star bethlehem"" open 12/8 - 12/10 @7pm bethani refom church redland (on 705 cajon street). call 909-335-1082 tickets. https:// twitter.com/heartlandthtr1 /status/936099545619996672 …"
3576,finish star war - empir strike back film? mark complet http:// canonkillerbase.com #hanshotfirst
3577,list come sime' plantat properti 'must buy' http:// po.st/3hqqrg via @staronlin
3578,"「look star .」この""at""で、星を指差しているイメージを持つと""at""の特性がズバッと理解できちゃいます‼︎"
3579,"would bayley' headband look star pattern t-shirt? think sport type headband could help, maybe. person don't see anyth wrong though."
3580,think it' time final watch star war movies... know lot charact stuff i'v never actual seen full one. kinda wanna hop train #starwar
3581,"screenshot beat shit me. styliz star ocean cast look like anim dolls, enough detail see eyelid crust up. porcelain anim doll tire old man eyes. pic.twitter.com/bxdjtu2abm"
3582,review star up! one is...less good... https://www. michigandaily.com/section/arts/% e2%80%98-star%e2%80%99-brings-nativity-poorly-animated-lif …
3583,everyon talk star war feel old behind
3584,everyon star quarterback.. someon keep bench warm
3585,@memgrizz get rid @davidgrizdal star player score 10pt coach fault. trade marc still valu
3586,"love star fish story. first heard 2008 humanitarian trip guatemala want save everyone! friend live 18 month told stori realiz do, it'll matter least one person."
3587,recal one time glanc star war page 1d4chan vader’ armor block lightsab blows.
3588,think impli one star player na o.o
3589,[ star ] http:// ift.tt/2zq5p7n #swfc alan biggs: player carlo carvalh must share blame sheffield wednesday rut
3590,"great interview! hope see @steelewar collider, can’t wait star war schmoedown dec. 8th!!!"
3591,"disney also found star new movi ""north korea, hermit kingdom"". star donald trump apprentic show & #maga cacas. kim jong un, fat dicktator. yay! https:// twitter.com/time/status/93 6097592466923520 …"
3592,think aw special worth could introduc boba fett star war universe.
3593,"star twinkl brightli lake. ""whi follow me?"" littl fish asked, adoringly. but, alway light splash by."
3594,where' star destroyer?
3595,"also go star war premiere, that’ cool"
3596,unpopular opinion: fun play star war game. pic.twitter.com/od8fiyi87g
3597,"gostei de um vídeo @youtub http:// youtu.be/k95dqdx981s?am ariah … carey sing "" star -spangl banner"" ""you don't mess zohan"""
3598,would clegg want defund star would mean could go back pretend trump twitter ?????????????? pic.twitter.com/dizxviykdw
3599,fire touch someon snap selfi far. women must lump case togeth - - one hear us take movement seriously. @mprnew read garrison keillor' full email star tribun regard fire mpr http:// strib.mn/2zq4vyo
3600,"realli notic major shift star trek pilot subsequ episodes. whole charact transformed, feel changed. much better."
3601,think star war empir strike back hot toy darth vader 1/6 scale figure? buy... http:// fb.me/8ycz7mdg5
3602,i’m watch star war seri first time ever rn i’m scare
3603,hope abus polit purpose.
3604,"3. song' writer, david paich, 6x grammi winner star spangl banner writer, franci scott key, slave owner racist"
3605,"""when rains, better thing fall together. i'd lie told regret star …"" -- @icouldswear pic.twitter.com/l91j7clkvg"
3606,"btw, @suckerpunchprod doesn’t ask izumi motoya repris role hojo tokimun (izumi star amaz 2001 nhk drama name, also star watanab ken) sad."
3607,@uta_mbb team one best team nation! dfw fan especi arlington need wake up. need star team beg support! best sport valu town! https:// twitter.com/kherv_25/statu s/936073267965759488 …
3608,2. rank number 1 us billboard 1982 top 100 ( star spangl banner never top billboard charts)
3609,"yo @optichitch @optich3cz , watch hitch vlog heard u want go texa hs footbal game. recommend go round 3 playoffs, southlak carrol vs arlington. 7 pm saturday star frisco. probabl best game week"
3610,anyon hasn't yet seen star war cantina music stuck head.
3611,star spangl banner! ye celebr flags. 1814 big bitch took 25 hour gangbang british navi cuck amateur poet. see wave wind inspir poem would spark controversi 202 year later #nflboycott #takeakne #potus45 pic.twitter.com/tnigweakz1
3612,"neonatologist understudy, obstetrician diva ceo star @lindajmellor @mercyperinat #gou2017 midwif @ruby_blues_ ??"
3613,"way buddy, reason star war movi fill white guy peopl auditioned. red forman would say, “you’r dumb ass”"
3614,sooo guess who’ ps4 doesn’t work pay $100.00 extra least came star war battl front
3615,like @youtub video http:// youtu.be/rbbwah_ixeu?a star war prequel aren't bad everyon say (video essay)
3616,[cnet] 'star wars: last jedi' car la auto show - roadshow http:// j.mp/2apg83u
3617,"yeah i'd guess guy think star chang franchis alway exceptions, bamba seem like percept kid interview i'v seen"
3618,"star now,just yesterday said nasa propos john mbadi leader minor junnet m. women rep parliament,now guy claim nasa want un court, question news???"
3619,disney found star live-act 'mulan' remak http:// ti.me/2i1jaf3
3620,forex rci: bank negara loss affect malaysia' economi http://www. thestar.com.my/news/nation/20 17/11/30/forex-rci-bank-negara-losses-affected-malaysias-economy/ … pic.twitter.com/ably4yjdl9
3621,"rt time ""disney found star live-act 'mulan' remak http:// ti.me/2i1jaf3 """
3622,'star wars: last jedi' car la auto show - roadshow: one thing learn 2017 lo angel auto show nissan take star war serious cosplay comic-con do. http:// feedproxy.google.com/%7er/cnet/mhpi /%7e3/rnd6ajhm-wa/?utm_source=dlvr.it&utm_medium=twitt … #car #autonew #ni pic.twitter.com/bb3gd1abbi
3623,i’m distress dg au turn star war prequel @bisexualleo
3624,star back!!!
3625,treat star ocean 4 remast reward get job pic.twitter.com/b6ubwghb3x
3626,star power mario kart hustl sped up?
3627,they'r true feel talk star war
3628,thestar @/aor_bam ติดจอง
3629,whomst must fight see topher grace' edit version star war prequel
3630,star malaysia - http:// bit.ly/2xlpcro http:// fb.me/9eilvq3vz
3631,steve: *rip star costume* anarchi
3632,disney found star live-act 'mulan' remak http:// ti.me/2i1jaf3
3633,keep shit like won't get star war games. quit bitch fun run around star war universe.
3634,■cd情報■ 李奈3rdシングル『catch star ☆』(¥500) came-on recordから発売中！ ライブ会場か通販でお買い求め出来ます 通販⇒ http:// imix.cart.fc2.com/?ca=72 https://www. youtube.com/watch?v=zpvez cfz1w … #音楽 #music
3635,like star idea!
3636,nazri: lui suarez' 'biting' rep won't affect tourism malaysia - star onlin https:// goo.gl/fb/kbzvsp
3637,love idea much! make wish @chimerarpg finish sci-fi magic girl modules. would awesom set game pure magic girl alien star war universe.
3638,"that' good look pixel! i'd gone flatter red though, give star trek look. give three (commander) four (captain) gold pip complet image."
3639,"let watch star wars: last jedi trailer. immedi hype. hype train. hype overload!!! *act vagu interest ""it' cool. i'm cool. everything' cool. don't even worri it, i'm worri anything..."""
3640,"incred talented, method actor robin lord taylor @robinlordtaylor star @gotham @foxtv join @buzzfeednew #am2dm talk play #penguin ; despit dark tale times, #light shine us all! #trump #hope #lgbt @glaad pic.twitter.com/5fze6atbwn"
3641,". @pwnerd97 “brad, anyth add star war prequels?” me: “yeah, go watch mortal kombat movi much better.”"
3642,f**ker
3643,i'm wear right met girl bathroom wear jacket told star trendi feel better
3644,"worst. seriously. why? look promising. variety: ""jar jar bink return star wars... http:// fb.me/lhcqekq"
3645,word star war comic timelin jump closer post empir era?
3646,"yeah, guess don't realli report exact number subsidiaries. either way, would hope they'd least put 20th centuri fanfar back star war movies, do."
3647,star effect emoji label dizzi symbol
3648,"1. guardian: i'm angry. you'r angry. women angry. enough? illo: celin loup 2. star : women alway alert threat sexual assault illo: raffi anderian 3. link: despit funding,quebec isn’t enough..on campu illo: gabor bata pic.twitter.com/mqvdpra9tk"
3649,"speak so-cal presid alma mater' student govern matter unbelievably, outrag disproportion respons soon possible. statement recklessli taint star olvera' name. https:// twitter.com/txstsg/status/ 936052950010654721 …"
3650,star hint aren't nearli obtus use be. one thing solidifi renew love addit new playabl charact
3651,it' easi make tasti & versatil canadian turkey star holiday season celebr - visit @cdn_turkey recip inspir prep tip need! #turkeytradit https:// oldermommystillyummy.com/2017/11/turkey -falafel-bites-appetizer.html …
3652,struggle. want star ocean 4 hd remaster. it' 50gb. ps4 alreadi struggling.
3653,@michaelcondrey admit prestieg glitch got ban got deserv accept star reset full reset reset befor glitch 3 prestieg legit way
3654,"@lanip seen/ plan see infin war trailer??? know keep away star war ones, i'm curiou know this."
3655,it' easi make tasti & versatil canadian turkey star holiday season celebr - visit @cdn_turkey recip inspir prep tip need! #turkeytradit https:// oldermommystillyummy.com/2017/11/turkey -falafel-bites-appetizer.html …
3656,name keali rae say sound like star old western tv special
3657,go full forc enforc act - star on-lin https://www. thestar.com.my/news/nation/20 17/11/26/going-full-force-to-enforce-act-most-malaysian-mobile-apps-are-collecting-too-much-personal-data-unr/ … @staronlin
3658,soniia beat sixth seed fitriani march second round - star onlin http:// ift.tt/2ipcir #badminton #badmintonnew
3659,uhhhh star ocean 4 remast look exactli same? im callin bullshit.
3660,'star wars: last jedi' car la auto show - roadshow https://www. cnet.com/roadshow/pictu res/star-wars-last-jedi-cars/#ftag=cad590a51 …
3661,"tweet shit ""where good ones? there' decent men there"" stfu they'r cant look past fact they'r short muscley nerd arent star quarterback footbal team"
3662,five million job could disappear five years' time. https://www. thestar.com.my/news/educ /2017/11/30/machines-taking-over-our-jobs-academics-weigh-in-on-the-issue/ …
3663,cops: drink sachet may drug - star onlin http:// ift.tt/2ins1eu #penang
3664,two women drug traffick suspect nab - star onlin http:// ift.tt/2ip1jvj
3665,"phil biggies, (jill & david), went see star tonight. said fun, recommend it! http://www. imdb.com/title/tt458765 6/?ref_=nv_sr_1 …"
3666,spotlight effect caus star show
3667,"i’m proud #jlover , jenn @jiopvt star pre- #superbowl show broadcast first time tv pic.twitter.com/epdbqxvytd"
3668,hair star show pic.twitter.com/rfbn2tb0rk
3669,everyon alway love worst player team. true everi team ever play also regular job matter. think it' zero threat place team star player 2nd wors player.
3670,fire matt lauer day lit christma tree? smh whose go put star now?
3671,"#hlaudi said 5-year deal innovation, project made #sabc money. @thestar _new https://www. iol.co.za/news/politics/ multichoice-kickback-charges-enrage-hlaudi-12202868?utm_source=twitter&utm_medium=soci …"
3672,happi birthday besti ages. i'm still super glad know @mosopeiv may keep soar high like star are. beauti day today! love
3673,i’m start petit biopic ayn rand star must steve bushemi.
3674,"revolvers, crossbows, knive sword hand south yorkshir polic - star http:// ift.tt/2blo5n6 http:// ift.tt/2quimmr"
3675,south yorkshir music student prepar week excit perform - star http:// ift.tt/2j47ob4 http:// ift.tt/2quimmr
3676,right one day could star look relationship convers start with......hel nah
3677,"bad star war holiday special was,i still think worth redo disney channel mayb even add mcu pixar charact updat version??"
3678,must good luck find $1000 buck chip floor star . funnier lose grand [dame]
3679,"chris: god savanna, haven't seen fast furious, indiana jones, star war movies. realli slacking. @chrisoffeath #nerdintrain"
3680,"https:// youtu.be/g3gcgjhfyf ..(""pete see sing "" star spangl banner "").."
3681,"star trek: voyag episod ""flesh blood"" air date 2000. #startrek #startrekvoy pic.twitter.com/4irumo3s"
3682,cops: drink sachet may drug - star onlin http:// ift.tt/2bxdhp1
3683,don’t even want know what’ go star war fandom prompt tweet tonight. stop polic peopl let folk fun. seen state world? fantasi good pure thing left. let peopl enter freely.
3684,“i bath star way blood” pic.twitter.com/mxnykbimzp
3685,read garrison keillor' full email star tribun regard fire mpr http:// strib.mn/2zq4vyo
3686,“help read star tribune”... https:// twitter.com/lizzieohr /status/935949889632129025 …
3687,"omg could taken wrong way noooo,,,, star 21 savag ."
3688,"@officialgtvid min, love star bisa dilanjut lagi gak? -_- plisss jangan motong tengah jalan"
3689,@mariahtrend #thestar final reach 1 million view @vevo lamb
3690,we'r you. star team help #hiv + at-risk new yorker find way care & servic http:// bit.ly/2bv4xt7 #brooklyn #nyc pic.twitter.com/k0jzwxsw5n
3691,star trophi @misskyliehugh #eyespyleaveitalon pic.twitter.com/urxfczg6fh
3692,"aw oh look star ... stupid, one sky. :p"
3693,happen stumbl upon gem star war store disneyland pic.twitter.com/eytls8l8oo
3694,yeah need togeth feather rais star rate
3695,star war edit electr razaor crack up.
3696,moment left univers felt like im lightyear away star want be.
3697,sure want buy tri star war 6 bd collect it’ quot $7.98 pic.twitter.com/aphfy3zsex
3698,// use star x red layout form red x rose layout. pic.twitter.com/065he0mknj
3699,ref wanna star . it' annoy
3700,hunti would littl busi #zaza star la cage aux foll
3701,wow... degre sole determin wages. dumb.. never trust star .
3702,"reason watch nba pacer fun. nba ref give star treatment, it' even harder watch it."
3703,hobbl altidor fire toronto ml cup final http://www. thestar.com.my/sport/footbal /2017/11/30/hobbling-altidore-fires-toronto-into-mls-cup-final/ … pic.twitter.com/dd07vwd7fx
3704,"ongo threat milit kidnap threats, sabah curfew extend http://www. thestar.com.my/news/nation/20 17/11/30/ongoing-threats-from-militant-and-kidnap-threats-sabah-curfew-to-be-extended/ … pic.twitter.com/rl3njky5ct"
3705,nazri: lui suarez' 'biting' rep won't affect tourism malaysia http://www. thestar.com.my/news/nation/20 17/11/30/nazri-luis-suarezs-biting-rep-wont-affect-tourism-malaysia/ … pic.twitter.com/tr2fwi8t0b
3706,"mani tasti recip options, it’ easi make @cdn_turkey star holiday season! #turkeytradit http:// totsfamily.com/use-turkey-aro und-table-holiday-season/ …"
3707,rci find forex scandal tabl parliament http://www. thestar.com.my/news/nation/20 17/11/30/rci-findings-forex-scandal-tabled-in-parliament/ … pic.twitter.com/hyp7ynnucj
3708,najib: malaysia continu benefit japan' invest http://www. thestar.com.my/news/nation/20 17/11/30/najib-malaysia-continues-to-benefit-from-japans-investments/ … pic.twitter.com/fpdk1zpr3t
3709,#thestar #rockefellercentertreelight #swarovski #salvadormundi #samsung #android #christi … https://www. instagram.com/p/bcghsr8abzx/
3710,star > japan emperor cede public duti abdic - princ http:// ow.ly/mj0850fs9mq
3711,excus me. don’t even know crap. leia han solo liter twin star war books. also huge star war fan fight me.
3712,star https:// twitter.com/chriistal_clea r/status/936080532189872129 …
3713,need star war marathon #lastjedi come
3714,robot come job mani 800 million worldwid - tech news | star onlin http:// fb.me/1sxvq0mto
3715,star war adapt book releas distant movi releas dates.
3716,tree almost done wait star https://www. instagram.com/p/bcgybvalaqb1 icqjjmaq4zigunugwg2qvavegs0/ …
3717,star soundtrack everyth 90’ vibe get love everi song!
3718,"real talk hope zack snyder get famili long needs. wouldn’t mind see seven samurai star war film rumor back. it’d simpl stori snyder action & visuals, set star war universe."
3719,too. wors watch star war holiday special watch aired.
3720,long gonna keep star player sideline?
3721,top 10 salman khan movi turn star today http:// bit.ly/2m3i10i #cinemaprob
3722,"y’all ugli let get die, none y’all allow use *star war theme play speakers* meme star war season"
3723,star #nonotyoukjah https://www. instagram.com/p/bcgx0oihezbz jkqkzzspw242ugayopffolaq8a0/ …
3724,love mh look dapper wool coat @rag_bon - cours star milly. #starwar @hamillhimself https:// twitter.com/hamillhimself/ status/936085257698365440 …
3725,"@johnlegend narr great today nmah. great learn life, thought star spangl banner nation anthem. keep good works."
3726,want star cast soooo pretti
