0,@finnskata star @gamegrump dude
1,"rtj go sell song year 4595, star war rap"
2,star trek daili wurd soeben publiziert! https:// paper.li/blickrichter/1 472979531?edition_id=e2c84e72-d608-11e7-b0e0-0cc47a0d1605 … #spacerid
3,oddli get hype star war movi
4,“star spangl banner” perform mormon tabernacl choir pinnacle! 2 version exist-they listen mix last even https:// twitter.com/billboard/stat us/936234519916662784 …
5,grandma dead ass pull magnifi glass see uncl commerci star of. #roast pic.twitter.com/kb41sure2k
6,sincerest wish . @roche_bro buy star market sidney st cambridge. #makegroceryshoppinggreatagain
7,broke hoe ass straight contempl open n h e r credit card star war design ctfu
8,"creator star destroyer: ""what made shield gener one notic part ship? also, made bridg second notic part ship?"""
9,weren't alreadi star airport security! :p
10,amend act lifelin charg drug traffick http://www. thestar.com.my/news/nation/20 17/12/01/amendments-to-act-a-lifeline-to-charged-drug-traffickers/ … pic.twitter.com/uxmbubhgio
11,game-chang ps4 consol star winner http://www. thestar.com.my/news/nation/20 17/12/01/gamechanger-for-ps4-console-all-star-winners/ … pic.twitter.com/7eohd1cwnx
12,driver injur heavi vehicl collid http://www. thestar.com.my/news/nation/20 17/12/01/drivers-injured-after-heavy-vehicles-collide/ … pic.twitter.com/k0bvpooriu
13,actress' former driver allow appeal court decis http://www. thestar.com.my/news/nation/20 17/12/01/actress-former-driver-allowed-to-appeal-court-decision/ … pic.twitter.com/ire4qqgdlj
14,ministri seek feedback youth tn50 initi http://www. thestar.com.my/news/nation/20 17/12/01/ministry-seeks-feedback-from-youths-on-tn50-initiative/ … pic.twitter.com/skje2li82d
15,team member noah definit star kind calendar video @channelmum #cmkindess https:// youtu.be/agdjbbil6yq pic.twitter.com/rt7f9k3rik
16,mca cri foul penang govt' land sale http://www. thestar.com.my/news/nation/20 17/12/01/mca-cries-foul-over-penang-govts-land-sales/ … pic.twitter.com/5wtkbxx4ov
17,"yep, they'll get away likely. don't think ufc ea commun larg enough vocal enough like star war commun make big deal it."
18,it' easi make tasti & versatil canadian turkey star holiday season celebr - visit @cdn_turkey recip inspir prep tip need! #turkeytradit https:// oldermommystillyummy.com/2017/11/turkey -falafel-bites-appetizer.html …
19,talk star tribun me?
20,pakistan talk malaysia other ga import - star onlin http:// ift.tt/2i5lbvu
21,"fort worth woman guilti run sex traffick ring articl today star telegraph, report ryan osborn give account guilti plea shatara .. http://www. drjohnaking.com/the-voice/woma n-guilty-sex-trafficking-ring/ … #dealwithit #drjohnak pic.twitter.com/atmqwdkwss"
22,confess make. never seen star war films. rais star trek. everi time new... http:// fb.me/unvk732n
23,one favorit scene star war saga!
24,“ star ” “coco” great movi take kid see. love
25,"star sky, shine bright pic.twitter.com/kmrhyi0hku"
26,exo #mamaredcarpet star
27,it’ like max kellerman say star spangl banner slaveri justifi nfl kneeling. everyth deserv sjw hot take. although pépe le pew need chill sexual assault
28,saw anim gurl star david deletingearth
29,tru aber auch: star crank shade drop bass
30,luminari star
31,never disrespect star #cowboysn readi football? #americasteam pic.twitter.com/dvuvcj83iz
32,young minist help run country. young peopl young energi idea
33,e​minem brother one knew – he' star new film - ladbibl http:// dlvr.it/q3kd1q
34,e​minem brother one knew – he' star new film - ladbibl http:// dlvr.it/q3kd0c
35,"j-hu star show tonight. legend. wish set list longer that’ hype i’v ever concert, ever."
36,"kaream quran honour quraysh kaream messeng dee power within dee throne sight moham stingi leav remark returned, surat star didn't sight mose ibrahim scriptur fraud prime propheci khatim"
37,yeah fix peopl stop talk .. get star card without lootbox .. card don't even give much advantag
38,week star war show!
39,trickstar decor christma tree together...subaru love light mao goe makoto shoulder put star top (it trickstar’ logo) hokk ur man come ornament placement arrang
40,star ledger report - http:// politinform.net/politics/the- tar-ledger-reports/ … #политика #украина #киев
41,"i'm multicin cinema star água linda de goiás, goiá https://www. swarmapp.com/c/57xvmpk2kr"
42,revisionist click bait regard star war prequel becom rather irksome. 'whi phantom... http:// fb.me/lmovwhgi
43,south elementari student work origin display star center! pic.twitter.com/bontiiurix
44,"read one star war books, like lost stars. one favorit book ever take place star war universe."
45,star spangl banner?
46,"star -touch queen, vicious, uprooted, truthwitch, sidekick"
47,"사연 많은 애니메이션, 더 크리스마스 ( star , 2017) 출처 : 쿠슈(kusu.. | 블로그 http:// naver.me/xwubzqj1"
48,pta split name chang decis http://www. thestar.com.my/news/nation/20 17/12/01/pta-split-on-name-change-decision-association-undecided-if-smk-st-thomas-should-keep-its-name-after/ … pic.twitter.com/swzk8fyakv
49,'chines investor won't threaten nation' security' http://www. thestar.com.my/news/nation/20 17/12/01/chinese-investors-wont-threaten-nations-security/ … pic.twitter.com/cxw9mkushi
50,"doan time get rid clothes, court hear http://www. thestar.com.my/news/nation/20 17/12/01/doan-had-time-to-get-rid-of-her-clothes-court-hears/ … pic.twitter.com/ujidywcblf"
51,chase ensu partial car plate http://www. thestar.com.my/news/nation/20 17/12/01/chase-ensues-over-partial-car-plate-suspect-still-at-large-after-fleeing-vehicle-when-cops-fire-warn/ … pic.twitter.com/qymb7j0e3r
52,two cop woman hurt car hit polic vehicl http://www. thestar.com.my/news/nation/20 17/12/01/two-cops-and-woman-hurt-after-car-hits-police-vehicle/ … pic.twitter.com/cukntrnblp
53,teach youth society' mosaic http://www. thestar.com.my/news/nation/20 17/12/01/teaching-youths-to-be-societys-mosaic-camp-teaches-kids-interethnic-appreciation/ … pic.twitter.com/a5fpmmaoi4
54,"home disabl children get rm25,000 cash aid http://www. thestar.com.my/news/nation/20 17/12/01/home-for-disabled-children-gets-rm25000-in-cash-aid/ … pic.twitter.com/wzcepawe"
55,retire shock find person inform use scam http://www. thestar.com.my/news/nation/20 17/12/01/retiree-shocked-to-find-personal-information-used-in-scam/ … pic.twitter.com/k0lqu19hgp
56,um engin faculti top http://www. thestar.com.my/news/nation/20 17/12/01/um-engineering-faculty-is-tops-engineering-depts-no10-position-in-global-ranking-proof-of-rd-quality/ … pic.twitter.com/xumorglchn
57,"pioneer star writer alison gordon honour canadian #basebal hall fame former blue jay outfield lloyd mosebi told star time gordon’ death he’d gotten along gordon right away, tea... http:// globalsportscentre.com/pioneering-sta r-writer-alison-gordon-honoured-by-canadian-baseball-hall-of-fame-6/ … #nfl #footbal #nhl pic.twitter.com/2eafqghecu"
58,"guess what? it' time month' last day q&a, ashley warren star time around. know ""guess what..."" one ashley' use phrases? would read blog! visit websit find ashley' favorites! #lastdayqanda pic.twitter.com/sjxzqivzz2"
59,"i'm best unknown 2k player commun play 5 positions, current i'm run pg squad, understand studi game basketbal daily, star team. purpos challeng play differ positions."
60,uhm i’v seen star war movi least 100x famili geek
61,let talk @audibleuk hardli star war book avail @audible_com all.
62,hear everyth fuck that. miss star ratings.
63,can't wait rock deck saturday night stage star ! don't miss @thestagenm pic.twitter.com/xmltcmerp6
64,"@thejuanwilliam hey juan let' see christma tree, guess star top candi a$$ obama"
65,"think kc isn't alway pawnee, indiana, star goe & report n go colorado."
66,deal discrimin http:// po.st/wctelg via @staronlin
67,daili fantasi 4 movies. play stars. star . link profil 4 free beta invite. #df #movi #game pic.twitter.com/enksjigx9n
68,@samdrakez your girl star sweater https:// twitter.com/lwiavader/stat us/935501274421874688 …
69,昨日のまとめ ①突然の恵みのv。ヒョンビンのケンタ な落書きの解説中、仲良く寝転ぶケンコル〜！ ②the star、日本語挨拶みんなキヨウォ〜。 ③jtbcワナビー、ヌッパンを解説しようと芸人並の機転でノテ、床に寝転ぶww。 ヒョンビンの靴にお絵描きケンタ画伯ww。高値が付く？ pic.twitter.com/eg1zdidigx
70,hope better star war cereal
71,#elfontheshelf night one hang star #treetopp https://www. instagram.com/p/bci1ws8l4j8/
72,way star war
73,i'm star . i'm moon #overthemoon moon sooner. #abstractlif
74,‘the last jedi’ final bring hacker ‘star wars’ univers http:// ift.tt/2jb0wv1
75,today psych teacher tri use oper condit make kid class get knee pray star david kdksndndnm
76,"grumpi cat' christmas, santa' slay, black christmas, christma evil, surviv christmas, deck halls, santa clau conquer martians, star war holiday special, jack frost 1 2(the killer snowman movie), jack frost (the non-kil snowman movi michael keaton)"
77,agre there' lot goe team functions. team go far star take can't pretend like russ doesn't get tunnel vision time point detrimental.
78,"weird bug princess pick star teleport weird ""world"" lmao pic.twitter.com/reksjucd8u"
79,excus star lay floor like set up. readi go vmd nashville… https://www. instagram.com/p/bci1qofd1s8/
80,"wait entir adult life see luke continu legacy. character, luke star !"
81,"repli meta joke themselves, one notic they'r star david? thought pun"
82,"let's! get audiobook intro leia' 1st love! (!!!spoilers!!!) turn good-heart imperi spi tri save alderaan. sinc hansolo relationship we'v ever seen leia have, star -cross kier stuff fave! #audiblestarwar https:// twitter.com/audible_com/st atus/936376588190519297 …"
83,day 8 #norepeatstarwarsshirt — world war ii style bomber art star war universe? pic.twitter.com/i3djuph1b3
84,http:// po.st/mdu3du via @staronlin
85,"사연 많은 애니메이션, 더 크리스마스 ( star , 2017) 출처 : 쿠슈(kusu.. | 블로그 http:// naver.me/xwubzqj1"
86,"think good argument make. star team, whole citi himself. low key media city, best ballpark america, etc. depend preferences. think end al though bc dh."
87,"star (별)의 역방향 카드야. 걸림, 이상이 너무 높음, 실망함. 을 의미해. 혹시 너무 무리한걸 바라거나 소망하고 있지는 않아? 때로는 기대치를 조금 낮춰보는것도 도움이 될거야."
88,tell cheer alon you'r star stage.
89,"#fakenew seri it' page hear, studi keep replac lie truth! star seri begin sunday. http:// ow.ly/raqm30gvymw"
90,it’ realli bad! show peopl monsoon beauti song. it’ much better star academi version franc also yvonn https:// twitter.com/dicke_muschi/ tatus/936370120645120003 …
91,pm' scienc advisor receiv global award http://www. thestar.com.my/news/nation/20 17/12/01/news-nibbles/ … pic.twitter.com/jp9dj1uf58
92,flood southern thailand spill kelantan http://www. thestar.com.my/news/nation/20 17/12/01/floods-in-southern-thailand-spilling-over-to-kelantan/ … pic.twitter.com/xjtxsombsv
93,"happi birthday one icon actress around amaz women know of. (i googl geraldo-guy, again, everyon know bett midler ehm... star .)"
94,http:// po.st/jnbfq3 via @staronlin
95,"whole lotta shakin goin - m4.1 #earthquak near dover, delaware. star show locat quake. info map https://www. usgs.gov/science/missio n-areas/natural-hazards/earthquake-hazard … pic.twitter.com/u8w0pznelv"
96,like yeah know sfa introduc krystal star fox canon like sfa didn't even anyth plot pretti much nonexist
97,'the last jedi' final bring hacker 'star wars' univers http:// thr.cm/adlkhr pic.twitter.com/lqatubw9n
98,star https:// twitter.com/ratedkjn/statu s/936332451567333376 …
99,like @youtub video http:// youtu.be/cemvxn_4kky?a follow star christma stori | christma book kid | star movi
100,star > exclus - yemen rebel missil fire saudi arabia appear iranian: u.n. http:// ow.ly/ween50ft706
101,. @tasoshernandez fan make sure read editor @goodhumorgrl 's interview star upcom film @jgsmovi http:// starrymag.com/tasos-hernand z-just-getting-started/ … ! #justgettingstart #movi #thebachelorett pic.twitter.com/gyeyxhltdo
102,"never momofuku seiōbo star realli miss out, food drink match are... http:// fb.me/meix53fp"
103,first time theatre. see star . happi post-hump day! (@regal cinema foothil town center 22) https://www. yelp.com/biz/regal-cin mas-foothill-towne-center-22-foothill-ranch-2?pt=check_in&ref=twitter&utm_campaign=checkin&utm_medium=twitter&utm_source=ishare&v=4b …
104,use see dad wear “star david” around neck constantly....grew littl ask “whi wear arent jewish?” said “becaus we’r israelites..... came first”
105,weren’t even star
106,"wonder spot-on tribut @princetonupress , peerless peter dougherty, star @christiehenri . https:// paw.princeton.edu/article/charac ter-its-cont …"
107,star wars-inspir nissan titan at-m6 walker assault l.a. show: nissan hitch wagon lucasfilm star war franchis last year rogu one episod base obviou tie-in the… http:// dlvr.it/q3k5vn #need4spe #exhaustleak #leakfreek #theleak pic.twitter.com/nk4n75penc
108,star pokémon. pic.twitter.com/s9q9cfvyn9
109,moon star
110,r mayb star spangl banner? ha
111,"make larg wing book trailer novel, star , first 8th island… https://www. instagram.com/p/bci0xwnfljw/"
112,"star offic book holiday parti us! offer bowling, 2 full bar inside, full restaurant, corn hole, bocc ball, ping pong. settl offic bet all. #goodtim #goodvib #officeparti #bowl #holidayparti pic.twitter.com/clmjpjmz9w"
113,bob star destroy
114,yeah didn't know pick haha put star tree lol
115,(title) imagin star cats. think titl possibl get attention? titl first book (young adult/fantasy/adventure) trilogy.
116,come see justic leagu see star war trailer big screen...
117,@jkcorden call star maker well everi one star me.if think could come see do.
118,"u.s. anthem, star spangl banner - star spangl banner... #instrument http:// joyyha.tumblr.com/post/168048238 219?utm_source=dlvr.it&utm_medium=twitt … #instrument"
119,"yesterday, star well. https:// twitter.com/gentle/status/ 934600342574174208 …"
120,"#illuminati #mkultra it' crazi celebr talk illuminati talk pedophil hollywood music industri die cornell, bennington, robin williams, prince, ledger, philiphoffman. star killer made lot look like hang"
121,star show!!! jamesey & smile.
122,"i'm cineplex odeon forum @cinemascineplex star montreal, qc w/ @mitadcolombiana https://www. swarmapp.com/c/41vthtx1dtu pic.twitter.com/1wysexgjro"
123,"got ""padm amidala"" ""star war clone war charact test!"" quiz. http://www. quibblo.com/quiz/bqfriot/ tar-wars-the-clone-wars-characters-test … via @quizz"
124,"universe' way tell @joebiden it' cool run 2020. p.s. - funni shape state star actual happen delaware. know it' incred remarkable, cri loud, doesn't even get mention?"
125,dont walk star ...a hand come grab yer junk.
126,journey star citizen latest ptu build 3.0 bug still they… https://www. instagram.com/p/bciz5rafjg6/
127,[ star ]. 희망을 의미하는 카드에요. 역방향은 환멸과 비애.. ...절망이 아니냐고요? 후후. 무슨 반쪽짜리 모니터 같은 소릴 하세요?
128,like @youtub video http:// youtu.be/cc-5vj1a1sw?a hand fate 2 - northernlion play - star [episod 23]
129,el elenco de doblaj de star movi #laestrelladebelén no cuenta cómo se prepararon para interpretar a... http:// fb.me/4ycqep8fb
130,'the last jedi' final bring hacker 'star wars' univers https://www. hollywoodreporter.com/heat-vision/la st-jedi-finally-brings-a-hacker-star-wars-universe-1063240 … vía @thr
131,anyon still need star glitch?
132,questão eh q alway knew best coolest girl know prettier rest star show
133,"one night moon hang one night star follow one night, one night, one night descansen."
134,"mani tasti recip options, it’ easi make @cdn_turkey star holiday season! #turkeytradit http:// totsfamily.com/use-turkey-aro und-table-holiday-season/ …"
135,"""dead goldfish swap kid school"" star war universe."
136,[genie][공유] star (星) - exo http:// genie.co.kr/du0210
137,justin timberlak & stephen colbert tackl ' star -spangl banner' http:// ihe.art/rqck9vx
138,gustó un video de @youtub http:// youtu.be/p9a1-fxd-hi?a vita - star
139,"steven yeun bo, small donkey big dream “ star ” http://www. latestcelebritynews.net/2017/11/steven -yeun-is-bo-small-donkey-with-big.html …"
140,"think that' realli sad suddenli move star orpheum time. move began??? guess they'll start take star place now, not....that' plain wrong!!!"
141,"look wonder christma movi take kid to, go see star ! https:// buff.ly/2arqqxk #thestarmovi #thestar #christmasmovi pic.twitter.com/qyggyohtug"
142,also @fallout @bethesdastudio y’all ever consid cutaway book (like star war cross section series?) think it’d popular amongst fan also help settl question technolog canon.
143,"star war solo trailer actual hit 8th -- day jurass world fallen kingdom trailer -- well, then, universal... y'all need better."
144,mike caus you'r cover star keep eye field! great night love do.
145,revealed: 111 amaz place sheffield - star http:// ift.tt/2akcrp #decentgo
146,"""farrah star /talent famili ‘teen mom og’ show"" wtaf? @theashleysrr pleas rt i'm start gofundm buy michael dictionari 4 christma ca learn mean word star talent pic.twitter.com/vakgbbld6z"
147,"look forward follow star advent. sunday celebr hope jesu give us, hope even darkest time lives. https:// twitter.com/tuscumbiaumc/ tatus/936265728755453954 …"
148,love geek bro reaction “star wars: last jedi” finaltrailer! experi it... https:// tmblr.co/zndocx2sx5npx
149,"mani tasti recip options, it’ easi make @cdn_turkey star holiday season! #turkeytradit http:// totsfamily.com/use-turkey-aro und-table-holiday-season/ …"
150,star sky btw
151,proud guy receiv star student award @walhallael month! pic.twitter.com/d1ilawyi26
152,"http:// kplg.co/ysc0 parodi lucu 'man star ', kamu wajib nonton!"
153,"finish phasma @delilahsdawson . it' tale paint complex portrait warrior chrome. equal part furi road scheherazade, phasma show us grim, desol corner star war galaxi rare explor before. recommended."
154,true - listen star bother star war bride song hear outcom event
155,"star > janna shock artist drug cultur - popular actress janna nick (pic) say shock fellow artist urg tri drugs, harian metro reported. http:// ow.ly/vam250ft6u7"
156,it' star war theme song???
157,star trek seri much gay cant believ didnt pick child
158,caus lebron star player gm https:// twitter.com/dimeuproxx/sta tus/936370711878303744 …
159,"appar can’t rent star war prequel itunes, buy them?? bitch bare even want pay rent"
160,eili harbo star joachim trier' thelma. favourit actress? vote eili cinema scandinavia awards: https:// goo.gl/forms/eexqr7xu bmrhgxeq2 … pic.twitter.com/kn0a3f2if5
161,"listen @tonyatamanuik @npr , #freshair ....great god good. "" star spangl scammer,"" lollllllll. ""i continu fight truth, justice, american way!"" @comedycentr air @presidentshow season one final tonight, 10 pm, pleas watch laugh."
162,"so, still march era, deal star war defens system? also dress like madonna “like virgin.”"
163,love part cantina bazin get job - vivid descript star war underworld stick year read it.
164,"i’m play mario parti two, just grab star that’ next star liter ring fornt dk!! dangit mario party!!"
165,"awesome, ea stock took $3.1 billion hit follow star war battlefront 2 lootbox bullshit. well deserved!"
166,rather star lose team warm bench star
167,"guess count star guardian anim thing, pretti tight"
168,'makcik' arwind bulli school http://www. thestar.com.my/news/nation/20 17/12/01/makcik-arwind-was-bullied-in-school/ … pic.twitter.com/yi7amj3lsa
169,janna shock artist drug cultur http://www. thestar.com.my/news/nation/20 17/12/01/janna-shocked-at-artiste-drug-culture/ … pic.twitter.com/9nk98qnj8c
170,#lego advent calendar best! got star war one. https://www. instagram.com/p/bciywbwlsxc/
171,"rememb star trek episod call ""day dove,"" kirk crew along romulan mock malevol manipul entiti ship? ya think.... https:// twitter.com/gerardbrady100 /status/936036634331680768 …"
172,star (2017) https:// goo.gl/fb/swgtrp
173,kelli clarkson carpool karaok pretti awesome! -rob michael download star app: http:// starfm.com http:// fb.me/vvzjjpbg
174,star online: bn stick power-shar principl despit call detractor https:// goo.gl/fb/mh1bcf
175,"star online: mahathir, anwar moham implic bnm forex loss https:// goo.gl/fb/r2uqff"
176,star online: rais jail term gang rape https:// goo.gl/fb/jww9qa
177,check conclus star war battlefront ii campaign!!! https:// mixer.com/umbacon24?vod= 12244025 …
178,"yes!! tell friend row like “i’m bb8. seat, star war character”"
179,"santa, santa. hang star fuck chimney. santa. chestnut give slowli ringing! santa, santa!"
180,"star simmer brightli pond. ""whi follow me?"" littl fish asked, suspiciously. but, alway light jump by."
181,sokyo star fli fish?
182,eventu see beauti landscap big screen. disney go take us quit star tour!
183,man like get call “ star show” avelino saw
184,star room
185,like @youtub video http:// youtu.be/ucl9cpq54ac?a danger lightsab star war univers – star war explain
186,"good attempt star challenge, found one trickier one don't good way remov curs easily, otherwis 3rd curs get make extrem difficult"
187,'the last jedi' final bring hacker 'star wars' univers http:// ift.tt/2alhoxf #movi #film #cinema
188,"love geek bro reaction ""star wars: last jedi"" finaltrailer! experi as... http:// fb.me/sthyc5i9"
189,"ad video @youtub playlist http:// youtu.be/z62klurvul4?a zara larsson - mari know? (from "" star movie"") danc cover |"
190,"know, hope dream one day, one gloriou day hacker final brought star war universe...then happens. never stop dream guys, one day wake becom true. #thelastjedi #final https:// twitter.com/thr/status/936 370915780284416 …"
191,"watch chicken play star -spangl banner keyboard... it' late now, time sleep"
192,"star kiss sea, oil canvas,70/90cm #dorset @bridportart #bridport bridport artist michael devlin taylor pic.twitter.com/fkxubakwdi"
193,yo! fact.. finish star aguh link
194,"person look hawk litmu test surviv als, one either mean star power."
195,"star war world lack pretenti hipsters, got 'em! 4 refer one quot god"
196,orchestra promis star def best song they’r powerful.. friend stan snh i’m get vid watch realli stan?? omg send song like u want
197,buy bunch n use dildo star
198,"forev mood mr. matya yell ""hey lizzy!"" point star cowboy shirt"
199,feel alreadi star im upstair drive car swim sky leav earth everyon dont cri #astronaut #space #imagin #keepflyinghigh
200,"thank nevada star war launch bay magic moment today! got skip line meet kylo ren, much appreci long day!@wdwtoday #castcompli"
201,"star war audiobook great, immers experiences. recommend @chuckwendig aftermath book @audible_com highli"
202,current condit star weather camera look south. #tucson #azwx pic.twitter.com/cif2llqkzj
203,look sky! look sky! 見上げて star bright! star bright! 見付けた こんな夜は 素直に言えそうだよ
204,"christmas, luigi star ! pic.twitter.com/7tl1fydga6"
205,"oh star war univers way better... actual movies? sure, marvel better star war prequel trilog fuck ass."
206,"zara larsson - mari know? (from "" star movie"") | ginger sibs: http:// youtu.be/z62klurvul4?a via @youtub"
207,star #film wear #corset make look younger (and flat-chested) - http:// bit.ly/ndms4j pic.twitter.com/gwop3uvlgx
208,"@easport mew fight night coming? give us new one femal boxer included! peopl prefer ufc, seriously, keep ignor fans, you'll lose star war license!"
209,rais jail term gang rape http://www. thestar.com.my/news/nation/20 17/12/01/raised-jail-term-for-gang-rape-sentence-increased-from-five-days-to-10-years-for-three-boys/ … pic.twitter.com/dbeilmeq49
210,here’ thread star war franchis time rewatch review last jedi.
211,"mahathir, anwar moham implic bnm forex loss http://www. thestar.com.my/news/nation/20 17/12/01/rci-facts-were-concealed-mahathir-anwar-and-nor-mohamed-implicated-over-bnm-forex-losses/ … pic.twitter.com/iyxmogwqna"
212,'probe moham possibl cbt' http://www. thestar.com.my/news/nation/20 17/12/01/probe-nor-mohamed-for-possible-cbt/ … pic.twitter.com/9mqar3wa5n
213,bn opposit rep loggerhead report http://www. thestar.com.my/news/nation/20 17/12/01/bn-and-opposition-reps-at-loggerheads-over-report/ … pic.twitter.com/9qe3ydzi5i
214,come dwoht got star ? pic.twitter.com/rxwcaxodwj
215,debunk myth hiv/aid http://www. thestar.com.my/news/nation/20 17/12/01/debunking-myths-about-hivaids/ … pic.twitter.com/cmbniyg8yf
216,"utc boon people, say pm http://www. thestar.com.my/news/nation/20 17/12/01/utcs-a-boon-to-the-people-says-pm-centres-give-malaysians-convenient-way-to-access-government-servic/ … pic.twitter.com/kmubrms57"
217,najib: japan still play big role malaysia' growth http://www. thestar.com.my/news/nation/20 17/12/01/najib-japan-still-playing-big-role-in-malaysias-growth/ … pic.twitter.com/i9zmxqvgix
218,great wikipedia articl battl proper titl grammar star trek movi releas 2013
219,"star silent, (shoo-zoe)"
220,"featur curl genuin smile, arm wrap around slender frame. ""are jedi?"" chuckles. couldn't get star war jokes."
221,"liter scream top lungs, proceed lightli cri lead staff meet realiz don’t exam star wars: last jedi press screening."
222,#sandiego : i'm air @star941fm chanc win seat star 94.1 tabl special @mariolopezextra bingo dark @sycuancasino way around 3:20pm: http:// star941fm.com/listen #alltheragewithshelleywad pic.twitter.com/rkfjdj4yif
