0,@finnskata star @gamegrump dude
1349,rihanna superfan kept perfect record everyth star 2017 http:// ht.ly/6fp850fsn1w
1350,quit coincid @averagejoemoney 's mous stop work today' #sblive @emilyguybirken 's #cat star show. hmmm.. https://www. facebook.com/istackbenjamin s/videos/1632750040101839/?type=2&theat … #thursdaythought #stackingbenjamin
1351,star bethlehem . . . planet? http:// dlvr.it/q3gnj4 @ilreport 6 pic.twitter.com/tthbn73x8v
1352,"star maker say ain’t bad, dream maker’ gonna make mad, spaceman say “everybodi look down, it’ mind”"
1353,don't think anyon world go admit copyright holder star war holiday special.
1354,"dad ask get star christma tree. told i'm task this, star david. pleased."
1355,"star movie, hero book wind behind sail life. lori moreno #success #leadership #wealth #love #quot #leadership #success #quot #lorimoreno"
1356,‘morn mirror’ joe miller. amazing- got tix? @eleanorheydon get desp everi minut mull vino @arabellaneal can’t wait decor star king @olivia_elsden hungri watch guy might burst. https:// billetto.co.uk/e/jukebox-club -can-t-even-handle-me-tickets-224874 … pic.twitter.com/0kfvbory7f
1357,drive time star station 95.7fm benin know mr mac #bronzec #lastdayofnovember2017 #ebsradio#bless @freshbossmac @jausman
1358,rihanna superfan kept perfect record everyth star 2017 https:// goo.gl/fb/st9s5m
1359,"us grave site mark row upon row crosses. ""star david!"" that' alleg ""hero's"" call ""veteran [foreign] wars."" #vfw nation and/or state ever attack usa except israel 1967. plu fbi behind domest terrorism. https:// twitter.com/ian56789/statu s/936288307012612096 …"
1360,"misachan – dish serv harvest season star palestinian kitchen, also base first oliv oil season. bed pita soak oliv oil top fri onions, roast chicken, sumac crispi roast almond pine kernels. #arabicfood pic.twitter.com/7qwjlxa2ho"
1361,musingsfortheday: cassian andor one underr charact star wars... https:// tmblr.co/ztqxzx2swykyb
1362,let forget star show hugo. thankyou help patient freez weather morn pic.twitter.com/exakebaag2
1363,sheffield terror arrests: polic abl reveal natur suspect terror plot - star http:// ref.gl/oox3olcg
1364,มันยากมาหที่จะมองดาวละคิดถึงใครคนหนึ่ง แต่เมื่อคุณเป็นภาวะนั่นคุณจะรู้ว่า เขาคือดาวที่คุณมอง และรู้ว่า เขาคือ พรที่คุณร้องขอให้เขา มีแสงสว่างลอบตัวเขา #thestar
1365,@jayeshgroup star perform award export western region 2015-16 @eepcindia @dgftindia pic.twitter.com/9kdib0yuuo
1366,mariah carey - star http:// rdo.to/ikjz #toronto #ohio #gospel #chh @mariahcarey
1367,star fox panel super famicon play e3 star fox zero puppet clip. everyon super sad
1368,watch star war christma special year
1369,"come meet jake, star pet + magazin decemb 16th @henri bendel https://www. instagram.com/p/bcimy1jg_zi/"
1370,"now, podcasting! episod 204 - star war battlefront ii release, star tour ii, more! | make star war http:// bit.ly/2isfwbp #starwar #thelastjedi #porg"
1371,"jabba hut cutest charact star war univers life simulation, creat earth never visit extraterrestri planet mbdtf 10"
1372,hurt star .
1373,star program includ 154+ lessons. video exampl lesson includ star media center! click preview hand wash lesson today. --> http:// bit.ly/2adagen pic.twitter.com/l4v1g9sxf8
1374,"@hillspet repres present $10,000 donat prize ch video entri hill' shelter tale adopt stori contest! kira, star adopt story, visit mom! pic.twitter.com/61qzqoekkj"
1375,mark liebowitz.... star mad max films.... thank pippa!
1376,made cameo pantomim earlier year. one best charact stone caterpillar. understand why. caterpillar alway star !
1377,star first mayor dncc . nice soul http:// fb.me/mfsgtrdq
1378,"justin timberlak stephen colbert tackl ' star -spangl banner,' talk super bowl performance: watch http:// ift.tt/2jzmqyc"
1379,"think it’ d-leagu competit much higher college. obvious best colleg player would well, that’ it. would probabl hurt draft positions. also, star colleg athlet lifestyl hard pass lot."
1380,fader http:// ift.tt/q3ihrj rihanna superfan kept perfect record everyth star 2017#hoodrichdailynew pic.twitter.com/g5cqz7luh1
1381,"justin timberlak stephen colbert tackl ' star -spangl banner,' talk super bowl performance: watch http:// ift.tt/2jzmqyc"
1382,ive said sinc forc awaken came out. would star war franchis realli make easi guess?!?
1383,"star maker say ain't bad, dream maker' gonna make mad, spaceman say everybodi look down, it' mind https:// twitter.com/carolscoooki /status/936113848913989632 …"
1384,#deadisdead south korea japan - nk re: save shore & china help seattl becom easi target fat boy concern guy name lauer mayb melania help oh note liveri stock holder star wit stock fraud
1385,beatl live star club 9/29 - tast honey http://www. youtube.com/watch?v=nl3ro4 xak98&feature=rel …
1386,"soni pictur anim estrena « star », una nueva película navideña para disfrutar en familia http:// expolit.com/sony-pictures- animation-estrena-star-una-nueva-pelicula-navidena-para-disfrutar-en-familia/ …"
1387,"justin timberlak stephen colbert tackl ' star -spangl banner,' talk super bowl performance: watch http:// bit.ly/2jbxo1k"
1388,"that' great thing hope & same, nope. right winger freak & don't understand white social construct. presid releas statement, sg presid ask star defunded. it' much lol"
1389,snow today nippl look like star war prequel
1390,"justin timberlak stephen colbert tackl ' star -spangl banner,' talk super bowl performance: watch https://www. billboard.com/articles/news/ 8054578/justin-timberlake-stephen-colbert-star-spangled-bann …"
1391,"empir magazine' star war 40th anniversari issu ton interview cast crew ""moment-by-mo guid star war holiday special. (seriously.)"" pic.twitter.com/a2jmkjnkzj"
1392,"@traceadkin great event last night america salut wall street rocks, great meet , thank host rendit star bangl banner!! pic.twitter.com/72mcblmpu4"
1393,@rihanna superfan kept perfect record everyth star 2017. http://www. thefader.com/2017/11/30/rih anna-fan-account-everything-she-did-in-2017?utm_source=tftw … pic.twitter.com/mhypesingu
1394,start get togeth quit librari thank gener friend famili shall soon move new home star room @nhsharlow via @sisterbridg pic.twitter.com/uzgj4ogwhj
1395,58 fact probabl didn't know star war movi https://www. buzzfeed.com/awesomer/fact -you-probably-didnt-know-about-the-star-wars-movies?utm_term=.uynzpj7jvk#.uynzpj7jvk …
1396,star war show netflix good wtf lol
1397,rihanna superfan kept perfect record everyth star 2017 http:// ift.tt/2jzhg0h
1398,also find lot star trek stuff littl dull .... i'd rather watch buck rodger 25th century. pic.twitter.com/nlhtsdzqbj
1399,total got star -space-celesti vibe want it’ good i’m glad you’r back new music :^)
1400,"new record set vuillaum violin own eugèn ysaÿe strad 29 november, french auction hous vichi enchèr held sale 127 lot belong lead french bow maker bernard millant, die earlier year. star perform violin made j.… pic.twitter.com/jzmszofedo"
1401,you. amazing. great. beautiful. live life. fun. wonder. star dark night. sun people. believ yourself. love yourself. greatest human you. don't give up.
1402,. @angelpark fan shortli i'm go interview star new seri @runaway ! tweet catherin wilder questions! #runaway
1403,"@bexmad last day i'v feel alone, know i'm not, you'r alway heart thank you, star illumin life pic.twitter.com/snnthmsy3o"
1404,"2018 convent book @joshgrel underway! star attack titan, yuri ice, devil part-timer, psycho-pass, etc. appear convent event, contact us booking@epochtalent.com pic.twitter.com/19xuhy8usb"
1405,"agree. best they’v on. fact, year’ good. eb star !"
1406,i'v never seen star war movi plan chang that. https:// twitter.com/kivabay/statu /936247828195680257 …
1407,attend princ trust respons busi meet #thestar #gi morn pic.twitter.com/dq2lolgjfo
1408,[new}: chao line - episod #90 - star ! https:// buff.ly/2ahy8wf pic.twitter.com/7s5loakcz
1409,"malaysia, thailand indonesia restrict rubber export - star onlin http:// dlvr.it/q3ghsq"
1410,"feel bad dice battlefront mess. game actual crazi fun, star card aren't half bad everyon claim are. (progress still sucks, gamebreaking.) you'll never hear angri echo chamber though."
1411,"""...at last noth els cloth wear littl bit bread hand charit soul given her. was, however, good pious."" ' star money' http:// bit.ly/2zlkcxv #folklorethursday #folktal #grimm"
1412,star > video give new promin charg libyan slave trade http:// ow.ly/5sdw50fsmxn
1413,"i’m look forward immensely. can’t imagin long open credit go be, though, sort star billing!"
1414,earli impress star war battlefront2 beta. number site felt call game came :) https:// elderlygoose.wordpress.com/2017/10/07/sta r-wars-battlefront-2-multiplayer-beta-exp-ops/ … https:// twitter.com/britishgaming/ status/935907232587370496 …
1415,battlefront 2 stori mode connect star war univers - stori explain #rogueon http:// youtu.be/rh8giz7ads
1416,check idea make littl artist-in-resid star home art show! http:// bit.ly/2aqd8si #kidscraft pic.twitter.com/dqcgrgomhw
1417,us regul say silicon valley threat internet - star onlin http:// bit.ly/2inretv
1418,"listen think balor, although good wrestler, he’ star everyon think is. https:// twitter.com/shootstylepod/ status/936285190133026816 …"
1419,read star -telegram stori yesterday?
1420,justin timberlak & stephen colbert tackl ' star -spangl banner' http:// ihe.art/ati4prg
1421,mayb star line brought back hyperloop: https:// en.m.wikipedia.org/wiki/suburban_ transit_access_rout …
1422,recov horror woman pretend queef star spangl banner mic la soiré tuesday.
1423,star tree
1424,"rev green look like star whimsic sunday even light drama bbc1, solv crime local commun well tend flock."
1425,"""the bigger star , bigger target"" - mj"
1426,yes! ma! @jlo jennif lopez becom star guess' newest campaign http:// dailym.ai/2bi33ug via @femail
1427,"daisi ridley star rey 'star wars: last jedi.' - wall street journal wall street journal daisi ridley star rey 'star wars: last jedi.' wall street journal eighth episod star war saga, “the last jedi,” open dec. 14.… http:// news.google.com/news/url?sa=t& fd=r&ct2=us&usg=afqjcned_-hjrnc8wlw-45f20vfhlqcdtq&clid=c3a7d30bb8a4878e06b80cf16b898331&cid=52779698085269&ei=sd4gwqiqm9hp3agjsqaydw&url=https://www.wsj.com/articles/the-unauthorized-guide-to-star-wars-the-last-jedi-1512061701 …"
1428,"must mad ""fan"" damn near mani follow twitter star believ make sure flip burger central degre next 10yr"
1429,"tonight flame buoy filet co.: star war crawl special •appet trio (lobster mac & cheese,... http:// fb.me/dyc2go6"
1430,"sorry, @emilyguybirken @averagejoemoney ...a fabul interview is, #cat star today' show https://www. facebook.com/istackbenjamin s/videos/vb.544974925546028/1632750040101839/?type=2&theat … #thursdaythought #stackingbenjamin #sblive pic.twitter.com/awwdicstti"
1431,"bummer, feel like i’v wait (world series) bam it’ over. hey opinion would make difference, suggestion. get rid star empire. time star empir rush chill i’v got star rush."
1432,star frisco 7
1433,it' easi forget even star war real life *awesome* h/t
1434,"tomorrow fli sweden play weebl music e-sport event, get back i'm gonna talk someon record music. i'm get suit boot star war premiere. also appar it' christma soon."
1435,@mrmoon1000 @dimitrisphoto @tehjamjar guy tri make vr content! https:// mindshow.com / star trek vr amaz fun watch - thank guy give us fan amaz experi share
1436,veggietal - star christma (vhs) anim https://www. ebay.com/itm/1828870868 12?roken=cugayn&soutkn=gp5hoa … via @ebay
1437,hear jar jar bink return star war movi pic.twitter.com/uxdhpuwuuz
1438,rememb star someone' life.
1439,"thought could champion unless facil call "" star "" frisco? #cowboy pic.twitter.com/7htlmjizht"
1440,"trump tweets, support slip lies. -- apolog lucas, fisher, star war franchise."
1441,"daisi ridley star rey 'star wars: last jedi.' - wall street journal wall street journal daisi ridley star rey 'star wars: last jedi.' wall street journal eighth episod star war saga, “the last jedi,” open dec. 14.… http:// news.google.com/news/url?sa=t& fd=r&ct2=us&usg=afqjcned_-hjrnc8wlw-45f20vfhlqcdtq&clid=c3a7d30bb8a4878e06b80cf16b898331&cid=52779698085269&ei=wj4gwui2gsgb3wgewpqqca&url=https://www.wsj.com/articles/the-unauthorized-guide-to-star-wars-the-last-jedi-1512061701 …"
1442,"can’t stand big mouth bitch! she’ alway talk everyone, attent whore! miss tamar star show! alway tri get clap audience!"
1443,fli star (anoth infin feat. mayumi morinaga):そこはかとなくアメリカっぽさを感じるハンズアップだ、リズムがわかりやすいので指慣らしにちょうどいいな prim http://www. nicovideo.jp/watch/sm189428 20 …
1444,i'll hungov somewher chief!! i'll pull time next week. nice stock besid star war cap nba merch
1445,"stoke trip cup final swansea, say clement http://www. thestar.com.my/sport/footbal /2017/12/01/stoke-trip-is-a-cup-final-for-swansea-says-clement/ … pic.twitter.com/ccw8qt0ypc"
1446,"rihanna: 'transgend peopl aren't market tool' star say transgend peopl shouldn't use ""conveni market tool"" advertisers. http://www. bbc.co.uk/news/entertain ment-arts-42172172 …"
1447,past sat got see @jess_m_thompson new #indiefilm @tlotmfilm . it! also got meet & talk star #film @iamstephbeatz . cool & nice! @lfabry93 . pic.twitter.com/vdgs6a4yco
1448,hmmm small indi platform call war battlefront star 2
1449,#malaysia sustain technolog innovation: recognis achiev #sme | @staronlin https://www. thestar.com.my/metro/metro-n ws/2017/11/30/recognising-achievements-of-smes-108-businesses-striving-for-excellence-throughout-the-year-get-asso/ …
1450,"i'm readi fun day ""buddi elf"" mode wrap/mail gift famili get star war christma tree out! pic.twitter.com/oqerfdpb5d"
1451,boss forgotten star candid #bjp
1452,updat pick hide tran ban great guest alreadi line delight hilari convers ! watch star ?
1453,@null rihanna: 'transgend peopl aren't market tool' star say transgend http://www. bbc.co.uk/news/entertain ment-arts-42172172 …
1454,buy boyfriend ticket go see star war premiere. boy better cry.
1455,celebr holiday star ! cowboy christma star give fan opportun enjoy free... http:// fb.me/40xw4zy00
1456,"j'aim une vidéo @youtub : ""if star war movi made ea"" à l'adress http:// youtu.be/d61w869szjw?a ."
1457,"mayb someon stori privat live star telegram wapo employees, see like it. https:// twitter.com/startelegram/ tatus/936039828872773632 …"
1458,problem peopl everybodi want star .. nobodi want work behind scene still reap type benefits!
1459,"i’v got weird thing don’t like someth i’ll end like later? star war movi & taylor swift’ new album prime exampl this. thought mediocre, find want see new movi & sing song head."
1460,mariah carey star \ http://www. 10nd.in/2017/11/mariah -carey-the-star/ … pic.twitter.com/veahl733l
1461,up: citi cullman christma tree 2017 citi cullman christma tree fulli place depot park. year' tree 44 feet tip star ground. 6 feet taller 2016 version (thi new height record). pic.twitter.com/qgjevb85so
1462,"star convers loud, hold forth authoritatively, first thought professor give lectur hallway."
1463,look star tomorrow @12pm grand open https://www. instagram.com/p/bcikeeknqy3/
1464,ami idea star wishes.
1465,star (origin motion pictur #soundtrack ) - variou artist http:// dlvr.it/q3gb4j
1466,highli rec star trek ds9 quark' worker union worf figur live situation.
1467,u wanna feel like star 2000 teen movi listen @spotifi tbt playlist. ur welcom
1468,"yesterday saw star @zacharylevi , today @psych_usa movi day well! never much zac!"
1469,love star . #kuker https://www. pscp.tv/w/bo7imtfkdktp wlhmufpauvh8mu95s0fkqw1hwkx4yhqxet-d9e6lz6hwq3idaszdsmmou3qh4uf5wuzdyqcw …
1470,dragon ball offic reach star war prequel level shit write ad midichlorian back tingl narr super saiyan exist. https:// twitter.com/herms98/statu /936097133731627008 …
1471,play star mariah carey !
1472,finish star war - return jedi film? mark complet http:// canonkillerbase.com #starwarscanon
1473,view star war battlefront ii updat 1.04 patch note http:// ift.tt/2bzzprw
1474,think worst superior complex star war universe?
1475,"#signsyourearealadult spend 10 minut decid whether buy star war pajama bottom plaid pajama bottoms, weigh argument wonder neighbor think wear take trash take dog bathroom"
1476,hodgson warn return dark day crowd troubl http://www. thestar.com.my/sport/footbal /2017/12/01/hodgson-warns-against-return-to-dark-days-of-crowd-trouble/ … pic.twitter.com/os9ccia5g3
1477,"question human race hasn't collaps it' stupidity. also, keep use star war hashtag?"
1478,ye back star wars/zelda/and even mario inspir name
1479,chanc we'll candlenight miracl meet greet? wish upon star king? @justinmcelroy @griffinmcelroy @travismcelroy
1480,like @youtub video http:// youtu.be/nookkjcshus?a star war battlefront 2 problem | everi right angry?
1481,"minseok: need put star tree baekhyun: well, get there. you'r star minseok: baekhyun jongdae: go on!! get there!! minseok: jongda"
1482,นี่อยากให้หน้ากากช้างดำ เจอกะ หน้ากากมงกุฏเพชร รอบไฟนอล จีๆ star star #themasksinger3
1483,account star abdul qadir shahrani comedi creativ twitter: @qedoo insta http:// instagram.com/qedoooo : snape: http:// snapchat.com/add/qedoooo support account @damqad admin account: @gegoi_23 #thursdaythought
1484,star destin be! don't let anyon stop you! pic.twitter.com/he36wvxjay
1485,#tbt star cutter team front old detroit plant #cuttingtool #toolgrind #starhistori #star90 pic.twitter.com/bjvpp0cdlw
1486,yasmine' piec star war desert rave tunisia one favorites. rip. http:// projects.aljazeera.com/2015/02/star-w ars-tunisia/ … https:// twitter.com/paulxharris/st atus/936274379054485506 …
1487,"gold trader reza zarrab said recep erdogan, turkey' president, direct two turkish bank move iranian cash. zarrab star wit trial banker accus move iranian money u.s. bank beat sanctions. http://www. nbcnews.com/news/us-news/w itness-says-turkey-s-erdogan-ordered-movement-iranian-cash-n825271 …"
1488,přidal(a) jsem seznamu videí @youtub video http:// youtu.be/d61w869szjw?a star war movi made ea
1489,account star abdul qadir shahrani comedi creativ twitter: @qedoo insta http:// instagram.com/qedoooo : snape: http:// snapchat.com/add/qedoooo support account @damqad admin account: @gegoi_23
1490,retweet : news wagonmast : look star chamber old grand wagon go becom star #jeep_grand_wagon #jeep #wagoneerlif #wagoneergirl #91grandwagon #jpfreek #the_grand_waggi #vineyardvin https://www. instagram.com/p/bar-f2ol0pp/ ?utm_source=sociallymap&utm_medium=sociallymap&utm_campaign=sociallymap … pic.twitter.com/v4ucnda2gu
1491,"@staronlin salam 1msia. want pandikar,amin drop dewan rakyat speaker. join opposit want to!"
1492,actual women know sick this. join twitter voic opinion. media turn star magazin mentality.
1493,miami' wynwood district home star war obsess @jwakefieldb https:// trib.al/xiwwypp pic.twitter.com/6wbq3ryqzz
1494,star filter >>> pic.twitter.com/xawy1khsux
1495,great advic one greatest ever wear star !! @dallascowboy let’ get w tonight!! https:// twitter.com/sportsbull/sta tus/936055392647417856 …
1496,movi night underway nati rowbottom star film join us evening! thank gibraltar nation archives! #heritage#events#gibraltar pic.twitter.com/jcggasodha
1497,"line star war premiere, son"
1498,"don’t think star movi sneak in. you’v said it, i’m definit come you. backsies."
1499,"inde true import outfit- woman wear it. alway star show, clothes. http:// istylebynatalie.com #women #entrepreneur #style #fashion #personalstylist pic.twitter.com/m1vtwbsaib"
1500,"lol think person take instastori legit doesn't know who' star . hear ladi say ""who' it?"" cantones https:// twitter.com/gagadoli/statu s/936278342663266304 …"
1501,star gone
1502,hi it' bev littl say http:// day.you star movi kind movi be? think it. ciao bev
1503,like @youtub video http:// youtu.be/ryohdo8zu-0?a star war holiday special - hilarioc review
1504,"think substanti amount evid public guy accus sinc ailes. concern star chamber colleg age men face without proof even know accusers. anything, may make liber revers that."
1505,"@torontostar 3 christma tree lobby? sure mean non-specific, non-denominational, inoffens random shrubbery. can't imagin star ever anyth promot christianity, howev tepidly."
1506,huge eye sore star war franchise. ea realli squander license. would love see go publish http://www. gamerevolution.com/news/358057-ea -loses-3-billion-stock-value-battlefront-2-debacl …
1507,hey @twitterbusi ! reason star war movi premier place decemb 1 decemb 15?
1508,basketbal back! 6 game week' star.. http://www. thecolumbiastar.com/current/sport ...and plenti pic https:// columbiastarsports.photoshelter.com/arch ! #local #thestar #highschoolsport pic.twitter.com/9o9iuujie
1509,doctor could visit star trek univers it’ anywher anywhen nature. vice vers
1510,"don’t worry, put collect star war film vault deep underground. there’ nuclear attack, star war live on."
1511,star talk want go 34 next month. shouldn’t carri load guy offens can’t run lebron ground cover defens gaps.
1512,love star !!! love muy cowboys!!! #cowboysn pic.twitter.com/hdkt0hjsvc
1513,suppos buy triangl step 4 separ haven’t got mean star fall pic.twitter.com/3ljjpe96kp
1514,"exclus interview | ranini, spoke #hazalkaya star #bizimhikay . soon ^_^ #zorgünler قريبا مقابلة... http:// fb.me/8tunsccek"
1515,ถ้าไม่รักกัน ฉันจะไป - นท star 7 (offici mv) hd https:// youtu.be/lq2ldhoijhi via @youtub
1516,everton hat-trick hero star man yahoo! fantasi footbal xi http:// ift.tt/2jykmsa
1517,"apart thor old man logan, star war titl probabl marvel' strongest right now. seem rapidli gone downhil sinc fraction, remender, hickman other left."
1518,mad winter edit - star farewel https:// twitter.com/yahngoe/statu /936272941368651776 …
1519,love hear @kellyripa say star @willandgrac @debramess im happi show return
1520,"join sirius, @nutanix @cohes portland, 12/14 learn cloud-en infrastructur first wit star war movi premiere! register: http:// bit.ly/2bzwt8k pic.twitter.com/ectgx8onmc"
1521,kylo' command shuttl pretti evil omin look too. also big fan star destroyer.
1522,#tbt give star war fan everything...?! definit won't buy second-hand vintag r2d2 collection! #vintagetoy #starwar #r2d2 #crazymedicalsuppli pic.twitter.com/akp4czhek
1523,tweet following: it' easi make tasti & versatil canadian turkey star holiday season celebr - visit @cdn_turkey recip inspir prep tip need! #turkeytradit https:// oldermommystillyummy.com/2017/11/turkey -falafel-bites-appetizer.html …
1524,origin seri best incident music star treks.
1525,@parademagazin : 10 gift star war obsess fan life http:// ow.ly/w6lx50fsl0k
1526,"saturday, decemb 2nd, 10:30am, select cineplex theatr show sensori friendli screen star . make sure get tickets! https://www. cineplex.com/theatres/senso ryfriendli … #sensoryfriendli #autism #asd #asdcommun #autismottawa #ottawa #ottkid #ott pic.twitter.com/xg4tishbud"
1527,"shot star blaster, one voidfish, shot griffin. oh guess that' 3 4"
1528,tbt: isn't scene star war movies. pictur taken last fundrais benefit... http:// fb.me/bzmqelsp
1529,"estreia: estrela de belém ( star , 2017) eua, 86 min. dir: timothi reckart. rot: carlo kotkin. voze de:... http:// fb.me/78knz5g0o"
1530,call thread: garrison keillor' e-mail star trib make feel nauseou
1531,"i’v seen mani time couldn’t possibl count. fli over, read newspap differ place - i’v certainli seen nyt, wapo, chronicle, la times, star others."
1532,"wisemen follow star , way follow heart"
1533,"case yes, though usual ""star ""- (bono?) get far arse. other (springsteen?), hand, maintain respect."
1534,wish could back vietnam see star war promot there. chuc mung viet nam! https://www. instagram.com/p/bcgschel7bo/ ?taken-by=kellymarietran …
1535,"lol realiz moon doesn't proper name. mani moon ""the moon"". peculiar lack consistency. guess work tho. hi, i'm human planet awaken star rises."
1536,yasssss! can’t wait steal ur camera star ur first vlogma
1537,met star knight rider cool
1538,"star ocean 4 remast ps4 featur pc' qualiti set menu. it' tweakabl consol game ps4, good thing? http://www. eurogamer.net/articles/digit alfoundry-2017-star-ocean-4-has-all-of-pcs-set … pic.twitter.com/aovmkenee5"
1539,"happi birthday, queen, hope absolut best day ever surround love. continu star bring viewer real joy everyday. love #happybirthday #yr pic.twitter.com/pwamqmdmkg"
1540,"well kati mani real achiev belt. bigger star , bigger target -michael jackson."
1541,#footbal ― everton hat-trick hero star man yahoo! fantasi footbal xi http:// dlvr.it/q3grjt → via http:// betbitcoin.trad √
1542,got @joe_mussatto mad? find listen latest @seccountryuk podcast. @kyletucker_sec & also joe star . https:// itunes.apple.com/us/podcast/ken tucky-wildcats-sec-country/id1219422551?mt=2#episodeguid=tag%3asoundcloud%2c2010%3atracks%2f362798570 … pic.twitter.com/4p8xoblavz
1543,"understand it, name infring star war tm china. china doesn't enforce. it' pecular chines language."
1544,ever consid movi star would about? arlan speaker @kevinrempel has. read find think star show... #wellb http://www. arlangroup.com/news-updates/g et-know-kevin-rempel/ …
