0,need somebodi go see wish upon
1,"""somewher rainbow... wish upon star..."""
2,like @youtub video http:// youtu.be/m8mqflxdvcc?a moist meter: wish upon
3,enter chanc #win $500 gift card. dare you. @wishuponmovi theater juli 14. http:// ul.ink/7rfe-485hmp_twt
4,": hatred... think don't stand now, when? tomorrow? keep watch & wish upon star? wonder?"
5,need go see wish upon love movi like
6,wish upon dead ? yup... say you'll get wish
7,"wish upon : fuck, like tortur sit through. everi part film awful. even close scary. embarrassing. verdict: f pic.twitter.com/zej7pfqag0"
8,take girl movies! #wishupon pic.twitter.com/khrau9yqj1
9,enter chanc #win $500 gift card. dare you. @wishuponmovi theater juli 14. http:// ul.ink/7rfe-485g76_twt
10,i'v enter giveaway @flickeringmyth win wish upon poster t-shirt. enter https:// goo.gl/krruop
11,never heard
12,@nyxfear wish upon ....thi i'v stop go film theaters. possibl audienc devolv garbag eat tard
13,pleas prove atheist creation myth?
14,muddi water can't prove claim
15,hope good wash littl role play session
16,◆全米デイリーtop10 [7/26] [順] 10位 [題] wish upon broad green pictur #boxoffic #映画 pic.twitter.com/czr6lhv4vb
17,estou assistindo wish upon (2017) https:// trakt.tv/movies/wish-up on-2017 … #trakt
18,"quit plagiarizing, i'm dean esmay."
19,evid god say reject claim
20,saw credit scene wish upon clean theater far it' funniest comedi 2017.
21,sogar tomorrowland war besser al wish upon .
22,"no, i'm dean esmay"
23,"omg!!! wish upon shock movi , much scari"
24,#pẻide . . #blood #prayer #wishupon #wednesdaywisdom
25,"you'r good claim are, perhap read work'll convinc repent join you!"
26,enter chanc #win $500 gift card. dare you. @wishuponmovi theater juli 14. http:// ul.ink/7rfe-485eyr_twt
27,want know publisher' name books' titl isn't attempt doxxing; it' sincer interest.
28,real fraud atheist thread argu reject god claim deni god exists. #atheistclown
29,"know authors, none hide material."
30,nuevo poster de wish upon pic.twitter.com/v0vr6chgfo
31,"you'r american, right eve? univers professor?"
32,"clear, no-on interest dox you. feel it' import you'r expos fraud are."
33,"said, i'm max, dean esmay."
34,"told i'm wrong, sent reword i'd written."
35,"argu everything, even agree?"
36,enter scott bloviat - stage left
37,"abruptli shift one' default expect due somewhat misled—and absurd, unexpect outcome. that' basi humour."
38,check collection.
39,"saw red turtl ago - beautiful. realli children, that' must-see."
40,art worn spec nice touch
41,hahahaha. elect night one funniest thing i’v seen years.
42,atheist empathy.
43,won't regret it.
44,"won't, can't. like say, wouldn't love prove wrong? embarrass me? front people?"
45,"note that’ one specif item information, like publisher."
46,"like said, you'r either fake account one sad littl troll, you'r collect even sadder minion trolls."
47,"oh, i’m sorry, didn’t realiz ask dox information. cost $10,000. here’ patreon: https://www. patreon.com/evekeneinan"
48,"wanna go movi see dunkirk wish upon , anyon wanna go tonight tomorrow?"
49,"i'm gener indiffer - although whole find pretti vile obnoxious. easili prove credentials,"
50,"don't dislik you, i'v littl interact max person."
51,tell us faculti on. take thete
52,mean non-cartoon—in case that' clear.
53,post recent photo yourself?
54,none. may independ individual—but i'm sceptical.
55,"ha! you'v trap web lies, haven't you?"
56,ah yes. boy film students. known
57,that' gone head. i'll look
58,all-know can't anyth know occur.
59,"enjoy it, likely, good think thing new way. tri it."
60,joke don’t “dupe” anyone. abruptli shift one default expectations.
61,"indeed. omnisci would worst curse, cancel omnipotence."
62,"realiz like say comedian don’t sens humor know joke already, right?"
63,"speculating—and stupidly, sinc i’m obvious max—with foundat dislik us."
64,"“evidence,” right? what’ evid i’m sock account max kolbe?"
65,also exactli someon charg fals bunch liar evid would say.
66,"dare follow dreams, wish upon star way hospit radio3 tune want hear @patientsradio"
67,i'm guess you'v seen frozen four-hundr time then? week alone.
68,évidemment.
69,"sure didn't. i'd embarrass this, honest. https:// youtu.be/82syhydzhfw"
70,daughter well.
71,"prefer studio ghibli, forc make exception."
72,"thing is, omnisci can't experi this. lighter would disingenuous—and don't think god either."
73,psycholog humour' fascinating.
74,enter chanc #win $500 gift card. dare you. @wishuponmovi theater juli 14. http:// ul.ink/7rfe-485bb8_twt
75,"we'r either laugh we'r enjoy see other tricked, get it."
76,"there' easi way prove wrong - manner, sure you'd take great delight take peg two?"
77,"we'r enjoy joke second, third, fourth time, we'r recal moment tricked."
78,enter chanc #win $500 gift card. dare you. @wishuponmovi theater juli 14. http:// ul.ink/7rfe-485bgm_twt
79,"i'm sure enjoy somewhat dupe (a everi joke), love it."
80,"humour, similar anger, involv expect dashed. absurd piss us (anger) pleas us (humour)."
81,omnisci can't sens humour.
82,"ha! thank you, didn’t even know existed."
83,"that' gener point someon say someth ""established"". anoth wast tweet without address subject hand."
84,"wish upon aw movie, wouldn't recommend"
85,that' exactli sad littl troll call creat numer fake account would say.
86,@escapingath @maxkolbegroup group accounts. may may max talking. aren’t sock accounts.
87,son still dvd
88,wish upon frustrat movi i'v ever watched. even scari still 10/10
89,unfortun don't excuse.
90,resembl remark.
91,"however, escap atheism project max kolb group are, fact, groups."
92,emoji movi atom blond wish upon movi get seen today?
93,"it’ “established” max = dean, never deni it, nitwit."
94,pretti useless philosoph outwit
95,book amazon doesn't seem troubl scorer subject ever
96,block month ago.
97,"don't tell that, she'll freak out, claim you'r troll block you."
98,too. daughter
99,look up. public list faculti - professor
100,"think that, regardless guidance, he' bound bomb stage bad here."
101,깨우지 말아줄래? - wish upon shoot star (hard) 88.60 % #deemo http:// bit.ly/1c4xfmt
102,one suppos best. wish upon star !!!!!! http:// fb.me/1ureraxmc
103,have... reasons...
104,enter chanc #win $500 gift card. dare you. @wishuponmovi theater juli 14. http:// ul.ink/7rfe-4859nj_twt
105,saw ' wish upon '
106,sometim it' like they'r even trying. can't read herself? it' almost like doesn't exist... pic.twitter.com/ohi8k4qxmf
107,let keep trying; one day may come close cleverness.
108,@onequestn —you never tell.
109,anesthetists.
110,"cours not, think sport don't exist. silli really."
111,""" wish upon "" taught extra care made wish."
112,"queria muito ver film "" wish upon "" garten!!! ma parec que ninguém mai gosta de film de terror, porra"
113,appar tom respect athlet
114,spelt sammich
115,aesthetes.
116,#estreno ::: #7deseo ( #wishupon ). http://www. cineymas.com.ar/2017/07/7-des os-wish-upon/ … pic.twitter.com/m9vl3e23jl
117,"wish upon star, princess walk bus! #amaz pic.twitter.com/hlzgzojktj"
118,wish upon would'v mediocr movi didn't kill dog first 30 minut
119,frozen reference...
120,even finish other's... sandwiches.
121,tem um chamado wish upon que eu nem sei se é bom e em breve sai (não que vc foss assistir ess comigo lmao)
122,enter chanc #win $500 gift card. dare you. @wishuponmovi theater juli 14. http:// ul.ink/7rfe-48574m_twt
123,movi wish upon pic.twitter.com/wtwivcuzli
124,#trailer ::: #7deseo ( #wishupon ). https:// youtu.be/httgwpscngq
125,clever??!
126,got see wish upon 2 time cool scari love much hope get d.v.d
127,wish upon ... darn...
128,wish upon star acn spot & scar gone... went! wish come true http:// etsy.me/2v2eibb
129,"bin noch ein bisschen fertig mit den nerven, wegen ' wish upon '."
130,enter chanc #win $500 gift card. dare you. @wishuponmovi theater juli 14. http:// ul.ink/7rfe-4855cy_twt
131,i'v alway like wish upon crescent moon pic.twitter.com/fvvag0g12l
132,like @youtub video http:// youtu.be/4zgr8hslh-u?a wish upon hottest garbag
133,"seem strang act same, use argument alway seem freak shit."
134,"base wish upon pike https:// mikerushistory.wordpress.com/2017/03/13/wh n-you-wish-upon-a-pike/ … btw, 17 rub (probabl usd, actually) ~3 days' avg pay ussr back"
135,there' sport can't respond kind. they'r fight wit impot rage.
136,everi wish upon star goe unansw dark dream i’v dreamt https:// open.spotify.com/track/4orzuuh mvqcacqch379vf … #nowplay
137,enter chanc #win $500 gift card. dare you. @wishuponmovi theater juli 14. http:// ul.ink/7rfe-4853py_twt
138,pornstar like big / briana bank – wish upon pornstar http://www. youporner.eu/pornstars-lik -it-big-briana-banks-wish-upon-a-pornstar/ … pic.twitter.com/8ssme34woj
139,"look like today, again, won't day final compos clever troll tweet. keep trying!"
140,"attempt clever troll make us cring feel compass you, tim."
141,bf1 ctme? wish upon tsar! *live now* http:// twitch.tv/mambo_b pic.twitter.com/ecyttdwlva
142,psychopathi troll fascin me.
143,"late, wish upon actual good movie. better expected."
144,"agree. dedic much time energi hurt other strange, clearli pathological."
145,wish upon actual look like good scari movi
146,say athlet believ sport don't exist?
147,enter chanc #win $500 gift card. dare you. @wishuponmovi theater juli 14. http:// ul.ink/7rfe-485280_twt
148,finna go see wish upon
149,"look, athlet atheists? chang mind day day, know? tomorrow athenians?"
150,wish upon star
151,"so, feel you, even though—du psychopathi (if it' true emotions)—y don't give fuck feel."
152,"hmm, you'r one stick stone types, eh? serious devoid emotion?"
153,ha gustado un vídeo de @youtub ( http:// youtu.be/jbsjnwquoa8?a - wish upon star - pinocchio [piano tutorial] (synthesia) //
154,care wish upon ~ wish upon (movie) https:// twitter.com/lori_am_stizzi /status/890665600703283200 …
155,"ah yes, get wrong—you go athlet yesterday. you'r fuck hilarious."
156,enter chanc #win $500 gift card. dare you. @wishuponmovi theater juli 14. http:// ul.ink/7rfe-4850tg_twt
157,enter chanc #win $500 gift card. dare you. @wishuponmovi theater juli 14. http:// ul.ink/7rfe-4850sj_twt
158,"cool. idea deni today either. you'r odd littl duckling, tommy."
159,"miss part said that, despit best efforts, you'v fail hurt me?"
160,enter chanc #win $500 gift card. dare you. @wishuponmovi theater juli 14. http:// ul.ink/7rfe-4850g2_twt
161,"don't believ don't believe? well, don't believ don't believ don't believe."
162,"sorry, don't think took screenshot yet, hurry, delet pretend never wrote it."
163,"said today never said atheist easi marks, @robster16a quot yesterday say exactli that."
164,"i'm flatter attention, hurt it. know goal, failed, littl troll."
165,you'r odd one. never acknowledg numer mistakes. charmless combin incompet misplac superior
166,ha!
167,"pile pejor pejor prove noth me. does, however, demonstr insecurities."
168,think clark everi day & also made wish upon shoot star
169,enter chanc #win $500 gift card. dare you. @wishuponmovi theater juli 14. http:// ul.ink/7rfe-484zm4_twt
170,enter chanc #win $500 gift card. dare you. @wishuponmovi theater juli 14. http:// ul.ink/7rfe-484zp8_twt
171,"ah, see—you'r choos evas rather answer question. i'll ask again: prime example?"
172,"erm, ye did. screenshot duplicit shared."
173,"ha! studi bibl college, well academically. longer believ it."
174,they'v decid i'm one they'll focu troll today (and yesterday—with eve come me). suppos i'm flattered.
175,wish upon bi bi man deserv 100% ratings!
176,talk toy troll cult leader. s/he'll know answer.
177,"forgiv you'd miss oper word, 'if', but, sinc includ here, seem comprehend it."
178,i'm watch wish upon right it' scari
179,"is—a expected, nice ad hominem @onequestn ."
180,"prime example? what? sorry, i'm following."
181,yep! :)
182,it' substanti tissu paper. there' noth understand
183,watch wish upon ! super cool movie!!
184,pick tj? isn't athlet
185,"aw shucks! got caught dishonest again, tom."
186,like @youtub video http:// youtu.be/4zgr8hslh-u?a wish upon hottest garbag
187,wish upon pic.twitter.com/o0vs96cp5n
188,"erm, isn't equation. i'm explain cosmolog argument."
189,"hitler whistl disney' ""when wish upon star"" overlooking... http:// crazyfacts.com/hitler-whistl d-disneys-when-you-wish-upon-a-star-while-overlooking/ … @qikipedia @qipodcast @walkthelin ldn"
190,"agree; it' simple-mind reasoning, yet it' use trick people. well, fear creator' anger/retribution."
191,"ah, is: tom' call stupid, role troll cult. it' time call fat!"
192,"wish upon star, make differ are, anyth heart desir come you."
193,tell belong cult somebodi else' task.
194,that' said yesterday... https:// twitter.com/onequestn /status/890453313153585152 …
195,"don't know non-believ blame god (includ god, god)."
196,"it' shockingly, laughabl weak."
197,enter chanc #win $500 gift card. dare you. @wishuponmovi theater juli 14. http:// ul.ink/7rfe-484wrr_twt
198,enter chanc #win $500 gift card. dare you. @wishuponmovi theater juli 14. http:// ul.ink/7rfe-484wkc_twt
199,wish upon star make differ anyth heart desir ≪loui armstrong*when wish upon star≫
200,"wish upon , ring https:// twitter.com/femaeirobbery/ status/888604931632107520 …"
201,tom say athlet easiest mark twitter
202,"would mind terribl old boy, plagiaris response, use elsewher tweeti site thing?"
203,like bacon well! yum!!!
204,"or, words, free thinker believ tell"
205,cto @cinetext watch #wishupon @cinemark centuri 16 & xd -- check share via #cinetext app. @wishuponmovi pic.twitter.com/elqyz5bpza
206,reject made believ whichev cosmolog argument adhere.
207,[reseña cine] siet deseo ( wish upon ): la muert anda de fiesta http://www. hojasmagicas.cl/2017/07/resena -cine-siete-deseos-wish-upon-la.html …
208,sinc reject idea someth (the known universe) alway exist entir premis stance.
209,@nyxfear plan see wish upon tomm base video. like new video felt weird without music. reason music?
210,"""you'r never old wish upon star"" can't wait @marinamoffett come home dream come true, colleg disney program pic.twitter.com/cv8zcuu2pf"
211,"yearn know origin story. say, ""god alway was!!!"", i'll ask find conveni answer comforting?"
212,@tomatograndpa hey want pass along horror review movi wish upon https://www. youtube.com/watch?v=4zgr8h slh-u …
213,"even it' true, kind creator, want know it, powers, gain them."
214,"is, doesn't answer origin question; mere move it."
215,existence/cr creator summarili dismiss lalalalalala—fing ear fashion.
216,"u suck equations. remember, equat 2 sides. u left side."
217,cosmolog argument sinc exist exists—bam—thi evid creator.
218,"new movi posters: #flatlinersmovi , #patticak , #callmebyyournam , #wishupon . pic.twitter.com/8fgmpdbeup"
219,u ever tweet u thought wish upon bc u miss & need 2 kno
220,like @youtub video http:// youtu.be/jbsjnwquoa8?a wish upon star - pinocchio [piano tutorial] (synthesia) // popular piano
221,"fact standard low, @melvitech64 , you'r will accept mere argument doesn't mean they'r evidence."
222,"uptight, insecur peopl thread, apolog capit word god."
223,"*so far, everi god claim—i'm open evidence, though."
224,"indeed. there' dogma, ideology, connection; there' lack belief god reject unfounded* god claims."
225,"free think mean u get decid u go. stupid think mean u decide; then, blame god decision."
226,"one thread, however, lack compass empathy, make sad peopl like exist."
227,win ‘ wish upon ’ t-shirt poster – uk cinema 28 july! http:// criticalpopcorn.com/2017/07/27/win -a-wish-upon-t-shirt-and-poster-in-uk-cinemas-28-july/ … pic.twitter.com/8xrh6lfcp
228,"come believers, (jews, muslims, hindus, sikhs, buddhists, christians, etc.) wonder people."
229,#sietedeseo ya está en cines... #wishupon #wishuponmovi https:// goo.gl/fmtfvq
230,wish upon death star men triblend crew neck tee http:// etsy.me/2w4qswo via @etsi
231,"freak again, no, don't know god (god) isn't real, don't like mean-spirited cult."
232,envi jealous everyth wish upon enemi #dave
233,"sorri guys, nerd shaming' go convinc join cult."
234,"""you'd better believ god—and heaven hell he'll send 'free thinking' like loser neck beard!"""
235,"free pain, happi fun time never happened, it?"
236,"life perfect, peopl trust someday, fall love, nice quiet home"
237,"went school taught fear obey cheerful, fit in, someon might think you'r weird"
238,"otp tyler tell "" wish upon """
239,"don't wish upon star, reach one!"
240,royal cinema - surpris - (omg) - wish upon soundtrack https:// youtu.be/lkyeb1ur9jg vía @youtub
241,suppos could tri copyright meme. let us know go.
242,guess
243,siet deseo ( @wishuponmovi ) de john r. leonetti: terror adolescent http://www. parlante.cl/siete-deseos-j ohn-r-leonetti-terror-adolescente/ …
244,anyon googl word 'symptoms' know design perfect
245,enter chanc #win $500 gift card. dare you. @wishuponmovi theater juli 14. http:// ul.ink/7rfe-484rjy_twt
246,"""somewher rainbow... wish upon star..."" - hilda. #bot"
247,enter chanc #win $500 gift card. dare you. @wishuponmovi theater juli 14. http:// ul.ink/7rfe-484r0t_twt
248,enter chanc #win $500 gift card. dare you. @wishuponmovi theater juli 14. http:// ul.ink/7rfe-484qym_twt
249,"go thru situat ethan someth wouldn't ever wish upon anybody, feel everyth aw"
250,""" wish upon "" la película ""de lo creador del conjuro"" es la peor mierda que visto en años."
251,mmm #bacon #sarni
252,enter chanc #win $500 gift card. dare you. @wishuponmovi theater juli 14. http:// ul.ink/7rfe-484pqr_twt
253,atheist origin content? plagiar meme use countless others.
254,pic.twitter.com/fo4vihro9m
255,"ask thought before, said ""tj stuff"" didn't respond anyth else. it' exactli compelling."
256,big sister go wonder babi brother & she' suffer pain wouldn't even wish upon enemi
257,design perfect design perfect need glass
258,i'v enter giveaway @flickeringmyth win wish upon poster t-shirt. enter https:// goo.gl/krruop
259,wish upon wildfir #pnr #bookreleas @siobhanmuir #summerread http:// goo.gl/knjrmk via @karithorp
260,pic.twitter.com/54tdjlwkvo
261,pic.twitter.com/8lizv7zead
262,pic.twitter.com/i9etpbddsh
263,"given argument isn't evidence, it' entir reason say that."
264,enter chanc #win $500 gift card. dare you. @wishuponmovi theater juli 14. http:// ul.ink/7rfe-484mpt_twt
265,"sei vorsichtig, du dir wünschst. #wishupon jetzt im kino http://www. wish-upon-film.de/#/wishes/"
266,enter chanc #win $500 gift card. dare you. @wishuponmovi theater juli 14. http:// ul.ink/7rfe-484mq6_twt
267,sci-fi short wish upon star select public year#happywrit pic.twitter.com/8ruas688vp
268,interview @iamsydneypark #wishupon - film hit uk cinema tomorrow!!! http://www. thehollywoodnews.com/2017/07/24/exc lusive-interview-sydney-park-wish-upon/ … pic.twitter.com/vxjtwjnqo9
269,watch movi wish upon today wtf movi weirdddd
270,enter chanc #win $500 gift card. dare you. @wishuponmovi theater juli 14. http:// ul.ink/7rfe-484m26_twt
271,check episod 1 - yoskay yamamoto - wish upon me... https://www. youtube.com/watch?v=rqdv-p _ug7i&t=2 …
272,like @youtub video http:// youtu.be/4zgr8hslh-u?a wish upon hottest garbag
273,would u put u think u know scripture? hypocrisi much?
274,"6. «πρόσεχε τι εύχεσαι» ( wish upon - 2017) του τζον ρ. λεονέτι - ή καλύτερα, πρόσεχε τι σκηνοθετείς... http:// tvxs.gr/news/sinema/pa me-sinema-mono-agori-sti-nea-yorki-synanta-enan-erota-met-empodion … pic.twitter.com/o0bnzo3z3v"
275,#wishupon film best comedi 2017. even close either.
276,enter chanc #win $500 gift card. dare you. @wishuponmovi theater juli 14. http:// ul.ink/7rfe-484k84_twt
277,wish upon
278,convey atheist nerd
279,pic.twitter.com/dvczozow5i
280,"""somewher rainbow... wish upon star..."" - hilda"
281,highkey want see wish upon
282,interesting. provid exampl this?
283,"#moviereview : ""thumb review - juli 2017 preview - ""valerian"", ""emoji movie"", ""atom blonde"", "" wish upon """" via /… http:// ift.tt/2vbycxu pic.twitter.com/3kiok2bx4b"
284,#seattl mood sky. blue and. romanc of. green make. a. wish upon thy.… https://www. instagram.com/p/bxd3kitfsnv/
285,like @youtub video http:// youtu.be/4zgr8hslh-u?a wish upon hottest garbag
286,irrelev design piss poor job that point
287,wish upon hottest garbag http:// fb.me/tugduct2
288,faith requir hypothesi becom theori empir evid faith need
289,"wish upon actual great movie, peopl slept soooo hard."
290,make wish. face fears. #wishupon come uk cinema tomorrow http:// wishuponfilm.co.uk @iamsydneypark @shannonpurs @joeykingactress pic.twitter.com/ynhsqcaomu
291,#microdecin en #lavidamodernad @avpinto cargo de @alvarezestreno !!! #dunkirk #wishupon #babydriv #estreno #juevesdeestreno
292,contrary; keep read whatev meant convey pass right me.
293,pic.twitter.com/nqbymsmqri
294,"within context christian god designer, ur arguing. yes, judg know base scriptur"
295,pic.twitter.com/flahih49sk
296,"fear one, u realli concern branch theism dogmas. let' resist strongli"
297,wish upon umbrella.. @citi walk dubai https://www. instagram.com/p/bxd1gaogqey/
298,hi iw world mani place planet live without technolog
299,"that' one iteration, yes. sinc chang didn't render univers nonexistent, exist, point moot"
300,know knife' edg anoth poor argument fir creation
301,pic.twitter.com/oynitdzho5
302,celldwel - wish upon blackstar (full album) [hd] https://www. youtube.com/watch?v=ndie2 tgmxm&feature=shar …
303,enlighten
304,pic.twitter.com/hjnxl0umli
305,pic.twitter.com/ai7r4w24tt
306,"1. good reason guess design 2. design poor constantli threaten life, reflect suppos design"
307,could live jupit without technolog
308,"also dunkirk ist auf jeden fall intensiv inszeniert. wish upon wird endlich mal wieder der trash,den ich brauch :d"
309,sure is. tune done specif purpose. none evident.
310,doch! mit zeit :') wish upon gehe ich morgen vielleicht sogar rein.
311,du zahlst doch eh nicht. dann lieber wish upon
312,it' pants. it' argument weak god.
313,99.9 % univers uninhabit human good design
314,nobodi told ryan phillipp wish upon . anyon tell him?
315,fine tun argument idiot
316,ad video @youtub playlist http:// youtu.be/4zgr8hslh-u?a wish upon hottest garbag
317,argument base unfound presumpt fallacious. it' natur logic.
318,shit wouldnt wish upon worst enemy.
319,good what? exampl fallacy?
320,#onlyintheatersthisweek 1 #wishupon 2 #cars3 3 #transformersthelastknight 4 #thehous @realpopulur
321,wish upon star pic.twitter.com/nybldzkiep
322,want see wish upon alic lee nyx fear said fun fuck
323,i'm begin suspect bacon person. pic.twitter.com/ppobnxpiwh
324,enter chanc #win $500 gift card. dare you. @wishuponmovi theater juli 14. http:// ul.ink/7rfe-484cjc_twt
325,like @youtub video http:// youtu.be/eal2ic-ob1o?a midnight screen - wish upon
326,ich sehe jetzt wish upon (2017). https:// trakt.tv/movies/wish-up on-2017 … #trakt
327,wish upon (@cineplex neufahrn) https://www. swarmapp.com/c/ezdpvp1lgln
328,"tj, convers bore tears."
329,necesito ir al cine ver wish upon
330,wish upon app: @quickbook @intuitdev need input! - https://www. firmofthefuture.com/content/when-i ou-wish-upon-an-app-we-need-your-input/ … #smallbiz #saa #firmofthefutur
331,"thank "" wish upon "". im start watch english movi lee ki hong. huwahahahahaha"
332,"indeed, feck is."
333,wanna watch wish upon
334,"#screenshot ! review untuk #warfortheplanet dan @wishuponmovi live, mulai jam 5 sore di @dreamersradioid :) pic.twitter.com/oqgmdwcguh"
335,"won't say ""that' evidence"" it's, indeed, evidence. please, bring on, @melvitech64 !"
336,wish upon twin stars/xi 双子座、ニア、ノアのイメージ曲ね。かわいらしさと作曲者ならではのきれいなメロディーラインが相まってとっても素敵な曲よ。回転中にノーツが迫ってくることが多いから、何度もやって定着させないと難しいかも。デバイスの左右振りにも注意してね
337,wish upon #app : need input! - https://www. firmofthefuture.com/content/when-i ou-wish-upon-an-app-we-need-your-input … #smallbiz #smb
338,"isn't unreason stance, matter hard tri claim is."
339,"it' repres come metaphys claims. evidence, i'm will accept claim' real."
340,fakkin guv'nor.
341,enter chanc #win $500 gift card. dare you. @wishuponmovi theater juli 14. http:// ul.ink/7rfe-4848jr_twt
342,"euphemisms, odd reason, usual are, euphemism' vowel shift."
343,"ireland say 'fucking' 'fecking'. mean thing, fecking' consid polite."
344,pic.twitter.com/q1osqjyhhl
345,enter chanc #win $500 gift card. dare you. @wishuponmovi theater juli 14. http:// ul.ink/7rfe-48483a_twt
346,even bondag worse.
347,"unser filmkritik zu #wishupon der neue film von #johnrleonetti mit sherilyn fenn, elisabeth röhm, joey king, ryan http://www. kritiken.de/film/wish-upon -9747759.html … pic.twitter.com/lvn4jgzvrk"
348,like @youtub video http:// youtu.be/4zgr8hslh-u?a wish upon hottest garbag
349,one time dodgi geezer mile end got bit cosy.
350,gotta fakkin kant?
351,wish upon wildfir #pnr #bookreleas @siobhanmuir #summerread http:// goo.gl/knjrmk via @karithorp
352,"trust me, it' less funni understand it."
353,christian sens humour
354,movi preview review ep 292 - wish upon http:// ow.ly/t3op30dxqrp
355,movi preview review ep 292 - wish upon http:// ow.ly/cmtf30dxrbv
356,fnerr fnerr nod good wink...
357,wish upon #app : need input! - https://www. firmofthefuture.com/content/when-i ou-wish-upon-an-app-we-need-your-input … #smallbiz #smb
358,"bow it' pronounc (and possibl spelt) ""kant"" believ"
359,naar wish upon met @ljghtoftheseven
360,christian stand up...
361,live bow while. rub you.
362,"wish upon hit cinema across uk tomorrow - it' definit funny, intend be? review: http://www. heyuguys.com/wish-upon-revi ew/ … pic.twitter.com/wecpmvrkhb"
